,Collection_Name,Category_Art,Category_Collectibles,Category_Domain Names,Category_Music,Category_Photography,Category_Sports,Category_Trading Cards,Category_Utility,Category_Virtual Worlds,Items,Owners,Floor_Price,Twitter_Page_Followers,Twitter_Page_Following,Twitter_Page_Is_Verified,Twitter_Page_Creation_Date,Max_Twitter_Retweets,Max_Twitter_Replies,Max_Twitter_Likes,Max_Twitter_Quotes,Collection_Creation_Date,Collection_30_Day_Volume,Collection_Listing_Status,Collection_Traits_count
0,A Blue World,0,0,0,0,1,0,0,0,0,11,5.0,0.011,235.0,382.0,False,12/26/2010,3,1,7,1,2021-11-28,0.0216,not_requested,0.0
1,A Colour Alphabet,1,0,0,0,0,0,0,0,0,26,8.0,0.001,24562.0,3507.0,True,06/06/2009,15,7,52,2,2021-11-07,0.007,not_requested,0.0
2,A Cute Cat,0,1,0,0,0,0,0,0,0,750,264.0,0.05,2639.0,3063.0,False,08/25/2011,4,3,33,1,2021-07-07,6.494799899999995,not_requested,904.0
3,A Dance of Light and Water,0,0,0,0,1,0,0,0,0,43,29.0,0.35,1820.0,1266.0,False,05/25/2021,2,2,9,0,2021-10-10,0.35,not_requested,42.0
4,A Glitch in Reality,0,0,0,0,1,0,0,0,0,10,7.0,0.08,32179.0,675.0,False,09/18/2019,803,18,4948,5,2021-08-09,0.7,not_requested,0.0
5,A Human in Times of Chaos,1,0,0,0,0,0,0,0,0,201,60.0,0.4,2536.0,380.0,False,08/09/2021,25,18,396,5,2021-08-30,1.82,not_requested,16.0
6,A Los Angeles Film Photography Collection,1,0,0,0,0,0,0,0,0,21,4.0,0.12,2001.0,1604.0,False,09/12/2021,2,2,10,0,2021-09-29,0.42,not_requested,0.0
7,A Martian Storybook Series,1,0,0,0,0,0,0,0,0,12,22.0,0.15,1755384.0,6226.0,False,08/12/2013,37,61,499,12,2021-04-14,0.15,approved,0.0
8,A Million Lonely Stars,0,0,0,0,1,0,0,0,0,25,19.0,0.69,2396.0,1000.0,False,05/25/2021,2,4,37,2,2021-10-18,0.45,not_requested,0.0
9,A Miscellany of Thoughts,1,0,0,0,0,0,0,0,0,5,12.0,2.9,4572.0,3768.0,False,12/23/2009,75,35,225,22,2021-12-15,16.067,approved,0.0
10,A Moment Forever,0,0,0,0,1,0,0,0,0,25,17.0,0.25,6815.0,1164.0,False,05/28/2019,12,4,47,3,2021-09-09,0.75,not_requested,0.0
11,A Mysterious Figure,0,1,0,0,0,0,0,0,0,46,2.0,0.015,383.0,220.0,False,11/03/2021,7,4,53,4,2021-11-07,0.025,not_requested,0.0
12,A New Light,0,0,0,0,1,0,0,0,0,12,9.0,0.1,1467.0,1124.0,False,08/05/2009,35,25,254,2,2021-09-20,0.4,not_requested,0.0
13,A New Path Forward,0,0,0,0,1,0,0,0,0,20,5.0,0.15,1271.0,953.0,False,12/02/2020,9,8,57,3,2021-08-22,0.1,not_requested,0.0
14,A New York Moment,0,0,0,0,1,0,0,0,0,12,3.0,0.033,978.0,342.0,False,05/17/2020,5,5,18,1,2021-10-19,0.066,not_requested,0.0
15,A Sense of Scale,0,0,0,0,1,0,0,0,0,40,27.0,0.2,8324.0,1299.0,False,09/22/2010,84,32,996,16,2021-08-11,0.3,not_requested,0.0
16,A Slime Appears,0,0,0,0,0,0,1,0,0,178,223.0,0.001,8.0,53.0,False,06/15/2021,0,1,1,1,2021-08-30,0.00175,not_requested,164.0
17,A Spark Of Light,1,0,0,0,0,0,0,0,0,22,15.0,0.3,33682.0,567.0,False,04/25/2020,202,11,2397,8,2021-08-11,0.6,not_requested,0.0
18,A Step Apart | NFT Short Film,1,0,0,0,0,0,0,0,0,320,13.0,0.01,2375.0,1648.0,False,10/12/2021,21,12,41,12,2021-10-31,0.6100000000000001,not_requested,0.0
19,A Symphony of Fog,0,0,0,0,1,0,0,0,0,50,41.0,0.45,22658.0,1246.0,False,08/09/2016,99,23,909,6,2021-08-09,0.435,approved,0.0
20,A Trip To Peace,1,0,0,0,0,0,0,0,0,13,5.0,0.02,3675.0,4806.0,False,04/07/2009,4,6,17,1,2021-11-23,0.04,not_requested,115.0
21,A YEAR TO REMEMBER,0,0,0,0,1,0,0,0,0,16,6.0,0.25,4376.0,636.0,False,05/22/2021,65,25,781,5,2021-11-25,1.4,not_requested,0.0
22,A tribute to Hua Lamphong in Monochrome,0,0,0,0,1,0,0,0,0,20,15.0,0.25,5397.0,1069.0,False,02/27/2016,12,12,47,3,2021-09-02,0.425,not_requested,0.0
23,AAI 2G,1,0,0,0,0,0,0,0,0,4,2.0,0.002,4012.0,2928.0,False,10/04/2021,35,39,88,4,2021-10-13,0.002,not_requested,0.0
24,ABCDJ x GAN,0,1,0,0,0,0,0,0,0,57,4.0,0.05,1031.0,909.0,False,02/26/2021,5,6,12,2,2021-09-15,0.1,not_requested,2.0
25,ABNORMAL ENTITY,1,0,0,0,0,0,0,0,0,59,26.0,0.333,696.0,1417.0,False,08/21/2021,10,9,70,5,2021-10-22,0.333,not_requested,13.0
26,ABRAXXAS,1,0,0,0,0,0,0,0,0,100,9.0,0.22,429.0,610.0,False,05/27/2009,21,10,196,4,2021-09-04,0.25,not_requested,0.0
27,ABSart ABSart,1,0,0,0,0,0,0,0,0,116,28.0,0.002,170.0,316.0,False,11/23/2021,28,7,48,4,2021-11-23,0.0309999999999999,not_requested,10.0
28,ACEOFLA,0,0,0,0,1,0,0,0,0,57,820.0,0.001,3875.0,376.0,False,01/27/2009,1,3,6,1,2021-08-04,0.2751593389569212,not_requested,27.0
29,ACULSW,1,0,0,0,0,0,0,0,0,17,2.0,0.25,109.0,361.0,False,03/01/2016,3,3,12,3,2021-12-17,0.27,not_requested,2.0
30,AD ASTRA - To the Stars,0,0,0,0,1,0,0,0,0,45,7.0,0.09,3197.0,2456.0,False,02/10/2011,7,13,46,1,2021-09-06,0.15,not_requested,0.0
31,ADAM X EGO,0,1,0,0,0,0,0,0,0,1500,36.0,0.01,204.0,42.0,False,10/23/2021,164,160,165,6,2021-12-01,0.0723176099999999,not_requested,135.0
32,ADD Generative Drawings,1,0,0,0,0,0,0,0,0,363,137.0,0.24,3983.0,675.0,False,04/03/2008,7,7,93,2,2021-01-05,1.524,approved,43.0
33,AFTER DAWN: Beyond META,0,0,0,0,0,0,0,1,0,9,3.0,0.023,3877.0,4959.0,False,01/19/2009,10,6,32,4,2021-11-26,0.0033257790628296,not_requested,80.0
34,AI Angels NFT,1,0,0,0,0,0,0,0,0,200,103.0,0.004,269.0,675.0,False,11/07/2017,6,4,13,2,2021-12-16,1.2535999999999998,not_requested,4.0
35,AI Art Animations - 4K 60 FPS,1,0,0,0,0,0,0,0,0,55,24.0,0.02,199.0,352.0,False,09/02/2021,2,1,10,1,2021-08-09,0.135,not_requested,35.0
36,AI Arts Gallery,1,0,0,0,0,0,0,0,0,90,12.0,0.005,1966.0,867.0,False,08/04/2021,28,34,23,2,2021-10-24,0.1043999999999999,not_requested,0.0
37,AI Fountain,1,0,0,0,0,0,0,0,0,240,146.0,0.065,14445.0,1678.0,False,04/01/2013,13,13,55,7,2021-08-24,0.8799999999999999,approved,181.0
38,AI Fountain - Curated Remix,1,0,0,0,0,0,0,0,0,34,19.0,0.14,14445.0,1678.0,False,04/01/2013,13,13,55,7,2021-09-27,0.1,not_requested,32.0
39,AI Generated Art by #TIA,1,0,0,0,0,0,0,0,0,39,18.0,0.01,3452.0,930.0,False,09/30/2021,43,29,98,2,2021-11-16,0.29,not_requested,0.0
40,AI Labyrinth,1,0,0,0,0,0,0,0,0,13,4.0,0.015,4923.0,3187.0,False,10/03/2021,30,19,94,6,2021-12-08,0.015,not_requested,0.0
41,AI PRETTIES,1,0,0,0,0,0,0,0,0,206,27.0,0.015,5733.0,5356.0,False,01/05/2021,17,11,42,3,2021-02-01,0.0533325,approved,19.0
42,AI Palette,1,0,0,0,0,0,0,0,0,22,5.0,0.05,1994.0,947.0,False,06/25/2021,8,25,73,3,2021-10-03,0.2,not_requested,23.0
43,AI Pixel Buddies,1,0,0,0,0,0,0,0,0,1000,390.0,0.02,446.0,0.0,False,09/12/2021,17,18,31,3,2021-09-13,0.613,not_requested,93.0
44,AI Toadz,1,0,0,0,0,0,0,0,0,19,13.0,1.0,24573.0,590.0,False,10/14/2009,7,5,67,1,2021-10-19,0.1,not_requested,0.0
45,AI by GummyLSD,1,0,0,0,0,0,0,0,0,43,16.0,0.003,18649.0,18513.0,False,03/03/2021,25,5,54,2,2021-12-12,0.095,not_requested,0.0
46,AI perspective,1,0,0,0,0,0,0,0,0,105,6.0,0.001,91.0,1015.0,False,12/26/2021,2,2,6,1,2021-12-11,0.015,not_requested,0.0
47,AI42 Loops,1,1,0,0,0,0,0,0,0,5300,1800.0,0.01,3973.0,389.0,False,03/24/2021,87,38,179,11,2021-04-03,1.2955546658952848,verified,32.0
48,AIR22,0,0,0,0,0,0,0,1,0,6,97.0,0.29,97527.0,1405.0,False,05/20/2021,18,12,147,3,2021-07-11,2.1606247500000006,approved,0.0
49,AIplay [Polygon],1,0,0,0,0,0,0,0,0,436,74.0,0.003,1247.0,10.0,False,11/15/2021,62,32,325,0,2021-11-11,0.2556,not_requested,0.0
50,ALAP : THE LOST PIONEERS,0,1,0,0,0,0,0,0,0,1200,524.0,0.163,198.0,0.0,False,10/21/2021,4,4,13,2,2021-11-01,166.84025439999985,approved,75.0
51,ALL GOOD THINGS COME IN THREES,0,0,0,0,1,0,0,0,0,18,4.0,0.3,38499.0,4633.0,False,02/21/2011,216,30,1551,13,2021-10-17,2.1,not_requested,0.0
52,ALL STARS: Trading Card Game,0,0,0,0,0,0,1,0,0,22,604.0,0.001,30.0,7.0,False,12/07/2021,6,4,7,1,2021-11-04,0.12273,not_requested,11.0
53,ALPACADABRAZ,1,0,0,0,0,0,0,0,0,9700,3800.0,1.32,36146.0,1225.0,False,09/25/2021,10234,10389,10774,419,2021-10-22,3228.3135851379334,approved,379.0
54,AMIS CATS,0,1,0,0,0,0,0,0,0,200,98.0,0.01,295.0,356.0,False,08/14/2021,15,12,22,2,2021-08-14,0.01,not_requested,19.0
55,ANCIENT CARDS,0,0,0,0,0,0,1,0,0,230,503.0,0.001,3286.0,4754.0,False,04/02/2011,24,21,29,2,2021-09-10,0.009506033,not_requested,164.0
56,ANGEL LEAGUE Factory @ Klaytn,1,0,0,0,0,0,0,0,0,2300,586.0,0.004,1792.0,49.0,False,04/13/2021,136,122,146,5,2021-10-14,0.6373631999999997,not_requested,716.0
57,ANGEL LEAGUE SeoulPunks @ Klaytn,1,0,0,0,0,0,0,0,0,678,111.0,0.004,1792.0,49.0,False,04/13/2021,136,122,146,5,2021-10-06,0.00211345,not_requested,81.0
58,ANIMAL UNIVERSE COLLECTIVE,0,0,0,0,0,0,1,0,0,4,3.0,0.006,1796.0,868.0,False,06/26/2009,8,8,9,2,2021-04-01,0.0055,not_requested,22.0
59,ANIME TCG,0,0,0,0,0,0,1,0,0,126,133.0,0.029,1164.0,1904.0,False,08/21/2021,42,41,57,6,2021-06-14,0.35,not_requested,0.0
60,ANOKO,0,1,0,0,0,0,0,0,0,34,29.0,0.006,328.0,105.0,False,09/29/2021,5,3,20,5,2021-09-29,0.012,not_requested,0.0
61,AOI (The Art of Identity),1,0,0,0,0,0,0,0,0,40,345.0,0.005,1833.0,317.0,False,07/17/2018,5,6,31,2,2021-09-12,0.4908000000000002,not_requested,0.0
62,AOZ_official,1,0,0,0,0,0,0,0,0,1600,486.0,0.007,17378.0,91.0,False,09/23/2021,3081,711,2254,370,2021-12-08,12.38126999999998,approved,20.0
63,APE DAO Legends,0,0,0,0,0,0,1,0,0,16,1100.0,0.008,2683.0,111.0,False,09/29/2021,158,75,188,6,2021-10-15,1.2938905799999991,not_requested,19.0
64,APE KIDS CARTOON CLUB (AKCC Official),0,1,0,0,0,0,0,0,0,342,155.0,0.02,6329.0,2.0,False,12/04/2021,400,205,410,70,2021-12-16,0.143,not_requested,119.0
65,APES GOLD,0,0,0,0,0,0,0,1,0,2,14.0,2.596,48.0,291.0,False,11/11/2021,2,4,3,1,2021-12-05,0.00156,not_requested,0.0
66,ARC TRIPPY PUNKS,0,1,0,0,0,0,0,0,0,65,26.0,0.01,231.0,443.0,False,10/05/2021,1,5,10,1,2021-10-01,0.03,not_requested,70.0
67,AREEB'S DAILY DRAW,0,1,0,0,0,0,0,0,0,59,20.0,0.01,507.0,1065.0,False,07/02/2019,13,10,80,2,2021-04-04,0.12,not_requested,32.0
68,ART AND THE MEME,1,0,0,0,0,0,0,0,0,3500,85.0,0.004,647.0,2365.0,False,02/11/2021,2,1,5,1,2021-02-15,0.07,approved,0.0
69,ART BY KEEMO,1,0,0,0,0,0,0,0,0,85,30.0,0.05,2419.0,997.0,False,05/12/2008,3,6,20,4,2021-03-03,1.22,requested,10.0
70,ART CARPET BOMBING,0,1,0,0,0,0,0,0,0,10000,1200.0,0.029,2427.0,102.0,False,09/15/2021,271,159,372,19,2021-09-28,21.90490324780001,approved,94.0
71,ART of KLAY_SIMFLOWER #999,0,1,0,0,0,0,0,0,0,87,47.0,0.008,881.0,1524.0,False,10/13/2021,33,9,51,2,2021-11-07,0.0768991199999999,not_requested,24.0
72,ART-IS-HUNGER,1,0,0,0,0,0,0,0,0,33,22.0,0.1,1104.0,1529.0,False,07/31/2021,62,15,139,18,2021-09-21,0.2379999999999999,not_requested,18.0
73,ARTface,0,1,0,0,0,0,0,0,0,4000,1400.0,0.039,1208.0,975.0,False,02/16/2021,6,10,38,3,2021-03-01,13.382,approved,0.0
74,ARTificial - AI Art by International Megadigital,1,1,0,0,0,0,0,1,0,4400,23.0,0.01,45130.0,15590.0,False,02/25/2013,16,3,41,1,2021-02-28,0.015,requested,4.0
75,ARTwork'z of myself...*,0,1,0,0,0,0,0,0,0,7,4.0,0.078,115.0,435.0,False,06/17/2010,2,3,5,3,2021-11-05,0.1446,not_requested,7.0
76,ASCII Punkz,1,1,0,0,0,0,0,0,0,10,4.0,0.1,8002.0,411.0,False,03/13/2021,8,11,17,2,2021-04-06,0.4499999999999999,not_requested,0.0
77,ASTROWOMEN,0,1,0,0,0,0,0,0,0,8,4.0,0.111,1731.0,2443.0,False,06/08/2020,2,37,59,1,2021-05-27,0.175,not_requested,0.0
78,ASWANG COLLECTION,1,0,0,0,0,0,0,0,0,136,56.0,0.427,4815.0,1262.0,False,03/14/2021,8,4,50,2,2021-05-06,3.29,not_requested,0.0
79,ATAS | Peranakan Miniature,1,0,0,0,0,0,0,0,0,10,2.0,0.06,10.0,16.0,False,10/08/2021,1,2,7,3,2021-11-14,0.04,not_requested,0.0
80,AV Club,0,1,0,0,0,0,0,0,0,50,8.0,0.079,299.0,38.0,False,10/27/2021,5,9,17,1,2021-10-27,0.1884,not_requested,0.0
81,AVA by TeresaMelvin,1,0,0,0,0,0,0,0,0,24,17.0,0.375,1493.0,1194.0,False,08/06/2021,14,12,133,3,2021-09-28,1.4,not_requested,21.0
82,AVAX APES,0,1,0,0,0,0,0,0,0,426,89.0,0.01,15766.0,224.0,False,08/16/2021,137,134,163,12,2021-09-08,0.10124,not_requested,0.0
83,AVEC: Insignias Metalicas,0,1,0,0,0,0,0,0,0,40,13.0,0.045,3629.0,87.0,False,05/07/2021,121,75,215,9,2021-11-29,2.325,not_requested,9.0
84,AVJ PUNKS,0,1,0,0,0,0,0,0,0,564,33.0,0.005,1071.0,1485.0,False,10/27/2021,41,13,59,8,2021-11-16,0.104,not_requested,122.0
85,AXONS,1,0,0,0,0,0,0,0,0,33,33.0,2.25,10605.0,1388.0,False,08/25/2021,85,76,576,13,2021-12-06,1.766,not_requested,0.0
86,Aavegotchi Collabs,0,1,0,0,0,0,0,0,0,3,105.0,0.27,91449.0,5.0,False,07/07/2020,1923,584,2725,446,2020-12-08,0.08,approved,3.0
87,Abandoned Hearts - A Digital Abstract and Surreal Art Series,1,0,0,0,0,0,0,0,0,208,31.0,0.002,922.0,591.0,False,07/01/2021,6,4,19,2,2021-09-06,0.2795000000000001,not_requested,20.0
88,Abstract Energy,1,0,0,0,0,0,0,0,0,256,165.0,0.069,3567.0,247.0,False,02/17/2021,22,14,145,4,2021-08-16,0.2915,verified,19.0
89,Abstract Geometrical by Nataly Borich,1,0,0,0,0,0,0,0,0,13,3.0,0.03,849.0,1167.0,False,07/29/2021,5,3,20,1,2021-08-29,0.15,not_requested,0.0
90,Abstract NFTs.,1,0,0,0,0,0,0,0,0,68,11.0,0.01,366.0,300.0,False,08/30/2020,1,3,10,1,2021-08-26,0.01,not_requested,0.0
91,Abstract Nature by Albert Dros,0,0,0,0,1,0,0,0,0,100,53.0,0.25,7802.0,753.0,False,02/19/2015,34,33,542,19,2021-08-28,1.608,approved,10.0
92,Abstract Nouns,0,1,0,0,0,0,0,0,0,94,58.0,0.05,326.0,37.0,False,08/23/2021,8,12,159,3,2021-08-19,0.15,not_requested,0.0
93,Abstract Solar System,0,1,0,0,0,0,0,0,0,11,57.0,0.002,38856.0,8290.0,False,08/28/2021,66,950,589,5,2021-09-04,0.0289059999999999,not_requested,0.0
94,Abstract Space Art AI,1,0,0,0,0,0,0,0,0,20,4.0,0.003,27.0,45.0,False,05/12/2019,1,1,6,0,2021-10-27,0.0025,not_requested,0.0
95,Abstract artworks by Schelle Jpeg,1,0,0,0,0,0,0,0,0,18,9.0,0.05,1688.0,2146.0,False,11/30/2013,5,13,20,1,2021-09-07,0.15,not_requested,11.0
96,Abstract brushstrokes by Schelle Jpeg,1,0,0,0,0,0,0,0,0,3,2.0,0.025,1688.0,2146.0,False,11/30/2013,5,13,20,1,2021-11-11,0.0095,not_requested,6.0
97,Abstraction Art Collection,1,0,0,0,0,0,0,0,0,7,2.0,0.05,84.0,699.0,False,04/07/2021,2,1,5,1,2021-04-04,0.05,approved,0.0
98,Absurd Arboretum,0,1,0,0,0,0,0,0,0,2800,950.0,0.025,2912.0,83.0,False,05/23/2021,53,57,73,12,2021-06-29,1.0159600100100004,verified,213.0
99,Absurd Arboretum - BONFIRE Festival,0,1,0,0,0,0,0,0,0,597,288.0,0.02,2912.0,83.0,False,05/23/2021,53,57,73,12,2021-09-02,0.02,not_requested,7.0
100,Abu Crypto NFT,1,0,0,0,0,0,0,0,0,2500,461.0,0.01,22129.0,811.0,False,09/17/2021,20,21,33,4,2021-11-01,4.017479999999998,not_requested,206.0
101,Abusamenta_21,1,0,0,0,0,0,0,0,0,21,3.0,0.003,163.0,487.0,False,03/25/2021,3,4,19,1,2021-09-19,0.002,not_requested,0.0
102,Accessory storage,0,0,0,0,0,0,0,1,0,7,124.0,0.001,1523.0,2204.0,False,09/26/2021,1,3,23,1,2021-10-20,0.02,not_requested,7.0
103,Acidgirls,1,0,0,0,0,0,0,0,0,62,37.0,0.042,2638.0,1161.0,False,09/10/2021,106,102,158,9,2021-09-09,0.7110000000000002,not_requested,31.0
104,Acidhatmat - Disorder Collection,1,0,0,0,0,0,0,0,0,8,2.0,0.04,290.0,601.0,False,05/26/2021,2,7,25,0,2021-09-11,0.06,not_requested,0.0
105,Acolytes,0,1,0,0,0,0,0,0,0,152,54.0,0.06,1349.0,719.0,False,07/04/2021,72,80,80,4,2021-07-06,0.3399999,not_requested,255.0
106,Acoustic Music - Rino Tirri,0,0,0,1,0,0,0,0,0,7,3.0,0.098,50.0,42.0,False,02/18/2019,34,9,13,1,2021-08-22,0.006,not_requested,21.0
107,Acquisition Royale,0,1,0,0,0,0,0,0,0,2100,1600.0,0.003,11226.0,65.0,False,10/14/2021,7472,139,7669,683,2021-10-28,0.175917,not_requested,0.0
108,Acquisition Royale Consumables,0,0,0,0,0,0,0,1,0,3,656.0,0.1,11226.0,65.0,False,10/14/2021,7472,139,7669,683,2021-10-26,0.065,not_requested,0.0
109,Actor Punks,0,1,0,0,0,0,0,0,0,251,25.0,0.03,1611.0,3266.0,False,10/11/2021,2,1,6,2,2021-10-31,1.0023000000000006,not_requested,0.0
110,Adam Bomb Squad,0,1,0,0,0,0,0,0,0,25000,8300.0,0.33,33113.0,31.0,True,07/07/2021,33,59,216,7,2021-08-27,991.0147014224268,verified,892.0
111,Adam Hoffman Fine Art Fractals,1,0,0,0,0,0,0,0,0,22,245.0,0.001,72.0,16.0,False,12/29/2017,4,4,15,6,2021-03-23,0.2015,not_requested,0.0
112,Adam Lister Studio,1,0,0,0,0,0,0,0,0,1000,285.0,0.022,1610.0,935.0,False,10/10/2010,14,15,38,3,2021-09-01,0.8039000000000002,not_requested,0.0
113,Adapting Elements,0,0,0,0,1,0,0,0,0,50,15.0,0.15,5038.0,917.0,False,03/25/2021,50,41,472,8,2021-10-01,0.9,not_requested,0.0
114,Ade's Press (2),1,0,0,0,0,0,0,0,0,26,3.0,0.006,324.0,896.0,False,11/14/2009,2,3,9,4,2021-09-25,0.008,not_requested,41.0
115,Ade's Press (Polygon),1,0,0,0,0,0,0,0,0,7,2.0,0.04,324.0,896.0,False,11/14/2009,2,3,9,4,2021-11-12,0.02,not_requested,7.0
116,Adofo-X,0,0,0,0,0,0,0,1,0,976,418.0,0.17,1193.0,69.0,False,09/23/2021,186,176,222,6,2021-09-24,89.08337999999998,approved,76.0
117,Adult Fantasy: Season 1,0,1,0,0,0,0,0,0,0,2200,422.0,0.049,1132.0,412.0,False,05/04/2021,15,9,33,10,2021-12-05,14.1508,not_requested,117.0
118,Adventure of Pepe,1,0,0,0,0,0,0,0,0,5,2.0,0.1,850.0,1175.0,False,10/09/2013,1,5,13,1,2021-12-14,0.48,not_requested,0.0
119,Aerial Aesthetics,1,0,0,0,0,0,0,0,0,22,3.0,0.15,17097.0,333.0,False,07/16/2008,5,7,39,1,2021-11-28,0.25,not_requested,0.0
120,Aerial Art by CA From The Sky,0,0,0,0,1,0,0,0,0,50,37.0,0.15,2248.0,1378.0,False,08/20/2021,5,15,45,4,2021-08-16,1.0,not_requested,0.0
121,Aerial Dreamscapes,0,0,0,0,1,0,0,0,0,40,34.0,0.2,11823.0,1090.0,False,06/10/2021,3,2,60,0,2021-08-24,0.15,not_requested,0.0
122,Aerial Loops by Dennis Schmelz,1,0,0,0,0,0,0,0,0,10,4.0,0.2,813.0,2329.0,False,11/28/2020,4,5,38,3,2021-10-24,0.6000000000000001,not_requested,27.0
123,Aerial Variance,0,0,0,0,1,0,0,0,0,50,8.0,0.07,2248.0,1378.0,False,08/20/2021,5,15,45,4,2021-11-27,0.5700000000000001,not_requested,0.0
124,Aeriinim,1,0,0,0,0,0,0,0,0,435,2600.0,0.001,5821.0,6391.0,False,07/29/2021,200,207,230,22,2021-07-23,0.1144048430619899,not_requested,117.0
125,Aether,0,0,0,0,0,0,0,0,1,788,328.0,0.69,1862.0,10.0,False,09/03/2021,81,85,136,15,2019-04-26,108.69889999999997,verified,156.0
126,Aethir Wars,1,0,0,0,0,0,0,0,0,580,160.0,0.05,592.0,601.0,False,07/22/2021,24,27,28,6,2021-06-01,0.24,approved,487.0
127,Affe mit Waffe,0,1,0,0,0,0,0,0,0,92,67.0,8.0,20195.0,135.0,False,08/20/2019,20,18,81,3,2021-08-30,84.05454854457373,approved,266.0
128,African people,1,0,0,0,0,0,0,0,0,27,14.0,0.001,24.0,297.0,False,11/03/2021,1,2,6,1,2021-10-11,0.005,not_requested,0.0
129,Afro Cosmic Spirit Dancer,1,0,0,0,0,0,0,0,0,4,3.0,0.008,965.0,653.0,False,08/22/2018,5,2,17,1,2021-12-12,0.0185,not_requested,0.0
130,Afro-renaissance,1,0,0,0,0,0,0,0,0,10,2.0,1.0,533.0,857.0,False,05/14/2012,9,5,43,2,2021-04-19,1.5,approved,18.0
131,AfroDroids By Owo,0,1,0,0,0,0,0,0,0,12100,3600.0,0.01,7606.0,1.0,False,08/06/2021,200,182,215,14,2021-09-01,2.906599999999996,verified,305.0
132,Afrodroid Legends,1,0,0,0,0,0,0,0,0,14,34.0,0.025,285.0,52.0,False,05/01/2021,22,32,125,4,2021-09-24,0.35,not_requested,19.0
133,Afromask,1,0,0,0,0,0,0,0,0,102,68.0,0.6,1445.0,413.0,False,10/25/2015,47,14,329,4,2021-09-23,0.201,not_requested,28.0
134,Afterlife ID,0,1,0,0,0,0,0,0,0,1300,660.0,0.03,3928.0,254.0,False,09/07/2021,35,31,108,3,2021-10-15,1.1581,not_requested,108.0
135,Age of Empires NFT,0,1,0,0,0,0,0,0,0,109,29.0,0.01,105.0,10.0,False,12/25/2021,3,2,14,3,2021-05-13,0.365,not_requested,0.0
136,Agent1,1,0,0,0,0,0,0,0,0,4500,939.0,0.018,1853.0,173.0,False,09/20/2021,29,20,56,10,2021-10-16,1.3470566666666672,not_requested,11.0
137,Aging Crypto Buddha,1,0,0,0,0,0,0,0,0,27,22.0,0.03,998.0,402.0,False,09/30/2021,7,5,22,2,2021-10-17,0.11,not_requested,0.0
138,Ai Primates,0,1,0,0,0,0,0,0,0,850,265.0,0.008,1281.0,0.0,False,11/27/2021,0,0,1,0,2021-09-15,0.337178999669,not_requested,0.0
139,AiAvatars,0,1,0,0,0,0,0,0,0,418,294.0,0.005,1327.0,345.0,False,11/13/2021,85,41,80,9,2021-11-14,0.4525,not_requested,0.0
140,AiCandy,1,0,0,0,0,0,0,0,0,273,103.0,0.015,717.0,1980.0,False,09/25/2021,14,9,43,3,2021-09-25,0.40689999,approved,53.0
141,AichakoB SIMPLE DESIGN,1,0,0,0,0,0,0,0,0,27,4.0,0.007,58.0,342.0,False,02/18/2021,1,10,8,3,2021-09-29,0.024,not_requested,0.0
142,Ain't no sunshine by Nadine Sieber - A moody Street Photography Collection,1,0,0,0,0,0,0,0,0,32,8.0,0.077,1005.0,278.0,False,06/23/2021,21,6,125,3,2021-10-14,0.616,not_requested,11.0
143,Air Jordan 1 *,0,0,0,0,0,0,1,0,0,149,1.0,0.023,48.0,31.0,False,03/02/2011,1,1,12,1,2021-11-18,0.023,not_requested,160.0
144,AirDoddyNFT Collection,0,0,0,0,1,0,0,0,0,3,2.0,0.15,491.0,904.0,False,10/08/2010,3,4,13,1,2021-11-04,0.25,not_requested,7.0
145,Airbits,0,1,0,0,0,0,0,0,0,165,111.0,0.3,6378.0,389.0,False,11/22/2020,9,7,76,6,2021-12-12,16.745,not_requested,69.0
146,Aircoins Metaverse,0,0,0,0,0,0,0,1,0,812,209.0,0.1,38044.0,300.0,False,01/07/2018,682,438,1255,250,2021-10-23,0.5780000000000001,not_requested,3.0
147,Akane's Toy Store,0,1,0,0,0,0,0,0,0,6,25.0,0.005,632.0,182.0,False,10/06/2017,5,3,13,2,2021-11-29,0.01,not_requested,3.0
148,Akatsuki_NFTs,0,1,0,0,0,0,0,0,0,10,2.0,0.025,11.0,0.0,False,12/13/2021,4,4,10,5,2021-11-01,0.012,not_requested,0.0
149,Alatelecoin Airdrop Eligible Pass,0,0,0,0,0,0,0,1,0,10000,9900.0,0.001,708.0,177.0,False,10/08/2020,1,5,4,0,2021-08-08,0.3313099999999991,not_requested,0.0
150,Alchemist Crucible v1,0,0,0,0,0,0,0,1,0,9700,8000.0,0.029,2697.0,11.0,False,08/05/2021,73,67,303,36,2021-02-18,0.5567900000000001,not_requested,0.0
151,Alejandro & Taylor - Mirage Gallery,1,0,0,0,0,0,0,0,0,128,68.0,0.35,1113.0,10.0,False,05/12/2021,34,37,138,7,2021-01-31,7.43411088693268,approved,0.0
152,Alembic League of Crucible Holders (ALCH),1,0,0,0,0,0,0,0,0,25,19.0,0.333,1016.0,469.0,False,04/11/2021,18,10,33,3,2021-09-28,0.25,not_requested,59.0
153,Alessio Miraglia NFT Collection,1,0,0,0,0,0,0,0,0,9,3.0,0.015,2686.0,1923.0,False,06/06/2014,2,2,6,1,2021-11-14,0.0507,not_requested,0.0
154,Alex Lavrov Art,1,0,0,0,0,0,0,0,0,76,140.0,0.04,1439.0,1183.0,False,02/28/2013,15,11,80,7,2021-07-22,0.7849999999999999,verified,128.0
155,Alex Qian - Chicago Origins - Collection of 50 Unique Stories,0,0,0,0,1,0,0,0,0,50,36.0,0.15,7436.0,2887.0,False,07/30/2017,27,26,327,4,2021-07-14,0.295,not_requested,0.0
156,Alex Solis,1,0,0,0,0,0,0,0,0,981,87.0,0.099,7096.0,318.0,False,10/16/2013,78,24,198,12,2021-04-05,0.41,verified,0.0
157,Alice Through the Looking Glass,1,0,0,0,0,0,0,0,0,41,15.0,0.003,1136.0,932.0,False,11/24/2013,58,11,492,8,2021-06-02,0.023,not_requested,0.0
158,Alien Ape Mining Club,0,1,0,0,0,0,0,0,0,1100,370.0,0.003,1523.0,2.0,False,11/19/2021,53,21,54,3,2021-11-26,0.3643389000000003,not_requested,138.0
159,Alien Archetypes,0,1,0,0,0,0,0,0,0,247,45.0,0.01,85.0,1.0,False,12/07/2021,16,7,22,4,2021-12-14,0.0098999999999999,not_requested,103.0
160,Alien Avatar,1,0,0,0,0,0,0,0,0,290,118.0,0.05,743.0,510.0,False,03/28/2021,39,42,55,5,2021-06-22,0.679,not_requested,6.0
161,Alien Fantasy Worlds,1,0,0,0,0,0,0,0,0,10,4.0,0.013,9407.0,7323.0,False,02/23/2018,14,86,236,1,2021-12-11,0.065,not_requested,10.0
162,Alien Genesys,1,1,0,0,0,0,0,0,0,333,236.0,0.04,2539.0,334.0,False,10/13/2021,58,25,80,30,2021-11-11,12.933799999999994,not_requested,55.0
163,Alien Insects by Shvembldr,1,0,0,0,0,0,0,0,0,1000,445.0,0.285,15490.0,427.0,False,03/15/2015,20,18,334,3,2021-08-24,26.500100000000018,verified,996.0
164,Alien Wizard Early Works,0,1,0,0,0,0,0,0,0,11,5.0,0.015,13.0,21.0,False,11/23/2021,1,2,5,0,2021-12-15,0.019,not_requested,9.0
165,Aliens Nation NFT,1,0,0,0,0,0,0,0,0,9000,340.0,0.001,470.0,238.0,False,09/01/2021,5,5,8,1,2021-09-24,0.0142692090167516,not_requested,628.0
166,Alisha Anglin Art,1,0,0,0,0,0,0,0,0,112,39.0,0.08,2639.0,1970.0,False,10/02/2017,6,6,20,2,2021-03-16,0.32,not_requested,0.0
167,All Around Artsy,1,0,0,0,0,0,0,0,0,35,85.0,0.15,13471.0,4230.0,False,08/26/2013,22,39,133,3,2021-08-30,1.38,not_requested,0.0
168,All Punks,1,0,0,0,0,0,0,0,0,195,16.0,0.005,935.0,1925.0,False,02/26/2011,3,2,7,2,2021-10-30,0.036,not_requested,0.0
169,AllStar Punks,0,0,0,0,0,1,0,0,0,104,15.0,0.024,40.0,3.0,False,05/20/2021,10,3,9,5,2021-07-07,0.13,not_requested,151.0
170,AllStarFreaks,0,0,0,0,0,1,1,0,0,603,217.0,0.23,3890.0,864.0,False,03/18/2021,10,12,25,3,2021-03-20,16.238234030728083,verified,2787.0
171,Alliance.X,0,1,0,0,0,0,0,0,0,1,92.0,0.06,65451.0,370.0,False,09/02/2020,788,23,570,14,2021-09-14,0.0913007999999999,not_requested,9.0
172,Almost Fancy Glyphs,1,0,0,0,0,0,0,0,0,2,29.0,0.1,797.0,217.0,False,07/24/2021,44,52,40,7,2021-08-01,0.01,not_requested,0.0
173,Alpaca City,0,1,0,0,0,0,0,0,0,25400,1900.0,0.01,43344.0,139.0,False,10/02/2020,14886,2732,9853,1406,2020-10-25,0.5549693450000002,verified,179.0
174,Alpaca Go Go,1,0,0,0,0,0,0,0,0,18,16.0,0.09,1989.0,541.0,False,01/24/2020,7,16,89,2,2021-09-29,0.269,not_requested,56.0
175,Alpha Girl Club,0,1,0,0,0,0,0,0,0,8300,3900.0,0.045,20057.0,76.0,False,08/26/2021,231,252,1124,84,2021-12-02,1972.6123038134351,approved,470.0
176,Alpha League,0,1,0,0,0,0,0,0,0,100,21.0,0.07,152.0,165.0,False,09/25/2021,7,8,17,2,2021-09-12,0.8017999999999998,approved,720.0
177,Alpha-Zeta,0,1,0,0,0,0,0,0,0,27,3.0,0.01,2823.0,2634.0,False,11/04/2012,15,33,126,2,2021-09-01,0.02,not_requested,0.0
178,Alphabetum,0,1,0,0,0,0,0,0,0,68,5.0,0.005,647.0,465.0,False,10/18/2021,34,12,50,2,2021-10-22,0.085,not_requested,31.0
179,Alpine Glow,0,0,0,0,1,0,0,0,0,10,8.0,0.5,7276.0,1240.0,False,11/29/2020,3,4,21,2,2021-11-03,0.6000000000000001,not_requested,0.0
180,Alpine Shades,0,0,0,0,1,0,0,0,0,58,119.0,0.058,18948.0,1359.0,False,10/07/2020,7,4,28,1,2021-08-24,0.988,approved,94.0
181,Alpine Textures,1,0,0,0,0,0,0,0,0,10,6.0,0.1,18948.0,1359.0,False,10/07/2020,7,4,28,1,2021-12-05,0.4,approved,19.0
182,Alpixzca,0,1,0,0,0,0,0,0,0,54,27.0,0.004,463.0,824.0,False,09/15/2020,0,4,6,0,2021-11-23,0.081,not_requested,27.0
183,Alt Fashion Squad,1,0,0,0,0,0,0,0,0,92,52.0,0.08,192.0,99.0,False,11/13/2021,11,10,36,4,2021-10-09,1.2350000000000003,not_requested,0.0
184,Alt-Coin Card Collection | KriptoKrazed,0,0,0,0,0,0,1,0,0,9,3300.0,0.002,6755.0,12.0,False,07/28/2021,601,118,430,20,2021-08-15,0.0587245754140802,approved,7.0
185,Alternative Habitats,0,0,0,0,1,0,0,0,0,11,2.0,0.11,700.0,594.0,False,08/20/2012,2,7,32,2,2021-11-19,0.11,not_requested,0.0
186,Alto city,1,0,0,0,0,0,0,0,0,4200,854.0,0.018,20626.0,104.0,False,03/07/2021,342,345,370,9,2021-08-28,2.123000000000001,approved,1309.0
187,Alzena,1,0,0,0,0,0,0,0,0,25,21.0,0.06,4969.0,3860.0,False,06/30/2018,17,10,89,2,2021-10-01,0.24,not_requested,1.0
188,Amazing Devya - Artwork,1,0,0,0,0,0,0,0,0,27,25.0,0.01,1231.0,944.0,False,05/17/2021,5,2,15,2,2021-04-30,0.355,not_requested,56.0
189,Amber Vittoria's Alphabet Collection,1,0,0,0,0,0,0,0,0,260,128.0,0.202,17667.0,3903.0,False,08/18/2010,27,32,146,10,2021-08-24,6.296400000000002,verified,38.0
190,AmbieNFT,0,0,0,1,0,0,0,0,0,35,25.0,0.685,1836.0,1388.0,False,08/18/2021,4,9,35,5,2021-09-14,1.08075,approved,100.0
191,American Football 2021-2022,0,0,0,0,0,1,0,0,0,166,12.0,0.001,39.0,36.0,False,04/23/2021,1,1,3,0,2021-05-04,0.004,not_requested,2.0
192,American Football Polygon,0,0,0,0,0,1,0,0,0,151,51.0,0.001,39.0,36.0,False,04/23/2021,1,1,3,0,2021-07-23,0.0391,not_requested,2.0
193,Among us Character Series,0,1,0,0,0,0,0,0,0,528,67.0,0.001,434.0,1115.0,False,11/10/2021,2,6,8,1,2021-11-27,0.075849,not_requested,0.0
194,Amuletum,0,1,0,0,0,0,0,0,0,13,9.0,0.04,1530.0,898.0,False,04/14/2021,6,7,28,2,2021-09-16,0.25,not_requested,0.0
195,An Appealing Collection of Horrific Things,1,0,0,0,0,0,0,0,0,35,21.0,0.7,1965.0,1162.0,False,03/09/2021,18,12,67,4,2021-08-26,0.855,not_requested,0.0
196,An Endless Summer,0,0,0,0,1,0,0,0,0,15,2.0,0.35,4887.0,2740.0,False,10/12/2008,8,11,54,1,2021-12-06,1.0499999999999998,not_requested,0.0
197,An Ethereal World,0,0,0,0,1,0,0,0,0,20,4.0,0.1,394.0,590.0,False,12/03/2011,2,8,8,1,2021-09-04,0.3,not_requested,17.0
198,Analog Doll,0,1,0,0,0,0,0,0,0,71,35.0,0.02,10734.0,5753.0,False,06/08/2011,99,69,108,34,2021-11-01,0.425,not_requested,0.0
199,Anatolian Nights,0,0,0,0,1,0,0,0,0,9,5.0,0.2,11728.0,3714.0,False,06/19/2019,2,22,41,1,2021-11-20,0.6000000000000001,not_requested,22.0
200,Anatomy Shapes,1,1,0,0,0,0,0,0,0,45,164.0,0.025,12102.0,2427.0,False,07/02/2020,32,20,123,4,2021-05-22,0.08,approved,36.0
201,Ancient Cats Club,0,1,0,0,0,0,0,0,0,2800,1700.0,0.01,7024.0,13.0,False,11/17/2021,3214,3390,3617,177,2021-11-27,2.939689999999998,approved,188.0
202,Ancient Sovereign,1,0,0,0,0,0,0,0,0,11,9.0,0.35,5115.0,565.0,False,05/14/2020,41,10,232,1,2021-04-01,0.9000000000000001,not_requested,0.0
203,Ancient message,1,0,0,0,0,0,0,0,0,206,190.0,0.001,143.0,384.0,False,08/29/2021,4,3,13,3,2021-08-26,0.068428,not_requested,27.0
204,Andro Genies,1,0,0,0,0,0,0,0,0,25,14.0,0.02,235.0,191.0,False,12/01/2010,3,9,11,4,2021-05-29,0.048,not_requested,52.0
205,Andy Borphol,0,1,0,0,0,0,0,0,0,2000,964.0,0.01,6787.0,35.0,False,08/28/2021,41,35,104,12,2021-09-24,0.6207000000000001,verified,48.0
206,Andy Warhol's Pantry Tokens,1,0,0,0,0,0,0,0,0,60,19.0,0.1,11817.0,4717.0,False,10/23/2011,3,6,36,1,2021-11-06,0.499,not_requested,0.0
207,Angel Baby Hit Squad by Fettuccine & Team,0,1,0,0,0,0,0,0,0,5000,1300.0,0.062,6449.0,699.0,False,07/14/2021,70,17,180,17,2021-11-11,2.780899999999999,not_requested,233.0
208,Angelic Engineering,1,0,0,0,0,0,0,0,0,17,2.0,0.14,52.0,186.0,False,02/18/2015,3,2,5,1,2021-08-01,0.18,not_requested,0.0
209,Angry Ape Army,0,1,0,0,0,0,0,0,0,3300,1200.0,2.45,5465.0,37.0,False,10/12/2021,201,157,269,24,2021-11-18,1008.6955275000008,approved,386.0
210,Angry Ape Four Eyes Club,0,1,0,0,0,0,0,0,0,218,8.0,0.01,1122.0,58.0,False,07/26/2021,3,10,16,4,2021-09-06,0.01,not_requested,175.0
211,Angry Boars,0,1,0,0,0,0,0,0,0,10000,3400.0,0.03,17862.0,1084.0,False,07/31/2021,133,55,259,20,2021-09-14,14.922819999999978,approved,238.0
212,Angry Dudez OG,0,1,0,0,0,0,0,0,0,51,17.0,0.03,648.0,2099.0,False,03/29/2021,3,5,11,2,2021-08-16,0.03,not_requested,13.0
213,Angry Gorilla Club,0,0,0,0,0,0,0,1,0,38,29.0,0.049,4019.0,22.0,False,05/03/2014,193,202,215,4,2021-12-03,1.0446000000000002,not_requested,40.0
214,Angry Meerkats,0,1,0,0,0,0,0,0,0,7600,2100.0,0.037,17862.0,1084.0,False,07/31/2021,133,55,259,20,2021-10-30,12.589108999999976,approved,236.0
215,Angry Natives,0,1,0,0,0,0,0,0,0,326,174.0,0.07,218.0,52.0,False,11/21/2021,14,10,41,5,2021-12-05,19.339158000000054,approved,10.0
216,Angry Rhinos,1,0,0,0,0,0,0,0,0,164,39.0,0.004,637.0,1478.0,False,11/25/2021,10,4,21,5,2021-11-28,0.2588000000000001,not_requested,13.0
217,Angry Skull Universe,1,0,0,0,0,0,0,0,0,49,62.0,0.003,410.0,559.0,False,10/14/2013,16,19,17,2,2021-12-13,0.17382,not_requested,0.0
218,Ani Mkhitaryan,1,0,0,0,0,0,0,0,0,27,23.0,0.03,3181.0,2408.0,False,10/11/2020,10,31,33,4,2021-09-21,4.52,not_requested,0.0
219,Animal Assassins,0,1,0,0,0,0,0,0,0,3000,278.0,0.023,1413.0,593.0,False,09/27/2021,726,731,744,14,2021-10-01,3.612731430000004,approved,88.0
220,Animal Coloring Book,1,0,0,0,0,0,0,0,0,938,456.0,0.1,179.0,5.0,False,08/29/2021,2,2,15,1,2021-08-31,1.023801,verified,17.0
221,Animal Society,0,1,0,0,0,0,0,0,0,7800,3600.0,0.02,11206.0,481.0,False,09/11/2021,61,147,130,9,2021-10-19,7.230067999999989,approved,254.0
222,Animal Society OG 300,0,1,0,0,0,0,0,0,0,290,245.0,0.05,11206.0,481.0,False,09/11/2021,61,147,130,9,2021-09-30,1.0690000000000004,not_requested,21.0
223,Animal creator planet,1,0,0,0,0,0,0,0,0,37,12.0,0.02,1568.0,660.0,False,05/18/2021,1,10,46,0,2021-09-01,0.18,not_requested,0.0
224,Animal walk,1,0,0,0,0,0,0,0,0,5,3.0,0.1,2007.0,1541.0,False,07/21/2021,2,15,59,1,2021-09-20,0.1,not_requested,0.0
225,Animalian Characters,0,1,0,0,0,0,0,0,0,18,18.0,0.075,2523.0,396.0,False,09/30/2021,6,11,54,2,2021-11-11,0.4677,not_requested,0.0
226,Animals Voxels,0,1,0,0,0,0,0,0,0,32,5.0,0.01,666.0,606.0,False,10/24/2021,63,10,95,3,2021-10-24,0.132,not_requested,61.0
227,AnimalsPunks V2,0,1,0,0,0,0,0,0,0,10000,1700.0,0.027,4283.0,346.0,False,08/09/2021,205,190,222,4,2021-09-11,21.474084919099862,approved,144.0
228,Animalsdz,1,0,0,0,0,0,0,0,0,9,2.0,0.02,53.0,391.0,False,07/02/2021,1,1,2,0,2021-07-02,0.02,not_requested,0.0
229,Animated Nouns,0,1,0,0,0,0,0,0,0,51,23.0,0.9,150.0,9.0,False,08/26/2021,7,2,18,1,2021-09-03,0.01,not_requested,77.0
230,AnimationParty,1,0,0,0,0,0,0,0,0,143,11.0,0.002,200.0,530.0,False,07/10/2021,25,3,30,4,2021-07-17,0.0139999999999999,not_requested,49.0
231,Anime Punks,1,1,0,0,0,0,0,0,0,1000,294.0,0.08,1573.0,343.0,False,04/09/2021,26,30,33,3,2021-02-23,8.299799999999998,approved,660.0
232,AnimeGirlsClub,0,1,0,0,0,0,0,0,0,2900,44.0,0.007,86.0,2.0,False,01/03/2022,24,21,26,1,2021-09-04,0.0242,approved,77.0
233,AnimeMeme,0,1,0,0,0,0,0,0,0,11,2.0,0.01,145.0,141.0,False,11/13/2021,3,2,14,3,2021-11-13,0.02,not_requested,7.0
234,Animetas,0,1,0,0,0,0,0,0,0,10100,4000.0,0.21,35091.0,360.0,False,06/14/2021,1792,1757,1953,24,2021-07-30,1074.217873251907,verified,713.0
235,Anna Koval,1,0,0,0,0,0,0,0,0,42,2.0,0.03,3.0,20.0,False,02/21/2021,0,6,50,0,2021-03-19,0.005,not_requested,80.0
236,Anna Zhilyaeva,1,0,0,0,0,0,0,0,0,672,64.0,0.253,23523.0,281.0,False,03/09/2017,159,81,887,26,2021-02-01,1.022,verified,0.0
237,Anon Deck,0,0,0,0,0,0,1,0,0,55,31.0,0.6,11885.0,102.0,False,07/05/2021,42,56,98,3,2021-10-20,0.018,not_requested,0.0
238,AnonymiceBreeding,0,1,0,0,0,0,0,0,0,3500,1400.0,0.44,15920.0,624.0,False,09/03/2021,65,49,216,19,2021-10-15,267.8181124051084,approved,984.0
239,Anonymous Nobody Official (2021),1,0,0,0,0,0,0,0,0,268,53.0,0.01,11022.0,2867.0,False,02/08/2018,3,5,24,0,2020-12-31,0.262,approved,19.0
240,AnthroWeed,0,1,0,0,0,0,0,0,0,75,19.0,0.004,707.0,1999.0,False,11/14/2021,17,8,69,4,2021-11-16,0.0628,not_requested,0.0
241,Anthropomorphic animals and birds,1,0,0,0,0,0,0,0,0,108,79.0,0.001,109.0,268.0,False,06/02/2020,8,3,20,2,2021-10-06,0.01029559,not_requested,9.0
242,Anthropomorphic dog collection,1,0,0,0,0,0,0,0,0,7,7.0,0.045,920.0,721.0,False,10/17/2021,3,8,36,1,2021-10-31,0.04,not_requested,0.0
243,Anti CryptoPunks,0,1,0,0,0,0,0,0,0,10000,496.0,0.004,657.0,169.0,False,12/13/2021,161,162,169,5,2021-12-01,1.2903987057799997,not_requested,99.0
244,Anti-Gravity,0,1,0,0,0,0,0,0,0,152,41.0,0.025,1074.0,1554.0,False,08/16/2021,27,17,89,6,2021-08-16,0.025,not_requested,264.0
245,Antimasks,0,1,0,0,0,0,0,0,0,1600,494.0,0.015,1761.0,253.0,False,04/03/2021,457,465,654,36,2021-04-26,0.388731329192866,approved,40.0
246,Antiverse NFT,0,1,0,0,0,0,0,0,0,826,394.0,0.04,6171.0,0.0,False,11/11/2021,50,59,60,3,2021-12-01,0.964,not_requested,313.0
247,Antoni Tudisco,1,0,0,0,0,0,0,0,0,897,110.0,0.25,9379.0,900.0,True,09/03/2011,99,45,978,12,2021-05-13,5.790789999999999,verified,0.0
248,AnunnakiZ NFT,0,1,0,0,0,0,0,0,0,59,98.0,0.02,1224.0,132.0,False,07/18/2021,54,16,52,3,2021-08-28,0.17,not_requested,37.0
249,Anxiety Abstractions,1,0,0,0,0,0,0,0,0,7,2.0,0.02,720.0,375.0,False,06/01/2017,8,2,10,2,2021-10-13,0.04,not_requested,0.0
250,Ape Fest 2021 - The Warehouse Party,0,0,0,0,1,0,0,0,0,30,3.0,0.15,7000.0,1765.0,True,02/21/2009,155,616,481,243,2021-11-06,0.15,not_requested,0.0
251,Ape Gang Old,0,1,0,0,0,0,0,0,0,10000,1900.0,0.32,39580.0,1034.0,False,05/04/2021,170,84,363,29,2021-05-04,83.14026000000001,verified,149.0
252,Ape Harbour Hoodies,0,1,0,0,0,0,0,0,0,3,2200.0,0.013,10250.0,1214.0,False,06/03/2021,29,21,130,2,2021-09-19,0.1332,not_requested,3.0
253,Ape Harbour Yachts,0,1,0,0,0,0,0,0,0,7800,2500.0,0.039,10250.0,1214.0,False,06/03/2021,29,21,130,2,2021-07-25,25.952908999999984,verified,96.0
254,Ape Harmony Monster Club,1,0,0,0,0,0,0,0,0,1100,503.0,0.65,3232.0,70.0,False,10/27/2021,55,44,106,8,2021-11-01,190.2913799990001,approved,221.0
255,Ape Island - Season 1,0,0,0,0,0,0,0,0,1,757,79.0,0.2,5059.0,1.0,False,01/26/2021,48,21,85,8,2021-03-23,1.590311034080988,verified,47.0
256,Ape Island - Season 2,0,1,0,0,0,0,0,0,1,1100,74.0,0.05,5059.0,1.0,False,01/26/2021,48,21,85,8,2021-03-26,0.125,not_requested,65.0
257,Ape Monster,0,1,0,0,0,0,0,0,0,86,3100.0,0.005,827.0,2612.0,False,11/23/2021,10,6,20,2,2021-11-23,0.288339421107405,not_requested,172.0
258,Ape Pix Society,0,1,0,0,0,0,0,0,0,30,4.0,0.01,145.0,101.0,False,01/26/2019,3,5,12,3,2021-12-09,0.02,not_requested,9.0
259,Ape Traders (Official),0,1,0,0,0,0,0,0,0,510,281.0,0.023,6076.0,1.0,False,09/27/2021,236,269,274,7,2021-11-16,1.1470000000000002,not_requested,102.0
260,Ape-In Productions,0,0,0,0,0,0,0,1,0,1,1600.0,0.219,9385.0,37.0,False,06/01/2021,193,74,790,82,2021-11-16,37.82173999999999,approved,12.0
261,Aped Punks,0,1,0,0,0,0,0,0,0,1000,556.0,0.02,2171.0,283.0,False,06/24/2021,14,6,36,2,2021-07-09,0.3905,approved,69.0
262,Apes 3D,0,0,0,0,0,0,0,1,0,1000,457.0,0.19,5988.0,994.0,False,05/22/2021,332,361,390,62,2021-05-19,17.548900000000003,verified,183.0
263,Apes In Space NFT,0,1,0,0,0,0,0,0,0,10000,6700.0,0.099,20546.0,1.0,False,11/22/2021,2487,2389,3081,154,2021-12-05,242.26692087704387,approved,130.0
264,Apes Stand Together,1,0,0,0,0,0,0,0,0,827,596.0,0.62,238771.0,0.0,False,01/15/2021,594,232,2298,95,2021-08-17,20.236000000000004,approved,11.0
265,Apes With Lasers NFT,0,1,0,0,0,0,0,0,0,647,495.0,0.03,401.0,36.0,False,03/01/2021,41,4,21,3,2021-04-23,0.027,not_requested,46.0
266,Apesthetics x MetaFactory,1,0,0,0,0,0,0,0,0,1,159.0,0.54,15781.0,461.0,False,10/20/2019,28,10,167,10,2021-10-23,2.8787,not_requested,3.0
267,Apex Optimizers Official,0,0,0,0,0,0,0,1,0,581,279.0,0.099,3044.0,560.0,False,10/08/2021,765,25,1182,4,2021-12-02,5.752359999999999,not_requested,94.0
268,"Aphrodite, The goddess!",0,1,0,0,0,0,0,0,0,11,2.0,0.02,67.0,129.0,False,07/23/2021,30,2,27,2,2021-08-07,0.02,not_requested,18.0
269,Apocalypse Art - Meeings,1,0,0,0,0,0,0,0,0,24,8.0,1.4,1537.0,1758.0,False,08/06/2021,4,3,19,1,2021-09-18,7.5,not_requested,2.0
270,Apocalypse- A Dance of Ice and Fire,0,0,0,0,1,0,0,0,0,41,28.0,0.5,8765.0,986.0,False,11/06/2013,41,63,351,4,2021-09-03,0.5,not_requested,3.0
271,Apparitions vol.1,1,0,0,0,0,0,0,0,0,5,13.0,0.02,1196.0,661.0,False,04/30/2021,35,20,140,2,2021-05-25,0.04,not_requested,4.0
272,Appoachables,0,1,0,0,0,0,0,0,0,450,7.0,0.01,1372.0,487.0,False,09/05/2021,25,21,26,3,2021-09-12,0.02,not_requested,65.0
273,Approving Corgis,0,1,0,0,0,0,0,0,0,4800,1600.0,0.045,11858.0,1031.0,False,06/24/2021,248,130,742,10,2021-09-03,9.597659999999989,approved,433.0
274,Aqua Aerials,0,0,0,0,1,0,0,0,0,50,2.0,0.1,590.0,685.0,False,05/09/2012,5,9,26,3,2021-10-02,0.1,not_requested,0.0
275,Arab Premium Club,0,1,0,0,0,0,0,0,0,100,3.0,0.01,88.0,17.0,False,05/13/2021,16,14,25,1,2021-11-30,0.5800000000000001,not_requested,8.0
276,Arabian Camels,0,1,0,0,0,0,0,0,0,12000,3100.0,0.065,6092.0,138.0,False,05/21/2021,39,30,83,8,2021-05-20,60.064536824936,verified,215.0
277,ArabianPunks,1,1,0,0,0,0,0,0,0,100,40.0,0.234,1905.0,1162.0,False,02/21/2021,34,9,57,5,2021-02-21,1.57,approved,135.0
278,ArcadeNFT,0,1,0,0,0,0,0,0,0,6100,3100.0,0.05,7356.0,780.0,False,03/01/2021,19,9,75,5,2021-08-13,43.69292199989995,verified,66.0
279,ArcadeNFT - ToadRunnerz,0,0,0,0,0,0,0,1,0,4800,3200.0,0.02,7356.0,780.0,False,03/01/2021,19,9,75,5,2021-10-14,1.85783,approved,32.0
280,Arcadians by OPGames,0,1,0,0,0,0,0,0,0,3700,695.0,0.03,3415.0,272.0,False,07/31/2021,88,87,114,19,2021-10-19,2.8398000000000017,not_requested,689.0
281,Arcane Characters,0,1,0,0,0,0,0,0,0,133,117.0,0.001,15.0,35.0,False,08/08/2014,0,2,5,2,2021-11-13,0.109483,not_requested,9.0
282,Archi Postcards,0,1,0,0,0,0,0,0,0,8,10.0,0.05,2540.0,1340.0,False,12/26/2009,18,10,118,3,2021-07-31,0.05,not_requested,0.0
283,Architecture & Culture,1,0,0,0,0,0,0,0,0,33,16.0,0.026,6597.0,2798.0,False,03/26/2021,12,24,78,2,2021-12-11,0.8210000000000002,not_requested,0.0
284,Arcona Digital Land,0,0,0,0,0,0,0,0,1,14200,4300.0,0.08,10627.0,443.0,False,10/21/2017,84,71,183,7,2019-04-26,2.2524,verified,86.0
285,Arcona Domains,0,0,0,0,0,0,0,1,0,7,120.0,0.037,10627.0,443.0,False,10/21/2017,84,71,183,7,2021-04-19,0.033,not_requested,28.0
286,Arctic Dream,0,0,0,0,1,0,0,0,0,14,2.0,0.1,1886.0,1429.0,False,11/19/2017,21,12,136,4,2021-05-18,0.1,not_requested,0.0
287,Arctic Wonders,0,0,0,0,1,0,0,0,0,9,5.0,0.1,1571.0,516.0,False,07/10/2021,6,11,103,2,2021-09-15,0.2,not_requested,0.0
288,Arcus by Rik Oostenbroek,1,0,0,0,0,0,0,0,0,40,30.0,15.0,28997.0,1052.0,False,05/15/2009,5,47,169,3,2021-10-21,67.77525,verified,16.0
289,Armegeddon Ape Club,0,0,0,0,0,0,0,1,0,230,587.0,0.001,2975.0,184.0,False,05/20/2021,416,688,529,18,2021-12-17,0.4964442999999999,not_requested,78.0
290,Army of Madness,1,0,0,0,0,0,0,0,0,10,2.0,0.025,742.0,739.0,False,05/06/2021,13,6,58,3,2021-09-05,0.03,not_requested,0.0
291,Arpeggi Genesis Studio Pass,0,0,0,1,0,0,0,0,0,600,324.0,0.545,5634.0,116.0,False,10/02/2021,50,26,244,73,2021-10-20,35.619899000000004,approved,212.0
292,Arq Skulls,1,0,0,0,0,0,0,0,0,70,49.0,0.49,5826.0,1338.0,False,02/16/2018,3,14,63,1,2021-08-22,1.69,not_requested,33.0
293,Art Apes Club,1,0,0,0,0,0,0,0,0,30,16.0,0.2,87.0,348.0,False,12/10/2021,6,7,18,2,2021-11-14,0.7849999999999999,not_requested,0.0
294,Art Banditz X GC,0,0,0,0,1,0,0,0,0,58,35.0,2.9,1252.0,241.0,False,09/02/2021,9,9,53,3,2021-09-15,2.99,not_requested,9.0
295,Art By Fractual,1,0,0,0,0,0,0,0,0,88,520.0,0.001,466.0,1309.0,False,11/16/2019,5,12,15,4,2021-12-13,0.4212729617021343,not_requested,0.0
296,Art By King Von,1,0,0,0,0,0,0,0,0,1,2.0,0.09,269.0,205.0,False,03/13/2021,6,2,14,1,2021-09-11,0.03,not_requested,0.0
297,Art By Urooj,1,0,0,0,0,0,0,0,0,4,3.0,0.066,758.0,1009.0,False,05/18/2015,20,37,186,5,2021-10-01,0.066,not_requested,0.0
298,Art Girls #,1,0,0,0,0,0,0,0,0,370,31.0,0.004,6.0,1.0,False,12/09/2021,0,1,2,0,2021-10-20,0.143727,not_requested,0.0
299,Art Kung-fu Girl collection,1,0,0,0,0,0,0,0,0,30,21.0,0.12,1831.0,985.0,False,11/20/2020,58,7,304,6,2021-11-06,1.87,not_requested,14.0
300,Art Of Colors NFT.,0,1,0,0,0,0,0,0,0,225,4.0,0.001,90.0,1480.0,False,11/30/2021,1,1,3,1,2021-12-15,0.153,not_requested,0.0
301,Art Paste,1,0,0,0,0,0,0,0,0,169,60.0,0.001,77.0,224.0,False,01/14/2015,2,1,2,0,2021-09-10,0.002881,not_requested,7.0
302,Art Universe Mandalas,1,0,0,0,0,0,0,0,0,466,9.0,0.005,1.0,13.0,False,10/23/2021,1,0,1,1,2021-10-31,0.005,not_requested,0.0
303,Art by 500ETH,1,0,0,0,0,0,0,0,0,10,18.0,0.05,6698.0,1157.0,False,02/13/2021,5,10,51,1,2021-07-18,0.4499999999999999,not_requested,0.0
304,Art by Angel Rivas,1,0,0,0,0,0,0,0,0,151,110.0,0.008,3802.0,2774.0,False,03/17/2020,6,8,29,3,2021-05-29,0.1714,approved,14.0
305,Art by Eugene Gorbachenko,1,0,0,0,0,0,0,0,0,405,7.0,0.003,855.0,1994.0,False,03/15/2018,2,1,12,2,2021-09-07,0.4575000000000002,not_requested,0.0
306,Art by Gabe Weis,1,0,0,0,0,0,0,0,0,103,543.0,0.347,21533.0,3158.0,False,05/20/2010,176,174,575,16,2021-02-28,31.42089999999997,verified,0.0
307,Art by Joyquintas,1,0,0,0,0,0,0,0,0,187,98.0,0.04,4797.0,1921.0,False,06/21/2021,16,17,59,3,2021-06-15,0.284,not_requested,0.0
308,Art by Kelly Moore,1,0,0,0,0,0,0,0,0,494,86.0,0.069,4061.0,4166.0,False,07/25/2021,25,15,104,4,2021-06-04,0.24,not_requested,0.0
309,Art by PixelPancho,1,0,0,0,0,0,0,0,0,16,12.0,0.156,1478.0,908.0,False,03/25/2010,5,4,13,2,2021-08-23,0.2,not_requested,0.0
310,Art by Robert Vandal,1,0,0,0,0,0,0,0,0,16,8.0,0.666,159.0,204.0,False,09/18/2021,1,2,3,1,2021-09-24,0.2214999999999999,not_requested,0.0
311,Art by Tas,1,0,0,0,0,0,0,0,0,9,15.0,0.05,8162.0,4246.0,False,07/27/2017,40,4,115,1,2021-05-12,1.35,not_requested,0.0
312,Art by Visithra,1,0,0,0,0,0,0,0,0,128,208.0,0.09,3740.0,2329.0,False,11/03/2020,5,7,22,1,2021-07-23,3.2890000000000006,approved,2.0
313,Art for Ballers x Gabbo3,0,0,0,0,0,1,0,0,0,42,21.0,1.0,244.0,1051.0,False,05/18/2010,12,12,21,2,2021-11-28,0.5450000000000002,not_requested,0.0
314,Art mixed,1,0,0,0,0,0,0,0,0,20,9.0,0.03,1807.0,459.0,False,08/02/2021,3,5,14,2,2021-04-24,0.18,not_requested,46.0
315,Art of Nature by Greg Dudka,1,0,0,0,0,0,0,0,0,10,3.0,0.05,7.0,23.0,False,11/06/2021,1,4,11,0,2021-11-16,0.05,not_requested,15.0
316,ArtFromAbove,0,0,0,0,1,0,0,0,0,8,6.0,0.2,3894.0,3058.0,False,06/19/2013,6,6,30,1,2021-11-17,0.4,not_requested,4.0
317,ArtGrails,1,0,0,0,0,0,0,0,0,676,263.0,0.12,487.0,42.0,False,03/10/2021,3,9,17,1,2021-03-15,5.188,approved,0.0
318,ArtMental,1,0,0,0,0,0,0,0,0,263,3.0,0.001,1350.0,3030.0,False,04/10/2020,6,4,24,4,2021-10-17,0.005,not_requested,0.0
319,ArtWork by OllOOl,1,0,0,0,0,0,0,0,0,44,48.0,0.025,1200.0,652.0,False,08/01/2021,7,16,47,3,2021-08-05,0.18,not_requested,0.0
320,Artgain,1,0,0,0,0,0,0,0,0,5,2.0,0.01,315.0,397.0,False,12/08/2021,54,12,84,3,2021-12-10,0.1,not_requested,4.0
321,Artifacts of The New Order,1,0,0,0,0,0,0,0,0,24,8.0,0.05,1428.0,1143.0,False,07/08/2021,6,10,21,1,2021-10-25,0.36,not_requested,0.0
322,Artifex,1,0,0,0,0,0,0,0,0,3200,654.0,0.049,8934.0,577.0,False,03/25/2021,22,21,233,4,2021-05-20,22.06801999999992,verified,71.0
323,Artificial Landscape,1,0,0,0,0,0,0,0,0,100,62.0,0.019,6.0,10.0,False,09/29/2021,0,2,4,1,2021-09-24,0.005,not_requested,0.0
324,"Artist Pavel Kuragin. Paintings, drawings, collages.",1,0,0,0,0,0,0,0,0,1600,693.0,0.001,1141.0,526.0,False,03/31/2009,5,3,19,2,2021-09-04,0.3709518548593196,not_requested,0.0
325,Artist VS AI,1,0,0,0,0,0,0,0,0,100,15.0,0.008,1349.0,2375.0,False,10/03/2021,20,19,29,3,2021-10-11,0.018,not_requested,20.0
326,Artist and Lyrics Collection,1,0,0,0,0,0,0,0,0,28,26.0,0.006,706.0,2140.0,False,11/29/2021,9,6,16,1,2021-11-29,0.02225,not_requested,0.0
327,ArtistAJJackson's Artistic Creations,1,1,0,0,0,0,0,0,0,268,5.0,0.001,108.0,389.0,False,09/19/2008,4,2,10,1,2021-03-14,0.08,not_requested,15.0
328,Artistas do Metaverso,0,1,0,0,0,0,0,0,0,3,70.0,0.01,797.0,206.0,False,05/14/2021,12,5,25,4,2021-11-29,0.6810000000000002,not_requested,0.0
329,Artoken,1,0,0,0,0,0,0,0,0,18,328.0,0.004,53.0,7.0,False,10/10/2021,3,5,12,3,2021-09-20,0.0266728999999999,not_requested,0.0
330,Artsy Squidney,1,0,0,0,0,0,0,0,0,25,5.0,0.01,94.0,39.0,False,11/30/2021,7,16,30,4,2021-09-12,0.06,not_requested,0.0
331,Artvatars,1,0,0,0,0,0,0,0,0,6700,1600.0,0.109,21143.0,512.0,False,02/05/2021,149,43,151,12,2021-04-14,17.98839899999999,verified,1431.0
332,Artvatars Community,1,0,0,0,0,0,0,0,0,78,36.0,0.4,21143.0,512.0,False,02/05/2021,149,43,151,12,2021-05-31,1.25,not_requested,52.0
333,Artworks HarisTojaga,0,1,0,0,0,0,0,0,0,32,24.0,0.005,138.0,421.0,False,02/27/2010,2,1,6,2,2021-03-17,0.04,not_requested,0.0
334,Asa 1000,1,0,0,0,0,0,0,0,0,1000,87.0,0.077,22374.0,802.0,False,08/05/2010,1557,88,4759,89,2021-10-23,2.1600000000000006,approved,0.0
335,Ascended Apes by 93nido,0,1,0,0,0,0,0,0,0,24,110.0,0.08,7786.0,6309.0,False,06/07/2011,17,5,84,1,2021-05-01,1.612,not_requested,127.0
336,Ascended Visions by 93nido,1,0,0,0,0,0,0,0,0,20,104.0,0.09,7786.0,6309.0,False,06/07/2011,17,5,84,1,2021-02-19,0.244,requested,168.0
337,Asian Foods,1,0,0,0,0,0,0,0,0,25,2.0,0.005,25.0,115.0,False,04/18/2013,3,1,8,0,2021-09-06,0.02,not_requested,0.0
338,Asimov's Dreams,1,0,0,0,0,0,0,0,0,5,4.0,0.008,58.0,79.0,False,04/09/2021,12,10,24,5,2021-11-04,0.0075,not_requested,0.0
339,Astro Frens,0,1,0,0,0,0,0,0,0,9900,2900.0,0.034,6267.0,0.0,False,07/16/2021,414,265,537,32,2021-07-21,24.032999089425385,verified,172.0
340,Astro Inkweaver Editions,0,0,0,0,1,0,0,0,0,2,38.0,0.03,3321.0,585.0,False,04/20/2011,15,21,84,6,2021-12-04,0.42,not_requested,0.0
341,Astro League,0,0,0,0,0,1,0,0,0,8,19.0,0.6,3573.0,3247.0,False,01/12/2015,9,18,104,3,2021-10-20,1.7999999999999998,not_requested,0.0
342,Astro Pup Club,0,1,0,0,0,0,0,0,0,19,6.0,0.005,419.0,182.0,False,11/16/2014,5,7,17,4,2021-11-15,0.035,not_requested,0.0
343,Astro Tags,1,0,0,0,0,0,0,0,0,2100,20.0,0.001,232.0,761.0,False,09/07/2021,9,12,11,2,2021-09-08,0.0015,not_requested,0.0
344,AstroGator Fam,0,1,0,0,0,0,0,0,0,3000,1700.0,0.299,2969.0,47.0,False,07/24/2021,280,319,316,12,2021-09-18,132.8327415982601,not_requested,121.0
345,AstroHeads,0,1,0,0,0,0,0,0,0,8900,4000.0,0.03,16120.0,161.0,False,10/12/2021,1298,4304,1578,54,2021-11-12,39.42115789000005,approved,166.0
346,AstroKidz,1,0,0,0,0,0,0,0,0,103,58.0,0.05,347.0,569.0,False,08/24/2021,15,26,25,2,2021-08-23,0.249,not_requested,36.0
347,Astrobros: Genesis Collection (Alphabros),0,1,0,0,0,0,0,0,0,39,30.0,0.49,23199.0,584.0,False,06/18/2015,238,232,333,43,2021-03-19,0.7,approved,81.0
348,Astrohedz,0,1,0,0,0,0,0,0,0,2000,569.0,0.009,10861.0,974.0,False,06/11/2021,494,49,595,16,2021-08-04,0.35631,not_requested,551.0
349,Astronaut Collection 1,1,0,0,0,0,0,0,0,0,9,3.0,0.04,21.0,6.0,False,03/11/2012,3,5,10,2,2021-04-21,0.09,not_requested,0.0
350,Astronaut Nature,0,1,0,0,0,0,0,0,0,37,13.0,0.006,109.0,169.0,False,11/15/2021,8,2,17,1,2021-11-23,0.0759999999999999,not_requested,36.0
351,Astrons,1,1,0,0,0,0,0,0,0,92,40.0,0.04,2026.0,787.0,False,06/03/2021,11,5,22,2,2021-06-03,0.0189,approved,82.0
352,Aswang Derivatives,1,0,0,0,0,0,0,0,0,3,11.0,0.35,4815.0,1262.0,False,03/14/2021,8,4,50,2,2021-08-02,0.2,not_requested,0.0
353,Async Art,1,0,0,0,0,0,0,0,0,3600,1000.0,0.02,51649.0,60.0,False,11/22/2019,173,22,202,3,2020-02-23,2.291158693203823,verified,728.0
354,Async Blueprints,0,1,0,0,0,0,0,0,0,2000,1200.0,0.2,51649.0,60.0,False,11/22/2019,173,22,202,3,2021-12-13,1598.3739846359967,verified,611.0
355,Async Music,0,0,0,1,0,0,0,0,0,849,946.0,0.04,51649.0,60.0,False,11/22/2019,173,22,202,3,2021-06-03,1.746,verified,82.0
356,Atardecer (album),0,0,0,1,0,0,0,0,0,24,8.0,0.004,407.0,631.0,False,05/21/2009,1,3,7,2,2021-07-17,0.001,not_requested,13.0
357,AtaryLabo,1,0,0,0,0,0,0,0,0,42,5.0,0.01,3062.0,4736.0,False,04/22/2021,4,7,18,1,2021-09-09,0.002,not_requested,12.0
358,Atrocity Exhibition,1,0,0,0,0,0,0,0,0,29,6.0,0.012,2557.0,2735.0,False,07/07/2021,20,6,33,2,2021-11-30,0.0696,not_requested,0.0
359,Audio NFT | Music Loops&Samples |,0,0,0,1,0,0,0,0,0,36,4.0,0.027,761.0,280.0,False,03/06/2021,7,4,14,2,2021-03-05,0.027,requested,0.0
360,Audioglyphs,0,1,0,1,0,0,0,0,0,10000,2600.0,0.031,2917.0,7.0,False,08/11/2021,79,42,320,58,2021-08-16,4.177322021999999,verified,0.0
361,Aurora Figueras Art,1,0,0,0,0,0,0,0,0,6,2.0,0.025,4.0,66.0,False,07/10/2020,1,0,1,1,2021-07-20,0.05,not_requested,0.0
362,Aus Footy Punks,0,0,0,0,0,1,0,0,0,76,21.0,0.01,346.0,1768.0,False,09/06/2021,17,21,22,3,2021-09-11,0.07,not_requested,19.0
363,Auston Matthews x The 34 Collection,0,0,0,0,0,1,0,0,0,107,53.0,0.5,241728.0,97.0,True,03/04/2013,20062,665,29450,345,2021-04-12,2.641,verified,6.0
364,Author Hashima (copies),1,0,0,0,0,0,0,0,0,5,448.0,0.45,2545.0,1012.0,False,03/05/2021,19,3,39,2,2021-08-31,0.0063972,not_requested,0.0
365,Autista Put,1,0,0,0,0,0,0,0,0,201,13.0,0.005,231.0,785.0,False,10/11/2021,2,1,2,0,2021-10-11,0.02,not_requested,92.0
366,Autistic Blocks,1,0,0,0,0,0,0,0,0,100,12.0,0.03,62.0,10.0,False,10/10/2021,20,18,29,2,2021-10-11,0.3,not_requested,52.0
367,Autochroma,0,1,0,0,0,0,0,0,0,100,51.0,0.1,1625.0,1011.0,False,03/13/2021,7,12,36,3,2021-08-27,0.2,not_requested,0.0
368,Autumn Explorations: Part 1,0,0,0,0,1,0,0,0,0,10,2.0,0.15,3447.0,3720.0,False,07/01/2021,26,13,188,4,2021-12-12,0.15,not_requested,0.0
369,Avarik Armor,0,1,0,0,0,0,0,0,0,129,254.0,0.023,14444.0,12.0,False,09/01/2021,408,382,459,199,2021-11-30,3.2151,not_requested,5.0
370,Avarik Saga Universe,0,1,0,0,0,0,0,0,0,8900,2700.0,0.085,14444.0,12.0,False,09/01/2021,408,382,459,199,2021-09-23,108.41657396237646,verified,504.0
371,Avarik Weapons,0,1,0,0,0,0,0,0,0,127,1800.0,0.01,14444.0,12.0,False,09/01/2021,408,382,459,199,2021-10-29,3.1861899999999985,not_requested,5.0
372,Avastars,1,1,0,0,0,0,0,0,0,25400,4800.0,0.09,23288.0,223.0,False,08/02/2019,55,32,307,17,2020-02-07,213.99310266893093,verified,946.0
373,Aventador NFT,0,1,0,0,0,0,0,0,0,138,8.0,0.01,132.0,84.0,False,11/29/2021,1,1,3,1,2021-11-24,0.0306,not_requested,49.0
374,AveragePunks,0,1,0,0,0,0,0,0,0,2100,608.0,0.033,5080.0,999.0,False,10/05/2021,67,55,84,11,2021-11-27,2.4034969000000004,not_requested,199.0
375,Awakened - MultiPass,0,1,0,0,0,0,0,0,0,5400,2200.0,0.065,7401.0,0.0,False,09/17/2021,709,644,793,57,2021-10-27,8.136716999999997,approved,1946.0
376,Awakened Avatars,0,1,0,0,0,0,0,0,0,147,105.0,0.06,7401.0,0.0,False,09/17/2021,709,644,793,57,2021-12-12,0.578,not_requested,337.0
377,Awakening of the Universe,0,1,0,0,0,0,0,0,0,53,14.0,0.1,80.0,239.0,False,09/10/2021,6,3,12,2,2021-09-12,0.2,not_requested,20.0
378,Awesome Mixtape,1,1,0,0,0,0,0,0,1,7,6.0,0.2,868.0,1354.0,False,09/18/2020,4,8,24,5,2021-03-20,1.0,not_requested,0.0
379,Axie Infinity FanArt x focc,1,0,0,0,0,0,0,0,0,7,14.0,0.1,2165.0,479.0,False,01/16/2021,22,5,92,3,2021-02-12,0.1,approved,2.0
380,Axion NFT Ecosystem,0,0,0,0,0,0,0,1,0,6,1600.0,0.075,16534.0,68.0,False,05/31/2020,47,42,140,6,2021-10-20,5.227299999999999,not_requested,9.0
381,Axion.Network NFTs: OG-5555-2.5,0,0,0,0,0,0,0,1,0,850,828.0,0.08,16534.0,68.0,False,05/31/2020,47,42,140,6,2020-12-18,0.2,not_requested,0.0
382,Azureus Planet,0,1,0,0,0,0,0,0,0,6,2.0,0.005,8.0,15.0,False,11/26/2021,1,1,3,2,2021-11-19,0.009,not_requested,18.0
383,B & W : The girl,1,0,0,0,0,0,0,0,0,12,3.0,0.04,1169.0,1388.0,False,03/04/2018,6,5,13,3,2021-11-29,0.095,not_requested,0.0
384,B&W African Stories,0,0,0,0,1,0,0,0,0,40,5.0,0.08,1391.0,2634.0,False,02/09/2021,28,18,89,13,2021-09-06,0.24,not_requested,0.0
385,B-Starz,1,0,0,0,0,0,0,0,0,98,54.0,0.07,2313.0,1847.0,False,05/09/2021,15,4,21,2,2021-03-28,2.0206172812500003,not_requested,0.0
386,B00NKB0TS,0,0,0,1,0,0,0,0,0,147,73.0,0.015,8616.0,828.0,True,12/23/2009,3,6,20,1,2021-10-21,0.055,not_requested,234.0
387,BABY DRUG-ADDICTED PUNKS,0,1,0,0,0,0,0,0,0,9800,69.0,0.003,102.0,0.0,False,12/06/2021,2,6,11,3,2021-12-16,0.08602,not_requested,114.0
388,BAD SHADOW,0,1,0,0,0,0,0,0,0,395,189.0,0.025,1803.0,5001.0,False,06/13/2021,50,10,65,2,2021-07-12,0.15,not_requested,191.0
389,BADASS Ape Club Official,1,0,0,0,0,0,0,0,0,1100,292.0,0.085,2159.0,112.0,False,11/01/2021,16,14,35,5,2021-12-10,3.813000000000001,not_requested,880.0
390,BADMAN'$,0,1,0,0,0,0,0,0,0,44,17.0,0.475,2936.0,471.0,False,02/17/2021,9,9,59,1,2021-08-29,0.22,not_requested,79.0
391,BALI VISUAL DIARY,1,0,0,0,0,0,0,0,0,4,4.0,0.01,697.0,327.0,False,09/10/2021,16,13,55,5,2021-10-15,0.02,not_requested,0.0
392,BANA-OJI NFT Series,0,0,0,0,0,0,0,1,0,9,174.0,0.009,60782.0,1557.0,False,11/30/2010,164,160,497,49,2021-09-11,0.0384,not_requested,36.0
393,BARFLIES,1,0,0,0,0,0,0,0,0,106,89.0,1.0,9726.0,377.0,True,06/05/2014,52,52,312,8,2021-12-14,30.585290625,verified,1.0
394,BARFS,0,1,0,0,0,0,0,0,0,100,46.0,0.055,2794.0,3246.0,False,07/25/2021,4,8,10,2,2021-08-27,0.47,not_requested,3.0
395,BASTARD GAN PUNKS V2,0,1,0,0,0,0,0,0,0,11300,2800.0,0.2,7798.0,91.0,False,10/23/2020,77,75,108,18,2021-03-07,62.56150900000003,verified,514.0
396,BAYC Honorary Members,0,1,0,0,0,0,0,0,0,35,29.0,85.0,491303.0,5138.0,True,04/12/2021,899,363,3430,155,2021-04-29,70.0,approved,35.0
397,BAYC x round 2l Basketball,0,1,0,0,0,0,0,0,0,275,9.0,0.005,491303.0,5138.0,True,04/12/2021,899,363,3430,155,2021-12-09,0.075,not_requested,0.0
398,BCBoys,0,0,0,0,0,0,0,1,0,174,68.0,0.04,6878.0,26.0,False,09/13/2021,296,74,203,12,2021-11-20,0.13,not_requested,220.0
399,BCCG,0,1,0,0,0,0,1,0,0,57,7000.0,0.01,57038.0,189.0,False,08/27/2020,68,39,272,12,2020-10-31,3.049823890930001,verified,60.0
400,BE..DO..HAVE,0,0,0,0,1,0,0,0,0,25,10.0,0.25,2824.0,1287.0,False,04/04/2019,36,23,94,16,2021-10-26,1.75,not_requested,0.0
401,BEATS Collection,0,1,0,0,0,0,0,0,0,20,4.0,0.023,2287.0,963.0,False,01/29/2011,13,13,52,2,2021-11-30,0.0452,not_requested,0.0
402,BEEP BEEPS,0,1,0,0,0,0,0,0,0,8,3.0,0.004,1480.0,4809.0,False,06/01/2020,11,5,29,3,2021-10-30,0.014,not_requested,0.0
403,BEXARS NFTS,1,0,0,0,0,0,0,0,0,8,44.0,0.005,156.0,628.0,False,09/28/2011,7,7,14,1,2021-08-29,0.0135,not_requested,2.0
404,BEYOND THE ' FALLS ',0,0,0,0,1,0,0,0,0,37,18.0,0.15,4255.0,3868.0,False,05/22/2021,4,7,29,2,2021-08-06,1.74,approved,0.0
405,BGG by Laura Rafferty,1,0,0,0,0,0,0,0,0,1,1200.0,0.004,783.0,195.0,False,09/08/2021,13,25,61,2,2021-10-26,0.0038,not_requested,0.0
406,BIG HEAD CLUB NFT,0,1,0,0,0,0,0,0,0,52,5.0,0.003,39.0,389.0,False,10/25/2021,0,1,2,1,2021-11-10,0.016,not_requested,129.0
407,BINARY CODE ART MUSEUM,1,0,0,0,0,0,0,0,0,350,2.0,0.009,661.0,1497.0,False,10/04/2021,3,1,7,0,2021-11-26,0.018,not_requested,252.0
408,BITDAWGS,0,1,0,0,0,0,0,0,0,1100,258.0,0.009,1155.0,1092.0,False,09/11/2021,40,50,53,5,2021-12-15,1.0552,not_requested,64.0
409,BLACK MOLD by Javan Jordan aka Illest Uminati,1,0,0,0,0,0,0,0,0,7,6.0,0.004,1613.0,1885.0,False,04/07/2009,3,3,4,1,2021-08-23,0.03905,not_requested,0.0
410,BLIND.goblin's Limited Edition Series,1,0,0,0,0,0,0,0,0,1,13.0,0.04,2434.0,2886.0,False,08/19/2012,3,3,18,1,2021-08-30,0.29,not_requested,2.0
411,BLIND_Street Photography,0,0,0,0,1,0,0,0,0,12,6.0,0.035,53.0,23.0,False,08/18/2021,8,2,32,2,2021-08-09,0.05,not_requested,30.0
412,BLOBs by Flooding Factory,1,0,0,0,0,0,0,0,0,34,16.0,1.0,500.0,1181.0,False,09/27/2021,5,2,17,3,2021-11-02,2.5500000000000003,not_requested,0.0
413,BLOCK of CARS,0,0,0,0,0,0,1,0,0,6,18.0,0.001,2.0,32.0,False,09/13/2021,1,0,1,0,2021-09-10,0.0002,not_requested,44.0
414,BLOCKS collection 1,1,0,0,0,0,0,0,0,0,20,16.0,0.35,18208.0,990.0,False,02/14/2020,339,20,2895,9,2021-09-20,0.01,not_requested,0.0
415,BLOCKS collection 3,1,0,0,0,0,0,0,0,0,20,11.0,0.3,18208.0,990.0,False,02/14/2020,339,20,2895,9,2021-10-28,0.3,not_requested,0.0
416,BLOCKWORKS,1,0,0,0,0,0,0,0,0,20,9.0,0.019,1443.0,1898.0,False,03/26/2021,10,11,99,1,2021-12-14,0.076,not_requested,4.0
417,BLOKKBOTS,0,1,0,0,0,0,0,0,1,302,135.0,0.299,12631.0,13092.0,False,03/24/2021,19,25,50,3,2021-03-23,7.339,not_requested,613.0
418,BLUPRINT,1,0,0,0,0,0,0,0,0,1100,221.0,0.029,15965.0,49.0,False,10/18/2021,684,27,220,4,2021-12-17,0.9314000000000004,not_requested,0.0
419,BOHNART,1,0,0,0,0,0,0,0,0,34,92.0,0.045,1437.0,473.0,False,04/02/2021,6,10,32,3,2021-01-25,0.235,approved,0.0
420,BOMBCRYPTO Official,0,1,0,0,0,0,0,0,0,201,104.0,0.01,174131.0,38.0,False,08/25/2021,61601,5719,22733,2952,2021-12-17,0.197,not_requested,19.0
421,BONK Minter,1,0,0,0,0,0,0,0,0,139,84.0,0.01,3094.0,240.0,False,07/19/2020,15,13,50,7,2020-10-08,0.01,approved,0.0
422,BOPSONLY.COM,1,0,0,0,0,0,0,0,0,2,206.0,0.01,1624.0,3313.0,False,10/22/2020,3,3,13,2,2021-07-27,0.0058,not_requested,0.0
423,BORING HEADERS SOCIETY,0,1,0,0,0,0,0,0,0,212,102.0,0.02,753.0,281.0,False,08/11/2021,0,1,8,0,2021-08-10,0.3420000000000001,not_requested,26.0
424,BOUNCE BOUNCE,1,0,0,0,0,0,0,0,0,37,5.0,0.005,5257.0,1541.0,False,07/30/2021,1,72,38,3,2021-10-18,0.01,not_requested,35.0
425,BOX WOLF NFT,0,1,0,0,0,0,0,0,0,42,33.0,0.2,8153.0,1902.0,False,08/04/2021,28,8,121,10,2021-11-07,0.4499999999999999,not_requested,16.0
426,BRAiN VOMiTS GARDEN,1,0,0,0,0,0,0,0,0,4400,2300.0,0.35,9535.0,32.0,False,10/04/2021,537,564,441,81,2021-10-29,234.1758605181636,verified,303.0
427,BROKEN CRAYONS,1,0,0,0,0,0,0,0,0,514,295.0,0.068,2484.0,672.0,False,05/19/2015,67,64,136,11,2021-09-04,2.6006111000000005,not_requested,157.0
428,BROKEN HEAD (TANPOPOE),0,1,0,0,0,0,0,0,0,11,11.0,8.0,2249.0,1928.0,False,06/13/2021,8,3,30,1,2021-08-17,0.45,not_requested,42.0
429,BTG Second Collection,1,0,0,0,0,0,0,0,0,19,28.0,0.42,46.0,1.0,False,11/02/2021,8,3,21,4,2021-10-11,0.03,not_requested,8.0
430,BUBBLES COLLECTIBLES,0,1,0,0,0,0,0,0,0,13,3.0,0.05,876.0,811.0,False,08/16/2021,5,6,18,0,2021-10-13,0.1,not_requested,0.0
431,BUBUU,1,0,0,0,0,0,0,0,0,300,180.0,0.01,11703.0,345.0,False,08/21/2021,15,6,50,3,2021-09-25,0.105,not_requested,377.0
432,BULLSEUM,0,1,0,0,0,0,0,0,0,5000,2000.0,0.048,15310.0,308.0,False,08/07/2021,29,34,63,4,2021-08-26,19.57709999999999,verified,100.0
433,BUNKI The Rabbits,1,0,0,0,0,0,0,0,0,41,4.0,0.02,1042.0,4006.0,False,03/26/2020,12,3,27,1,2021-08-27,0.02,not_requested,0.0
434,BUNS.LAND Genesis,0,1,0,0,0,0,0,0,0,250,122.0,0.13,479.0,315.0,False,06/21/2021,10,8,33,4,2021-10-08,3.4298000000000006,not_requested,0.0
435,BUNS.LAND Origin,0,1,0,0,0,0,0,0,0,235,89.0,0.3,479.0,315.0,False,06/21/2021,10,8,33,4,2021-09-04,2.95,not_requested,0.0
436,BUTTHEADS,0,1,0,0,0,0,0,0,0,8900,2700.0,0.015,2551.0,343.0,False,07/14/2021,202,190,262,12,2021-09-16,54.59871150930076,not_requested,228.0
437,BUTTON EYES PLANET,1,0,0,0,0,0,0,0,0,46,30.0,0.009,1092.0,969.0,False,10/02/2021,4,4,17,2,2021-10-02,0.0289999999999999,not_requested,0.0
438,BYOKEY,0,1,0,0,0,0,0,0,0,1,262.0,3.96,29664.0,404.0,False,06/21/2021,200,62,640,34,2021-09-09,368.0997999,approved,2.0
439,BYOPills,0,1,0,0,0,0,0,0,0,10000,3400.0,1.715,29664.0,404.0,False,06/21/2021,200,62,640,34,2021-07-16,1735.8174093352045,verified,206.0
440,BYOVAPE,0,0,0,0,0,0,0,1,0,1,2800.0,0.62,29664.0,404.0,False,06/21/2021,200,62,640,34,2021-12-07,394.51547849080976,approved,1.0
441,Baboon Brigade,0,0,0,0,0,0,1,0,0,819,331.0,0.03,14678.0,87.0,False,12/04/2017,159,40,176,99,2021-11-11,0.4975,not_requested,124.0
442,Baby Ape Boat Club,0,1,0,0,0,0,0,0,0,333,179.0,0.24,9176.0,1620.0,False,05/18/2021,726,757,825,21,2021-05-18,9.013000000000002,not_requested,530.0
443,Baby Camel Monsters Season 1,0,1,0,0,0,0,0,0,0,263,85.0,0.03,17261.0,6322.0,False,06/08/2013,48,36,84,7,2021-10-21,0.07,approved,364.0
444,Baby Camels Season 1,0,1,0,0,0,0,0,0,0,1100,615.0,0.01,17261.0,6322.0,False,06/08/2013,48,36,84,7,2021-08-25,0.1638,approved,238.0
445,Baby Combat Bots G1,0,1,0,0,0,0,0,0,0,3500,1400.0,0.009,18008.0,117.0,False,07/25/2021,11652,2286,8765,1688,2021-08-24,2.0347989999999982,verified,92.0
446,Baby Crocs,0,1,0,0,0,0,0,0,0,65,30.0,0.04,354.0,705.0,False,12/08/2021,2,4,10,6,2021-12-08,1.2339696969696976,not_requested,63.0
447,Baby Dormant Dragons,0,0,0,0,0,0,0,1,0,741,298.0,0.025,23418.0,49.0,False,10/30/2021,1286,1331,1371,18,2021-12-15,0.8495000000000004,not_requested,205.0
448,Baby Draco,1,0,0,0,0,0,0,0,0,72,9.0,0.006,606.0,1070.0,False,10/24/2021,1,1,2,0,2021-11-09,0.05821,not_requested,0.0
449,Baby Flag Punk,1,0,0,0,0,0,0,0,0,100,12.0,0.03,3014.0,1958.0,False,10/06/2021,71,84,81,5,2021-11-26,0.55,not_requested,156.0
450,Baby Gaming Hodla,0,1,0,0,0,0,0,0,0,999,379.0,0.009,8239.0,657.0,False,11/16/2020,7,5,13,5,2021-11-26,0.04111,not_requested,297.0
451,Baby Garlic,0,1,0,0,0,0,0,0,0,66,19.0,0.005,659.0,737.0,False,07/25/2017,8,8,23,7,2021-10-18,0.0495,not_requested,104.0
452,Baby Ghosts,0,1,0,0,0,0,0,0,0,10000,3700.0,0.019,13124.0,766.0,False,09/23/2021,940,919,1043,30,2021-10-22,66.155774138127,approved,200.0
453,Baby Hamster,1,0,0,0,0,0,0,0,0,159,4.0,0.002,3.0,51.0,False,09/17/2021,2,15,10,1,2021-10-02,0.045,not_requested,62.0
454,Baby Llama Chemistry Labs,0,1,0,0,0,0,0,0,0,2,2000.0,0.017,8464.0,881.0,False,08/11/2021,720,40,742,8,2021-09-06,0.083,not_requested,3.0
455,Baby Llama Club,0,1,0,0,0,0,0,0,0,7800,2700.0,0.008,8464.0,881.0,False,08/11/2021,720,40,742,8,2021-08-30,2.655802099999998,verified,131.0
456,Baby Platypus,0,1,0,0,0,0,0,0,0,49,36.0,0.005,1186.0,699.0,False,10/14/2021,3,2,5,0,2021-11-08,0.134,not_requested,0.0
457,Baby Sasquatch,0,1,0,0,0,0,0,0,0,994,256.0,0.015,371.0,2.0,False,09/05/2021,7,9,18,2,2021-08-10,0.4909000000000001,not_requested,493.0
458,Baby Toads,0,1,0,0,0,0,0,0,0,3500,1300.0,0.003,2919.0,851.0,False,11/23/2021,636,673,801,29,2021-11-28,0.7946499900764772,not_requested,283.0
459,Baby Toons Private Access,0,0,0,0,0,0,0,1,0,1,31.0,0.65,979.0,3.0,False,08/10/2021,14,19,53,3,2021-08-19,2.06,not_requested,5.0
460,BabyApePunk Polygon Metaverse,0,1,0,0,0,0,0,0,0,41,723.0,0.02,89220.0,2417.0,False,05/03/2021,4272,4244,4740,96,2021-12-12,0.192962013889407,not_requested,0.0
461,BabyCharlie,1,0,0,0,0,0,0,0,0,70,11.0,0.003,1124.0,1435.0,False,10/27/2021,13,6,20,4,2021-11-07,0.038,not_requested,0.0
462,BabyElonWorld,0,1,0,0,0,0,0,0,0,2800,1700.0,0.21,9042.0,173.0,False,10/31/2021,645,750,931,46,2021-12-12,198.695273,approved,0.0
463,BabyRex,0,1,0,0,0,0,0,0,0,23,807.0,0.055,13.0,3.0,False,12/14/2021,3,3,7,1,2021-12-14,0.7780000000000002,not_requested,51.0
464,Babylon Prophets,0,0,0,0,0,0,0,1,0,2600,1800.0,0.013,9025.0,161.0,False,02/13/2021,13,6,45,7,2021-11-15,9.227799999999998,approved,660.0
465,Back Alley Art Drop,1,0,0,0,0,0,0,0,0,17,45.0,0.015,279.0,139.0,False,11/06/2021,13,5,45,6,2021-11-08,0.004,not_requested,0.0
466,Back Alley Music Lanyard,0,0,0,0,0,0,0,1,0,69,20.0,0.03,279.0,139.0,False,11/06/2021,13,5,45,6,2021-11-03,0.27,not_requested,0.0
467,Back Street Bunnys,0,1,0,0,0,0,0,0,0,77,16.0,0.003,385.0,199.0,False,12/09/2021,4,6,25,2,2021-12-11,0.088,not_requested,0.0
468,Backwood Punks,0,1,0,0,0,0,0,0,0,45,69.0,0.001,412.0,1012.0,False,03/01/2021,6,2,10,2,2021-09-07,0.0329199999999999,not_requested,0.0
469,Bad / Holo cats,1,0,0,0,0,0,0,0,0,1200,335.0,0.001,686.0,20.0,False,10/28/2021,24,38,38,10,2021-12-16,0.2084187222222221,not_requested,3.0
470,Bad Bunnies Cigar Bar,0,1,0,0,0,0,0,0,0,31,23.0,0.75,7272.0,3390.0,False,07/10/2021,13,26,49,7,2021-11-23,0.25,not_requested,7.0
471,Bad Bunnies NFT,0,1,0,0,0,0,0,0,0,5500,1900.0,0.149,7272.0,3390.0,False,07/10/2021,13,26,49,7,2021-09-15,118.15173249990026,verified,238.0
472,Bad Bunnies Originals,1,0,0,0,0,0,0,0,0,10,175.0,0.02,7272.0,3390.0,False,07/10/2021,13,26,49,7,2021-10-01,0.75,not_requested,32.0
473,Bad Kids Alley Official,0,1,0,0,0,0,0,0,0,8900,3300.0,0.01,9012.0,583.0,False,08/30/2021,373,395,437,9,2021-09-17,5.544109000009988,verified,213.0
474,Bad Produce,1,0,0,0,0,0,0,0,0,24,15.0,0.06,1467.0,1153.0,False,05/16/2008,8,4,26,3,2021-10-31,0.06,not_requested,41.0
475,Badass Bulls,0,1,0,0,0,0,0,0,0,2200,1000.0,0.02,5858.0,1395.0,False,07/30/2021,74,76,100,6,2021-07-30,1.6971309721579264,verified,51.0
476,Badblok Bunniez,0,1,0,0,0,0,0,0,0,22,4.0,0.01,90.0,546.0,False,08/16/2021,5,3,10,1,2021-08-14,0.015,not_requested,78.0
477,Baked Ape,1,0,0,0,0,0,0,0,0,738,216.0,0.039,342.0,1450.0,False,03/04/2021,14,7,21,3,2021-11-15,7.502299999999998,not_requested,11.0
478,Balance in Nature - Conservation of Wildlife,0,0,0,0,1,0,0,0,0,50,19.0,0.2,5285.0,1685.0,False,05/02/2021,26,16,128,1,2021-08-05,2.25,not_requested,0.0
479,Bald Eagle Punks,0,1,0,0,0,0,0,0,0,2600,379.0,0.002,498.0,2342.0,False,09/22/2021,21,11,49,11,2021-09-10,0.0170999999999999,not_requested,97.0
480,Bali Bohemia (Genesis Collection),1,0,0,0,0,0,0,0,0,6,2.0,0.25,2995.0,1462.0,False,10/11/2021,140,63,562,24,2021-10-11,0.2,not_requested,0.0
481,Bali in Black & White,0,0,0,0,1,0,0,0,0,30,26.0,0.3,18567.0,1829.0,False,01/27/2019,62,67,419,13,2021-08-28,0.1,not_requested,0.0
482,Ballardian,1,0,0,0,0,0,0,0,0,16,6.0,0.05,223.0,69.0,False,06/15/2009,4,1,25,1,2021-10-27,0.35,not_requested,0.0
483,Baller Apes,0,0,0,0,0,1,0,0,0,554,196.0,0.027,5613.0,178.0,False,07/01/2021,83,50,92,10,2021-11-25,1.1672499999999997,not_requested,90.0
484,BallerToadz,0,0,0,0,0,1,0,0,0,71,26.0,0.039,297.0,512.0,False,11/19/2021,32,17,21,4,2021-11-19,0.5179999999999999,not_requested,55.0
485,BallooNFT,0,1,0,0,0,0,0,0,0,93,285.0,0.001,114.0,366.0,False,11/29/2021,2,4,12,5,2021-11-29,0.0883,not_requested,219.0
486,Ballseyes Series - PFP Collectibles,1,0,0,0,0,0,0,0,0,136,77.0,0.02,235.0,358.0,False,09/05/2021,7,6,30,3,2021-09-05,2.510000000000001,not_requested,0.0
487,Bamboo Babies,0,1,0,0,0,0,0,0,0,28,18.0,0.009,49.0,49.0,False,12/14/2021,2,4,9,1,2021-12-13,0.1999,not_requested,21.0
488,Bamboozlers,0,1,0,0,0,0,0,0,0,10000,840.0,0.035,1129.0,6.0,False,09/04/2021,74,43,152,9,2021-10-10,4.484311199999999,approved,61.0
489,BananaGuns,0,1,0,0,0,0,0,0,0,5,5.0,0.03,1034.0,799.0,False,03/11/2021,4,7,16,2,2021-11-03,0.06,not_requested,1.0
490,Bandyland Beer Garden,0,0,0,0,0,0,0,1,0,3,6.0,0.01,11513.0,5118.0,False,06/27/2010,11,6,34,2,2021-11-20,0.015,not_requested,3.0
491,Banyan & Clouds - Bestiary Compendium,1,0,0,0,0,0,0,0,0,23,5.0,0.018,90.0,161.0,False,09/04/2021,7,3,23,1,2021-09-17,0.0539999999999999,not_requested,0.0
492,Bapho-SKULL Universe,0,1,0,0,0,0,0,0,0,82,11.0,0.007,820.0,999.0,False,10/22/2018,3,6,17,3,2021-11-17,0.23976,not_requested,260.0
493,Barnyard Fashionistas Official,0,1,0,0,0,0,0,0,0,1100,264.0,0.009,5712.0,205.0,False,10/05/2021,70,81,81,7,2021-12-16,0.9796010000000002,not_requested,584.0
494,BarongaNft,1,0,0,0,0,0,0,0,0,140,25.0,0.001,91.0,224.0,False,11/06/2021,2,3,7,2,2021-11-06,0.0618,not_requested,54.0
495,BarrelFi Genesis Vintage: Striped Pig Pixie Collection,0,0,0,0,0,0,0,1,0,113,41.0,0.088,3782.0,2821.0,False,06/25/2010,2,1,4,1,2021-09-25,0.31,not_requested,114.0
496,Barry The Gorilla,0,1,0,0,0,0,0,0,0,165,2.0,0.009,27.0,190.0,False,01/06/2013,2,1,5,1,2021-11-11,0.009,not_requested,0.0
497,Barstool NFT,0,1,0,0,0,0,0,0,0,5,5.0,6.942,3295498.0,785.0,True,03/03/2009,762,740,10327,693,2021-04-20,11.830125,verified,0.0
498,Bartholomoo the Cow,0,1,0,0,0,0,0,0,0,56,37.0,0.02,6633.0,5374.0,False,04/02/2021,8,12,21,1,2021-08-27,0.12,not_requested,205.0
499,Baseball Fans,1,0,0,0,0,0,0,0,0,23,2.0,0.05,183.0,1177.0,False,01/06/2011,2,2,3,1,2021-08-11,0.05,not_requested,0.0
500,Baseball NFT ART,0,0,0,0,0,1,0,0,0,21,6.0,0.001,2.0,48.0,False,01/22/2018,1,0,1,0,2021-09-17,0.0173,not_requested,21.0
501,Based Fish Mafia,0,1,0,0,0,0,0,0,0,10000,2500.0,0.06,8723.0,1005.0,False,06/30/2021,263,279,320,13,2021-08-26,41.73995019980294,verified,202.0
502,Based Fish Mafia Fine Art Print Tokens,0,1,0,0,0,0,0,0,0,504,242.0,0.05,8723.0,1005.0,False,06/30/2021,263,279,320,13,2021-10-25,0.045,not_requested,0.0
503,Based Fish Mafia Wire,0,1,0,0,0,0,0,0,0,1,917.0,0.032,8723.0,1005.0,False,06/30/2021,263,279,320,13,2021-12-10,1.3497,not_requested,0.0
504,Based Walrus Collective',0,1,0,0,0,0,0,0,0,15,6.0,0.04,826.0,110.0,False,09/29/2021,433,96,478,6,2021-11-22,0.08,not_requested,0.0
505,Basic Bored Ape Club,1,0,0,0,0,0,0,0,0,10000,4400.0,0.02,10609.0,10.0,False,12/02/2021,1167,1476,1428,44,2021-12-17,480.7927473876838,approved,125.0
506,BassHeadz,0,0,0,1,0,0,0,0,0,50,16.0,0.04,1011.0,333.0,False,02/02/2018,7,7,34,1,2021-09-08,0.04,not_requested,56.0
507,Bassed Sea,0,0,0,1,0,0,0,0,0,14,13.0,0.07,1011.0,333.0,False,02/02/2018,7,7,34,1,2020-12-29,0.21,approved,29.0
508,Bastard Bit Birds,0,1,0,0,0,0,0,0,0,300,3.0,0.01,4297.0,317.0,False,04/06/2021,34,422,301,1,2021-04-09,0.01,not_requested,74.0
509,Bath and pretty girl Collection,0,1,0,0,0,0,0,0,0,10,9.0,0.12,1440.0,778.0,False,11/10/2021,320,91,377,7,2021-11-14,0.34,not_requested,0.0
510,Battle Of S3XY,1,1,0,0,0,0,0,0,0,3,7.0,0.13,2145.0,1649.0,False,02/05/2016,19,27,189,3,2021-03-31,0.19,not_requested,0.0
511,Battlepunk,0,1,0,0,0,0,0,0,0,1100,397.0,0.024,22581.0,1.0,False,10/26/2021,1410,1564,1430,49,2021-11-28,2.76879,not_requested,266.0
512,Bauhaus Faces,1,1,0,0,0,0,0,0,0,60,47.0,0.19,2896.0,2867.0,False,01/19/2021,11,10,41,2,2021-03-20,0.01701,not_requested,39.0
513,Bay of Bridges,0,0,0,0,1,0,0,0,0,35,11.0,0.15,2491.0,865.0,False,05/24/2021,4,15,31,2,2021-08-30,0.3,not_requested,0.0
514,Bazooka Chicks,0,1,0,0,0,0,0,0,0,3300,197.0,0.015,1774.0,26.0,False,08/30/2021,92,26,118,6,2021-10-01,0.4239000000000001,not_requested,415.0
515,Beacon Book Series,0,1,0,0,0,0,0,0,0,1400,661.0,0.014,2868.0,160.0,False,10/27/2020,26,11,145,7,2021-10-19,0.165,not_requested,2.0
516,Beacons of light,1,0,0,0,0,0,0,0,0,10,2.0,0.05,3741.0,1425.0,False,02/19/2020,32,4,194,1,2021-09-11,0.06,not_requested,0.0
517,BearCat.Studio - Bunny Club,0,1,0,0,0,0,0,0,0,10000,4.0,0.089,612.0,8.0,False,11/03/2021,729,13,696,0,2021-09-19,0.0888,not_requested,206.0
518,BearPunks.,0,1,0,0,0,0,0,0,0,100,33.0,0.005,658.0,814.0,False,08/07/2021,4,5,17,1,2021-08-06,0.008,not_requested,56.0
519,BearSociety,0,1,0,0,0,0,0,0,0,2100,1000.0,0.001,334.0,230.0,False,09/26/2019,17,21,31,4,2021-11-23,1.068312564981421,not_requested,301.0
520,BearXLabs,1,0,0,0,0,0,0,0,0,4500,1600.0,0.183,57879.0,17.0,False,09/29/2021,2139,2141,2194,20,2021-11-04,201.8278597727892,approved,112.0
521,Bearbrains Collabs,1,0,0,0,0,0,0,0,0,10,25.0,0.02,7916.0,5940.0,False,11/09/2009,19,13,84,4,2021-08-03,0.5,not_requested,17.0
522,Beard Bears yOGi Pass,0,0,0,0,0,0,0,1,0,100,98.0,0.039,739.0,235.0,False,09/01/2021,146,55,70,9,2021-12-17,2.0624,not_requested,0.0
523,Beardeliciouz,1,0,0,0,0,0,0,0,0,36,11.0,0.043,861.0,723.0,False,12/06/2021,2,5,8,1,2021-12-08,0.162,not_requested,0.0
524,Bears Deluxe,1,0,0,0,0,0,0,0,0,5900,2400.0,2.15,22656.0,9.0,False,09/21/2021,2156,2313,2426,90,2021-11-28,1094.2638601000017,approved,133.0
525,BearsOnTheBlock,0,1,0,0,0,0,0,0,0,9500,3200.0,0.025,30373.0,397.0,False,06/10/2021,221,219,314,11,2021-07-31,6.206092198108467,verified,177.0
526,Beary Nice,1,0,0,0,0,0,0,0,0,88,36.0,0.005,2165.0,1613.0,False,09/10/2021,19,14,51,2,2021-09-21,0.1686,not_requested,130.0
527,Beast dolls,0,1,0,0,0,0,0,0,0,113,29.0,0.015,4936.0,5277.0,False,08/13/2021,3,1,5,2,2021-09-23,0.017,not_requested,48.0
528,Beat Warrrior World,0,1,0,0,0,0,0,0,0,13,35.0,0.003,2769.0,4632.0,False,12/22/2013,5,5,12,4,2021-07-02,0.0135,not_requested,2.0
529,Beautiful Birds,1,0,0,0,0,0,0,0,0,7,24.0,0.017,1386.0,1886.0,False,01/11/2016,8,4,19,2,2021-06-13,0.06,not_requested,0.0
530,Beautiful Cities of the World,0,0,0,0,1,0,0,0,0,55,87.0,0.6,60163.0,2772.0,False,03/12/2007,7,13,39,6,2021-08-11,0.5,verified,0.0
531,BeautifulMindz,0,0,0,0,0,0,0,1,0,14,2.0,0.1,516.0,1510.0,False,10/05/2014,17,4,25,1,2021-05-10,0.1,not_requested,8.0
532,Beauty in Chaos,0,1,0,0,0,0,0,0,0,32,10.0,0.007,785.0,667.0,False,04/10/2018,74,81,90,3,2021-04-20,0.0782,not_requested,0.0
533,Beauty in Dreamland,1,0,0,0,0,0,0,0,0,83,27.0,0.044,1515.0,1805.0,False,03/14/2009,10,4,46,2,2021-07-05,0.06,not_requested,20.0
534,Beauty portrait,0,0,0,0,1,0,0,0,0,10,2.0,0.01,1001.0,1232.0,False,03/20/2016,2,1,4,0,2021-09-15,0.01,not_requested,0.0
535,Bebarbarie,0,1,0,0,0,0,0,0,0,42,27.0,0.04,325.0,59.0,False,01/21/2012,3,3,6,2,2021-11-22,0.6900000000000002,not_requested,26.0
536,Beck the Duck,1,0,0,0,0,0,0,0,0,22,3.0,0.01,123.0,127.0,False,10/25/2021,4,4,14,3,2021-10-24,0.03,not_requested,6.0
537,Bedhead Fairies,1,0,0,0,0,0,0,0,0,10,2.0,0.005,635.0,501.0,False,09/03/2021,20,7,26,4,2021-10-24,0.005,not_requested,0.0
538,Beeple: All Hail The King,1,0,0,0,0,0,0,0,0,58,691.0,0.01,60644694.0,1.0,True,02/20/2007,31113,8001,273205,6048,2021-02-24,0.255331,approved,0.0
539,Bees Deluxe,1,0,0,0,0,0,0,0,0,6200,1500.0,0.125,22656.0,9.0,False,09/21/2021,2156,2313,2426,90,2021-11-28,67.47171000000004,approved,149.0
540,BeezerBears,0,1,0,0,0,0,1,0,0,20300,533.0,0.02,1849.0,3077.0,False,09/17/2014,14,4,20,3,2021-02-28,2.666,approved,214.0
541,Behaving Badly,1,0,0,0,0,0,0,0,0,12,2.0,0.05,1336.0,717.0,False,09/04/2021,11,7,53,1,2021-10-02,0.05,not_requested,0.0
542,BeingHumanBeing Collection,1,0,0,0,0,0,0,0,0,101,14.0,0.008,208.0,207.0,False,11/06/2021,26,10,38,5,2021-11-24,0.152,not_requested,0.0
543,Bellow,1,0,0,0,0,0,0,0,0,66,21.0,0.07,875.0,217.0,False,09/10/2021,50,10,77,3,2021-09-11,0.55,not_requested,0.0
544,Beluga Bay - Founders Special Edition Collection,0,1,0,0,0,0,0,0,0,78,464.0,0.002,8872.0,4855.0,False,06/28/2021,47,28,156,9,2021-09-07,0.0467606,not_requested,85.0
545,Beluga Bay Season One (Official),0,1,0,0,0,0,0,0,0,3300,268.0,0.006,8872.0,4855.0,False,06/28/2021,47,28,156,9,2021-09-27,0.8482000000000005,not_requested,174.0
546,Ben Baller BlockChains,0,1,0,0,0,0,0,0,0,6000,830.0,0.02,3590.0,32.0,True,11/03/2021,759,726,991,71,2021-11-22,10.064079999999986,approved,53.0
547,Ben Baller Gems,0,1,0,0,0,0,0,0,0,4000,233.0,0.01,3590.0,32.0,True,11/03/2021,759,726,991,71,2021-12-15,19.799579999987007,not_requested,22.0
548,Ben Hopper - Dancers on Rooftops - 100 Unique Dance Photographs,0,0,0,0,1,0,0,0,0,49,26.0,0.3,28434.0,18375.0,False,02/09/2009,4,4,28,2,2021-08-30,0.59,approved,73.0
549,Ben Savage Editions,1,0,0,0,0,0,0,0,0,2,34.0,0.024,6586.0,1423.0,False,12/07/2020,15,8,90,4,2021-08-26,0.02,not_requested,0.0
550,Ben Strauss Editions,1,0,0,0,0,0,0,0,0,1,87.0,0.75,24404.0,972.0,False,04/02/2019,164,93,1523,12,2021-05-09,0.996,approved,0.0
551,Benson's Block Party,0,1,0,0,0,0,0,0,0,101,19.0,0.07,674.0,148.0,False,10/30/2021,4,9,51,3,2021-11-28,0.6300000000000001,not_requested,54.0
552,Bespoke Toy Faces,0,1,0,0,0,0,0,0,0,7,6.0,420.0,21529.0,5799.0,False,01/07/2010,70,271,573,8,2021-04-09,6.0,not_requested,0.0
553,Best Cigar Smokers,0,0,0,0,1,0,0,0,0,10,663.0,0.001,479.0,251.0,False,12/03/2017,1,1,3,1,2021-12-15,0.10268869,not_requested,0.0
554,Bet On Bux,0,0,0,0,0,0,0,1,0,5,2.0,0.006,45.0,177.0,False,07/04/2019,1,2,6,0,2021-11-02,0.0070435099999999,not_requested,0.0
555,Betsy Neis Illustrator,1,0,0,0,0,0,0,0,0,50,4.0,0.01,101.0,707.0,False,03/06/2017,16,1,76,1,2021-12-16,0.03,not_requested,0.0
556,Bettorverse,0,0,0,0,0,0,0,1,0,1200,462.0,0.02,1294.0,15.0,False,08/24/2021,183,114,133,14,2021-09-20,0.3573,not_requested,0.0
557,Between Landscapes,0,0,0,0,1,0,0,0,0,9,9.0,1.0,10542.0,1199.0,False,07/03/2021,7,60,213,0,2021-09-02,0.8,not_requested,20.0
558,Beyond Earth Races,0,1,0,0,0,0,0,0,0,1100,565.0,0.009,4891.0,116.0,False,08/18/2021,41,39,60,6,2021-10-08,0.1081999999999999,not_requested,164.0
559,BeyondNFT [Ethereum],1,1,0,0,0,0,0,0,0,60,192.0,0.035,1832.0,15.0,False,10/26/2020,7,5,27,1,2021-03-12,0.05,approved,29.0
560,Biased Football Canvas,0,0,0,0,0,1,0,0,0,7,2.0,0.008,3.0,3.0,False,12/07/2021,0,1,5,2,2021-12-07,0.008,not_requested,0.0
561,Big Dragons,1,0,0,0,0,0,0,0,0,136,70.0,0.005,470.0,510.0,False,12/04/2019,1,4,10,5,2021-10-07,0.4133900000000002,not_requested,34.0
562,Big Head Soccer Club,0,0,0,0,0,1,0,0,0,213,48.0,0.02,1758.0,4942.0,False,08/24/2021,54,60,58,3,2021-07-28,0.17,not_requested,127.0
563,Big Reds,1,0,0,0,0,0,0,0,0,50,5.0,0.03,143.0,70.0,False,02/27/2012,3,22,12,2,2021-09-23,0.012,not_requested,0.0
564,Big Tiddy Goth GFs,0,1,0,0,0,0,0,0,0,7000,966.0,0.002,284.0,23.0,False,11/02/2021,20,12,32,4,2021-10-31,0.2729350000000002,not_requested,1268.0
565,Big Time Founders Collection,0,0,0,0,0,0,0,0,1,5,2600.0,0.175,179103.0,1811.0,False,02/11/2021,13890,1769,15161,365,2021-08-24,166.80421898989997,verified,0.0
566,BigFatCats OG Collection,0,1,0,0,0,0,0,0,0,51,26.0,0.55,243.0,137.0,False,08/26/2021,31,24,40,10,2021-08-03,0.4650000000000002,not_requested,256.0
567,BigOldBears,1,0,0,0,0,0,0,0,0,42,16.0,0.01,1241.0,34.0,False,11/12/2021,19,26,27,3,2021-11-13,0.0999,not_requested,55.0
568,Bikes of Burden - Hans Kemp's cult collection of 130 motorized street beasts.,0,0,0,0,1,0,0,0,0,130,54.0,1.5,2296.0,816.0,False,10/25/2020,10,6,40,3,2021-04-21,9.79,verified,18.0
569,BillionDollarDapp,1,0,0,0,0,0,0,0,0,30,14.0,100.0,149.0,307.0,False,03/30/2021,4,2,5,1,2021-04-22,0.25,not_requested,146.0
570,Billionaire Bones Club Official,1,0,0,0,0,0,0,0,0,5000,42.0,0.02,53.0,23.0,False,12/01/2021,10,12,12,3,2021-12-03,0.4600000000000001,not_requested,0.0
571,Billionaire Coyote Cartel,0,1,0,0,0,0,0,0,0,2200,260.0,0.63,9915.0,6.0,False,10/25/2021,893,366,1101,32,2021-11-08,344.33077912626425,approved,117.0
572,Billionaire Dogs Club BDC,0,1,0,0,0,0,0,0,0,2000,1200.0,0.003,3088.0,1.0,False,11/12/2021,27,30,69,3,2021-12-11,9.959821887899995,approved,121.0
573,Billionaire Penguin Punks,0,1,0,0,0,0,0,0,0,160,22.0,0.005,34.0,20.0,False,11/14/2021,2,1,7,3,2021-11-13,0.1435000000000001,not_requested,65.0
574,BillionaireCryptoCrocs,0,1,0,0,0,0,0,0,0,124,3.0,0.018,33.0,189.0,False,11/08/2021,9,2,7,1,2021-11-05,0.0175,not_requested,70.0
575,BillionaireZombiesClub,0,1,0,0,0,0,0,0,0,10000,3400.0,0.068,11687.0,487.0,False,08/11/2021,266,251,342,41,2021-10-05,83.53382748377781,approved,129.0
576,BillionaireZombiesClub MetaCrystals Official,0,1,0,0,0,0,0,0,0,9700,1200.0,0.03,11687.0,487.0,False,08/11/2021,266,251,342,41,2021-11-26,4.2011999999999965,approved,0.0
577,BillionaireZombiesClub Skeleton Keys,0,1,0,0,0,0,0,0,0,618,504.0,0.445,74927.0,21016.0,True,01/21/2008,86,54,131,4,2021-11-19,21.175110000000004,approved,0.0
578,Bills Bills Bills,1,0,0,0,0,0,0,0,0,29,23.0,25.0,8210.0,352.0,False,09/02/2010,147,206,2425,36,2021-08-31,2.5,not_requested,0.0
579,Billy-K1D,0,1,0,0,0,0,0,0,0,82,33.0,0.015,10182.0,3402.0,False,11/10/2020,34,9,26,11,2021-09-11,0.07,not_requested,83.0
580,Bilocation VOL. 1,0,0,0,0,1,0,0,0,0,10,8.0,0.3,38500.0,4633.0,False,02/21/2011,216,30,1551,13,2021-08-11,0.2,not_requested,0.0
581,Bingo! - on Forma,1,0,0,0,0,0,0,0,0,447,177.0,0.019,377.0,122.0,False,08/28/2021,50,5,47,5,2021-09-29,0.015501,not_requested,13.0
582,Biomes A tribute to Conway's Game of Life,0,1,0,0,0,0,0,0,0,169,79.0,0.235,1069.0,1303.0,False,03/17/2021,45,46,67,9,2021-08-10,0.09,not_requested,95.0
583,Bird Brains Collection,0,1,0,0,0,0,0,0,0,29,17.0,0.025,1137.0,3249.0,False,11/30/2010,3,3,12,1,2021-09-03,0.145,not_requested,0.0
584,Bird Guys,0,1,0,0,0,0,0,0,0,1600,465.0,0.009,2572.0,1111.0,False,04/06/2021,5,18,33,2,2021-04-18,1.0750287500000004,not_requested,228.0
585,Birds of Life,1,0,0,0,0,0,0,0,0,4,2.0,0.005,1.0,3.0,False,11/14/2021,0,0,1,0,2021-11-15,0.005,not_requested,0.0
586,Bisco Punks Season 1,0,0,0,0,0,0,0,1,0,18,11.0,0.1,29523.0,565.0,True,12/08/2008,26,45,226,34,2021-10-20,0.32,not_requested,50.0
587,Bit Liquor,0,1,0,0,0,0,0,0,0,81,25.0,0.02,1057.0,650.0,False,04/18/2021,2,11,20,1,2021-04-18,0.06,not_requested,212.0
588,Bit Soulmate,1,0,0,0,0,0,0,0,0,3000,83.0,0.011,615.0,130.0,False,10/09/2021,166,145,192,84,2021-11-27,0.1848593999999999,not_requested,158.0
589,Bit Wine,0,1,0,0,0,0,0,0,0,1000,323.0,0.04,1169.0,242.0,False,03/16/2021,83,86,114,8,2021-04-07,2.7859,verified,774.0
590,BitAliens,0,1,0,0,0,0,0,0,0,1900,755.0,0.01,21097.0,2790.0,False,03/09/2021,0,2,3,0,2021-03-08,1.1169000000000002,approved,334.0
591,BitBear_B.B,1,0,0,0,0,0,0,0,0,57,24.0,0.008,36.0,47.0,False,10/08/2021,3,4,14,3,2021-10-24,0.0146132,not_requested,0.0
592,BitBlots,1,0,0,0,0,0,0,0,0,711,224.0,0.033,3413.0,929.0,False,03/05/2021,1298,377,1629,16,2021-03-09,0.175,approved,116.0
593,BitColors,1,0,0,0,0,0,0,0,0,1000,464.0,0.06,4637.0,1.0,False,09/25/2021,15,16,52,5,2021-10-21,6.168828,approved,0.0
594,BitDrivers,0,0,0,0,0,0,0,1,0,22200,421.0,0.001,115.0,20.0,False,09/29/2021,24,7,27,3,2021-12-08,0.3843456137366745,not_requested,216.0
595,BitFoxes,1,1,0,0,0,0,0,0,0,8900,482.0,0.019,283.0,106.0,False,08/07/2021,61,75,71,2,2021-03-08,6.143100000000019,approved,151.0
596,BitFrenchie,0,1,0,0,0,0,0,0,0,2200,931.0,0.04,13944.0,694.0,False,11/14/2021,3971,2505,1532,131,2021-12-13,12.623499999899988,not_requested,177.0
597,BitHamsters,0,1,0,0,0,0,0,0,0,86,8.0,0.02,17.0,35.0,False,04/08/2021,0,0,2,0,2021-03-29,0.015,not_requested,0.0
598,BitKidZ,0,0,0,0,0,0,1,0,0,190,49.0,0.001,51.0,104.0,False,10/27/2021,3,2,10,2,2021-10-30,0.0131998,not_requested,130.0
599,BitRings,1,0,0,0,0,0,0,0,0,94,14.0,0.003,187.0,160.0,False,11/13/2021,29,31,30,3,2021-11-12,0.002,not_requested,42.0
600,BitStampsNFT,0,1,0,0,0,0,0,0,0,20,2.0,0.01,265.0,1556.0,False,09/21/2021,4,10,13,1,2021-10-27,0.01,not_requested,0.0
601,Bitbones,1,1,0,0,0,0,0,0,0,1000,510.0,0.19,6695.0,873.0,False,03/10/2021,136,135,179,12,2021-03-01,7.169500000000004,verified,338.0
602,Bitchcoin,1,0,0,0,0,0,0,0,0,3300,254.0,1.35,2528.0,845.0,False,11/16/2012,27,9,103,9,2021-05-22,20.110000000000003,verified,0.0
603,Bitcoin mooning,1,0,0,0,0,0,0,0,0,11,2.0,0.005,20.0,178.0,False,11/26/2016,1,6,5,0,2021-03-06,0.0185433324185543,requested,0.0
604,BitcoinBillionaires,0,1,0,0,0,0,0,0,0,13300,5000.0,0.05,16381.0,297.0,False,09/20/2021,358,330,712,39,2021-06-22,102.63292365995038,approved,203.0
605,BitcoinTarot - World's 1st Crypto Tarot Cards,0,0,0,0,0,0,1,0,0,107,53.0,0.05,1065.0,1407.0,False,07/01/2019,3,3,10,0,2019-06-30,0.051,approved,68.0
606,Bitcolour NFTs,1,0,0,0,0,0,0,0,0,100,5.0,0.01,4.0,6.0,False,10/19/2021,0,1,2,0,2021-10-19,0.01,not_requested,0.0
607,Bitz,0,1,0,0,0,0,0,0,0,1000,601.0,0.5,20394.0,69.0,False,03/06/2021,112,328,324,13,2021-07-12,60.1590999999999,approved,75.0
608,Black & White Days,0,0,0,0,1,0,0,0,0,50,44.0,0.9,26816.0,820.0,False,09/15/2010,44,68,90,3,2021-09-26,0.5,not_requested,56.0
609,Black Hole Sun 0-&,0,0,0,0,0,0,0,0,1,6,5.0,0.001,8.0,7.0,False,04/04/2021,0,0,0,0,2021-04-04,0.0015,not_requested,16.0
610,Black Iris,1,0,0,0,0,0,0,0,0,6,5.0,0.1,4698.0,2391.0,False,07/30/2019,38,8,268,3,2021-11-18,0.38,not_requested,0.0
611,Black NFT Art - Rise Token,0,0,0,0,0,0,0,1,0,1,151.0,0.25,13268.0,1539.0,False,03/01/2021,171,157,218,16,2021-11-08,1.7500000000000009,not_requested,1.0
612,Black Wallstreet Bulls,0,0,0,0,0,0,0,1,0,50,4.0,0.03,3.0,10.0,False,12/01/2021,0,0,1,0,2021-12-01,0.03,not_requested,1.0
613,Black and Aurum,1,0,0,0,0,0,0,0,0,5,3.0,0.3,1710.0,1440.0,False,03/03/2019,83,33,214,14,2021-11-03,0.5700000000000001,not_requested,8.0
614,Blacky Circle,1,0,0,0,0,0,0,0,0,12,2.0,0.004,38.0,72.0,False,11/10/2021,5,3,6,2,2021-11-16,0.007,not_requested,37.0
615,BladeRunner Punks,0,1,0,0,0,0,0,0,0,10000,4100.0,0.058,5513.0,949.0,False,12/06/2021,725,698,855,24,2021-12-11,1412.6503327684652,approved,113.0
616,BlankFace,0,1,0,0,0,0,0,0,0,10000,5200.0,0.002,14752.0,50.0,False,08/25/2021,673,729,809,65,2021-09-12,0.9995100000100005,verified,161.0
617,Bleacher Brews,0,0,0,0,0,1,0,0,0,7,9.0,0.375,301.0,135.0,False,02/08/2017,22,28,35,3,2021-11-17,0.0005,not_requested,0.0
618,Blesko Cat,1,0,0,0,0,0,0,0,0,3300,10.0,0.002,8.0,51.0,False,09/30/2021,0,2,1,0,2021-10-13,0.004,not_requested,61.0
619,Blinking Girls,0,1,0,0,0,0,0,0,0,51,13.0,0.008,480.0,912.0,False,11/06/2021,22,8,32,5,2021-11-05,0.05,not_requested,60.0
620,Blitmap,0,1,0,0,0,0,0,0,0,1700,595.0,5.0,22248.0,18.0,False,03/18/2021,77,48,641,45,2021-05-15,115.48340000000002,verified,296.0
621,Blob Mob,0,1,0,0,0,0,0,0,0,939,506.0,0.02,2596.0,370.0,False,05/01/2021,57,26,180,11,2021-05-01,0.632,verified,57.0
622,Blobs By Peter The Roman,1,0,0,0,0,0,0,0,0,100,60.0,0.3,1112.0,938.0,False,02/21/2021,6,10,33,1,2021-10-19,3.8683,approved,0.0
623,Blochi | Lost in Reality,1,0,0,0,0,0,0,0,0,45,15.0,0.025,118.0,1120.0,False,12/31/2020,1,2,3,1,2021-09-01,0.0125,not_requested,0.0
624,Block Worlds,0,1,0,0,0,0,0,0,0,72,2.0,0.2,12.0,2.0,False,04/23/2010,0,0,1,0,2021-05-04,0.3,not_requested,0.0
625,BlockArt,1,0,0,0,0,0,0,0,0,10700,2800.0,0.02,8657.0,512.0,False,12/14/2020,16,16,146,4,2021-01-06,6.313756857521706,verified,0.0
626,BlockBirds,0,1,0,0,0,0,0,0,0,849,258.0,0.05,3419.0,3266.0,False,04/10/2021,57,49,84,4,2021-04-25,3.6456588949956616,not_requested,117.0
627,BlockBots by Indorse,0,1,0,0,0,0,0,0,0,3000,1500.0,0.009,13129.0,56.0,False,08/09/2021,488,490,571,32,2021-10-28,3.2866199999999983,approved,195.0
628,BlockMark Gems,0,1,0,0,0,0,0,0,0,594,114.0,0.049,154.0,199.0,False,11/30/2018,29,26,28,3,2019-04-26,74.28503000000005,approved,34.0
629,Blockasset Legends,0,1,0,0,0,0,0,0,0,10,3.0,0.2,66890.0,266.0,False,05/13/2021,286,198,342,24,2021-09-25,0.45,not_requested,0.0
630,Blockchain Adventures Of Bella The Blue Bot,0,1,0,0,0,0,0,0,0,3100,1600.0,0.025,27478.0,3870.0,False,05/22/2013,11,13,31,3,2021-11-13,2.0552,not_requested,198.0
631,Blockchain Babies Metaverse,0,0,0,0,0,0,0,1,0,121,77.0,0.41,1887.0,390.0,False,09/07/2021,81,322,132,8,2021-10-05,28.667999999999992,approved,85.0
632,Blockchain Badlands,0,1,0,0,0,0,0,0,0,3400,661.0,0.007,14124.0,1387.0,False,08/20/2021,38,41,55,5,2021-10-08,0.207,not_requested,235.0
633,Blockchain Buds,1,1,0,0,0,0,0,0,0,110,158.0,0.012,4815.0,205.0,False,03/10/2021,11,14,43,4,2021-03-10,0.09,requested,490.0
634,Blockchain Fox,0,1,0,0,0,0,0,0,0,80,14.0,0.001,364.0,967.0,False,08/28/2021,7,33,25,3,2021-08-28,0.012,not_requested,0.0
635,Blockchain Miners Club Official,1,0,0,0,0,0,0,0,0,11100,3400.0,0.65,18694.0,674.0,False,10/11/2021,2566,2540,2764,58,2021-11-22,806.2051401540004,approved,304.0
636,BlockchainBikers,0,1,0,0,0,0,0,0,0,11100,4600.0,0.006,13792.0,862.0,False,07/24/2021,203,211,785,37,2021-08-21,0.9128587967120542,verified,155.0
637,Blockheads Family,0,1,0,0,0,0,0,0,0,3900,987.0,0.01,1372.0,147.0,False,09/27/2021,11,14,73,3,2021-10-20,0.24564,not_requested,384.0
638,Blockmine Advent Calendar 2021,0,1,0,0,0,0,0,0,0,24,47.0,0.012,9988.0,101.0,False,04/24/2021,49,27,146,6,2021-11-30,0.1255,not_requested,2.0
639,Blockship,0,1,0,0,0,0,0,0,0,514,328.0,0.023,4866.0,19.0,False,09/10/2021,128,15,744,6,2021-09-11,0.174,not_requested,22.0
640,Blocky Doge: Guilds,0,1,0,0,0,0,0,0,0,1000,528.0,0.23,724.0,31.0,False,10/22/2021,140,335,372,2,2021-10-09,55.77039999999995,verified,271.0
641,Blokpax Razz,0,0,0,0,0,0,1,0,0,37,1600.0,0.001,3965.0,130.0,False,04/16/2021,18,5,36,4,2021-09-30,9.14511102530999,not_requested,7.0
642,Bloktopia Official,0,1,0,0,0,0,0,0,0,136,25.0,0.05,328905.0,121.0,False,05/17/2021,3226,1078,10956,534,2021-11-29,2.295,not_requested,0.0
643,Bloom with grace,1,0,0,0,0,0,0,0,0,2,2.0,0.3,9037.0,2078.0,False,05/26/2016,6,12,73,2,2021-12-11,0.63,approved,0.0
644,Blooming Flower/AlineSubi,1,0,0,0,0,0,0,0,0,5,4.0,0.035,1391.0,940.0,False,11/25/2018,8,9,22,3,2021-09-20,0.07,not_requested,1.0
645,Bluboy's BluWorld,1,0,0,0,0,0,0,0,0,1300,702.0,0.05,12295.0,73.0,False,10/07/2021,94,89,125,6,2021-11-09,3.7976,approved,135.0
646,Blue Hour - Town with a Cold Case,0,0,0,0,1,0,0,0,0,9,9.0,1.0,1953.0,1523.0,False,07/24/2019,7,49,290,1,2021-10-08,0.15,not_requested,0.0
647,BlueBird Gangster,0,1,0,0,0,0,0,0,0,41,10.0,0.009,1157.0,923.0,False,10/03/2021,2,1,5,0,2021-11-16,0.0559999999999999,not_requested,62.0
648,BluePanda,0,1,0,0,0,0,0,0,0,35,12.0,0.003,23.0,52.0,False,12/03/2021,1,1,4,3,2021-12-03,0.042,not_requested,26.0
649,BlueWorld Metaverse,0,1,0,0,0,0,0,0,0,3500,831.0,0.109,2503.0,117.0,False,10/27/2021,111,108,133,10,2021-11-13,26.58397000000004,approved,0.0
650,Bluerabbitillust Tarot Card Collections.,1,1,0,0,0,0,0,0,0,16,17.0,0.12,2591.0,1569.0,False,06/20/2009,10,6,28,0,2021-03-31,0.17,not_requested,35.0
651,Bluescale Punks,0,1,0,0,0,0,0,0,0,3000,55.0,0.01,738.0,3.0,False,08/23/2021,1,2,5,0,2021-08-22,0.0279999999999999,not_requested,522.0
652,Bluesters,1,0,0,0,0,0,0,0,0,140,65.0,0.025,98.0,23.0,False,01/02/2022,51,51,62,7,2021-11-14,2.312399999999998,not_requested,0.0
653,Blunt's Buds,0,1,0,0,0,0,0,0,0,170,282.0,0.004,5020.0,5342.0,False,02/21/2021,18,21,35,3,2021-06-13,0.050099,not_requested,887.0
654,Bluntz With Friendz NFT,0,0,0,0,0,0,0,1,0,397,2000.0,0.001,1015.0,340.0,False,12/28/2019,30,29,29,5,2021-10-02,0.1432097300000001,not_requested,63.0
655,Board Animal,0,1,0,0,0,0,0,0,0,77,49.0,0.05,3459.0,832.0,False,09/23/2021,8,21,87,3,2021-09-26,0.498,not_requested,133.0
656,Boats Boats Boats,0,0,0,0,1,0,0,0,0,30,9.0,0.05,2476.0,1006.0,False,08/20/2021,3,9,37,1,2021-09-08,0.35,not_requested,58.0
657,BobMarleyArt,0,0,0,0,0,0,1,0,0,13,2.0,0.03,353.0,1011.0,False,04/05/2021,4,2,7,1,2021-05-08,0.03,not_requested,0.0
658,Bobblers,0,0,0,0,0,1,0,0,0,78,15.0,1.0,915.0,2243.0,False,10/24/2021,5,7,17,4,2021-10-08,0.025,not_requested,22.0
659,Bold and Brash Collection,0,1,0,0,0,0,0,0,0,85,49.0,0.008,933.0,1426.0,False,08/31/2021,4,8,12,2,2021-08-31,0.16037,approved,70.0
660,Bonedroids,1,0,0,0,0,0,0,0,0,43,14.0,0.005,134.0,366.0,False,12/07/2021,3,8,10,6,2021-12-07,0.1015,not_requested,0.0
661,Bones & Bananas,0,1,0,0,0,0,0,0,0,10000,6900.0,0.002,4224.0,552.0,False,07/07/2021,15,6,31,3,2021-07-15,0.6138000000000001,approved,80.0
662,Bones Club Heritage,1,1,0,0,0,0,0,0,0,1000,588.0,0.07,6880.0,1052.0,False,05/18/2021,195,195,241,13,2021-05-18,2.216500000000001,verified,131.0
663,Bonjour Richesse | Margaux Klein,1,0,0,0,0,0,0,0,0,114,60.0,1.09,56.0,183.0,False,12/22/2021,1,22,8,1,2021-11-11,21.045,approved,7.0
664,Bonkers Dragon,1,0,0,0,0,0,0,0,0,17,2.0,0.015,5782.0,1207.0,False,06/10/2021,126,102,118,5,2021-11-20,0.017,not_requested,19.0
665,Bonzai by VizualGardens,0,1,0,0,0,0,0,0,0,211,152.0,0.079,4270.0,9.0,False,11/14/2021,47,67,106,4,2021-12-17,0.37,not_requested,0.0
666,Boodles Club,0,1,0,0,0,0,0,0,0,1900,627.0,0.01,3183.0,37.0,False,10/26/2021,430,150,471,9,2021-11-29,2.649628999999992,not_requested,369.0
667,Book II - Continuum (Pt. 1),0,0,0,0,1,0,0,0,0,10,4.0,0.15,2441.0,1572.0,False,11/15/2013,41,47,216,11,2021-09-28,0.4499999999999999,not_requested,0.0
668,Book page art by Pavel Kuragin. First edition.,1,0,0,0,0,0,0,0,0,168,12.0,0.005,1141.0,526.0,False,03/31/2009,5,3,19,2,2021-10-18,0.002,not_requested,0.0
669,Bookie Art Therapy,1,0,0,0,0,0,0,0,0,11,10.0,0.08,6286.0,2108.0,False,09/07/2021,28,10,101,6,2021-10-10,0.08,not_requested,0.0
670,Boomboxheads Legends,0,1,0,0,0,0,0,0,0,252,70.0,0.269,1854.0,1495.0,False,03/18/2016,24,12,76,9,2021-07-26,0.905,approved,86.0
671,Boopalicious,0,1,0,0,0,0,0,0,0,25,2.0,0.01,99.0,548.0,False,10/11/2021,2,4,11,5,2021-09-22,0.015,not_requested,0.0
672,Booty Sandwich,1,0,0,0,0,0,0,0,0,7,5.0,0.7,27831.0,939.0,False,10/14/2017,525,111,667,16,2021-11-19,2.3,not_requested,0.0
673,BoozyMonsters,1,0,0,0,0,0,0,0,0,125,18.0,0.05,290.0,728.0,False,10/25/2021,33,42,44,5,2021-11-02,0.006,not_requested,0.0
674,Borderland.,1,0,0,0,0,0,0,0,0,14,2.0,0.01,623.0,288.0,False,11/28/2021,2,2,7,0,2021-12-05,0.08,not_requested,0.0
675,Boreal Dreams,0,0,0,0,1,0,0,0,0,10,3.0,0.1,1055.0,768.0,False,03/04/2020,28,10,150,3,2021-09-27,0.1,not_requested,0.0
676,Bored Alien Mars Club,0,1,0,0,0,0,0,0,0,1100,177.0,0.01,329.0,162.0,False,01/26/2021,100,117,94,4,2021-05-30,0.046,approved,76.0
677,Bored Ape Adidas,0,1,0,0,0,0,0,0,0,19,46.0,0.004,4086796.0,177.0,True,05/17/2011,1887,541,21371,182,2021-12-05,0.7084000000000003,not_requested,0.0
678,Bored Ape Ansi Club,0,1,0,0,0,0,0,0,0,5,2.0,0.005,72.0,113.0,False,11/27/2021,3,1,14,4,2021-11-28,0.01,not_requested,0.0
679,Bored Ape Board Club,0,1,0,0,0,0,0,0,0,150,25.0,0.01,9536.0,128.0,False,10/19/2021,520,532,519,16,2021-11-22,0.1349999999999999,not_requested,0.0
680,Bored Ape Club 4D (Official),0,1,0,0,0,0,0,0,0,510,41.0,0.03,9.0,19.0,False,11/16/2021,1,0,2,0,2021-10-29,0.8659500000000004,not_requested,82.0
681,Bored Ape Comic,0,1,0,0,0,0,0,0,0,10000,2700.0,0.039,8400.0,1771.0,False,06/25/2021,65,45,158,12,2021-07-20,24.809291100000014,approved,0.0
682,Bored Ape Comic PRE SALE OFFICIAL SEASON PASS,1,0,0,0,0,0,0,0,0,1,322.0,0.3,8400.0,1771.0,False,06/25/2021,65,45,158,12,2021-07-15,9.945499,approved,0.0
683,Bored Ape Crypto Paintings,0,1,0,0,0,0,0,0,0,550,65.0,0.02,10104.0,46.0,False,10/25/2021,683,716,726,17,2021-12-15,2.864999999999995,not_requested,0.0
684,Bored Ape Degenerates Club,0,1,0,0,0,0,0,0,0,21,18.0,0.99,44533.0,3570.0,False,10/05/2014,50,25,269,6,2021-05-03,1.55,approved,109.0
685,Bored Ape Lab (TAYC),1,0,0,0,0,0,0,0,0,52,4.0,0.3,4348.0,1408.0,False,07/21/2011,1,1,7,0,2021-09-14,1.5,not_requested,53.0
686,Bored Ape Ladies Collective,1,0,0,0,0,0,0,0,0,51,223.0,0.08,4823.0,869.0,False,05/02/2021,52,47,123,17,2021-10-14,16.591000000000005,approved,175.0
687,Bored Ape LaserEyes Club,0,1,0,0,0,0,0,0,0,1000,62.0,0.05,1881.0,1283.0,False,02/24/2021,39,22,51,3,2021-11-11,2.0827,not_requested,190.0
688,Bored Ape Mining Club,0,1,0,0,0,0,0,0,0,1100,414.0,0.009,1523.0,2.0,False,11/19/2021,53,21,54,3,2021-11-16,1.07009521,not_requested,132.0
689,Bored Ape Motion Club by sophie 1337,1,0,0,0,0,0,0,0,0,33,12.0,0.134,787.0,486.0,False,01/16/2011,19,22,103,4,2021-11-02,0.9511,not_requested,75.0
690,Bored Ape Not Club,0,1,0,0,0,0,0,0,0,83,163.0,0.17,1816.0,2827.0,False,05/13/2021,202,197,273,6,2021-05-13,25.13878868125,not_requested,0.0
691,Bored Ape Paint Art,1,0,0,0,0,0,0,0,0,102,914.0,0.002,1313.0,12.0,False,11/08/2021,189,217,225,9,2021-09-26,0.2574080000000001,not_requested,0.0
692,Bored Ape Paint Art Cards,0,0,0,0,0,0,1,0,0,99,11.0,1.0,1313.0,12.0,False,11/08/2021,189,217,225,9,2021-12-12,0.0639359999999999,not_requested,10.0
693,Bored Ape Picasso Party,0,1,0,0,0,0,0,0,0,1000,41.0,0.01,2979.0,1765.0,False,08/27/2021,53,214,155,2,2021-11-28,0.5900000000000001,not_requested,0.0
694,Bored Ape Pixel Party,0,1,0,0,0,0,0,0,0,1000,348.0,0.011,476.0,232.0,False,11/13/2021,68,60,94,6,2021-11-10,1.8271199999999983,not_requested,89.0
695,Bored Ape Remix Club - by Dario De Siena,1,0,0,0,0,0,0,0,0,80,270.0,0.105,34074.0,2184.0,False,09/04/2014,25,69,134,2,2021-05-01,2.720700000000001,approved,44.0
696,Bored Ape Salon,1,0,0,0,0,0,0,0,0,115,82.0,0.07,1793.0,872.0,False,06/25/2021,19,7,109,6,2021-06-29,0.7000000000000002,not_requested,54.0
697,Bored Ape Seeks Yacht Club #0,0,1,0,0,0,0,0,0,0,5600,1200.0,0.001,5022.0,153.0,False,07/12/2021,59,52,79,10,2021-08-14,0.2622,not_requested,11.0
698,Bored Ape Winter Special,0,1,0,0,0,0,0,0,0,690,5.0,0.007,1348.0,1215.0,False,08/11/2021,6,1,9,2,2021-10-03,0.014,not_requested,0.0
699,Bored Ape Yacht Club,1,1,0,0,0,0,0,0,0,10000,6100.0,77.77,491336.0,5138.0,True,04/12/2021,900,365,3431,157,2021-04-22,61469.00058706184,verified,168.0
700,Bored Ape Yacht Club Co11ection,1,0,0,0,0,0,0,0,0,309,7.0,0.08,491336.0,5138.0,True,04/12/2021,900,365,3431,157,2021-09-10,0.22,not_requested,393.0
701,Bored Ape Yacht Express (BAYEX) - Timeless8 x Etherist,1,0,0,0,0,0,0,0,0,154,70.0,0.06,995.0,2447.0,False,07/12/2021,24,21,40,4,2021-07-11,0.6,not_requested,129.0
702,Bored Apes Derivatives,1,0,0,0,0,0,0,0,0,1400,2500.0,0.009,1013.0,384.0,False,10/06/2021,6,4,50,0,2021-10-25,0.3073829999999999,not_requested,0.0
703,Bored Aztec Apes,0,1,0,0,0,0,0,0,0,20,123.0,0.15,3361.0,2682.0,False,04/09/2017,6,84,35,1,2021-08-10,2.021,approved,7.0
704,Bored Baboon,1,0,0,0,0,0,0,0,0,115,32.0,0.01,138.0,308.0,False,10/24/2021,5,4,20,5,2021-10-30,0.1175,not_requested,306.0
705,Bored Baby Musk,0,1,0,0,0,0,0,0,0,61,31.0,0.005,580.0,70.0,False,08/21/2019,9,6,14,5,2021-12-05,0.3672000000000003,not_requested,106.0
706,Bored Banana Club,0,1,0,0,0,0,0,0,0,290,54.0,0.01,496.0,1191.0,False,06/27/2021,42,40,133,2,2021-06-28,0.045,not_requested,117.0
707,Bored Bananas,0,1,0,0,0,0,0,0,0,4000,1800.0,0.03,469.0,923.0,False,05/17/2021,9,5,36,1,2021-06-23,10.472065796763385,verified,232.0
708,Bored Bananas Polygon,0,1,0,0,0,0,0,0,0,5000,113.0,0.001,2465.0,996.0,False,11/23/2021,181,212,193,8,2021-11-28,0.225991,not_requested,0.0
709,Bored Bigfoot Billionaires,0,1,0,0,0,0,0,0,0,3300,1500.0,0.079,5949.0,0.0,False,11/15/2021,627,469,735,34,2021-12-10,113.40467945151542,approved,118.0
710,Bored Boy,0,1,0,0,0,0,0,0,0,231,88.0,0.2,4652.0,661.0,False,07/21/2021,7,9,35,3,2021-07-21,9.003900000000003,not_requested,4.0
711,Bored Bud Bong Club,1,0,0,0,0,0,0,0,0,420,7.0,0.025,3.0,0.0,False,12/26/2021,0,0,1,0,2021-09-07,0.125,not_requested,61.0
712,Bored Cat Club,0,1,0,0,0,0,0,0,0,10000,2800.0,0.004,2727.0,1246.0,False,10/02/2021,185,78,220,9,2021-09-11,4.848187885348768,approved,210.0
713,Bored Chipmunks,0,1,0,0,0,0,0,0,0,1000,91.0,0.001,470.0,133.0,False,11/18/2021,19,16,24,4,2021-12-05,0.2567638614100002,not_requested,67.0
714,Bored Cyclops YC,0,1,0,0,0,0,0,0,0,505,47.0,0.001,838.0,242.0,False,09/30/2021,181,184,189,3,2021-10-04,0.0009,not_requested,0.0
715,Bored Doggy Club,1,0,0,0,0,0,0,0,0,122,46.0,0.003,571.0,1300.0,False,09/18/2021,27,33,34,9,2021-12-04,0.0496,not_requested,213.0
716,Bored Doodle NFT,0,1,0,0,0,0,0,0,0,41,21.0,0.002,153.0,338.0,False,11/03/2019,1,1,4,1,2021-12-10,0.1486,not_requested,0.0
717,Bored Elon x Bull Punk: Future of Mars,0,1,0,0,0,0,0,0,0,101,63.0,0.3,1554.0,40.0,False,02/20/2021,3,3,8,2,2021-03-10,1.97,verified,16.0
718,Bored Friends by Bored Boy,0,1,0,0,0,0,0,0,0,111,49.0,0.01,4652.0,661.0,False,07/21/2021,7,9,35,3,2021-09-21,0.5135000000000002,not_requested,1.0
719,Bored Gator Club,1,0,0,0,0,0,0,0,0,171,37.0,0.003,16.0,12.0,False,12/08/2021,0,1,4,2,2021-11-17,0.2938000000000001,not_requested,20.0
720,Bored Gentlemen,0,1,0,0,0,0,0,0,0,10,310.0,0.009,52120.0,3534.0,False,05/23/2021,17,80,171,2,2021-06-17,0.1396,not_requested,0.0
721,Bored Girls Club,1,0,0,0,0,0,0,0,0,42,25.0,0.045,8279.0,1607.0,False,06/17/2021,9,24,160,1,2021-09-29,0.3899999999999999,not_requested,17.0
722,Bored Girra Club,0,1,0,0,0,0,0,0,0,2700,62.0,0.005,68.0,127.0,False,12/09/2021,13,16,21,1,2021-12-07,0.3869,not_requested,36.0
723,Bored Gorilla Crypto Gang,0,1,0,0,0,0,0,0,0,82,14.0,0.01,222.0,449.0,False,10/17/2021,2,1,2,1,2021-10-29,0.03,not_requested,176.0
724,Bored Grim Reaper Crew,0,1,0,0,0,0,0,0,0,100,3.0,0.025,383.0,520.0,False,05/21/2017,18,20,21,3,2021-12-02,0.04,not_requested,77.0
725,Bored Gutter Apes,0,1,0,0,0,0,0,0,0,50,48.0,3.5,4104.0,2702.0,False,01/01/2018,14,17,116,2,2021-05-24,12.7,approved,125.0
726,Bored Gutter Apes Gen 2,0,1,0,0,0,0,0,0,0,176,140.0,0.8,31305.0,7623.0,False,06/10/2007,39,16,52,1,2021-11-30,111.48296262619984,approved,141.0
727,Bored Hasbi Club,1,0,0,0,0,0,0,0,0,135,72.0,0.06,8359.0,126.0,False,11/19/2021,3096,447,975,7,2021-11-11,3.2840000000000007,not_requested,25.0
728,Bored Mafia Club NFT,1,0,0,0,0,0,0,0,0,36,2.0,0.075,15274.0,260.0,False,07/01/2015,247,90,246,4,2021-11-06,0.075,not_requested,0.0
729,Bored Monkey Yaht Club,0,1,0,0,0,0,0,0,0,27400,5.0,0.07,491338.0,5138.0,True,04/12/2021,900,366,3431,157,2021-12-06,0.14,not_requested,0.0
730,Bored Monkey Yat Club,0,1,0,0,0,0,0,0,0,31700,12.0,0.007,491338.0,5138.0,True,04/12/2021,900,366,3431,157,2021-12-11,0.133,not_requested,0.0
731,Bored Monkeys Yact Club,0,1,0,0,0,0,0,0,0,52200,28.0,0.007,491338.0,5138.0,True,04/12/2021,900,366,3431,157,2021-11-03,0.147,not_requested,0.0
732,Bored Monkeys Yaht Club,0,1,0,0,0,0,0,0,0,49800,35.0,0.005,491338.0,5138.0,True,04/12/2021,900,366,3431,157,2021-12-07,0.2940000000000001,not_requested,0.0
733,Bored Monster Kids,1,0,0,0,0,0,0,0,0,2600,2.0,0.043,902.0,2769.0,False,11/05/2021,7,4,20,2,2021-12-05,0.043,not_requested,179.0
734,Bored Mummy Baby Waking Up,0,1,0,0,0,0,0,0,0,3900,2600.0,0.09,16100.0,8071.0,False,07/26/2021,368,353,436,22,2021-08-27,36.08793980000005,verified,79.0
735,Bored Mummy Waking Up,0,1,0,0,0,0,0,0,0,8900,3700.0,0.139,16100.0,8071.0,False,07/26/2021,368,353,436,22,2021-08-08,91.60029589100006,verified,184.0
736,Bored Noun Gang,0,1,0,0,0,0,0,0,0,201,22.0,0.004,29.0,45.0,False,12/03/2021,3,2,16,1,2021-11-23,0.1653,not_requested,0.0
737,Bored Octopi,0,1,0,0,0,0,0,0,0,50,13.0,0.001,153.0,2.0,False,08/28/2021,0,3,3,1,2021-08-27,0.012,not_requested,30.0
738,Bored Orc Crypto Club,0,1,0,0,0,0,0,0,0,2200,539.0,0.001,2301.0,157.0,False,11/28/2021,191,213,223,7,2021-11-28,0.0976379999999999,not_requested,128.0
739,Bored Pugs,1,0,0,0,0,0,0,0,0,159,81.0,0.03,504.0,20.0,False,09/06/2021,18,6,44,2,2021-09-04,0.645,not_requested,48.0
740,Bored Punk Pioneers,0,1,0,0,0,0,0,0,0,120,80.0,0.1,5090.0,13.0,False,09/14/2021,327,200,787,114,2021-09-17,2.16,not_requested,0.0
741,Bored Punk Yacht Club,0,1,0,0,0,0,0,0,0,812,356.0,0.2,3675.0,689.0,False,06/01/2021,124,31,176,34,2021-08-09,3.99,not_requested,121.0
742,Bored Punks of Society,0,1,0,0,0,0,0,0,0,2800,1300.0,0.012,5090.0,13.0,False,09/14/2021,327,200,787,114,2021-12-07,90.91964767910432,not_requested,310.0
743,Bored Starry Night Anime Club,1,0,0,0,0,0,0,0,0,26,556.0,0.001,1272.0,2286.0,False,05/03/2014,1,6,5,1,2021-09-21,0.002523,not_requested,0.0
744,Bored Starry Night Club,1,0,0,0,0,0,0,0,0,93,665.0,0.001,1272.0,2286.0,False,05/03/2014,1,6,5,1,2021-09-04,0.044875,not_requested,0.0
745,Bored Starry Night Marvel Club,1,0,0,0,0,0,0,0,0,11,145.0,0.005,1272.0,2286.0,False,05/03/2014,1,6,5,1,2021-11-02,0.005,not_requested,0.0
746,Bored Starry Night Pokemon Club,1,0,0,0,0,0,0,0,0,156,2900.0,0.001,1272.0,2286.0,False,05/03/2014,1,6,5,1,2021-09-13,0.1472055999999999,not_requested,6.0
747,Bored Starry Night Samurai Club,1,0,0,0,0,0,0,0,0,49,1800.0,0.002,1272.0,2286.0,False,05/03/2014,1,6,5,1,2021-09-11,0.08511,not_requested,0.0
748,Bored Vikings,0,1,0,0,0,0,0,0,0,89,45.0,0.006,204.0,1443.0,False,12/10/2021,17,18,22,2,2021-12-11,0.6689000000000004,not_requested,72.0
749,Boring Bananas Co.,0,1,0,0,0,0,0,0,0,8900,2200.0,0.01,6658.0,1.0,False,06/18/2021,22,25,55,4,2021-06-29,1.1884900000000005,verified,130.0
750,Boring Non Fungible Tokens,0,0,0,0,0,0,0,1,0,5,1200.0,0.001,1639.0,42.0,False,10/06/2021,500,515,475,15,2021-09-10,0.0005,not_requested,0.0
751,BoringStone Genesis Collection,0,1,0,0,0,0,0,0,0,10000,3000.0,0.012,6145.0,806.0,False,10/01/2021,100,81,145,6,2021-10-05,7.911739999999988,not_requested,207.0
752,Born Soldiers,0,0,0,0,0,0,0,1,0,450,156.0,0.01,5926.0,578.0,False,10/14/2021,38,28,41,26,2021-12-17,0.4255,not_requested,193.0
753,Borpacasso,0,1,0,0,0,0,0,0,0,2300,1200.0,0.099,6787.0,35.0,False,08/28/2021,41,35,104,12,2021-09-10,8.423190999,verified,96.0
754,Borrowed Time,0,0,0,0,1,0,0,0,0,60,31.0,0.19,23519.0,1081.0,False,02/06/2013,929,29,5639,17,2021-08-10,1.3299999999999998,not_requested,0.0
755,Boss Beauties,0,1,0,0,0,0,0,0,0,10000,4700.0,0.405,28811.0,1755.0,False,08/02/2021,143,65,691,30,2021-09-24,1690.2248939050305,verified,212.0
756,Boss Llamas,0,1,0,0,0,0,0,0,0,100,85.0,4.15,23456.0,1036.0,False,09/10/2021,473,452,858,57,2021-10-08,71.6969,approved,245.0
757,Botzy Punks,1,0,0,0,0,0,0,0,0,96,33.0,0.019,996.0,70.0,False,11/05/2021,9,9,21,3,2021-11-11,0.8660000000000003,not_requested,37.0
758,Bounce/Bounce,1,0,0,0,0,0,0,0,0,10,2.0,0.005,433.0,715.0,False,07/27/2021,40,2,37,3,2021-08-01,0.005,not_requested,20.0
759,BowerBird Collective,1,0,0,0,0,0,0,0,0,1100,190.0,0.014,2045.0,3.0,False,10/19/2021,132,71,186,9,2021-12-08,0.2975,not_requested,291.0
760,BoxGallery,1,0,0,0,0,0,0,0,0,53,8.0,0.003,641.0,561.0,False,10/06/2021,1,1,4,1,2021-10-17,0.0115,not_requested,0.0
761,BoxHead City Rabbits,1,0,0,0,0,0,0,0,0,501,19.0,0.002,410.0,914.0,False,01/27/2021,3,3,4,0,2021-10-04,0.003,not_requested,98.0
762,Boxer Dogs in Style,1,0,0,0,0,0,0,0,0,14,4.0,0.004,47.0,194.0,False,10/18/2021,1,1,5,1,2021-10-17,0.013,not_requested,0.0
763,Boxoos,0,1,0,0,0,0,0,0,0,5,2.0,0.03,960.0,761.0,False,07/25/2010,20,18,124,5,2021-09-30,0.07,not_requested,0.0
764,Brain Dead Zombies,0,0,0,0,0,0,0,1,0,51,7.0,0.003,334.0,274.0,False,05/04/2021,3,6,10,1,2021-11-18,0.009,not_requested,0.0
765,Bratz Gang,1,0,0,0,0,0,0,0,0,9,2.0,0.008,1077.0,1223.0,False,06/16/2019,8,6,26,0,2021-11-15,0.008,not_requested,37.0
766,Brava NFT,0,1,0,0,0,0,0,0,0,282,138.0,0.05,1431.0,1449.0,False,09/25/2021,14,11,30,4,2021-11-22,0.15,not_requested,288.0
767,Brave Series Universe,0,1,0,0,0,0,0,0,0,558,392.0,0.3,1233.0,142.0,False,10/06/2021,17,5,21,8,2021-11-02,11.276200000000005,not_requested,32.0
768,Brave Slimes,0,1,0,0,0,0,0,0,0,1000,55.0,0.006,2167.0,308.0,False,12/01/2021,801,772,784,17,2021-12-07,1.2629498139999995,not_requested,112.0
769,Brave dog,0,1,0,0,0,0,0,0,0,18,10.0,0.009,984.0,817.0,False,08/14/2021,1,2,3,0,2021-11-20,0.0689999999999999,not_requested,0.0
770,Bread Heads,0,1,0,0,0,0,0,0,0,500,247.0,0.022,764.0,1037.0,False,09/06/2021,8,4,28,2,2021-09-20,0.2145099999999999,approved,194.0
771,BreakingThroughTheMultiverse,1,0,0,0,0,0,0,0,0,29,12.0,0.005,43.0,45.0,False,10/26/2021,8,4,24,2,2021-08-04,0.01,not_requested,0.0
772,Breathings,1,0,0,0,0,0,0,0,0,98,17.0,0.06,234.0,510.0,False,02/09/2009,3,2,11,2,2021-08-31,0.12,not_requested,171.0
773,Bret Blackberg,0,1,0,0,0,0,0,0,0,27,16.0,0.01,1583.0,1251.0,False,05/29/2021,5,9,18,2,2021-08-19,0.1,not_requested,61.0
774,Brian Romero: Remixes,1,0,0,0,0,0,0,0,0,8,35.0,0.15,5437.0,1083.0,False,01/02/2009,17,16,136,10,2021-07-07,0.33,not_requested,0.0
775,BrickHeads,1,0,0,0,0,0,0,0,0,130,65.0,0.002,1120.0,160.0,False,12/10/2021,18,11,83,4,2021-03-15,0.2490000000000001,not_requested,0.0
776,Bridge Mutual,0,0,0,0,0,0,0,1,0,4,63.0,0.4,45572.0,157.0,False,08/11/2011,39,41,138,20,2021-07-24,0.2,not_requested,0.0
777,Bright Darkness by Michael B. Stuart,0,0,0,0,1,0,0,0,0,16,8.0,0.15,3399.0,1704.0,False,04/08/2009,2,5,11,1,2021-08-09,0.4499999999999999,not_requested,0.0
778,Bright Lights and Colours,1,0,0,0,0,0,0,0,0,9,6.0,0.02,3296.0,1900.0,False,09/09/2021,9,14,42,1,2021-09-08,0.06,not_requested,4.0
779,Broccoli Club,0,1,0,0,0,0,0,0,0,825,51.0,0.002,417.0,383.0,False,12/12/2021,26,27,32,4,2021-12-08,0.05702,not_requested,211.0
780,Broke Life Club,0,1,0,0,0,0,0,0,0,32,2.0,0.008,88.0,0.0,False,11/27/2021,6,6,12,7,2021-11-24,0.008,not_requested,126.0
781,BrokeBoyz,1,0,0,0,0,0,0,0,0,6300,1900.0,0.019,7691.0,126.0,False,09/10/2021,42,21,82,9,2021-10-17,17.051945999999994,not_requested,711.0
782,Broken-Minds,0,1,0,0,0,0,0,0,0,103,37.0,0.3,945.0,435.0,False,08/29/2021,24,11,58,7,2021-10-14,1.21702732025539,not_requested,300.0
783,Brood Punks,0,0,0,0,0,0,0,1,0,15,10.0,0.02,660.0,1738.0,False,05/27/2021,26,26,31,2,2021-05-31,0.05,not_requested,37.0
784,Brooky Zombies,0,1,0,0,0,0,0,0,0,270,32.0,0.01,1272.0,4442.0,False,07/20/2021,2,2,10,3,2021-07-08,0.01,not_requested,0.0
785,Brotchain,1,0,0,0,0,0,0,0,0,506,349.0,1.4,4475.0,7.0,False,07/28/2021,22,34,123,7,2021-08-21,22.341,verified,127.0
786,Brothers Of Gaia,0,1,0,0,0,0,0,0,0,2,12.0,4.795,40.0,564.0,False,03/13/2021,0,3,2,0,2021-08-24,0.0144,not_requested,0.0
787,BruceTheGoose Digital Art - ERC1155,1,0,0,0,0,0,0,0,0,30,115.0,0.001,11794.0,7774.0,False,02/23/2020,5,11,27,2,2020-06-21,0.003,approved,56.0
788,BruceTheGoose Fine Digital Art,1,0,0,0,0,0,0,0,0,58,37.0,0.035,11794.0,7774.0,False,02/23/2020,5,11,27,2,2020-04-07,0.2,approved,53.0
789,Bruno Bamma x Skyscapes,1,0,0,0,0,0,0,0,0,5,3.0,0.2,1441.0,833.0,False,11/28/2013,7,11,45,1,2021-10-26,0.6000000000000001,not_requested,0.0
790,Brush Strokes by 0xCulture,1,0,0,0,0,0,0,0,0,1100,666.0,0.047,2125.0,300.0,False,09/24/2021,10,9,56,3,2021-10-14,0.7746999999000003,not_requested,1011.0
791,Bryan Brinkman,1,0,0,0,0,0,0,0,0,350,65.0,0.5,46739.0,9575.0,True,01/09/2009,108,171,2250,16,2020-10-28,1.75,verified,0.0
792,Bryson DeChambeau Limited Edition NFTs,0,1,0,0,0,0,0,0,0,10,9.0,4.0,296299.0,305.0,True,08/27/2015,2951,1347,28521,1607,2021-03-18,1.8,verified,9.0
793,Bubble Budz,0,1,0,0,0,0,0,0,0,100,31.0,0.99,3437.0,119.0,False,09/01/2021,109,106,120,10,2021-08-31,2.98,approved,111.0
794,Bubble FlokiPups,0,1,0,0,0,0,0,0,0,16,7.0,0.1,4636.0,17.0,False,09/13/2021,189,250,261,15,2021-09-23,0.1,not_requested,0.0
795,Bubble Tea,0,1,0,0,0,0,0,0,0,103,36.0,0.01,507.0,477.0,False,03/10/2021,6,6,16,1,2021-03-12,0.01,not_requested,33.0
796,Bubblegum Kids,0,1,0,0,0,0,0,0,0,10000,3500.0,0.179,14636.0,326.0,False,09/04/2021,129,170,403,12,2021-09-29,447.5117613018098,verified,135.0
797,Bubbler Symbiotic Collabs,0,0,0,0,0,0,0,1,0,93,87.0,0.14,1128.0,49.0,False,08/07/2021,184,75,249,37,2021-12-05,0.61,not_requested,5.0
798,Buck Breaking,1,0,0,0,0,0,0,0,0,29,11.0,0.4,278949.0,526.0,True,10/24/2008,1043,256,1956,107,2021-12-14,2.342222222,not_requested,0.0
799,Bud Head Hood,0,1,0,0,0,0,0,0,0,1000,13.0,0.001,351.0,86.0,False,11/06/2021,35,30,52,4,2021-11-13,0.0129,requested,82.0
800,BudgetPunks,0,1,0,0,0,0,0,0,0,101,119.0,0.001,16.0,13.0,False,10/25/2021,1,9,9,1,2021-10-31,0.7336847200000189,not_requested,88.0
801,Budverse Cans - Heritage Edition,0,1,0,0,0,0,0,0,0,1900,1200.0,0.649,234794.0,196.0,True,10/09/2012,72,202,304,32,2021-11-29,267.6446488799999,verified,138.0
802,"Budyz Collection: Bitcoin Budyz, Polydoge Budyz, & Titan Budyz",1,0,0,0,0,0,0,0,0,130,484.0,0.001,1256.0,815.0,False,06/27/2014,12,7,30,2,2021-08-22,0.04135,approved,10.0
803,Bufalo NFT Releases,1,0,0,0,0,0,0,0,0,41,6.0,0.05,1396.0,772.0,False,12/16/2018,147,141,166,7,2021-10-14,0.41,not_requested,3.0
804,Bug Court,1,0,0,0,0,0,0,0,0,50,34.0,0.07,133.0,291.0,False,06/07/2014,2,2,12,1,2021-09-23,0.49,not_requested,1.0
805,Bull Market Girlfriends,1,0,0,0,0,0,0,0,0,173,127.0,2.788,18077.0,536.0,False,08/24/2021,2,1,7,1,2021-08-23,25.61099999999999,verified,379.0
806,Bull Market Girlfriends - Editions & Collabs,1,0,0,0,0,0,0,0,0,28,352.0,0.035,3471.0,332.0,False,07/15/2021,1,1,2,1,2021-09-24,26.51765999999996,approved,7.0
807,Bull Tang Clan V1,1,0,0,0,0,0,0,0,0,556,186.0,0.04,4124.0,608.0,False,06/29/2021,347,365,378,9,2021-12-11,1.152,not_requested,151.0
808,Bullish Llama,0,1,0,0,0,0,0,0,0,3700,1600.0,0.001,6722.0,508.0,False,01/10/2021,261,80,190,37,2021-09-28,0.1784,not_requested,194.0
809,Bullish Mastiffs,0,1,0,0,0,0,0,0,0,365,12.0,0.055,459.0,1423.0,False,09/25/2021,0,1,3,0,2021-11-08,0.4184,not_requested,0.0
810,Bullrun Babes,0,1,0,0,0,0,1,0,0,2700,929.0,0.002,3182.0,25.0,False,11/23/2020,9,9,41,4,2021-02-16,4.904749999999996,verified,7.0
811,BullsOnTheBlock,0,1,0,0,0,0,0,0,0,10000,1700.0,0.087,30373.0,397.0,False,06/10/2021,221,219,314,11,2021-06-27,17.156536706900265,verified,284.0
812,BullsOnTheBlock Evo,0,1,0,0,0,0,0,0,0,5900,1800.0,0.07,30373.0,397.0,False,06/10/2021,221,219,314,11,2021-10-15,15.944370502515396,not_requested,189.0
813,BullsOnTheBlock Exclusives,0,1,0,0,0,0,0,0,0,12,2500.0,0.002,30373.0,397.0,False,06/10/2021,221,219,314,11,2021-10-11,0.045,not_requested,0.0
814,Bullshit NFT,0,1,0,0,0,0,0,0,0,100,11.0,0.064,7190.0,682.0,False,10/20/2021,31,488,317,1,2021-11-19,1.8560000000000008,not_requested,0.0
815,Bully Bashers,0,1,0,0,0,0,0,0,0,50,15.0,0.03,1681.0,634.0,False,12/05/2020,4,5,17,1,2021-10-11,0.03,not_requested,75.0
816,BunnyBit,1,0,0,0,0,0,0,0,0,31,3.0,0.009,975.0,1043.0,False,10/07/2021,42,42,47,2,2021-11-07,0.018,not_requested,0.0
817,Burli Jazzy Series,1,0,0,0,0,0,0,0,0,3,2.0,0.7,318.0,273.0,False,10/20/2021,1,4,7,0,2021-10-27,1.0,not_requested,3.0
818,Burnt Matchstick,0,0,0,0,1,0,0,0,0,45,5.0,0.3,3402.0,1281.0,False,11/01/2017,3,15,46,3,2021-12-15,2.4000000000000004,not_requested,14.0
819,Burtonesques,0,1,0,0,0,0,0,0,0,70,28.0,0.015,1907.0,1366.0,False,08/16/2021,46,12,66,2,2021-08-14,0.135,not_requested,0.0
820,Bushido Apes,0,1,0,0,0,0,0,0,0,215,397.0,0.03,3127.0,818.0,False,06/11/2021,4,2,15,1,2021-06-17,4.875687500000001,approved,43.0
821,Bushidos,0,1,0,0,0,0,0,0,0,8900,2800.0,0.017,9246.0,235.0,False,08/28/2021,1343,377,1456,71,2021-10-20,13.39283,approved,141.0
822,Business Ducks INC.,0,1,0,0,0,0,0,0,0,344,128.0,0.035,354.0,232.0,False,08/05/2021,27,28,33,2,2021-08-03,3.1004950000010023,approved,1486.0
823,BusinessBuilders Employees,0,1,0,0,0,0,0,0,0,1800,115.0,0.007,4474.0,32.0,False,09/21/2021,24,7,52,6,2021-12-04,1.7095699999999991,not_requested,29.0
824,BusinessBuilders Factories,0,1,0,0,0,0,0,0,0,202,50.0,0.06,4474.0,32.0,False,09/21/2021,24,7,52,6,2021-12-05,0.0917,not_requested,13.0
825,Butterflies Museum,1,0,0,0,0,0,0,0,0,56,9.0,0.04,173.0,179.0,False,11/10/2021,8,10,14,4,2021-10-21,0.04,not_requested,0.0
826,Buzzed Bear Hideout,0,1,0,0,0,0,0,0,0,10000,2600.0,0.037,4357.0,10.0,False,06/28/2021,21,5,48,2,2021-07-15,7.635291246503508,verified,130.0
827,By Accident,0,0,0,0,1,0,0,0,0,21,28.0,0.15,730.0,621.0,False,10/19/2021,3,9,30,2,2021-10-21,1.74,not_requested,17.0
828,By God: The Singularity (creator.nightcafe.studio),1,0,0,0,0,0,0,0,0,160,39.0,0.001,791.0,1664.0,False,06/10/2016,1,1,4,2,2021-12-13,0.0110999999999999,not_requested,0.0
829,Byte Candy,1,0,0,0,0,0,0,0,0,95,61.0,0.14,6433.0,620.0,False,06/08/2011,18,22,124,4,2021-05-26,1.725,approved,0.0
830,Byteosaurus,1,0,0,0,0,0,0,0,0,9700,970.0,0.028,714.0,207.0,False,03/24/2021,64,141,71,2,2021-03-06,7.965742979999981,approved,157.0
831,CAC - Chill Ape Club,1,0,0,0,0,0,0,0,0,56800,8.0,0.002,5056.0,1.0,False,11/11/2021,801,1142,902,152,2021-12-05,0.015,not_requested,0.0
832,CARDELUCCI - Wild Mustangs,0,0,0,0,1,0,0,0,0,20,18.0,100.0,5442.0,1006.0,False,08/24/2009,4,8,36,1,2021-08-13,7.0,not_requested,0.0
833,CARISMA Collection,1,0,0,0,0,0,0,0,0,80,9.0,0.01,3816.0,4440.0,False,06/19/2021,13,9,49,1,2021-09-12,0.02,not_requested,0.0
834,CAROLINES,0,1,0,0,0,0,0,0,0,31,14.0,0.01,842.0,554.0,False,07/11/2021,215,96,218,11,2021-10-18,0.08,not_requested,4.0
835,CAT EYE GIRL,1,0,0,0,0,0,0,0,0,156,55.0,0.004,1822.0,1024.0,False,07/28/2021,22,7,44,3,2021-11-28,0.2309999999999999,not_requested,0.0
836,CATCUPATION,1,0,0,0,0,0,0,0,0,50,37.0,0.005,4387.0,1903.0,False,10/27/2017,10,20,44,1,2021-10-26,0.026,not_requested,40.0
837,CATNIPP,0,1,0,0,0,0,0,0,0,90,38.0,0.01,342.0,150.0,False,07/14/2016,64,7,74,6,2021-05-31,0.12,not_requested,0.0
838,CB Hoyo's THIS IS NOT A JPEG,0,1,0,0,0,0,0,0,0,99,56.0,0.5,1123.0,143.0,False,12/09/2020,10,13,64,3,2021-08-29,2.44,approved,72.0
839,CBM NFT Vouchers - Polygon,0,0,0,0,0,0,0,1,0,3,4.0,0.008,37250.0,48.0,False,07/27/2017,63,78,180,167,2021-11-26,0.2324999999999999,not_requested,0.0
840,CBRPunks,1,0,0,0,0,0,0,0,0,10000,408.0,0.001,1248.0,41.0,False,12/19/2021,206,224,240,12,2021-12-17,0.16121932,not_requested,0.0
841,CEM YILMAZ COLLABORATIONS,1,0,0,0,0,0,0,0,0,66,9.0,10.0,15167692.0,233.0,True,03/26/2010,3140,3481,130859,1385,2021-10-19,3.2999999999999994,approved,0.0
842,CHIBI DINOS,0,1,0,0,0,0,0,0,0,10000,3500.0,0.07,91977.0,5139.0,False,08/10/2021,220,213,241,8,2021-08-20,65.584413720273,verified,1311.0
843,CHIBI TANPOPO,0,1,0,0,0,0,0,0,0,9,5.0,0.011,6558.0,3345.0,False,07/01/2021,56,18,103,9,2021-12-02,0.029,not_requested,0.0
844,CHICKINZ,0,1,0,0,0,0,0,0,0,46,40.0,0.02,5259.0,5174.0,False,11/11/2008,10,33,30,2,2021-11-08,0.2,not_requested,64.0
845,CHRISTIAN BOK,1,0,0,0,0,0,0,0,0,8,6.0,0.06,11799.0,250.0,False,01/23/2009,7,4,25,2,2021-09-04,0.06,not_requested,25.0
846,CHUN-PERO's STUDIO,1,0,0,0,0,0,0,0,0,7,8.0,0.005,443.0,123.0,False,10/21/2021,2,2,9,1,2021-10-23,0.024,not_requested,0.0
847,CHZZY CARD COLLECTION,0,0,0,0,0,0,1,0,0,12,4.0,0.04,2227.0,2274.0,False,09/26/2016,17,27,588,16,2021-12-09,0.12,not_requested,0.0
848,CITY BLOCKS by COOPER RAY,0,0,0,0,1,0,0,0,0,44,34.0,0.65,4863.0,2845.0,False,05/22/2011,8,54,165,4,2021-09-06,1.3199999999999998,not_requested,300.0
849,CITY BOY & CITY GIRL,0,1,0,0,0,0,0,0,0,24,23.0,0.12,1695.0,242.0,False,10/06/2021,12,7,67,5,2021-10-07,0.54,not_requested,0.0
850,CLONE X - X TAKASHI MURAKAMI,0,1,0,0,0,0,0,0,0,18400,7500.0,5.35,246538.0,1155.0,True,04/28/2019,509,997,3421,112,2021-12-12,25576.39533828299,verified,522.0
851,CLONE-X CLUB,1,0,0,0,0,0,0,0,0,21300,29.0,0.001,246538.0,1155.0,True,04/28/2019,509,997,3421,112,2021-12-14,0.1279,not_requested,0.0
852,CLOUTZ,0,1,0,0,0,0,0,0,0,75,32.0,0.03,4485.0,2319.0,False,04/10/2021,27,8,57,1,2021-09-11,0.15,not_requested,0.0
853,CMPLX Bored Apes,0,1,0,0,0,0,0,0,0,41,99.0,0.9,14812.0,742.0,False,03/20/2018,61,34,311,12,2021-05-03,3.52,approved,8.0
854,CMYK's Kaleidescope Artefacts (1 - 100),1,0,0,0,0,0,0,0,0,100,57.0,0.04,4278.0,2260.0,False,09/25/2020,5,10,24,2,2021-03-01,0.0205,approved,31.0
855,CNK World,1,0,0,0,0,0,0,0,0,225,116.0,0.09,2163.0,176.0,False,09/18/2021,211,212,263,14,2021-11-19,0.147,not_requested,132.0
856,CNNNR - The Last Frontier Collection,0,0,0,0,1,0,0,0,0,30,22.0,0.5,15707.0,423.0,False,11/08/2015,92,50,721,4,2021-08-04,2.0,not_requested,0.0
857,COFFEE VIBES,0,0,0,0,1,0,0,0,0,9,2.0,0.075,8970.0,4640.0,False,08/07/2011,7,7,41,0,2021-11-09,0.075,not_requested,0.0
858,COLORFUL ANIMALS FOREST,1,0,0,0,0,0,0,0,0,3000,1500.0,0.003,470.0,1906.0,False,04/26/2021,1,1,5,1,2021-09-12,0.3242823500000001,not_requested,0.0
859,COLORFUL ANIMALS FOREST (series 2),1,0,0,0,0,0,0,0,0,3000,616.0,0.001,470.0,1906.0,False,04/26/2021,1,1,5,1,2021-11-24,0.0850841,not_requested,0.0
860,COLORFULLY ART,1,0,0,0,0,0,0,0,0,1900,267.0,0.001,470.0,1906.0,False,04/26/2021,1,1,5,1,2021-12-08,0.1284589799999999,not_requested,0.0
861,COLORGRAPHS i,0,0,0,0,1,0,0,0,0,64,27.0,0.4,1266.0,1183.0,False,05/27/2009,12,11,39,3,2021-08-25,0.3,not_requested,0.0
862,COMMIXTURE,1,0,0,0,0,0,0,0,0,100,23.0,0.01,1054.0,816.0,False,09/13/2014,18,6,31,2,2021-10-20,0.1389999999999999,not_requested,0.0
863,COMMON PEOPLE,1,0,0,0,0,0,0,0,0,66,22.0,0.015,715.0,1338.0,False,07/13/2021,28,5,22,1,2021-08-01,0.1139999999999999,not_requested,82.0
864,CONSTRUCTURE,1,0,0,0,0,0,0,0,0,7,4.0,0.08,2071.0,935.0,False,03/08/2021,40,16,109,4,2021-11-25,0.16,not_requested,0.0
865,CONVERSATIONAL FREESTYLES EP,1,0,0,0,0,0,0,0,0,4,2.0,0.33,353.0,1132.0,False,05/14/2020,4,7,51,2,2021-03-26,0.33,not_requested,0.0
866,COOL DOGS Official,0,1,0,0,0,0,0,0,0,5000,2600.0,0.13,18468.0,2195.0,False,10/21/2021,1508,1500,1785,28,2021-11-15,412.6344052984163,approved,202.0
867,COOLDOGS NFT,0,1,0,0,0,0,0,0,0,100,5.0,0.035,18468.0,2195.0,False,10/21/2021,1508,1500,1785,28,2021-11-17,0.14,not_requested,0.0
868,COSMIC COWBOYS: NFT,0,1,0,0,0,0,0,0,0,1900,571.0,0.001,9823.0,7.0,False,07/28/2021,119,51,246,24,2021-12-15,2.072700999999999,not_requested,336.0
869,COSMIC COWGIRLS: NFT,0,1,0,0,0,0,0,0,0,7000,2300.0,0.01,9823.0,7.0,False,07/28/2021,119,51,246,24,2021-10-22,205.17934244684727,approved,376.0
870,COSMOSTONES,1,0,0,0,0,0,0,0,0,18,4.0,0.02,28.0,4.0,False,12/06/2021,9,8,231,4,2021-12-09,0.06,not_requested,7.0
871,COSPLAYCAT,1,0,0,0,0,0,0,0,0,18,7.0,0.001,29.0,78.0,False,11/06/2021,1,1,8,2,2021-11-05,0.011,not_requested,0.0
872,COVIDPunks!,0,1,0,0,0,0,0,0,0,10000,3900.0,0.019,14130.0,126.0,False,07/09/2021,709,721,825,27,2021-07-31,4.788789999999995,approved,134.0
873,CRAPS NFTs,1,0,0,0,0,0,0,0,0,5,18.0,0.2,2794.0,3246.0,False,07/25/2021,4,9,10,3,2021-11-05,0.364,not_requested,0.0
874,CREATIVE HEALING,0,0,0,0,1,0,0,0,0,13,10.0,0.096,8970.0,4640.0,False,08/07/2011,7,7,41,0,2021-10-21,0.192,not_requested,0.0
875,CROWNsCOLLECTION.,1,0,0,0,0,0,0,0,0,69,292.0,0.001,3352.0,2319.0,False,10/17/2018,489,352,559,15,2021-10-25,0.093,not_requested,8.0
876,CRYPTO ART _ WOW 1:1 Collection,1,1,1,0,0,1,1,1,1,72,19.0,0.005,12425.0,12656.0,False,11/11/2020,2,2,9,5,2021-03-09,0.025,requested,0.0
877,CRYPTO BITchez,0,1,0,0,0,0,0,0,0,66,3.0,0.015,3.0,23.0,False,09/15/2021,0,0,1,1,2021-10-04,0.015,not_requested,118.0
878,CRYPTO BOTS X REMO,1,1,0,0,0,0,0,0,0,96,36.0,0.2,2860.0,4947.0,False,01/09/2009,5,3,20,3,2020-08-23,0.375,approved,239.0
879,CRYPTO CRYPTOS,1,0,0,0,0,0,0,0,0,51,38.0,0.469,14151.0,1583.0,True,06/07/2012,9,22,94,3,2021-05-04,0.375,verified,0.0
880,CRYPTO CRYPTOS CARDS,0,0,0,0,0,0,1,0,0,40,92.0,0.015,14151.0,1583.0,True,06/07/2012,9,22,94,3,2021-05-11,0.02591,not_requested,3.0
881,CRYPTO REDS,0,1,0,0,0,0,0,0,0,5,5.0,1.0,635.0,964.0,False,04/01/2021,6,9,24,2,2021-11-08,0.3,not_requested,0.0
882,CRYPTO TRADER CARDS,0,0,0,0,0,0,1,0,0,151,343.0,0.01,14151.0,1583.0,True,06/07/2012,9,22,94,3,2021-06-30,0.0615,not_requested,4.0
883,CRYPTO-NEON From JAPAN,1,0,0,0,0,0,0,0,0,82,221.0,0.002,4447.0,3713.0,False,02/13/2018,5,4,18,1,2021-10-04,0.005,not_requested,0.0
884,CRYPTOKARENS 1000,0,1,0,0,0,0,0,0,0,460,112.0,0.044,8796.0,3683.0,False,03/11/2021,73,14,75,4,2021-03-11,0.1929,approved,226.0
885,CRYPTOLORS CARDS,0,1,0,0,0,0,0,0,0,161,2.0,0.01,86.0,0.0,False,12/09/2021,12,4,78,3,2021-11-19,0.01,not_requested,310.0
886,CTEROID PUNKS,0,1,0,0,0,0,0,0,0,463,17.0,0.03,358.0,632.0,False,08/28/2021,1,2,5,2,2021-08-29,0.6300000000000003,not_requested,0.0
887,CUBE DANCERS,0,1,0,0,0,0,0,0,0,201,24.0,0.1,90.0,87.0,False,08/27/2021,18,11,58,47,2021-08-27,0.201,not_requested,0.0
888,CUBEMAN BOXGUY,1,0,0,0,0,0,0,0,0,22,2.0,0.01,268.0,437.0,False,06/29/2018,1,0,2,0,2021-08-31,0.025,not_requested,0.0
889,CUCHALA's Calligraphy Collection,1,0,0,0,0,0,0,0,0,117,54.0,0.01,3664.0,1192.0,False,10/29/2021,8,8,40,1,2021-10-29,0.51,not_requested,0.0
890,CURSED OBJKTS,0,1,0,0,0,0,0,0,0,4,41.0,0.1,1652.0,155.0,False,07/01/2021,21,13,109,3,2021-08-12,0.0666,not_requested,0.0
891,CUTIE PERSON,0,1,0,0,0,0,0,0,0,35,13.0,0.003,1153.0,937.0,False,09/19/2021,68,29,76,3,2021-11-01,0.026,not_requested,12.0
892,CVRSED,1,0,0,0,0,0,0,0,0,197,40.0,0.05,1669.0,1619.0,False,05/31/2021,9,11,26,3,2021-06-03,0.135,not_requested,54.0
893,CYBERPOP 2021,1,1,0,0,0,0,0,0,0,5,2.0,0.1,16.0,12.0,False,03/17/2021,1,1,6,1,2021-04-05,0.25,not_requested,1.0
894,CYBERWITCH WARRIORS,1,0,0,0,0,0,0,0,0,13,38.0,0.1,3522.0,1923.0,False,02/09/2011,11,11,106,2,2021-02-11,3.140000000000001,not_requested,54.0
895,CYBORGS Arrival of Chaos,0,1,0,0,0,0,0,0,0,615,164.0,0.024,1061.0,886.0,False,06/05/2021,9,3,20,1,2021-09-04,0.6197000000000001,not_requested,81.0
896,CYN-C COVONSKIA 1st Edition,0,1,0,0,0,0,0,0,0,73,3.0,0.05,1647.0,309.0,False,10/09/2021,34,16,31,5,2021-10-30,1.2,not_requested,15.0
897,Caboodles,0,1,0,0,0,0,0,0,0,1300,719.0,0.04,3453.0,333.0,False,11/01/2021,12,8,31,4,2021-11-20,65.17107109999998,approved,222.0
898,Cachorro Caramelo NFT,0,1,0,0,0,0,0,0,0,10000,4.0,0.005,15.0,24.0,False,10/15/2021,0,5,7,0,2021-10-14,0.064,not_requested,57.0
899,Cactimen,1,0,0,0,0,0,0,0,0,3300,600.0,0.001,106.0,141.0,False,09/10/2021,13,17,17,2,2021-09-06,0.06876716,not_requested,57.0
900,Cake One,1,0,0,0,0,0,0,0,0,8,25.0,0.1,610.0,1016.0,False,11/23/2021,6,5,19,2,2021-04-01,0.1,not_requested,16.0
901,Cake'd Grungy Shit Cats,1,0,0,0,0,0,0,0,0,6,111.0,0.055,11756.0,3333.0,False,09/11/2013,35,15,129,1,2021-06-12,1.1110000000000002,not_requested,6.0
902,Calia,0,1,0,0,0,0,0,0,0,16,8.0,0.006,574.0,546.0,False,10/16/2021,17,4,37,7,2021-12-12,0.09,not_requested,0.0
903,California Dreaming Fall Collection 2021,0,0,0,0,1,0,0,0,0,20,5.0,0.3,2271.0,1171.0,False,05/07/2014,5,5,42,5,2021-09-20,0.6,not_requested,0.0
904,California Memories by Casara Moon,1,0,0,0,0,0,0,0,0,25,14.0,0.2,16222.0,491.0,False,08/25/2016,74,18,611,5,2021-08-26,0.53,not_requested,0.0
905,Camomilo Dogs,0,1,0,0,0,0,0,0,0,139,21.0,0.002,178.0,567.0,False,11/30/2021,2,2,9,1,2021-11-28,0.1673000000000001,not_requested,0.0
906,Can I Kick it...in the Metaverse?,1,0,0,0,0,0,0,0,0,21,3.0,0.5,559.0,381.0,False,08/30/2021,4,4,12,2,2021-11-04,4.5,not_requested,53.0
907,Can't Catch Them All,0,1,0,0,0,0,0,0,0,49,18.0,0.1,973.0,1486.0,False,03/02/2021,5,6,37,4,2021-10-09,0.2,not_requested,36.0
908,Candid Squares,0,0,0,0,1,0,0,0,0,25,3.0,0.05,192.0,330.0,False,08/14/2017,2,4,9,2,2021-09-24,0.05,not_requested,37.0
909,Candows,0,1,0,0,0,0,0,0,0,28,8.0,0.007,81.0,288.0,False,07/11/2021,1,1,9,1,2021-06-25,0.02,not_requested,81.0
910,Candy Digital,0,1,0,0,0,1,0,0,0,47900,9800.0,0.008,20210.0,146.0,True,09/23/2015,2234,226,1171,124,2021-07-04,26.512686953678102,verified,0.0
911,Candyman Candyland Vault,0,0,0,0,0,0,0,1,0,1,90.0,0.003,3492.0,6769.0,False,03/12/2010,6,11,12,2,2021-12-11,0.0453999999999999,not_requested,4.0
912,CanineCartel,0,1,0,0,0,0,0,0,0,10000,4300.0,0.01,8375.0,266.0,False,07/05/2021,77,73,187,16,2021-08-24,2.834199989899997,verified,240.0
913,Canna Comics,0,1,0,0,0,0,0,1,0,728,3000.0,0.003,9178.0,7522.0,False,07/31/2021,363,428,452,16,2021-08-10,20.304527809491457,not_requested,182.0
914,CanvaIsland,1,0,0,0,0,0,0,0,1,256,88.0,0.1,968.0,152.0,False,04/08/2021,15,14,24,5,2021-04-04,4.4670000000000005,not_requested,0.0
915,Canvas Apes,1,1,0,0,0,0,0,0,0,1000,427.0,0.012,1873.0,511.0,False,09/05/2021,52,42,63,2,2021-11-05,2.376193999999999,not_requested,75.0
916,Canvas Apes Bored,0,1,0,0,0,0,0,0,0,942,5.0,0.002,1873.0,511.0,False,09/05/2021,52,42,63,2,2021-12-10,0.018,not_requested,0.0
917,Capsule House,0,1,0,0,0,0,0,0,0,10000,3000.0,1.397,13180.0,266.0,False,08/25/2021,325,112,944,45,2021-09-28,5993.371990206434,verified,356.0
918,Capturing moments...,0,0,0,0,1,0,0,0,0,66,7.0,0.05,1970.0,1334.0,False,04/05/2021,2,6,15,1,2021-05-10,0.13,approved,0.0
919,Car Corners of Cuba,1,0,0,0,0,0,0,0,0,90,8.0,0.05,10891.0,392.0,True,03/04/2008,152,47,1047,10,2021-10-13,0.175,not_requested,31.0
920,Car Sales Characters,0,1,0,0,0,0,0,0,0,56,8.0,0.03,54.0,40.0,False,09/06/2021,6,10,10,2,2021-11-19,0.12,not_requested,52.0
921,Carbon Creatures Collection,0,1,0,0,0,0,0,0,0,473,218.0,0.04,1359.0,238.0,False,09/15/2021,7,10,36,1,2021-11-19,0.09,not_requested,61.0
922,Cardano Collection V2,0,1,0,0,0,0,0,0,0,7,5.0,0.1,5.0,15.0,False,02/18/2021,3,1,4,0,2021-02-18,0.23,approved,6.0
923,Careless Bears Collectibles,0,1,0,0,0,0,0,0,0,100,57.0,0.135,2442.0,2435.0,False,03/03/2009,5,16,32,5,2021-08-25,1.47,not_requested,619.0
924,Caricatures Face2FaceZ,1,0,0,0,0,0,0,0,0,29,2.0,0.002,7541.0,1451.0,False,10/05/2017,105,26,130,95,2021-09-19,0.005,not_requested,3.0
925,Carl Club,0,1,0,0,0,0,0,0,0,372,53.0,0.02,1479.0,1034.0,False,08/07/2020,6,5,15,4,2021-08-12,0.35,not_requested,718.0
926,Carrizozo,0,0,0,0,1,0,0,0,0,17,2.0,0.1,786.0,1193.0,False,06/16/2011,12,11,47,6,2021-11-03,0.1,not_requested,0.0
927,Cartlads,0,1,0,0,0,0,0,0,0,1000,475.0,0.075,2510.0,115.0,False,04/18/2021,21,22,95,2,2021-04-22,4.856900000000002,verified,203.0
928,Carved Geisha,1,0,0,0,0,0,0,0,0,4,2.0,0.11,538.0,1287.0,False,11/30/2010,2,3,9,4,2021-10-18,0.14,not_requested,33.0
929,Case Simmons - Temple X 111,1,0,0,0,0,0,0,0,0,111,63.0,0.11,708.0,187.0,False,04/22/2021,9,3,49,5,2021-05-13,0.245,approved,0.0
930,Cases by Kate,0,1,0,0,0,0,0,0,0,10000,1300.0,0.023,1519.0,231.0,False,09/15/2021,53,56,86,4,2021-09-13,6.296921661950011,approved,496.0
931,CastPunks,0,1,0,0,0,0,0,0,0,12,2.0,0.03,148.0,465.0,False,03/31/2021,6,2,6,1,2021-03-31,0.03,not_requested,0.0
932,Castles Generation One ( Ethereum ),0,0,0,0,0,0,1,0,0,157,53.0,0.1,1400.0,72.0,False,09/11/2021,385,119,343,28,2021-09-07,1.6e-05,not_requested,563.0
933,Cat Fest,1,0,0,0,0,0,0,0,0,73,51.0,0.06,5233.0,1273.0,False,01/03/2020,85,61,94,4,2021-06-25,0.195,not_requested,178.0
934,Cat Hats Collection,0,1,0,0,0,0,0,0,0,52,139.0,0.008,1889.0,1269.0,False,02/20/2021,40,49,72,5,2021-10-29,0.2137,not_requested,62.0
935,Cat Licious,1,0,0,0,0,0,0,0,0,18,10.0,0.005,1192.0,1988.0,False,10/02/2021,47,8,65,4,2021-11-19,0.0499999999999999,not_requested,0.0
936,Cat Town Punks,0,1,0,0,0,0,0,0,0,20000,1100.0,0.007,3149.0,175.0,False,09/21/2021,252,243,255,6,2021-09-20,167.55122190919946,approved,111.0
937,Cat from Scratch,1,0,0,0,0,0,0,0,0,22,4.0,0.001,5521.0,404.0,False,06/15/2009,2,1,14,3,2021-11-23,0.011,not_requested,0.0
938,Cat on Blockchain,0,1,0,0,0,0,0,0,0,3200,6200.0,0.001,1594.0,8.0,False,10/22/2021,5,13,16,5,2021-10-23,0.0817183971793257,not_requested,0.0
939,CatDirty,1,0,0,0,0,0,0,0,0,32,174.0,0.05,5350.0,547.0,False,01/11/2020,128,45,709,16,2021-08-28,5.6,not_requested,0.0
940,CatLygon,1,0,0,0,0,0,0,0,0,51,150.0,0.001,513.0,1030.0,False,09/04/2020,1,2,5,2,2021-11-23,0.0917,not_requested,24.0
941,CatSle,1,0,0,0,0,0,0,0,0,9700,242.0,0.042,937.0,406.0,False,11/26/2021,722,724,754,22,2021-11-22,60.87002345785447,approved,0.0
942,Cat_Kingdom,1,0,0,0,0,0,0,0,0,72,10.0,0.001,139.0,397.0,False,12/10/2021,14,12,18,4,2021-12-08,0.011,not_requested,81.0
943,Catchy Girls,0,1,0,0,0,0,0,0,0,281,71.0,0.002,1318.0,1051.0,False,09/30/2021,21,7,36,3,2021-10-07,0.6130000000000003,not_requested,195.0
944,Catchy Girls Collabs,0,1,0,0,0,0,0,0,0,15,6.0,0.01,1318.0,1051.0,False,09/30/2021,21,7,36,3,2021-11-02,0.08,not_requested,0.0
945,Catgirl Japan,0,1,0,0,0,0,0,0,0,9,6.0,0.02,14899.0,413.0,False,07/11/2011,73,3,310,2,2021-10-21,0.02,not_requested,0.0
946,Catharsis Drop [0.1],0,0,0,0,0,0,0,1,0,458,18.0,0.08,3343.0,575.0,False,08/11/2021,15,8,49,3,2021-09-14,0.59,not_requested,23.0
947,Catified Flower,0,1,0,0,0,0,0,0,0,19,4.0,0.035,6098.0,3575.0,False,08/02/2021,4,2,12,1,2021-09-12,0.05,not_requested,0.0
948,Cats Saga,0,1,0,0,0,0,0,0,0,190,14.0,0.025,8610.0,1026.0,False,10/25/2021,295,319,333,5,2021-11-15,0.05,not_requested,142.0
949,Cats Tale,1,0,0,0,0,0,0,0,0,12,3.0,0.05,9.0,10.0,False,06/11/2020,0,0,1,0,2021-11-01,0.01,not_requested,1.0
950,Cats with names,1,0,0,0,0,0,0,0,0,6,412.0,0.001,1444.0,930.0,False,12/09/2021,9,11,47,2,2021-12-06,0.155113636219086,not_requested,0.0
951,Celebrities Punks,0,1,0,0,0,0,0,0,0,128,386.0,0.029,194.0,61.0,False,03/13/2018,13,263,150,2,2021-09-30,0.12,not_requested,17.0
952,Celebrity Caricature,0,1,0,0,0,0,0,0,0,140,19.0,0.001,114.0,374.0,False,09/21/2021,8,5,22,2,2021-09-21,0.0151339999999999,not_requested,0.0
953,Celebrity Code,0,1,0,0,0,0,0,0,0,68,421.0,0.014,330.0,332.0,False,08/29/2021,6,4,11,3,2021-09-14,2.4750366898999974,not_requested,17.0
954,Celebrity Party Punks,1,0,0,0,0,0,0,0,0,61,35.0,0.02,1431.0,924.0,False,08/03/2021,55,62,67,4,2021-08-19,0.04,not_requested,113.0
955,Celestial Daughters,1,0,0,0,0,0,0,0,0,16,11.0,0.008,3765.0,2791.0,False,09/18/2021,13,6,23,1,2021-11-08,0.008,not_requested,0.0
956,Celestio,1,0,0,0,0,0,0,0,0,48,295.0,0.004,387.0,1467.0,False,04/23/2021,4,3,11,3,2021-10-02,0.0167432991937241,not_requested,124.0
957,CeoPunks Collection,0,1,0,0,0,0,0,0,0,111,62.0,0.149,867.0,295.0,False,03/17/2021,8,7,17,2,2021-03-20,2.94,not_requested,76.0
958,Certified Justin Kan Stories,0,1,0,0,0,0,0,0,0,14,72.0,0.15,251224.0,2112.0,True,04/05/2009,1114,174,4692,134,2021-02-18,0.15,verified,14.0
959,Chads NFT,0,1,0,0,0,0,0,0,0,10000,2300.0,0.009,8943.0,312.0,False,06/24/2017,39,42,49,2,2021-08-26,0.9551301230999998,verified,174.0
960,Chain Kusari C and ILL Collection,1,0,0,0,0,0,0,0,0,20,32.0,0.045,3320.0,419.0,False,03/30/2021,8,13,38,2,2021-10-01,0.3949999999999999,not_requested,0.0
961,Chain Soldier,0,1,0,0,0,0,0,0,0,15,14.0,0.015,470.0,385.0,False,09/16/2021,10,15,27,2,2021-09-17,0.05,not_requested,35.0
962,ChainFaces,1,0,0,0,0,0,0,0,0,10000,1300.0,0.09,112955.0,1890.0,False,01/25/2018,19,77,419,3,2020-01-19,46.76817899999997,verified,90.0
963,ChairNFT,0,1,0,0,0,0,0,0,0,54,20.0,0.007,9856.0,7161.0,False,05/18/2021,6,52,150,3,2021-08-29,0.05901,not_requested,49.0
964,Chametheon,0,1,0,0,0,0,0,0,0,89,45.0,0.888,560.0,885.0,False,06/20/2021,32,14,132,11,2021-09-07,6.1170069696969,not_requested,206.0
965,Changer Punk,0,1,0,0,0,0,0,0,0,7900,60.0,0.002,9614.0,2314.0,False,03/03/2021,57,914,551,6,2021-11-11,0.03949,not_requested,0.0
966,Chaos Algorithm,0,1,0,0,0,0,0,0,0,868,316.0,0.008,1198.0,2918.0,False,06/25/2020,1,2,10,4,2021-06-04,0.1227999999999999,verified,68.0
967,Chapter01,1,0,0,0,0,0,0,0,0,92,40.0,0.09,11375.0,1347.0,False,09/11/2019,16,6,74,1,2021-07-10,3.66,not_requested,111.0
968,Character Packs,0,1,0,0,0,0,0,0,0,15,5.0,0.016,96.0,122.0,False,08/26/2021,10,4,30,4,2021-09-30,0.016,not_requested,15.0
969,Charged Punks,0,1,0,0,0,0,0,0,0,1700,630.0,0.12,869.0,2.0,False,10/24/2021,14,28,39,4,2021-12-02,6.490400000000004,not_requested,73.0
970,Charles Peterson Grunge Years NFT collection - Classics,0,0,0,0,1,0,0,0,0,32,59.0,0.2,527.0,245.0,False,03/14/2021,7,3,39,5,2021-09-13,2.3539000000000003,not_requested,50.0
971,Charles Peterson Grunge Years NFT collection - Insouciants,0,0,0,0,1,0,0,0,0,10,15.0,1.0,527.0,245.0,False,03/14/2021,7,3,39,5,2021-08-31,1.6,not_requested,24.0
972,Charming Raccoons,1,0,0,0,0,0,0,0,0,1600,31.0,0.008,2618.0,1271.0,False,09/27/2021,7,4,17,1,2021-09-25,0.051,not_requested,86.0
973,Chasing Ghosts,0,0,0,0,1,0,0,0,0,20,5.0,0.25,6980.0,1456.0,False,07/18/2018,211,26,1870,20,2021-09-26,0.8,not_requested,0.0
974,Chasing Shadows,0,0,0,0,1,0,0,0,0,18,15.0,0.2,2108.0,971.0,False,10/26/2009,2,3,10,0,2021-03-18,0.2,approved,18.0
975,Chasing Trains,1,0,0,0,0,0,0,0,0,40,19.0,0.15,6039.0,1884.0,False,03/08/2010,15,29,134,2,2021-08-14,0.2,approved,0.0
976,Che-Yu Wu x Nobody,0,1,0,0,0,0,0,0,0,1100,474.0,0.111,2101.0,405.0,False,09/03/2021,18,16,76,3,2021-11-10,6.7305,not_requested,100.0
977,Checkered animals,1,0,0,0,0,0,0,0,0,14,2.0,0.004,2200.0,1222.0,False,05/07/2018,6,6,25,0,2021-11-20,0.004,not_requested,0.0
978,Cheddaz,0,1,0,0,0,0,0,0,0,6200,1200.0,0.001,9467.0,203.0,False,02/03/2021,105,108,268,30,2021-08-14,0.153,not_requested,179.0
979,Chef Boi R Doge: Mutts,0,1,0,0,0,0,0,0,0,151,94.0,0.028,22244.0,10843.0,False,06/05/2021,6,134,92,1,2021-11-08,0.04,not_requested,229.0
980,Chelsea Player Cartoons,0,0,0,0,0,1,0,0,0,23,2.0,0.01,9.0,7.0,False,11/30/2020,1,0,1,0,2021-11-12,0.01,not_requested,0.0
981,Chibi 7-year-old Little Crypto Artist,1,0,0,0,0,0,0,0,0,88,61.0,0.05,6271.0,627.0,False,09/03/2021,6,3,25,3,2021-09-30,0.2249999999999999,not_requested,0.0
982,Chibi Apes,0,1,0,0,0,0,0,0,0,3000,1800.0,0.14,25472.0,860.0,False,08/24/2018,75,37,148,15,2021-09-08,65.57489487284803,verified,118.0
983,Chibi Clash,0,1,0,0,0,0,0,0,0,5600,1200.0,0.05,3743.0,41.0,False,06/22/2021,73,88,89,2,2021-10-18,11.12226,not_requested,106.0
984,Chicken Derby,0,0,0,0,0,0,0,1,0,33300,5700.0,0.034,21274.0,237.0,False,03/29/2021,800,834,887,28,2021-07-16,118.06593331096218,verified,121.0
985,Chihuahua Gang,0,1,0,0,0,0,0,0,0,500,192.0,0.01,1174.0,347.0,False,06/22/2021,44,58,58,2,2021-06-22,0.3522,approved,363.0
986,Children of the Fractured Soul,1,0,0,0,0,0,0,0,0,4,10.0,0.035,1157.0,788.0,False,11/09/2021,46,45,42,1,2021-11-21,0.07,not_requested,5.0
987,Chill Ape Club,0,1,0,0,0,0,0,0,0,2200,977.0,0.008,5056.0,1.0,False,11/11/2021,801,1142,902,152,2021-12-05,4.214699999999997,approved,111.0
988,Chill Bill,1,1,0,0,0,0,0,1,1,18,61.0,0.03,12504.0,2955.0,False,08/20/2018,8,16,45,2,2021-03-19,0.34,not_requested,42.0
989,Chill Frogs NFT,0,1,0,0,0,0,0,0,0,6000,2400.0,0.13,10489.0,226.0,False,08/12/2021,502,466,575,27,2021-08-23,42.72147928694206,verified,180.0
990,Chillmeleons,0,1,0,0,0,0,0,0,0,10000,619.0,0.018,1847.0,449.0,False,05/08/2021,546,527,774,120,2021-05-09,0.34489,verified,196.0
991,Chinese Future Art,1,0,0,0,0,0,0,0,0,3,188.0,0.015,1386.0,201.0,False,08/18/2021,1,8,23,1,2021-11-15,3.58999999999999,not_requested,0.0
992,Chinese-Dragons,0,1,0,0,0,0,0,0,0,6,3.0,0.02,2376.0,1217.0,False,04/23/2021,1,13,19,0,2021-11-20,0.04,not_requested,0.0
993,ChipMonk World Heritage Collection,0,1,0,0,0,0,0,0,0,1000,28.0,0.08,848.0,21.0,False,09/11/2021,158,21,25,1,2021-04-01,0.8799999999999999,not_requested,117.0
994,Chiptos,0,1,0,0,0,0,0,0,0,512,283.0,1.65,3938.0,376.0,False,08/22/2021,89,75,204,7,2021-08-20,74.35569999999998,approved,48.0
995,Chirps NFT,0,1,0,0,0,0,0,0,0,73,6.0,0.01,50.0,65.0,False,11/18/2021,8,11,11,2,2021-11-17,0.007,not_requested,96.0
996,Chonkyz Boi,0,1,0,0,0,0,0,0,0,214,80.0,0.015,1473.0,1526.0,False,06/12/2021,9,7,19,3,2021-06-15,0.09,not_requested,217.0
997,ChouxCrew,0,1,0,0,0,0,0,0,0,66,19.0,0.014,1524.0,784.0,False,09/15/2021,432,30,3378,2,2021-09-15,0.014,not_requested,17.0
998,Chromatic Efflorescence,1,0,0,0,0,0,0,0,0,24,13.0,0.2,193.0,335.0,False,12/06/2021,18,6,51,2,2021-12-13,0.2,not_requested,0.0
999,Chromatic Sun Ranch,1,0,0,0,0,0,0,0,0,955,120.0,0.001,1257.0,3998.0,False,07/18/2013,10,7,25,1,2021-11-22,0.024822,not_requested,345.0
1000,Chromospheres,1,0,0,0,0,0,0,0,0,707,312.0,0.034,1752.0,130.0,False,09/17/2021,87,86,96,18,2021-12-12,13.794299999999998,not_requested,209.0
1001,Chronicles: A 360 Journey,0,0,0,0,1,0,0,0,0,33,17.0,0.2,4749.0,2340.0,False,09/05/2010,57,72,591,7,2021-09-29,0.99,approved,0.0
1002,Chubbies,0,1,0,0,0,0,0,0,0,10000,2800.0,0.02,9804.0,64.0,False,03/12/2021,164,189,203,22,2021-03-18,163.18699433943937,verified,112.0
1003,Chumbi Valley Founders Collection,0,1,0,0,0,0,0,0,0,2,86.0,1.6,254582.0,232.0,False,07/23/2021,13365,4759,7332,2892,2021-09-10,5.94,approved,1.0
1004,Chumbi Valley Official,0,1,0,0,0,0,0,1,0,4000,2000.0,0.55,254582.0,232.0,False,07/23/2021,13365,4759,7332,2892,2021-12-15,983.7208295800016,approved,4.0
1005,CigarPunkz,0,1,0,0,0,0,0,0,0,50,4.0,0.003,92.0,76.0,False,11/27/2021,1,3,9,2,2021-11-27,0.009,not_requested,117.0
1006,Cine City Vegas,0,0,0,0,1,0,0,0,0,16,1.0,0.035,2257.0,611.0,False,01/08/2010,42,5,267,2,2021-03-18,0.07,not_requested,0.0
1007,CipherShooters Operators,0,0,0,0,0,0,0,1,0,1100,213.0,0.009,1466.0,169.0,False,08/20/2021,71,69,84,17,2021-10-29,0.3256,not_requested,100.0
1008,Ciphersquares Official,1,1,0,0,0,0,0,0,0,3600,1200.0,0.008,3626.0,255.0,False,05/13/2021,488,446,503,57,2021-07-19,0.4710180000000001,verified,62.0
1009,Circles of Circles,1,0,0,0,0,0,0,0,0,51,40.0,2.0,6346.0,180.0,False,03/01/2009,5,8,49,0,2021-02-25,6.75,approved,0.0
1010,Citations,0,1,0,0,0,0,0,0,0,12,2.0,0.1,6.0,1.0,False,12/07/2021,4,2,5,1,2021-09-25,0.1,not_requested,74.0
1011,Citizens of Bulliever Island,0,0,0,0,0,0,0,1,0,10000,2200.0,0.11,42549.0,683.0,False,07/14/2021,22550,3894,21455,4116,2021-08-12,146.90879381733782,verified,161.0
1012,Citizens.Y2123,0,0,0,0,0,0,0,1,0,130,78.0,0.045,3582.0,864.0,False,09/08/2021,11,10,24,8,2021-12-16,0.0849999999999999,not_requested,1.0
1013,Citizenz Genesis,0,0,0,0,0,0,0,1,0,5000,1800.0,0.009,3686.0,5.0,False,09/21/2021,174,79,169,6,2021-11-27,188.2177649977997,approved,225.0
1014,CityCaps,0,0,0,0,0,1,0,0,0,262,81.0,0.001,2104.0,1999.0,False,07/29/2011,3,10,7,1,2021-03-20,0.0327,not_requested,107.0
1015,CityDAO Citizenship,0,0,0,0,0,0,0,1,0,3,5100.0,1.13,26823.0,245.0,False,07/02/2021,429,152,2012,187,2021-11-01,635.1608009990099,approved,0.0
1016,CityDao Founding Citizenship,0,0,0,0,0,0,0,1,0,3,490.0,0.001,26823.0,245.0,False,07/02/2021,429,152,2012,187,2021-12-01,0.136712,not_requested,0.0
1017,Cityroots,1,0,0,0,0,0,0,0,0,1600,545.0,0.075,6542.0,529.0,False,08/03/2021,42,14,52,22,2021-10-13,3.7186,not_requested,83.0
1018,Claudia Pawlak - Serce Matki (Mother's Heart),0,0,0,0,1,0,0,0,0,11,5.0,0.45,3447.0,1519.0,False,08/31/2018,14,22,133,2,2021-08-24,1.8,not_requested,0.0
1019,ClayPunks,1,1,0,0,0,0,0,0,0,564,280.0,0.04,1464.0,1045.0,False,04/07/2021,4,8,43,1,2021-04-07,0.784,approved,166.0
1020,CleverGirls NFT,0,1,0,0,0,0,0,0,0,5600,2000.0,0.009,7704.0,184.0,False,07/23/2021,43,19,87,17,2021-08-31,1.4829000000000003,verified,300.0
1021,ClewPunks,0,1,0,0,0,0,0,0,0,2700,54.0,0.001,2159.0,182.0,False,09/28/2021,37,44,71,6,2021-10-25,0.0911,not_requested,131.0
1022,Clock Faces,1,0,0,0,0,0,0,0,0,4,3.0,10.0,1101.0,981.0,False,11/23/2021,12,31,46,3,2021-12-16,0.135,not_requested,2.0
1023,Clods' Pet,0,1,0,0,0,0,0,0,0,33,76.0,0.019,4546.0,2571.0,False,08/04/2018,9,5,48,2,2021-05-31,0.03,not_requested,37.0
1024,Clones Never Die Asset,1,0,0,0,0,0,0,0,0,77,888.0,0.01,2573.0,442.0,False,06/24/2021,284,102,345,4,2021-10-21,0.883,not_requested,38.0
1025,Clones Never Die V2,1,0,0,0,0,0,0,0,0,10000,308.0,0.049,2573.0,442.0,False,06/24/2021,284,102,345,4,2021-09-12,15.797700000000017,approved,119.0
1026,Cloud Ahead,1,0,0,0,0,0,0,0,0,9,5.0,0.05,1004.0,1140.0,False,10/20/2021,2,1,5,0,2021-04-28,0.069,not_requested,0.0
1027,Cloud Street,0,0,0,0,1,0,0,0,0,32,14.0,0.18,1930.0,1105.0,False,10/04/2021,9,9,60,2,2021-10-16,1.4499999999999995,not_requested,0.0
1028,Clout Punks,0,1,0,0,0,0,0,0,0,499,276.0,0.09,2896.0,16.0,False,04/16/2021,57,60,111,5,2021-04-15,3.8249999999999993,approved,501.0
1029,Club 3Doodz,0,1,0,0,0,0,0,0,0,29,28.0,50.0,1402.0,1102.0,False,02/17/2021,10,14,130,2,2021-10-22,0.54,not_requested,0.0
1030,Cnidarian Soup,1,0,0,0,0,0,0,0,0,36,2.0,0.025,415.0,382.0,False,02/16/2021,4,5,23,1,2021-08-27,0.05,not_requested,36.0
1031,Coach Barbara Stevens,0,0,0,0,0,1,0,0,0,99,9.0,0.003,19668.0,2859.0,True,03/10/2009,9,3,78,3,2021-05-13,0.003,not_requested,0.0
1032,Coalition Crew,0,1,0,0,0,0,0,0,0,1000,520.0,0.35,6904.0,405.0,False,10/09/2021,362,379,435,16,2021-12-02,26.338130000000007,approved,86.0
1033,Coca-Cola 2022,0,1,0,0,0,0,0,0,0,5,1200.0,0.004,193.0,685.0,False,05/11/2017,1,5,20,2,2021-12-14,0.01082,not_requested,1.0
1034,Coconut Sunday Universe,1,0,0,0,0,0,0,0,0,14,2.0,0.03,674.0,629.0,False,05/07/2012,12,3,25,3,2021-11-22,0.1,not_requested,0.0
1035,Coffee Junkie Club,0,0,0,0,0,0,0,1,0,2,1500.0,0.006,4168.0,86.0,False,10/08/2021,308,190,349,12,2021-12-09,0.3262,not_requested,0.0
1036,Coffee Punks,0,1,0,0,0,0,0,0,0,200,78.0,0.01,838.0,77.0,False,08/12/2021,97,112,123,4,2021-08-13,0.1649,not_requested,0.0
1037,Coin By Chalana,0,0,0,0,0,0,1,0,0,19,448.0,0.001,2154.0,4957.0,False,12/09/2010,12,6,30,2,2021-09-06,0.00043,not_requested,0.0
1038,Coin Laundry,1,0,0,0,0,0,0,0,0,34,17.0,0.009,780.0,954.0,False,12/26/2021,8,6,21,1,2021-12-16,0.1371009999999999,not_requested,0.0
1039,CoinApes,0,1,0,0,0,0,0,0,0,27,3.0,0.05,1860.0,0.0,False,08/09/2015,976,956,1022,162,2021-11-18,0.05,not_requested,0.0
1040,Coke Boys LA Sneaker,0,1,0,0,0,0,0,0,0,14,329.0,0.05,127.0,149.0,False,09/05/2021,2,2,10,0,2021-09-13,0.612,not_requested,35.0
1041,Cold & Fire,0,0,0,0,1,0,0,0,0,20,5.0,0.1,905.0,212.0,False,12/07/2017,6,5,59,2,2021-09-23,0.4,not_requested,3.0
1042,Cole Buxton,0,1,0,0,0,0,0,0,0,118,63.0,0.3,193.0,0.0,False,04/08/2021,2,1,35,3,2021-11-09,0.8200000000000001,not_requested,33.0
1043,Collage of Myself,1,0,0,0,0,0,0,0,0,500,125.0,0.002,421.0,933.0,False,11/28/2021,2,2,9,2,2021-12-10,0.13754,not_requested,163.0
1044,Collect Vault,0,1,0,0,0,0,0,0,0,15,4.0,0.25,631.0,638.0,False,09/21/2020,6,5,22,2,2021-11-23,0.525,not_requested,12.0
1045,Collecting Hands,0,0,0,0,1,0,0,0,0,30,23.0,1.5,22582.0,1005.0,True,09/21/2017,88,62,768,10,2021-08-03,3.1100000000000003,not_requested,0.0
1046,Colonists,0,1,0,0,0,0,0,0,0,25000,5800.0,0.015,27413.0,1.0,False,06/03/2021,406,405,532,14,2021-08-28,12.472283021103893,verified,175.0
1047,Colony Online (Concept Art),0,1,0,0,0,0,0,0,0,5,5600.0,0.002,27413.0,1.0,False,06/03/2021,406,405,532,14,2021-09-30,0.04219,not_requested,0.0
1048,Color and Light,0,0,0,0,1,0,0,0,0,13,7.0,0.008,1037.0,1189.0,False,03/16/2014,9,3,48,3,2021-10-17,0.04,not_requested,0.0
1049,ColorMapGolf,1,0,0,0,0,0,0,0,0,32,3.0,0.05,514.0,560.0,False,01/29/2021,9,4,20,3,2021-12-17,0.15,not_requested,0.0
1050,ColorPortraits,1,0,0,0,0,0,0,0,0,7,3.0,0.002,1.0,11.0,False,10/28/2021,1,0,3,0,2021-11-06,0.003,not_requested,0.0
1051,Colored streets.,0,0,0,0,1,0,0,0,0,6,2.0,0.06,2532.0,1528.0,False,10/30/2017,7,20,51,1,2021-11-19,0.06,not_requested,0.0
1052,Colorful Abstract Girls,1,0,0,0,0,0,0,0,0,32,11.0,0.01,2274.0,2054.0,False,11/04/2021,18,7,26,3,2021-12-14,0.1395,not_requested,0.0
1053,Colorful Abstract Painting Art,1,0,0,0,0,0,0,0,0,10,2.0,0.025,1.0,17.0,False,03/23/2021,1,1,4,1,2021-04-13,0.0025,not_requested,2.0
1054,Colorful Idiots,1,0,0,0,0,0,0,0,0,11,4.0,0.1,1397.0,1695.0,False,08/25/2021,19,3,33,2,2021-09-17,0.003,not_requested,0.0
1055,Colorful Super Heroes,1,0,0,0,0,0,0,0,0,4,7.0,0.02,276.0,539.0,False,06/17/2009,4,3,15,3,2021-11-12,0.16,not_requested,0.0
1056,Colorful_thoughts,1,0,0,0,0,0,0,0,0,50,121.0,0.004,572.0,122.0,False,10/30/2021,1,2,2,1,2021-10-30,0.038078,not_requested,0.0
1057,Colors of Japan,1,0,0,0,0,0,0,0,0,20,3.0,0.05,290.0,393.0,False,01/07/2021,10,2,68,2,2021-12-02,0.1,not_requested,0.0
1058,Colors of Water,0,0,0,0,1,0,0,0,0,20,4.0,0.1,427.0,3140.0,False,04/14/2011,3,6,11,1,2021-10-16,0.4499999999999999,not_requested,0.0
1059,Colors of the North,0,0,0,0,1,0,0,0,0,16,11.0,0.1,4598.0,603.0,False,05/26/2018,13,8,48,1,2021-11-23,1.0,not_requested,0.0
1060,Colors of the World by Ryan Resatka,1,0,0,0,0,0,0,0,0,48,38.0,0.22,15896.0,762.0,False,11/16/2017,104,31,1192,10,2021-08-30,0.467,not_requested,0.0
1061,ColorsByBit,0,1,0,0,0,0,0,0,0,8200,3.0,0.01,19.0,17.0,False,10/30/2021,2,0,8,0,2021-11-18,0.02,not_requested,729.0
1062,ColourVision,1,0,0,0,0,0,0,0,0,19,15.0,0.15,3823.0,1423.0,False,04/13/2015,23,25,92,3,2021-10-02,0.3,not_requested,0.0
1063,Combined Values,1,0,0,0,0,0,0,0,0,17,135.0,0.015,1016.0,3783.0,False,09/22/2021,9,44,48,1,2021-10-14,0.0082339368,not_requested,1.0
1064,Comedy Monsters Club,0,1,0,0,0,0,0,0,0,4100,1700.0,0.097,7039.0,260.0,False,09/09/2021,74,14,157,12,2021-11-21,1.772,not_requested,1.0
1065,Cometh Goods,0,0,0,0,0,0,1,0,0,14,4800.0,0.001,21719.0,68.0,False,01/13/2021,45,7,110,25,2021-09-14,0.102579,not_requested,14.0
1066,Comfy Cat Crew,0,1,0,0,0,0,0,0,0,1800,57.0,0.002,2811.0,61.0,False,10/27/2021,33,14,73,5,2021-10-27,0.0654,not_requested,135.0
1067,Comic Kids Club,0,1,0,0,0,0,0,0,0,200,15.0,0.045,484.0,1.0,False,12/15/2021,1,6,9,0,2021-12-15,0.7739999999999999,not_requested,0.0
1068,Commission Tokens,0,1,0,0,0,0,0,0,0,4,34.0,0.035,3783.0,824.0,False,07/28/2015,35,25,137,9,2021-08-27,0.07,not_requested,10.0
1069,CommonVerse,0,1,0,0,0,0,0,0,0,21,24.0,0.05,2923.0,1083.0,False,06/02/2021,10,5,81,2,2021-11-07,0.4049999999999999,not_requested,20.0
1070,Community Scans,1,0,0,0,0,0,0,0,0,7,826.0,0.001,404.0,93.0,False,10/29/2021,3,2,13,1,2021-11-19,0.005518,not_requested,0.0
1071,Company Punks,0,1,0,0,0,0,0,0,0,159,13.0,0.009,52.0,0.0,False,09/12/2021,3,3,9,2,2021-08-31,0.0198,not_requested,0.0
1072,Complicit,0,0,0,0,1,0,0,0,0,55,19.0,0.4,2204.0,919.0,False,04/03/2015,37,18,250,4,2021-11-02,6.000000000000001,not_requested,0.0
1073,Concentric by Eric P. Rhodes,1,0,0,0,0,0,0,0,0,418,17.0,0.05,9986.0,914.0,False,02/03/2011,18,24,125,3,2021-11-27,0.45,approved,0.0
1074,Cong Kings,0,1,0,0,0,0,0,0,0,9,117.0,0.015,273.0,240.0,False,12/07/2021,18,12,46,3,2021-11-12,0.479,not_requested,34.0
1075,Conmaru's kawaii collection,1,0,0,0,0,0,0,0,0,5,5.0,0.2,768.0,158.0,False,10/21/2021,11,7,58,4,2021-12-17,0.32,not_requested,0.0
1076,Conor McGregor Ufc,1,0,0,0,0,0,0,0,0,14,2.0,0.03,9105552.0,746.0,True,09/07/2011,8830,6734,92812,2798,2021-12-10,0.028,not_requested,0.0
1077,Conscience Cards,0,0,0,0,0,0,1,0,0,12,68.0,0.04,1662.0,695.0,False,08/12/2021,40,141,60,2,2021-08-03,0.158,not_requested,3.0
1078,Conspiratopia,0,1,0,0,0,0,0,0,0,22,603.0,0.001,37.0,9.0,False,08/25/2020,8,13,17,2,2021-09-24,0.05856,not_requested,12.0
1079,Constellation Girls 3D Collection,0,1,0,0,0,0,0,0,0,6,18.0,0.45,1251.0,574.0,False,10/21/2021,7,8,47,3,2021-12-06,0.8750000000000001,not_requested,0.0
1080,Continuation Collection,1,0,0,0,0,0,0,0,0,5,3.0,0.1,1982.0,980.0,False,04/02/2013,9,29,43,1,2021-09-13,0.2,not_requested,5.0
1081,Continuation from you,1,0,0,0,0,0,0,0,0,4,4.0,0.025,1275.0,539.0,False,02/05/2020,16,4,43,4,2021-11-17,0.065,not_requested,0.0
1082,Contour Mutant Ape Yacht Club,0,1,0,0,0,0,0,0,0,87,45.0,0.002,16.0,76.0,False,10/29/2021,1,2,8,4,2021-09-23,0.05099826,not_requested,4.0
1083,Contrasted,1,0,0,0,0,0,0,0,0,3,2.0,0.05,1064.0,499.0,False,11/21/2017,2,7,12,1,2021-09-10,0.05,not_requested,0.0
1084,Convenience Stores: A Kiosk Culture,0,0,0,0,1,0,0,0,0,30,4.0,0.25,1407.0,718.0,False,05/27/2021,10,14,31,3,2021-12-07,0.75,not_requested,8.0
1085,Convicted Squirrels,0,1,0,0,0,0,0,0,0,1200,330.0,0.005,34819.0,1166.0,False,08/26/2021,58,18,61,9,2021-09-19,0.19943,not_requested,132.0
1086,CookieTheDogV3,0,1,0,0,0,0,0,0,0,111,42.0,0.08,478.0,23.0,False,09/19/2021,65,82,95,4,2021-10-27,0.1094,not_requested,63.0
1087,Cool Bananas,0,1,0,0,0,0,0,0,0,16,2.0,0.1,1223.0,1233.0,False,11/16/2021,4,10,31,4,2021-11-16,0.1,not_requested,0.0
1088,Cool Bears Club,0,1,0,0,0,0,0,0,0,5000,29.0,0.005,49.0,158.0,False,12/06/2021,6,6,8,2,2021-12-13,0.2704000000000001,not_requested,117.0
1089,Cool Cats Achievements,0,1,0,0,0,0,0,0,0,5,4100.0,0.006,90469.0,1119.0,False,05/21/2021,1600,553,6655,715,2021-08-17,0.627585913,approved,0.0
1090,Cool Cats Collabs,0,1,0,0,0,0,0,0,0,18,6200.0,0.05,90469.0,1119.0,False,05/21/2021,1600,553,6655,715,2021-07-22,28.836100050999995,verified,0.0
1091,Cool Cats Events,0,1,0,0,0,0,0,0,0,17,7100.0,0.008,90469.0,1119.0,False,05/21/2021,1600,553,6655,715,2021-10-01,9.838045500199984,verified,0.0
1092,Cool Cats NFT,0,1,0,0,0,0,0,0,0,9900,5100.0,10.8,90469.0,1119.0,False,05/21/2021,1600,553,6655,715,2021-06-27,11461.01387132065,verified,252.0
1093,Cool Cats Originals,0,1,0,0,0,0,0,0,0,4,955.0,0.091,90469.0,1119.0,False,05/21/2021,1600,553,6655,715,2021-07-18,0.6576920039999999,approved,0.0
1094,Cool Catz NFT Collection,0,0,0,0,0,0,1,0,0,122,2.0,0.01,3.0,4.0,False,12/14/2021,0,0,4,0,2021-12-17,0.02,not_requested,0.0
1095,Cool Crabs NFT,0,1,0,0,0,0,0,0,0,3300,44.0,0.005,196.0,520.0,False,08/31/2021,4,3,7,1,2021-08-31,0.015,not_requested,69.0
1096,Cool Kangaroos NFT,0,1,0,0,0,0,0,0,0,113,163.0,0.007,116.0,27.0,False,08/02/2021,10,17,16,2,2021-08-02,0.06164,not_requested,136.0
1097,Cool Monstaz,0,1,0,0,0,0,0,0,0,168,58.0,0.027,1442.0,21.0,False,09/26/2021,37,37,53,5,2021-12-09,0.0301,not_requested,120.0
1098,Cool Teddies,1,0,0,0,0,0,0,0,0,5,2.0,0.002,28.0,70.0,False,11/15/2021,2,3,7,2,2021-11-24,0.0024,not_requested,5.0
1099,CoolStree,0,1,0,0,0,0,0,0,0,26,18.0,0.025,563.0,83.0,False,11/16/2009,84,7,133,7,2021-09-25,0.09,not_requested,6.0
1100,Coolman's Universe,0,1,0,0,0,0,0,0,0,10000,5200.0,1.17,27494.0,70.0,False,10/08/2021,4316,845,4911,66,2021-12-17,9612.64559481773,approved,435.0
1101,Copy Cats NFT,0,1,0,0,0,0,0,0,0,53,5.0,0.009,382.0,1449.0,False,09/01/2021,8,3,24,1,2021-11-16,0.01,not_requested,118.0
1102,Corrupt Cubes,1,0,0,0,0,0,0,0,0,20,37.0,0.004,726.0,1139.0,False,08/13/2015,3,4,12,2,2021-08-13,0.0044,not_requested,9.0
1103,CorruptedToadz,1,0,0,0,0,0,0,0,0,696,98.0,0.035,422.0,326.0,False,10/13/2021,25,9,53,4,2021-10-17,0.185,not_requested,26.0
1104,Cosmic Caps,0,1,0,0,0,0,0,0,0,356,134.0,0.02,1071.0,463.0,False,08/17/2021,174,46,183,4,2021-08-28,0.059,not_requested,112.0
1105,Cosmic Critters,0,1,0,0,0,0,0,0,0,425,231.0,0.05,1677.0,400.0,False,08/24/2021,63,65,80,5,2021-11-30,0.426,not_requested,157.0
1106,Cosmic Hues,1,0,0,0,0,0,0,0,0,6,17.0,0.03,2121.0,1179.0,False,07/10/2016,53,5,64,2,2021-10-11,0.5100000000000002,not_requested,1.0
1107,Cosmic by Cliffwind,1,0,0,0,0,0,0,0,0,12,2.0,0.111,31.0,49.0,False,11/16/2021,3,3,15,6,2021-11-17,0.111,not_requested,24.0
1108,CosmoChamber,1,0,0,0,0,0,0,0,0,206,94.0,0.11,8294.0,294.0,False,08/28/2021,34,32,49,15,2021-10-03,0.1299,not_requested,48.0
1109,Cosmodinos Gods,0,1,0,0,0,0,0,0,0,88,75.0,3.7,13250.0,417.0,False,09/14/2021,2071,2084,2293,48,2021-09-23,55.9085,approved,184.0
1110,Cosmopolity,1,0,0,0,0,0,0,0,0,234,90.0,0.03,700.0,26.0,False,07/10/2021,6,3,13,2,2021-10-08,0.202,not_requested,67.0
1111,Cosplayers,0,1,0,0,0,0,0,0,0,84,46.0,0.02,3318.0,953.0,False,04/23/2021,25,12,144,1,2021-04-26,0.2199999999999999,not_requested,5.0
1112,Cosplayers Academy,0,1,0,0,0,0,0,0,0,63,47.0,0.05,3318.0,953.0,False,04/23/2021,25,12,144,1,2021-07-13,0.119,not_requested,34.0
1113,Couple collection,1,0,0,0,0,0,0,0,0,7,4.0,0.021,6.0,19.0,False,11/12/2021,2,0,5,0,2021-11-28,0.047,not_requested,0.0
1114,Covid Bored Ape,0,1,0,0,0,0,0,0,0,1000,187.0,0.001,1950.0,24.0,False,07/20/2021,555,607,611,24,2021-08-06,0.04903,not_requested,0.0
1115,Cozy Pond Hooligans,1,0,0,0,0,0,0,0,0,21,6.0,0.07,148.0,461.0,False,08/30/2021,1,2,10,2,2021-09-30,0.22,not_requested,63.0
1116,CraftyBallers,0,0,0,0,0,1,0,0,0,47,4.0,0.025,227.0,1233.0,False,11/12/2021,3,3,10,3,2021-11-22,0.075,not_requested,76.0
1117,Cranes (for special wallets),0,1,0,0,0,0,0,0,0,1000,655.0,0.024,205.0,5.0,False,09/20/2021,5,5,34,5,2021-09-14,0.288,approved,0.0
1118,Crashing into Nothing,0,0,0,0,1,0,0,0,0,6,3.0,0.5,3304.0,1064.0,False,09/01/2021,9,22,72,4,2021-07-09,0.65,not_requested,0.0
1119,CrayonBoys,0,1,0,0,0,0,0,0,0,2700,255.0,0.005,1370.0,105.0,False,10/29/2021,430,426,423,17,2021-12-13,0.7113872699999996,not_requested,184.0
1120,CrayonBoys Old,0,1,0,0,0,0,0,0,0,2600,180.0,0.004,1370.0,105.0,False,10/29/2021,430,426,423,17,2021-10-06,0.462788144,not_requested,190.0
1121,Crazy Babies Official,0,1,0,0,0,0,0,0,0,3900,2200.0,0.095,9529.0,3.0,False,10/25/2021,663,86,711,9,2021-11-25,408.7790577765504,approved,222.0
1122,Crazy Cats!,0,1,0,0,0,0,0,0,0,9,3.0,0.02,18.0,62.0,False,05/26/2021,1,1,2,2,2021-05-21,0.04,not_requested,9.0
1123,Crazy Gnome,0,1,0,0,0,0,0,0,0,220,40.0,0.019,682.0,635.0,False,07/06/2021,7,7,14,1,2021-07-06,0.08,not_requested,585.0
1124,Crazy Kids of the Renaissance,1,0,0,0,0,0,0,0,0,75,39.0,0.1,3187.0,1032.0,False,01/01/2016,9,18,97,2,2021-09-02,0.5,not_requested,116.0
1125,Crazy Lizard Army,0,1,0,0,0,0,0,0,0,6300,1900.0,0.037,20803.0,1464.0,False,07/07/2021,41,36,107,3,2021-07-27,5.798239999999997,verified,177.0
1126,Crazy Mad Punk,0,1,0,0,0,0,0,0,0,100,48.0,0.007,294.0,920.0,False,11/20/2021,2,1,2,0,2021-11-20,0.3538000000000002,not_requested,66.0
1127,Crazy Panthers,0,1,0,0,0,0,0,0,0,3300,1000.0,0.02,7352.0,290.0,False,09/04/2021,160,154,174,8,2021-10-05,7.4062902999999904,not_requested,173.0
1128,Crazy Skeleton Gang,1,0,0,0,0,0,0,0,0,750,87.0,0.001,39.0,58.0,False,12/20/2021,1,2,6,0,2021-11-19,0.0337,not_requested,0.0
1129,CrazySkullzNFT,0,1,0,0,0,0,0,0,0,10000,2900.0,0.019,18530.0,726.0,False,09/08/2021,378,325,447,10,2021-09-25,6.644459999999991,approved,146.0
1130,Creation_2020,1,0,0,0,0,0,0,0,0,1,5.0,0.05,2458.0,1238.0,False,07/11/2019,2,2,10,1,2021-10-10,0.05,not_requested,0.0
1131,Creations By Aaron Ricketts,0,0,0,0,1,0,0,0,0,40,38.0,1.0,10105.0,2489.0,False,09/20/2009,281,26,1725,25,2021-02-23,0.85,requested,0.0
1132,Creations by Joe Bradley,1,0,0,0,0,0,0,0,0,24,71.0,0.12,2372.0,1399.0,False,03/06/2021,26,15,86,7,2021-10-01,4.498,approved,5.0
1133,Creative mess,1,0,0,0,0,0,0,0,0,65,22.0,0.005,9414.0,7323.0,False,02/23/2018,14,91,248,1,2021-10-26,0.0639999999999999,not_requested,25.0
1134,Creativity is intelligence having fun,1,0,0,0,0,0,0,0,0,62,6.0,0.01,8959.0,4448.0,False,05/28/2012,19,9,44,1,2021-10-16,0.08,not_requested,0.0
1135,Creator Space,1,0,0,0,0,0,0,0,0,7200,485.0,0.035,65.0,2.0,False,12/28/2021,2,4,10,2,2021-10-13,25.15724999999995,approved,0.0
1136,Creature Christmas: 12 Days,1,0,0,0,0,0,0,0,0,78,21.0,0.05,809.0,1318.0,False,11/04/2021,6,3,29,2,2021-11-23,0.8510162681447416,not_requested,38.0
1137,Creep Show,1,0,0,0,0,0,0,0,0,15,31.0,0.03,1067.0,1207.0,False,02/28/2020,10,10,36,4,2021-08-25,0.26,not_requested,1.0
1138,Creeptures,0,1,0,0,0,0,0,0,0,19,39.0,0.95,23682.0,1512.0,False,11/04/2020,6,34,77,1,2021-08-17,0.25,approved,1.0
1139,Creepy Creams: Alpha Wave,0,0,0,0,0,0,0,1,0,1500,476.0,0.039,4904.0,615.0,False,09/11/2021,14,6,29,3,2021-10-13,3.854699900000001,approved,209.0
1140,Criminal Minds,0,1,0,0,0,0,0,0,0,15,8.0,0.03,448.0,1037.0,False,11/10/2021,3,6,12,6,2021-11-11,0.135,not_requested,0.0
1141,Criminal Zombie,1,0,0,0,0,0,0,0,0,176,95.0,0.005,3723.0,3420.0,False,10/28/2017,81,24,113,12,2021-06-13,0.414,approved,744.0
1142,Crimson Redstone Music Collection,0,0,0,1,0,0,0,0,0,10,1.0,0.005,126.0,90.0,False,02/13/2010,10,8,147,2,2021-11-13,0.005,not_requested,43.0
1143,Crimson Redstone Variety Collection,0,0,0,1,0,0,0,0,0,17,1700.0,0.001,126.0,90.0,False,02/13/2010,10,8,147,2,2021-11-13,0.00879098186289,not_requested,28.0
1144,CriptoFace,0,1,0,0,0,0,0,0,0,170,50.0,0.016,1614.0,1110.0,False,09/25/2021,41,17,65,4,2021-09-28,0.5946800000000002,approved,0.0
1145,CriptyKeens,0,1,0,0,0,0,0,0,0,616,2.0,0.005,209.0,496.0,False,12/09/2021,2,26,17,2,2021-12-01,0.02,not_requested,0.0
1146,Crocs Leagues NFT,1,0,0,0,0,0,0,0,0,42,3.0,0.04,12118.0,34.0,False,09/14/2021,9575,126,8354,37,2021-11-09,0.15,not_requested,0.0
1147,Cross Sections,1,0,0,0,0,0,0,0,0,10,3.0,0.01,272.0,232.0,False,04/06/2020,28,67,73,7,2021-05-11,0.02,not_requested,33.0
1148,CrypTards NFT,0,1,0,0,0,0,0,0,0,117,53.0,0.23,4959.0,1730.0,False,09/15/2021,25,18,124,3,2021-10-14,0.3,not_requested,118.0
1149,CrypToadz by GREMPLIN,0,1,0,0,0,0,0,0,0,7000,3700.0,2.88,35846.0,146.0,False,08/10/2021,84,72,419,30,2021-09-08,4501.818203561807,verified,246.0
1150,Crypt Toads,0,1,0,0,0,0,0,0,0,183,5.0,0.01,4.0,23.0,False,08/26/2021,1,1,6,1,2021-08-26,0.01,not_requested,40.0
1151,CryptBabies,0,1,0,0,0,0,0,0,0,101,51.0,0.069,405.0,1615.0,False,10/31/2021,13,10,22,5,2021-11-09,2.0641111111111,not_requested,54.0
1152,CryptSkulls,0,1,0,0,0,0,0,0,0,118,40.0,0.01,41.0,101.0,False,09/20/2021,15,8,28,1,2021-09-25,0.0824739999999999,not_requested,438.0
1153,Cryptallic Islands,0,1,0,0,0,0,0,0,0,132,103.0,0.39,828.0,2012.0,False,09/24/2021,11,7,32,5,2021-09-26,12.570149999999998,not_requested,43.0
1154,Cryptarverse,0,1,0,0,0,0,0,0,0,250,72.0,0.035,601.0,328.0,False,09/17/2021,66,52,74,7,2021-10-01,0.6489000000000001,not_requested,121.0
1155,Crypto AI arts and crafts,1,0,0,0,0,0,0,0,0,159,356.0,0.002,1965.0,867.0,False,08/04/2021,31,36,23,2,2021-09-20,0.0127999999999999,not_requested,0.0
1156,Crypto Aliens Galaxy,0,1,0,0,0,0,0,0,0,35,15.0,0.004,353.0,743.0,False,10/13/2021,2,10,11,1,2021-11-09,0.082499,not_requested,2.0
1157,Crypto Anime NFTs,0,1,0,0,0,0,0,0,0,391,701.0,0.001,762.0,5001.0,False,10/07/2021,10,6,18,2,2021-10-05,0.094198,not_requested,245.0
1158,Crypto Art NFT,1,1,0,0,0,0,0,0,0,7,3.0,0.02,1919.0,1730.0,False,03/20/2021,7,6,33,0,2021-03-18,0.02,not_requested,20.0
1159,Crypto Bawtz,1,0,0,0,0,0,0,0,0,525,25.0,0.001,111.0,237.0,False,12/03/2021,3,4,3,1,2021-12-14,0.08007528,not_requested,4.0
1160,Crypto Beautiful,1,0,0,0,0,0,0,0,0,32,28.0,0.65,2289.0,24.0,False,03/24/2020,3,1,15,1,2021-10-13,3.255000000000001,not_requested,33.0
1161,Crypto Beetles,0,1,0,0,0,0,0,0,0,19,2.0,0.01,184.0,453.0,False,04/12/2021,8,38,36,4,2021-06-15,0.095,not_requested,1.0
1162,Crypto Bigheads,0,1,0,0,0,0,0,0,0,60,75.0,0.005,1142.0,500.0,False,08/14/2021,1,1,4,0,2021-08-02,0.01,not_requested,71.0
1163,Crypto Birds Cafe,0,1,0,0,0,0,0,0,0,523,292.0,0.007,1179.0,629.0,False,04/15/2009,59,51,76,4,2021-11-04,0.08282,not_requested,223.0
1164,Crypto Birthday Cakes,0,1,0,0,0,0,0,0,0,366,142.0,0.025,1726.0,4877.0,False,08/01/2021,2,2,21,4,2021-07-31,0.8150000000000005,approved,1.0
1165,Crypto Buddhas,0,0,0,0,0,0,1,0,0,145,55.0,0.03,558.0,778.0,False,02/08/2021,3,7,13,5,2021-02-09,0.7969999999999999,approved,59.0
1166,Crypto Bull Society,0,1,0,0,0,0,1,0,0,7800,4800.0,1.55,43933.0,2.0,False,06/06/2012,5439,1347,5892,118,2021-11-27,2999.293392147548,verified,168.0
1167,Crypto Bulls Club,1,0,0,0,0,0,0,0,0,626,169.0,0.013,4760.0,62.0,False,06/21/2021,67,64,127,3,2021-06-17,0.042,not_requested,240.0
1168,Crypto Cabinet Cards,1,0,0,0,0,0,0,0,0,3,28.0,0.07,937.0,970.0,False,10/04/2011,1,2,7,1,2021-09-21,0.042,not_requested,0.0
1169,Crypto Calaveras NFT,1,0,0,0,0,0,0,0,0,1300,261.0,0.027,1342.0,96.0,False,08/17/2021,41,43,109,9,2021-11-01,0.16,not_requested,352.0
1170,Crypto Calf: Gear of Mootopia,0,0,0,0,0,0,1,0,0,27,4.0,0.001,3724.0,4345.0,False,03/18/2021,3,3,10,2,2021-10-17,0.0026,not_requested,38.0
1171,Crypto Calf: Monsters & Minions of Mootopia,0,0,0,0,0,0,1,0,0,18,4.0,0.001,3724.0,4345.0,False,03/18/2021,3,3,10,2,2021-10-20,0.0013,not_requested,77.0
1172,Crypto Cannabis Club,0,1,0,0,0,0,0,0,0,10000,4200.0,0.198,34441.0,4009.0,False,06/17/2021,377,280,428,37,2021-07-30,213.22989621029856,verified,160.0
1173,Crypto Cannabis Club NFTokins,0,1,0,0,0,0,0,0,0,13000,3600.0,0.034,34441.0,4009.0,False,06/17/2021,377,280,428,37,2021-09-09,20.19098379689997,approved,257.0
1174,Crypto Cock Collection,0,1,0,0,0,0,0,0,0,399,138.0,0.029,955.0,1135.0,False,04/11/2021,3,6,15,2,2021-04-11,0.6380000000000002,not_requested,102.0
1175,Crypto Cock: Cock & Balls (2020/21),0,1,0,0,0,0,0,0,0,25,3.0,0.007,44.0,432.0,False,01/31/2021,1,3,12,1,2021-08-28,0.0138,not_requested,0.0
1176,Crypto Cockatoos,0,1,0,0,0,0,0,0,0,1400,549.0,0.001,2508.0,2425.0,False,04/07/2021,28,23,39,2,2021-06-06,0.02,not_requested,204.0
1177,Crypto College,0,0,0,0,0,0,0,1,0,168,164.0,0.25,11153.0,0.0,False,05/18/2020,390,28,187,19,2021-10-21,0.93,not_requested,103.0
1178,Crypto Color Collection,1,1,0,0,0,0,0,0,0,126600,1700.0,0.001,153.0,0.0,False,02/21/2021,20,10,365,12,2021-02-20,1.8174369999998936,approved,0.0
1179,Crypto Corgis,0,1,0,0,0,0,0,0,0,10000,4100.0,0.008,2507.0,280.0,False,02/26/2021,12,10,53,2,2021-03-21,3.017587282305056,verified,244.0
1180,Crypto Coven,1,0,0,0,0,0,0,0,0,9800,4700.0,0.285,9857.0,5.0,False,10/01/2021,24,85,269,9,2021-11-04,748.1915585579284,approved,548.0
1181,Crypto Coven: Curse of the Void Witch,1,0,0,0,0,0,0,0,0,135,81.0,0.5,9857.0,5.0,False,10/01/2021,24,85,269,9,2021-10-31,3.6,approved,14.0
1182,Crypto Creature,1,0,0,0,0,0,0,0,1,114,48.0,0.003,719.0,1366.0,False,01/01/2021,6,2,10,3,2021-03-21,0.0238,not_requested,0.0
1183,Crypto Creeps GENESIS,0,0,0,0,0,0,1,0,0,4,42.0,0.12,1572.0,458.0,False,03/05/2021,48,322,200,3,2021-05-18,1.163,not_requested,20.0
1184,Crypto Cute Demon Girls 1st collection,1,0,0,0,0,0,0,0,0,36,37.0,0.08,4077.0,444.0,False,09/20/2021,9,16,65,5,2021-10-06,0.5,not_requested,0.0
1185,Crypto Cyberpunk Girls,1,0,0,0,0,0,0,0,0,76,401.0,0.001,172.0,125.0,False,04/22/2021,16,21,26,4,2021-09-10,0.0681931275471432,not_requested,175.0
1186,Crypto Dalmatians,1,0,0,0,0,0,0,0,0,22,11.0,0.005,149.0,36.0,False,01/28/2021,28,22,456,4,2021-08-31,0.005,not_requested,0.0
1187,Crypto DinoPunk,0,1,0,0,0,0,0,0,0,99,3.0,0.02,731.0,649.0,False,10/01/2020,1,3,10,1,2021-06-06,0.076,not_requested,119.0
1188,Crypto Doberman Club,0,1,0,0,0,0,0,0,0,77,24.0,0.015,1578.0,2152.0,False,12/26/2009,38,28,35,2,2021-08-31,0.1169999999999999,not_requested,125.0
1189,Crypto Dodos,0,1,0,0,0,0,0,0,0,103,78.0,0.29,611.0,264.0,False,09/12/2017,101,108,145,13,2021-03-27,17.83754125,not_requested,104.0
1190,Crypto Dragonz,1,1,0,0,0,0,0,0,0,263,83.0,0.01,881.0,378.0,False,03/19/2021,7,10,23,3,2021-03-21,0.025,not_requested,194.0
1191,Crypto Duckies,0,1,0,0,0,0,0,0,0,5000,1900.0,0.085,5300.0,981.0,False,05/18/2021,55,65,183,9,2021-05-18,18.18547999999,verified,122.0
1192,Crypto Duckies (onchain),0,1,0,0,0,0,0,0,0,1400,427.0,0.078,5300.0,981.0,False,05/18/2021,55,65,183,9,2021-11-28,3.213400000000001,not_requested,117.0
1193,Crypto Duuudes,1,1,0,0,0,0,0,0,0,170,57.0,0.2,1658.0,1283.0,False,02/08/2021,2,9,20,1,2021-02-09,0.02,verified,0.0
1194,Crypto Fellows,1,0,0,0,0,0,0,0,0,28,18.0,0.01,1239.0,939.0,False,11/30/2020,18,62,172,2,2021-09-11,0.0399999999999999,not_requested,31.0
1195,Crypto Flamingos,0,1,0,0,0,0,0,0,0,555,37.0,0.02,291.0,362.0,False,09/05/2021,1,1,3,1,2021-08-26,0.2,not_requested,53.0
1196,Crypto Flavors,1,0,0,0,0,0,0,0,0,32,3.0,0.02,361.0,866.0,False,09/08/2021,6,4,17,3,2021-09-08,0.06,not_requested,0.0
1197,Crypto G4N9,0,1,0,0,0,0,0,0,0,10000,1500.0,0.003,3069.0,24.0,False,09/19/2021,142,140,160,5,2021-10-21,7.699246579739765,approved,263.0
1198,Crypto Geishas,1,1,0,0,0,0,0,0,0,100,310.0,0.17,8735.0,1405.0,False,02/05/2021,19,18,152,3,2021-02-18,3.7890000000000006,verified,4.0
1199,Crypto Gem Alliance,0,0,0,0,0,0,0,1,0,4800,1600.0,0.001,7086.0,640.0,False,07/22/2021,143,146,163,12,2021-08-23,0.1749,approved,180.0
1200,Crypto Girls Collection 2,1,0,0,0,0,0,0,0,0,9,3.0,0.03,2108.0,1902.0,False,07/14/2016,5,16,48,1,2021-11-18,0.04,not_requested,13.0
1201,Crypto Goddess the ANGRY GIRL,0,1,0,0,0,0,0,0,0,6,4.0,0.491,1670.0,1073.0,False,03/24/2021,18,11,49,2,2021-03-25,0.07,not_requested,0.0
1202,Crypto Golf Carts,1,0,0,0,0,0,0,0,0,15,2.0,0.015,70.0,124.0,False,09/12/2021,2,5,14,3,2021-09-13,0.015,not_requested,0.0
1203,Crypto Goonz,0,1,0,0,0,0,0,0,0,3000,880.0,0.006,2288.0,1193.0,False,08/26/2021,23,13,36,5,2021-09-07,1.2366213999899986,approved,910.0
1204,Crypto Gothic Girls,1,0,0,0,0,0,0,0,0,177,48.0,0.01,513.0,1114.0,False,07/14/2021,7,7,22,4,2021-06-27,0.07855,not_requested,203.0
1205,Crypto Guns,0,1,0,0,0,0,0,0,0,74,21.0,0.2,172.0,1.0,False,03/09/2021,5,7,113,2,2021-03-09,0.5,verified,56.0
1206,Crypto Hasbulla,1,1,0,0,0,0,0,0,0,1000,591.0,0.33,25885.0,37.0,False,11/25/2021,2292,195,35648,314,2021-12-17,301.1606199999987,approved,0.0
1207,Crypto Heroes on Mars,1,0,0,0,0,0,0,0,0,6100,813.0,0.02,727.0,147.0,False,04/01/2021,3,4,10,2,2021-02-17,6.158999899999991,approved,0.0
1208,Crypto Hipsters,0,1,0,0,0,0,0,0,0,1000,355.0,0.01,1245.0,1292.0,False,07/08/2021,5,7,22,3,2021-07-27,0.078,not_requested,0.0
1209,Crypto Hobos,0,1,0,0,0,0,0,0,0,8000,3000.0,0.01,11837.0,865.0,False,08/04/2021,685,726,763,22,2021-09-19,8.473999999999988,verified,188.0
1210,Crypto Hobos Pet Partners,0,1,0,0,0,0,0,0,0,2600,822.0,0.007,11837.0,865.0,False,08/04/2021,685,726,763,22,2021-11-15,1.0847,not_requested,170.0
1211,Crypto Hodlers NFT,0,1,0,0,0,0,0,0,0,10000,1900.0,0.001,6925.0,1299.0,False,06/24/2021,19,20,63,2,2021-07-10,2.6952340999999955,verified,475.0
1212,Crypto Intellectuals Collectibles,1,1,1,0,0,1,1,1,1,120,7.0,0.01,10.0,170.0,False,08/06/2019,0,1,3,0,2021-03-21,0.01,not_requested,74.0
1213,Crypto Jocks,0,1,0,0,0,0,0,0,0,20,2.0,0.02,1403.0,2348.0,False,12/28/2013,20,20,21,1,2021-05-05,0.04,not_requested,39.0
1214,Crypto Junior Punks,0,1,0,0,0,0,0,0,0,499,21.0,0.005,736.0,2882.0,False,11/01/2018,2,3,11,3,2021-05-25,0.24,not_requested,0.0
1215,Crypto Karakuri,0,1,0,0,0,0,0,0,0,24,22.0,0.1,730.0,487.0,False,10/10/2021,6,7,32,2,2021-10-14,0.29,not_requested,78.0
1216,Crypto Labyrin,1,0,0,0,0,0,0,0,0,18,19.0,0.003,1412.0,255.0,False,10/01/2021,5,3,14,1,2021-10-16,0.006,not_requested,7.0
1217,Crypto LeBron - LeBron James Pixel Collection - Choose Your LeBron!,0,0,0,0,0,1,0,0,0,30,9.0,0.001,13.0,34.0,False,10/11/2021,1,3,6,1,2021-10-21,0.015,not_requested,39.0
1218,Crypto Machines Car Collection First Edition,0,1,0,0,0,0,0,0,0,39,3.0,0.01,7.0,255.0,False,09/21/2021,3,2,9,1,2021-10-08,0.03,not_requested,71.0
1219,Crypto Mamas,0,1,0,0,0,0,0,0,0,342,2.0,0.05,7943.0,2188.0,False,10/27/2013,10,9,15,1,2021-08-05,0.07,not_requested,0.0
1220,Crypto Mars NFTs,0,1,0,0,0,0,0,0,0,57,13.0,0.01,600.0,269.0,False,11/12/2021,1,2,4,0,2021-11-17,0.3330000000000001,not_requested,67.0
1221,Crypto Meme Tokens,0,1,0,0,0,0,0,0,0,57,11.0,0.005,2194.0,2595.0,False,05/18/2021,6,6,20,3,2021-10-01,0.2182,not_requested,2.0
1222,Crypto Miners Syndicate,0,0,0,0,0,0,0,1,0,1000,343.0,0.1,2254.0,101.0,False,11/19/2021,92,94,73,9,2021-12-16,0.929,not_requested,0.0
1223,Crypto Mkeyf,1,0,0,0,0,0,0,0,0,76,27.0,0.014,229.0,949.0,False,11/09/2021,3,6,19,4,2021-11-13,0.293,not_requested,118.0
1224,Crypto Models,1,0,0,0,0,0,0,0,0,3000,558.0,0.007,231.0,15.0,False,03/08/2021,5,6,17,2,2021-01-12,0.9745500000000006,approved,130.0
1225,Crypto Monkeyz,0,1,0,0,0,0,0,0,0,304,168.0,0.02,566.0,17.0,False,08/09/2018,58,66,70,3,2021-09-26,0.2079,not_requested,18.0
1226,Crypto New Kids (InfamousFriends),1,0,0,0,0,0,0,0,0,200,3.0,0.05,5.0,34.0,False,08/29/2021,1,0,2,1,2021-08-15,0.0605,not_requested,0.0
1227,Crypto Nijigen,0,1,0,0,0,0,0,0,0,887,189.0,0.02,20267.0,17.0,False,08/31/2021,5946,1069,2022,14,2021-09-29,0.155,not_requested,654.0
1228,Crypto Nike Air Max 90,1,1,0,0,0,1,1,0,1,104,15.0,0.006,48.0,122.0,False,04/01/2021,2,1,5,1,2021-03-20,0.1207,not_requested,21.0
1229,Crypto Omamori,1,0,0,0,0,0,0,0,0,25,16.0,0.005,1398.0,427.0,False,02/27/2011,8,6,24,4,2021-10-18,0.031,not_requested,27.0
1230,Crypto Packaged Goods,0,0,0,0,0,0,0,1,0,11,279.0,6.0,6819.0,882.0,False,07/07/2021,3,6,46,6,2021-09-27,65.47,approved,23.0
1231,Crypto Penguin NFT,0,1,0,0,0,0,0,0,0,145,23.0,0.005,381.0,1355.0,False,11/26/2021,7,10,13,2,2021-11-25,0.106,not_requested,329.0
1232,Crypto Pixel Pepe (Genesis. Re-launch soon),0,1,0,0,0,0,0,0,0,802,160.0,0.45,6787.0,811.0,False,10/17/2021,256,151,282,57,2021-03-03,11.389,approved,442.0
1233,Crypto Pizzeria,1,0,0,0,0,0,0,0,0,4,4.0,0.2,3528.0,3540.0,False,05/06/2016,4,4,24,2,2021-11-02,0.5800000000000001,not_requested,6.0
1234,Crypto Plebes,0,1,0,0,0,0,0,0,0,315,165.0,0.15,10430.0,58.0,False,08/13/2021,200,189,253,66,2021-08-15,12.769763148165802,not_requested,189.0
1235,Crypto Poisons,0,0,0,0,0,0,0,1,0,29,3000.0,0.001,2034.0,14.0,False,11/21/2021,157,103,181,11,2021-11-09,0.0277129,not_requested,0.0
1236,Crypto Pop juice and Emotitional outlet,1,0,0,0,0,0,0,0,0,31,17.0,0.002,341.0,256.0,False,09/23/2020,3,2,23,2,2021-10-10,0.005,not_requested,0.0
1237,Crypto Posters AES-256,1,0,0,0,0,0,0,0,0,110,43.0,0.07,190.0,161.0,False,10/18/2021,2,1,9,1,2021-03-24,0.6186856946963437,not_requested,9.0
1238,Crypto Princesses: Dream Edition,0,1,0,0,0,0,0,0,0,336,128.0,0.03,4141.0,427.0,False,08/31/2019,17,8,45,6,2021-03-14,0.279,approved,0.0
1239,Crypto Prisoners,0,1,0,0,0,0,0,0,0,5500,180.0,0.012,51.0,1.0,False,12/14/2021,2,3,5,1,2021-12-10,2.5135000000000014,approved,145.0
1240,Crypto Pro Wrestlers,0,0,0,0,0,0,0,1,0,22,11.0,0.3,48.0,468.0,False,11/17/2021,3,12,9,1,2021-12-11,0.1665,not_requested,0.0
1241,Crypto Prophecies Magic Items,0,1,0,0,0,0,0,0,0,8000,998.0,0.001,28605.0,11.0,False,11/20/2020,42,197,81,8,2021-10-12,0.33001,not_requested,0.0
1242,Crypto Punk Alien,1,0,0,0,0,0,0,0,0,99,47.0,0.005,1010.0,1778.0,False,12/12/2021,2,1,1,0,2021-12-11,0.5107000000000004,not_requested,0.0
1243,Crypto Punks 2 ~ Polygon,0,1,0,0,0,0,0,0,0,3900,313.0,0.008,17023.0,600.0,False,09/18/2018,2616,122,833,4,2021-10-18,0.22075,not_requested,49.0
1244,Crypto Rabbits*,0,1,0,0,0,0,0,0,0,72,73.0,0.002,1920.0,608.0,False,03/28/2020,5,5,38,3,2021-10-02,0.7570000000000003,not_requested,0.0
1245,Crypto Raiders Characters,0,0,0,0,0,0,0,1,0,23300,1800.0,0.11,18751.0,13.0,False,07/01/2021,210,95,367,14,2021-07-27,612.5975537899066,verified,0.0
1246,Crypto RudeBoy Club,0,1,0,0,0,0,0,0,0,130,29.0,0.065,90553.0,192.0,True,11/10/2015,788,167,3038,137,2021-12-06,2.989,approved,389.0
1247,Crypto SNKRZ,0,1,0,0,0,0,0,0,0,33,11.0,0.005,7543.0,1451.0,False,10/05/2017,105,26,130,95,2021-10-07,0.045,not_requested,21.0
1248,Crypto Sasquatch UookHook,0,1,0,0,0,0,0,0,0,40,23.0,0.05,1502.0,462.0,False,07/20/2020,17,45,115,6,2021-10-20,0.3920000000000001,not_requested,0.0
1249,Crypto Sneakers Collection,0,1,0,0,0,0,0,0,0,18,14.0,0.15,4465.0,4374.0,False,07/13/2009,15,14,68,2,2021-02-17,0.15,approved,0.0
1250,Crypto Souls Collection,1,1,0,0,0,0,0,0,0,21,193.0,0.005,57.0,74.0,False,09/18/2021,20,21,12,3,2021-03-31,0.0392,not_requested,47.0
1251,Crypto Space Aliens,1,0,0,0,0,0,0,0,0,107,571.0,0.001,764.0,2903.0,False,05/18/2015,2,20,18,4,2021-11-09,0.1063972641,not_requested,0.0
1252,Crypto Space flight,0,0,0,0,0,0,0,1,0,15,39.0,0.001,1378.0,52.0,False,11/01/2021,396,181,403,7,2021-11-12,0.001,not_requested,0.0
1253,Crypto Television,1,0,0,0,0,0,0,0,0,70,36.0,0.01,1247.0,10.0,False,11/15/2021,62,32,320,0,2021-11-20,0.276,not_requested,0.0
1254,Crypto Titties ( . Y . ),0,1,0,0,0,0,0,0,0,110,368.0,0.002,2.0,19.0,False,11/10/2021,1,0,1,1,2021-09-01,0.04344,not_requested,0.0
1255,Crypto Todlers NFT,0,1,0,0,0,0,0,0,0,601,296.0,0.01,6925.0,1299.0,False,06/24/2021,19,20,63,2,2021-09-08,0.03,not_requested,472.0
1256,Crypto Trumpy,0,1,0,0,0,0,0,0,0,31,15.0,0.005,63.0,210.0,False,09/20/2016,1,2,3,3,2021-09-19,0.02,not_requested,5.0
1257,Crypto Tuners,1,0,0,0,0,0,0,0,0,5000,1300.0,0.002,2420.0,316.0,False,07/10/2021,169,178,197,12,2021-08-15,0.16089,not_requested,122.0
1258,Crypto WOW Girls,0,1,0,0,0,0,0,0,0,102,29.0,0.01,532.0,789.0,False,12/11/2021,20,14,30,3,2021-12-12,0.241,not_requested,251.0
1259,Crypto Whales NFT Club,0,1,0,0,0,0,0,0,0,333,5.0,0.08,2060.0,709.0,False,10/01/2021,44,6,98,18,2021-10-08,0.24,not_requested,0.0
1260,Crypto Yankiz,0,1,0,0,0,0,0,0,0,311,130.0,0.02,2859.0,1320.0,False,02/02/2014,12,5,18,1,2021-05-12,0.4159,approved,378.0
1261,Crypto Zombies vs Planet X,1,0,0,0,0,0,0,0,0,20,172.0,0.001,4119.0,843.0,False,08/12/2009,3,6,8,4,2021-08-03,0.0219,not_requested,1.0
1262,Crypto design jp collection,1,0,0,0,0,0,0,0,0,24,500.0,0.001,1715.0,1350.0,False,10/11/2021,2,4,13,1,2021-10-10,0.0304924325428972,not_requested,0.0
1263,Crypto lucky bunny,0,1,0,0,0,0,0,0,0,56,34.0,0.005,4662.0,178.0,False,01/06/2013,23,41,100,3,2021-10-23,0.0648,not_requested,37.0
1264,Crypto rocket to the moon,0,1,0,0,0,0,0,0,0,206,299.0,0.001,64.0,59.0,False,12/03/2021,1,13,6,2,2021-10-17,0.0283596,not_requested,24.0
1265,Crypto rude,1,0,0,0,0,0,0,0,0,100,28.0,0.003,515.0,993.0,False,12/18/2021,5,1,8,1,2021-11-28,0.09305,not_requested,0.0
1266,"Crypto""Chibi-Yokai""",1,0,0,0,0,0,0,0,0,8,3.0,0.005,19.0,143.0,False,11/10/2021,1,2,8,2,2021-11-18,0.025,not_requested,0.0
1267,"Crypto""WAFUKU"" NFT",0,1,0,0,0,0,0,0,0,19,18.0,0.2,2916.0,427.0,False,03/08/2021,15,10,60,9,2021-10-05,0.55,not_requested,50.0
1268,Crypto-Calendar,0,0,0,0,0,0,0,1,0,367,54.0,0.14,390.0,949.0,False,04/30/2021,18,19,19,4,2021-08-10,1.2,not_requested,0.0
1269,Crypto-Neondesign-Japan,1,0,0,0,0,0,0,0,0,36,399.0,0.001,4448.0,3713.0,False,02/13/2018,5,4,18,1,2021-10-03,0.007,not_requested,0.0
1270,Crypto-Surfers,0,1,0,0,0,0,0,0,0,100,9.0,0.01,5.0,29.0,False,11/18/2021,1,1,1,1,2021-05-10,0.035,not_requested,11.0
1271,Crypto-bighead,0,1,0,0,0,0,0,0,0,18,2.0,0.008,602.0,282.0,False,04/01/2021,3,1,10,1,2021-10-13,0.008,not_requested,31.0
1272,Crypto-bonus-cards,1,0,0,0,0,0,0,0,0,11,8.0,0.005,3485.0,2699.0,False,02/08/2021,25,18,34,3,2021-03-27,0.02,not_requested,2.0
1273,Crypto.Chicks,0,1,0,0,0,0,0,0,0,10000,3600.0,0.15,24394.0,327.0,False,08/14/2021,102,87,467,13,2021-09-19,779.3877748613326,verified,223.0
1274,Crypto.Vortex,1,0,0,0,0,0,0,0,0,12,644.0,0.002,9474.0,593.0,False,01/26/2011,77,40,296,8,2021-04-05,0.019096,not_requested,27.0
1275,CryptoAnimals (300),1,1,0,0,0,0,1,0,1,359,45.0,0.002,303.0,35.0,False,04/14/2021,4,7,9,4,2021-03-08,0.0478999999999999,requested,4.0
1276,CryptoApes1,1,1,0,0,0,0,0,0,0,262,85.0,0.035,998.0,884.0,False,03/12/2021,76,77,89,7,2021-03-12,0.1309,approved,188.0
1277,CryptoArte,1,0,0,0,0,0,0,0,0,9900,3400.0,0.13,9249.0,3356.0,False,06/07/2018,48,17,143,10,2019-04-26,163.52939800000013,verified,76.0
1278,CryptoArtefacts,0,1,0,0,0,0,0,0,0,51,3.0,0.005,12.0,18.0,False,10/31/2021,1,2,6,2,2021-10-30,0.045,not_requested,76.0
1279,CryptoAuthors,0,1,0,0,0,0,0,0,0,98,30.0,0.02,244.0,266.0,False,06/02/2021,101,41,111,7,2021-05-27,0.04,not_requested,120.0
1280,CryptoAvatars,0,0,0,0,0,0,0,0,1,497,187.0,0.15,3249.0,664.0,False,02/06/2020,51,50,177,6,2020-09-28,2.8599999999999994,verified,0.0
1281,CryptoBengz,1,0,0,0,0,0,0,0,0,189,104.0,0.01,462.0,384.0,False,09/19/2021,42,45,49,6,2021-10-20,0.9690000000000004,not_requested,148.0
1282,CryptoBlunts 420,0,1,0,0,0,0,0,0,0,94,66.0,0.065,12551.0,5753.0,False,03/11/2021,22,16,54,4,2021-08-23,0.2760000000000001,not_requested,253.0
1283,CryptoBordies,0,1,0,0,0,0,0,0,0,20,13.0,0.25,25161.0,2470.0,False,11/02/2015,11,19,57,3,2021-12-06,2.39,not_requested,91.0
1284,CryptoBot Utility,0,0,0,0,0,0,0,1,0,6,3.0,2.5,66581.0,0.0,False,03/20/2018,166,215,394,12,2021-12-15,0.275,not_requested,0.0
1285,CryptoBots,0,1,0,0,0,0,0,0,0,10000,1900.0,0.098,2834.0,56.0,False,01/04/2018,1011,135,1041,58,2019-04-26,590.0272407335294,verified,173.0
1286,CryptoBroski's,0,1,0,0,0,0,0,0,0,191,48.0,0.01,145.0,168.0,False,09/03/2021,1,5,6,1,2021-08-30,0.1069,not_requested,151.0
1287,CryptoBucky,0,1,0,0,0,0,0,0,0,321,91.0,0.015,795.0,571.0,False,06/28/2021,3,13,16,6,2021-06-28,0.21,not_requested,1176.0
1288,CryptoBullTerrier Gen 1&2,0,1,0,0,0,0,0,0,0,100,11.0,0.005,547.0,950.0,False,07/19/2020,6,4,15,3,2021-09-07,0.0355,not_requested,68.0
1289,CryptoBullTerrier Gen 3,0,1,0,0,0,0,0,0,0,100,10.0,0.005,547.0,950.0,False,07/19/2020,6,4,15,3,2021-10-07,0.025,not_requested,165.0
1290,CryptoCampions,0,1,0,0,0,0,0,0,0,770,123.0,0.01,95.0,132.0,False,03/16/2021,2,3,11,1,2021-08-02,0.329,not_requested,285.0
1291,CryptoCars Porsche,0,1,0,0,0,0,0,0,0,32,24.0,0.065,91.0,155.0,False,03/02/2021,3,7,14,0,2021-03-02,0.32,approved,35.0
1292,CryptoChefs NFT,0,0,0,0,0,0,0,1,0,151,60.0,0.055,3345.0,14.0,False,03/15/2021,1189,782,2050,1856,2021-10-22,0.1669,not_requested,178.0
1293,CryptoChess - Chessmasters,0,1,0,0,0,0,0,0,0,125,33.0,0.02,89.0,48.0,False,03/06/2021,4,2,5,3,2021-04-03,0.045,approved,0.0
1294,CryptoCinema,0,1,0,0,0,0,0,0,0,160,96.0,0.001,89.0,48.0,False,03/06/2021,4,2,5,3,2021-03-07,0.0398,approved,0.0
1295,CryptoCities,1,1,0,0,0,0,0,0,0,83,51.0,65.0,8754.0,1014.0,False,03/29/2021,95,49,928,32,2021-04-10,112.5,verified,0.0
1296,CryptoClimates,0,1,0,0,0,0,0,0,0,170,84.0,2.25,2876.0,1233.0,False,02/02/2021,7,8,45,1,2021-01-19,5.928358126020165,verified,84.0
1297,CryptoClub.IO,0,0,0,0,0,0,0,1,0,1,14.0,0.5,6634.0,0.0,False,05/05/2021,359,445,323,4,2021-09-01,1.3945,not_requested,0.0
1298,CryptoCommonerz,0,1,0,0,0,0,0,0,0,367,200.0,0.003,742.0,1622.0,False,09/18/2021,8,40,19,6,2021-10-19,0.8450000000000003,approved,238.0
1299,CryptoCosmos Planets,0,1,0,0,0,0,0,0,1,4400,24.0,0.01,347.0,385.0,False,03/20/2021,151,154,177,12,2021-03-20,0.22,not_requested,6.0
1300,CryptoCosplay,0,1,0,0,0,0,0,0,0,61,112.0,0.2,5661.0,895.0,False,05/16/2013,11,6,39,3,2021-02-15,0.599,verified,22.0
1301,CryptoCrawlerz,1,1,0,0,0,0,0,0,0,22,208.0,0.04,6537.0,6958.0,False,02/16/2021,3,19,39,3,2021-02-27,0.4,approved,0.0
1302,CryptoCruisersNFT,0,1,0,0,0,0,0,0,0,25,14.0,0.008,352.0,194.0,False,08/25/2021,6,4,11,2,2021-10-13,0.0075,not_requested,58.0
1303,CryptoCrystal,1,1,0,0,0,0,0,0,0,10000,1500.0,0.044,3980.0,30.0,False,03/06/2018,44,18,171,14,2019-04-26,486.3117880000004,verified,101.0
1304,CryptoCubeCat,0,1,0,0,0,0,0,0,0,50,111.0,0.011,2146.0,896.0,False,06/16/2021,40,80,199,21,2021-10-01,0.066,not_requested,40.0
1305,CryptoCubes,0,1,0,0,0,0,0,0,0,254,145.0,16.0,5295.0,1.0,False,10/22/2020,51,38,236,25,2020-10-20,116.75,verified,274.0
1306,CryptoCubes & Creators,1,0,0,0,0,0,0,0,0,265,34.0,0.3,5295.0,1.0,False,10/22/2020,51,38,236,25,2021-04-07,0.55,verified,0.0
1307,CryptoDemonzV1,1,0,0,0,0,0,0,0,0,7000,1800.0,0.033,13065.0,427.0,False,07/13/2021,189,211,256,34,2021-08-25,9.522299999999989,not_requested,60.0
1308,CryptoDemonzV2,0,0,0,0,0,0,0,1,0,2000,582.0,0.046,13065.0,427.0,False,07/13/2021,189,211,256,34,2021-09-26,0.7749000000000003,not_requested,60.0
1309,CryptoDickbutts,0,1,0,0,0,0,0,0,0,5200,1600.0,0.599,6033.0,69.0,False,03/02/2021,415,463,675,46,2021-07-28,357.77687000000014,verified,204.0
1310,CryptoDictators,1,1,0,0,0,0,0,0,0,150,7.0,0.01,747.0,1201.0,False,04/02/2021,31,382,254,2,2021-04-02,0.065,not_requested,97.0
1311,CryptoDinosaurs,1,0,0,0,0,0,0,0,1,91,43.0,0.11,878.0,3170.0,False,02/28/2021,20,7,20,3,2021-02-26,2.150000000000001,approved,0.0
1312,CryptoDirectors,0,0,0,0,0,0,1,0,0,40,3.0,0.005,11.0,291.0,False,04/07/2021,1,6,8,0,2021-05-03,0.005,not_requested,104.0
1313,CryptoDrunks,1,1,0,0,0,0,0,0,0,53,31.0,0.45,1737.0,4962.0,False,03/04/2021,9,5,27,2,2021-03-02,0.85,verified,12.0
1314,CryptoDuckies,1,1,0,0,0,0,0,0,0,483,226.0,0.04,610.0,290.0,False,03/15/2021,8,7,29,6,2021-03-13,0.304,approved,334.0
1315,CryptoDunks,1,1,0,0,0,1,0,0,0,66,728.0,0.012,2511.0,2504.0,False,02/20/2021,7,4,45,2,2021-02-19,7.522199999999974,approved,23.0
1316,CryptoElephantsClub,0,1,0,0,0,0,0,0,0,5000,736.0,0.002,1157.0,56.0,False,10/13/2021,515,105,555,9,2021-10-14,1.1936688999999987,not_requested,150.0
1317,CryptoEmpire Cards,0,0,0,0,0,0,1,0,0,120,1400.0,0.01,3030.0,244.0,False,08/30/2021,196,192,308,87,2021-09-02,0.11,not_requested,147.0
1318,CryptoFalu,0,1,0,0,0,0,0,0,0,43,6.0,0.001,65.0,162.0,False,10/21/2021,7,2,16,3,2021-11-24,0.0678,not_requested,5.0
1319,CryptoFighters,0,1,0,0,0,0,0,0,0,5000,1300.0,0.069,2935.0,500.0,False,12/14/2017,14,5,38,3,2019-04-26,91.90542169170756,verified,77.0
1320,CryptoFoxes,0,1,0,0,0,0,0,0,0,11100,3200.0,0.021,5697.0,7.0,False,03/13/2021,148,149,319,17,2021-04-23,9.83040222219998,approved,369.0
1321,CryptoFoxes Origins to Migrate,0,1,0,0,0,0,0,0,0,1000,112.0,0.35,5696.0,7.0,False,03/13/2021,148,149,319,17,2021-03-13,1.497,approved,244.0
1322,CryptoGFs,1,1,0,0,0,0,0,0,0,17,13.0,20.0,67661.0,5004.0,False,02/21/2021,5322,5206,5777,343,2021-03-02,53.3,verified,0.0
1323,CryptoGamblers V1,0,1,0,0,0,0,0,0,0,112,47.0,0.033,215.0,9.0,False,03/11/2021,5,3,10,2,2021-03-21,0.07,approved,76.0
1324,CryptoGameboyz,0,1,0,0,0,0,0,0,0,211,76.0,0.001,336.0,863.0,False,03/05/2021,3,2,5,1,2021-04-25,0.298988,not_requested,0.0
1325,CryptoGangsNFT,0,1,0,0,0,0,0,0,0,1300,351.0,0.015,3442.0,143.0,False,08/21/2021,113,70,262,9,2021-10-17,0.9823000000000002,not_requested,189.0
1326,CryptoGoblinz,1,1,0,0,0,0,0,0,0,115,10.0,0.008,1375.0,406.0,False,10/05/2014,19,15,106,4,2021-03-04,0.017,approved,19.0
1327,CryptoGoros,1,0,0,0,0,0,0,0,0,197,109.0,0.49,5722.0,4911.0,False,05/03/2021,15,16,93,8,2021-07-01,14.868021000000002,not_requested,79.0
1328,CryptoGreats,0,1,0,0,0,1,0,0,0,833,119.0,0.01,1636.0,1602.0,False,03/18/2021,3,6,14,3,2021-03-18,0.3950000000000001,not_requested,100.0
1329,CryptoGuysNFT,1,0,0,0,0,0,0,0,0,9700,445.0,0.034,1650.0,683.0,False,02/17/2021,88,69,99,4,2021-03-15,10.141399999999988,approved,203.0
1330,CryptoHackerZ,1,0,0,0,0,0,0,0,0,54,23.0,0.011,924.0,4479.0,False,09/14/2021,4,3,34,3,2021-11-15,0.0899999999999999,not_requested,0.0
1331,CryptoHamsters Elementals,0,1,0,0,0,0,0,0,0,368,104.0,0.005,381.0,67.0,False,02/21/2018,24,19,39,6,2021-11-18,0.189,not_requested,83.0
1332,CryptoHeadPunks,0,1,0,0,0,0,0,0,0,404,26.0,0.005,895.0,1616.0,False,04/07/2016,2,2,9,1,2021-10-15,0.0235,not_requested,120.0
1333,CryptoHoots Steampunk Parliament,0,1,0,0,0,0,0,0,0,2500,954.0,0.489,4667.0,596.0,False,07/28/2021,388,416,453,18,2021-09-28,108.36650000000002,verified,213.0
1334,CryptoHotties in your mansion,0,1,0,0,0,0,0,0,0,60,12.0,0.04,480.0,222.0,False,04/15/2015,111,121,157,6,2021-05-04,0.08,not_requested,4.0
1335,CryptoHouses,1,1,0,0,0,0,0,0,0,100,28.0,0.2,164.0,22.0,False,02/03/2021,6,2,8,3,2021-02-02,0.21,approved,22.0
1336,CryptoJaks,1,1,0,0,0,0,0,0,0,1100,375.0,0.039,1215.0,1367.0,False,02/24/2021,81,319,274,121,2021-02-25,0.67201,verified,86.0
1337,CryptoJars,1,1,0,0,0,0,0,0,0,23,140.0,0.1,3596.0,992.0,False,08/25/2009,362,368,482,9,2021-03-26,0.1588999999999999,not_requested,0.0
1338,CryptoKanojo Waifu,1,1,0,0,0,0,0,0,0,8,19.0,0.1,1883.0,1852.0,False,05/10/2017,31,4,124,3,2021-03-10,0.25,not_requested,14.0
1339,CryptoLadyGabi,1,0,0,0,0,0,0,0,0,6,5.0,0.2,11732.0,11658.0,False,07/22/2016,15,2,31,1,2021-02-21,0.6599999999999999,approved,20.0
1340,CryptoLeos,0,1,0,0,0,0,0,0,0,611,254.0,0.15,4217.0,2952.0,False,04/15/2021,12,11,55,2,2021-04-01,2.9168998999999998,verified,352.0
1341,CryptoLlamas Official,1,0,0,0,0,0,0,0,0,27,2.0,0.008,330.0,162.0,False,03/11/2021,3,31,18,2,2021-03-17,0.005,not_requested,66.0
1342,CryptoMaidsFanArtCollection,0,1,0,0,0,0,0,0,0,25,58.0,0.009,608.0,297.0,False,09/16/2021,11,4,27,3,2021-09-29,0.013,not_requested,0.0
1343,CryptoManga Genesis,0,1,0,0,0,0,0,0,0,1300,286.0,0.078,5109.0,187.0,False,08/16/2021,17,128,42,13,2021-09-19,3.968,not_requested,279.0
1344,CryptoMifflins of The Office,0,1,0,0,0,0,0,0,0,403,85.0,0.008,1025.0,2172.0,False,03/15/2021,4,3,11,2,2021-03-24,0.31,approved,0.0
1345,CryptoMinerz,0,1,0,0,0,0,0,0,0,10000,269.0,0.001,99.0,36.0,False,10/17/2021,7,6,13,1,2021-10-20,0.024919,not_requested,137.0
1346,CryptoMiss,0,1,0,0,0,0,0,0,0,219,9.0,0.01,651.0,946.0,False,04/18/2021,4,1,7,2,2021-04-18,0.01,not_requested,0.0
1347,CryptoMonsterClub,1,0,0,0,0,0,0,0,0,799,1600.0,0.001,128.0,53.0,False,09/29/2021,4,6,4,1,2021-09-28,0.0064,not_requested,8.0
1348,CryptoMonsters NFT,1,0,0,0,0,0,0,0,0,121,77.0,0.005,1327.0,720.0,False,09/14/2021,17,7,82,6,2021-10-15,0.4720000000000002,not_requested,0.0
1349,CryptoMories,0,1,0,0,0,0,0,0,0,10000,4800.0,1.75,33887.0,2716.0,False,09/03/2021,233,240,990,24,2021-10-08,5522.855556812056,approved,244.0
1350,CryptoMotors,0,1,0,0,0,0,0,0,0,557,240.0,1.2,5049.0,782.0,False,03/14/2018,55,40,109,11,2019-04-26,11.57254244,verified,81.0
1351,CryptoMushrooms.co,1,0,0,0,0,0,0,0,0,301,7.0,0.05,892.0,0.0,False,10/22/2021,1,2,4,1,2021-10-22,0.24,not_requested,0.0
1352,CryptoNBA Collection,1,0,0,0,0,0,0,0,0,176,12.0,0.01,173.0,525.0,False,10/25/2021,2,3,5,1,2021-10-21,0.04,not_requested,258.0
1353,CryptoNature Cards,0,0,0,0,0,0,1,0,0,23,5.0,0.02,62.0,554.0,False,03/13/2021,2,3,21,2,2021-03-09,0.02,not_requested,0.0
1354,CryptoNinja 8bit,0,1,0,0,0,0,0,0,0,27,46.0,0.002,595.0,114.0,False,09/29/2021,5,5,20,5,2021-10-03,0.0125,not_requested,0.0
1355,CryptoNinja NFT,0,1,0,0,0,0,0,0,0,26,26.0,18.5,16259.0,2.0,False,10/23/2020,165,24,197,22,2021-09-20,2.73,approved,66.0
1356,CryptoNugs,0,1,0,0,0,0,0,0,0,73,32.0,0.01,864.0,1429.0,False,10/01/2019,5,4,16,2,2021-11-29,0.7000000000000004,not_requested,0.0
1357,CryptoOldPunks,0,1,0,0,0,0,0,0,0,500,140.0,0.039,784.0,847.0,False,04/25/2021,6,5,15,4,2021-04-25,0.5608000000000001,not_requested,545.0
1358,CryptoPervs,0,1,0,0,0,0,0,0,0,937,233.0,0.24,17449.0,1171.0,False,03/09/2021,19,98,101,3,2021-03-14,42.91649388888899,approved,247.0
1359,CryptoPhunk,0,1,0,0,0,0,0,0,0,135,5.0,0.115,10091.0,1066.0,False,05/07/2021,299,310,683,106,2021-11-15,0.51,not_requested,0.0
1360,CryptoPhunkV2,0,1,0,0,0,0,0,0,0,466,5.0,0.01,10091.0,1066.0,False,05/07/2021,299,310,683,106,2021-11-15,0.0456,not_requested,0.0
1361,CryptoPick,0,0,0,0,0,0,0,1,0,5100,544.0,0.005,4129.0,93.0,False,02/05/2019,593,51,258,12,2021-03-18,0.0009,not_requested,168.0
1362,CryptoPigsNFT,1,0,0,0,0,0,0,0,0,8000,133.0,0.059,516.0,821.0,False,03/10/2021,4,3,19,3,2021-02-27,3.297000000000002,approved,156.0
1363,CryptoPochi,1,0,0,0,0,0,0,0,0,732,434.0,0.689,2526.0,114.0,False,08/28/2021,121,133,130,11,2021-09-05,17.53808426827012,verified,149.0
1364,CryptoPolz,0,1,0,0,0,0,0,0,0,9700,3200.0,0.019,18867.0,15472.0,False,07/11/2014,19,22,114,4,2021-10-16,12.27107678699999,approved,191.0
1365,CryptoPons,0,1,0,0,0,0,0,0,0,101,6.0,0.02,638.0,1859.0,False,11/22/2021,2,3,12,4,2021-11-19,0.0699999999999999,not_requested,51.0
1366,CryptoPostage,0,1,0,0,0,0,0,0,0,295,1100.0,0.001,1613.0,3246.0,False,07/24/2021,2,3,8,2,2021-07-25,0.0758552338840955,not_requested,55.0
1367,CryptoPunk Club,0,1,0,0,0,0,0,0,0,10200,367.0,0.001,139320.0,40.0,True,08/03/2009,327,291,1591,192,2021-11-13,0.0405799999999999,not_requested,0.0
1368,CryptoPunk Dragons,0,1,0,0,0,0,0,0,0,777,52.0,0.03,53.0,30.0,False,09/29/2021,4,10,14,4,2021-09-08,0.179,approved,74.0
1369,CryptoPunk Lab,0,1,0,0,0,0,0,0,0,8000,11.0,0.001,139320.0,40.0,True,08/03/2009,327,291,1591,192,2021-11-13,0.0465299999999999,not_requested,0.0
1370,CryptoPunk Oficial,0,1,0,0,0,0,0,0,0,10100,3300.0,0.001,139320.0,40.0,True,08/03/2009,327,291,1591,192,2021-11-13,0.0358999999999999,not_requested,0.0
1371,CryptoPunk PixelArt,0,1,0,0,0,0,0,0,0,10100,1700.0,0.001,139320.0,40.0,True,08/03/2009,327,291,1591,192,2021-11-13,0.0146399999999999,not_requested,0.0
1372,CryptoPunk Russia,0,1,0,0,0,0,0,0,0,10100,3100.0,0.001,139320.0,40.0,True,08/03/2009,327,291,1591,192,2021-11-13,0.1439899999999999,not_requested,0.0
1373,CryptoPunk's Exit,1,0,0,0,0,0,0,0,0,64,11.0,0.001,4.0,98.0,False,11/22/2021,0,1,2,2,2021-11-12,0.01325,not_requested,0.0
1374,CryptoPunkPepes,0,1,0,0,0,0,0,0,0,1400,59.0,0.025,91.0,89.0,False,11/06/2021,3,5,11,3,2021-10-23,0.645,not_requested,1397.0
1375,CryptoPunkZombies,0,1,0,0,0,0,0,0,0,913,232.0,0.001,516.0,270.0,False,05/30/2013,2,1,4,1,2021-09-15,0.22325,not_requested,28.0
1376,CryptoPunks,1,1,0,0,0,0,0,0,0,10000,3300.0,60.69,139320.0,40.0,True,08/03/2009,327,291,1591,192,2019-04-26,30170.74500000004,verified,100.0
1377,CryptoPunks (PolyVerse),0,1,0,0,0,0,0,0,0,10000,301.0,0.001,103.0,14.0,False,11/17/2021,25,10,20,2,2021-11-16,0.5363189999998004,not_requested,222.0
1378,CryptoPunks 2,1,0,0,0,0,0,0,0,0,25,2000.0,0.008,193.0,685.0,False,05/11/2017,1,5,20,2,2021-10-26,9.5208,not_requested,36.0
1379,CryptoPunks Alive,0,0,0,0,1,0,0,0,0,299,110.0,0.1,3797.0,5001.0,False,06/22/2021,25,28,101,8,2021-05-30,5.236011476193319,not_requested,89.0
1380,CryptoPunks in Tesla Roadsters,1,0,0,0,0,0,0,0,0,52,10.0,0.01,1186.0,2256.0,False,04/18/2021,3,4,7,1,2021-04-25,0.01,not_requested,0.0
1381,CryptoPuppyClub,0,1,0,0,0,0,0,0,0,50,3.0,0.01,26.0,10.0,False,09/07/2021,3,5,8,2,2021-08-29,0.01,not_requested,47.0
1382,CryptoPython (Eth),1,0,0,0,0,0,0,0,0,5000,123.0,0.02,290.0,642.0,False,03/16/2021,2,5,5,1,2021-01-20,0.5379000000000003,approved,0.0
1383,CryptoRaccoonz,1,0,0,0,0,0,0,0,0,1000,26.0,0.001,2344.0,117.0,False,12/06/2020,302,52,198,3,2021-12-13,0.39,not_requested,2.0
1384,CryptoRalph,0,1,0,0,0,0,0,0,0,1100,44.0,0.01,2529.0,136.0,False,08/10/2021,713,23,697,6,2021-09-13,0.1405,not_requested,80.0
1385,CryptoReapers,0,1,0,0,0,0,0,0,0,274,56.0,0.01,5202.0,5413.0,False,03/11/2021,1,3,7,0,2021-03-13,0.08,approved,408.0
1386,CryptoResin,0,1,0,0,0,0,0,0,0,1,3.0,0.01,410.0,813.0,False,05/30/2015,4,3,14,1,2021-09-01,0.02,not_requested,0.0
1387,CryptoRobots,0,1,0,0,0,0,0,0,0,51,35.0,0.45,800.0,3.0,False,02/19/2021,7,6,24,3,2021-02-19,0.1,approved,0.0
1388,CryptoRolls.Eth,0,1,0,0,0,0,0,0,0,577,518.0,0.013,116.0,3.0,False,08/21/2021,27,24,29,1,2021-08-19,0.031,not_requested,11.0
1389,CryptoRonin8,1,0,0,0,0,0,0,0,0,202,106.0,0.08,1371.0,331.0,False,08/30/2021,6,2,12,2,2021-08-31,16.73115437499999,not_requested,10.0
1390,CryptoSaviors,0,1,0,0,0,0,0,0,0,399,230.0,0.045,911.0,2182.0,False,03/08/2021,12,5,26,2,2021-07-23,0.1,not_requested,0.0
1391,CryptoSculptures by Vicens,1,0,0,0,0,0,0,0,0,14,38.0,0.1,223.0,388.0,False,10/22/2021,14,6,34,5,2021-12-07,1.514000000000001,not_requested,32.0
1392,CryptoSergs Archive,1,0,0,0,0,0,0,0,0,1100,346.0,0.279,3782.0,594.0,False,03/13/2021,72,72,128,6,2021-03-13,2.9948999999999995,verified,75.0
1393,CryptoSharks (SHARK),0,1,0,0,0,0,0,0,0,10000,4900.0,0.004,2694.0,833.0,False,04/24/2021,54,35,76,5,2021-07-12,10.008258800000084,approved,144.0
1394,CryptoShips (CS),1,0,0,0,0,0,0,0,0,39,65.0,0.025,1240.0,1439.0,False,02/10/2021,38,26,51,5,2021-02-21,0.005,approved,45.0
1395,CryptoSikhs,0,1,0,0,0,0,0,0,0,91,24.0,0.008,1734.0,4174.0,False,10/09/2021,12,4,21,3,2021-10-09,0.06375,not_requested,112.0
1396,CryptoSkulls,0,1,0,0,0,0,0,0,0,10000,1300.0,0.04,13617.0,968.0,False,05/27/2019,4534,4792,4274,236,2019-05-18,13239.760683839124,verified,0.0
1397,CryptoSkulls Polygon (Matic),0,1,0,0,0,0,0,0,0,28,21.0,0.07,13617.0,968.0,False,05/27/2019,4534,4792,4274,236,2021-03-02,16.48,verified,129.0
1398,CryptoSlav,0,1,0,0,0,0,0,0,0,215,72.0,0.01,496.0,795.0,False,06/04/2018,25,19,40,2,2021-08-30,0.1629999999999999,not_requested,88.0
1399,CryptoSmash!,0,1,0,0,0,0,0,0,0,31,20.0,0.03,380.0,309.0,False,07/29/2021,52,6,68,6,2021-08-02,0.13,not_requested,59.0
1400,CryptoSongz,0,1,0,0,0,0,0,0,0,999,421.0,0.02,1088.0,284.0,False,07/13/2021,4,3,11,2,2021-05-16,3.3669000000000007,verified,889.0
1401,CryptoSpacemen,0,1,0,0,0,0,0,0,0,1000,328.0,0.008,431.0,429.0,False,07/12/2021,33,12,41,2,2021-04-03,0.234,approved,643.0
1402,CryptoSpliff,0,1,0,0,0,0,0,0,0,106,61.0,0.004,46.0,169.0,False,11/23/2021,1,12,7,1,2021-09-17,0.01,not_requested,0.0
1403,CryptoSquads,0,0,0,0,0,1,0,0,0,33,11.0,0.05,860.0,3144.0,False,09/21/2021,24,25,28,2,2021-09-25,0.4222383513710937,not_requested,147.0
1404,CryptoTeddies,1,1,0,0,0,0,0,0,0,109,313.0,0.115,6313.0,1119.0,False,07/25/2020,2,5,31,1,2021-03-02,1.9778,approved,271.0
1405,CryptoTendies,0,1,0,0,0,0,1,0,0,130,233.0,0.009,2516.0,260.0,False,06/25/2020,28,38,107,27,2020-09-09,0.1239,approved,25.0
1406,CryptoThinkers,0,1,0,0,0,0,0,0,0,100,4.0,0.023,123.0,654.0,False,04/22/2021,1,3,5,2,2021-05-31,0.0525,not_requested,29.0
1407,CryptoTokyoLabs,0,1,0,0,0,0,0,0,0,16,122.0,0.001,568.0,817.0,False,10/06/2021,159,142,183,11,2021-10-18,0.01,not_requested,2.0
1408,CryptoTrex_old,1,0,0,0,0,0,0,0,0,1100,185.0,0.245,2443.0,760.0,False,03/08/2021,146,123,184,19,2021-03-10,14.857500000000003,approved,48.0
1409,CryptoTrunks,0,1,0,0,0,0,0,0,0,23500,11600.0,0.022,6773.0,565.0,False,05/03/2021,85,50,589,34,2021-05-16,3.075109999999999,verified,287.0
1410,CryptoUnity,1,0,0,0,0,0,0,0,0,18,2200.0,0.009,40.0,18.0,False,09/22/2021,14,10,21,13,2021-09-20,0.0127974999999999,not_requested,0.0
1411,CryptoWAKO by Rafael Lanfranco,0,1,0,0,0,0,0,0,0,10,4.0,0.05,471.0,1802.0,False,02/21/2013,4,4,13,1,2021-04-30,0.111,not_requested,30.0
1412,CryptoWTF,1,0,0,0,0,0,0,0,1,76,39.0,0.025,461.0,1409.0,False,02/02/2011,3,4,8,5,2021-03-21,0.394,not_requested,44.0
1413,CryptoWarNFT,1,0,0,0,0,0,0,0,0,20,2.0,0.028,10390.0,3173.0,False,09/03/2021,36,7,42,3,2021-12-16,0.055,not_requested,0.0
1414,CryptoWars Genesis Spies,0,1,0,0,0,0,0,0,0,824,443.0,0.031,10390.0,3173.0,False,09/03/2021,36,7,42,3,2021-12-14,1.632,not_requested,197.0
1415,CryptoWeebs,1,0,0,0,0,0,0,0,0,72,57.0,33.33,26612.0,418.0,True,03/26/2012,1034,1554,4287,2224,2021-03-02,128.29,verified,0.0
1416,CryptoWeedys,0,1,0,0,0,0,0,0,0,2900,73.0,0.004,2046.0,91.0,False,10/04/2021,174,175,197,3,2021-10-07,0.037,not_requested,191.0
1417,CryptoWhips,0,1,0,0,0,0,0,0,0,101,62.0,8.88,1265.0,378.0,False,03/06/2021,93,78,169,13,2021-03-10,12.401,verified,78.0
1418,CryptoWiener,1,1,0,0,0,0,0,0,0,200,73.0,0.99,1815.0,1342.0,False,02/05/2020,25,18,95,11,2019-11-15,3.0,verified,0.0
1419,CryptoWolvesClub,0,1,0,0,0,0,0,0,0,3300,2000.0,0.07,5789.0,184.0,False,11/09/2021,96,112,110,5,2021-12-02,79.45221000000002,approved,249.0
1420,CryptoWooks,0,1,0,0,0,0,0,0,0,55,24.0,0.025,1816.0,1173.0,False,01/22/2021,10,3,24,2,2021-02-28,0.025,approved,113.0
1421,CryptoYummy,0,1,0,0,0,0,0,0,0,116,22.0,0.002,644.0,2706.0,False,10/14/2021,1,1,6,1,2021-11-21,0.062155,not_requested,68.0
1422,CryptoZilla,0,1,0,0,0,0,0,0,0,1000,303.0,0.24,5419.0,806.0,False,03/06/2021,18,24,42,4,2021-03-06,14.2809,verified,202.0
1423,CryptoZombies(TM),1,0,0,0,0,0,0,0,0,13,8.0,0.05,215.0,522.0,False,10/21/2020,18,4,47,1,2021-02-16,0.1,approved,20.0
1424,CryptoZombiez NFT,1,0,0,0,0,0,0,0,0,5600,806.0,0.048,15613.0,3.0,False,10/08/2021,279,120,448,23,2021-10-21,5.513809999999998,approved,89.0
1425,Crypto_Icecream,0,1,0,0,0,0,0,0,0,16,15.0,0.015,678.0,195.0,False,11/08/2021,9,14,97,2,2021-11-08,0.077,not_requested,6.0
1426,Crypto_djs,0,1,0,0,0,0,0,0,0,150,43.0,0.007,978.0,1093.0,False,12/11/2021,27,12,48,4,2021-12-11,0.6907,not_requested,83.0
1427,Cryptocamo,0,0,0,0,0,0,1,0,0,61,4.0,0.001,4.0,15.0,False,11/02/2021,0,0,1,1,2021-11-01,0.001,not_requested,2.0
1428,Cryptodevils (genesis),1,1,0,0,0,0,0,0,0,100,77.0,0.3,6986.0,2263.0,False,03/31/2021,2,7,21,1,2021-03-31,0.245,approved,175.0
1429,Cryptodictators_NFT,0,0,0,0,0,0,1,0,0,33,13.0,0.02,319.0,126.0,False,07/13/2021,4,37,17,4,2021-09-05,0.02,not_requested,46.0
1430,Cryptographics Art,1,0,0,0,0,0,0,0,0,430,164.0,0.08,596.0,245.0,False,08/28/2018,9,3,34,3,2019-04-26,0.1699999999999999,not_requested,0.0
1431,Cryptohamsters Official,1,1,0,0,0,0,0,0,0,5100,587.0,0.025,1778.0,1064.0,False,02/01/2021,2,3,15,1,2021-02-10,0.6865,approved,0.0
1432,Cryptomosaics Art,1,0,0,0,0,0,0,0,0,1200,2.0,0.069,6.0,7.0,False,11/12/2021,2,0,0,0,2021-11-24,0.089,not_requested,30.0
1433,Cryptomushroons,1,0,0,0,0,0,0,0,0,30,778.0,0.001,1354.0,1354.0,False,08/06/2021,9,21,24,2,2021-09-08,0.006,not_requested,0.0
1434,CryptoonGoonz,0,1,0,0,0,0,0,0,0,7000,3900.0,0.68,23257.0,1733.0,False,12/31/2019,376,147,1746,50,2021-10-17,1611.5665284146485,approved,403.0
1435,Cryptoplanet - multi editions,1,0,0,0,0,0,0,0,0,9,62.0,0.18,9442.0,1174.0,False,03/30/2019,25,19,90,6,2021-11-02,1.16,not_requested,0.0
1436,Cryptoplanet by Christophe Tritz,1,0,0,0,0,0,0,0,0,37,33.0,1.69,9442.0,1174.0,False,03/30/2019,25,19,90,6,2021-10-04,4.7,not_requested,0.0
1437,Cryptopoop,0,1,0,0,0,0,0,0,0,14,19.0,0.06,483.0,401.0,False,02/28/2021,3,2,16,2,2021-02-28,0.05,approved,60.0
1438,Cryptopunk Kings,0,1,0,0,0,0,0,0,0,40,18.0,0.003,307.0,671.0,False,12/05/2021,3,5,13,3,2021-12-07,0.10275,not_requested,33.0
1439,Cryptopunk kids,0,1,0,0,0,0,0,0,0,228,140.0,0.03,346.0,849.0,False,10/23/2021,2,3,9,2,2021-10-22,2.280399999000001,not_requested,25.0
1440,Cryptopus Collection,1,1,0,0,0,0,0,0,0,58,6.0,0.06,5721.0,4467.0,False,09/09/2009,1,1,6,2,2021-03-26,0.24,approved,162.0
1441,Cryptopus NFT,0,1,0,0,0,0,0,0,0,534,317.0,0.044,12579.0,13.0,False,09/17/2021,6268,185,6993,10,2021-11-08,2.6034999999999995,not_requested,356.0
1442,Cryptorado Random,1,0,0,0,0,0,0,0,0,8,3.0,0.05,254.0,420.0,False,09/04/2021,9,8,25,3,2021-10-26,0.0025,not_requested,2.0
1443,Cryptorastas Collection,0,1,0,0,0,0,0,0,0,10400,3500.0,0.025,5974.0,1437.0,False,03/19/2021,136,332,238,28,2021-08-29,17.574453664048622,approved,200.0
1444,Cryptosaurs1,1,0,0,0,0,0,0,0,0,231,1800.0,0.001,1856.0,603.0,False,08/05/2021,32,395,277,3,2021-07-03,0.1621722145,not_requested,467.0
1445,Cryptossaur,1,0,0,0,0,0,0,0,0,30,2.0,0.003,25.0,126.0,False,12/14/2019,1,8,11,0,2021-09-19,0.003,not_requested,0.0
1446,Cryptovian NFT,0,0,0,0,0,0,0,1,0,10,8.0,31.92,15641.0,162.0,False,11/23/2021,2474,194,1057,4,2021-11-25,0.56,not_requested,0.0
1447,Cryptovoxels,0,0,0,0,0,0,0,0,1,6500,1900.0,2.2,73603.0,2041.0,False,04/05/2018,68,48,367,14,2019-04-26,612.0712241513569,verified,106.0
1448,Cryptowalkers-Official,0,0,0,0,0,0,0,1,0,6500,2200.0,0.205,11251.0,358.0,False,08/16/2021,352,463,757,438,2021-12-04,349.871911390951,approved,196.0
1449,Crypts and Caverns,1,0,0,0,0,0,0,0,0,1700,629.0,0.026,478.0,18.0,False,10/29/2021,17,8,131,7,2021-11-21,2.77539,not_requested,800.0
1450,Cryptsoul,0,1,0,0,0,0,0,0,0,25,6.0,0.015,1129.0,1067.0,False,08/29/2020,126,103,122,7,2021-08-15,0.12,not_requested,28.0
1451,Crystal Element,1,0,0,0,0,0,0,0,0,1100,22.0,0.014,77.0,53.0,False,11/17/2021,3,2,22,1,2021-11-28,0.8670000000000002,approved,0.0
1452,Crystal Quartz Club,0,1,0,0,0,0,0,0,0,126,67.0,0.065,5101.0,491.0,False,01/13/2015,26,21,200,7,2021-09-08,0.24,not_requested,31.0
1453,Crystallized Illusions,1,0,0,0,0,0,0,0,0,99,67.0,0.01,997.0,733.0,False,11/30/2020,8,7,38,2,2021-09-03,0.04,not_requested,36.0
1454,CtyptoVoxel,0,1,0,0,0,0,0,0,0,24,3.0,0.01,2329.0,2710.0,False,08/31/2021,8,15,57,5,2021-10-08,0.015,not_requested,55.0
1455,Cubed Creatures,0,1,0,0,0,0,0,0,0,10,8.0,0.5,432.0,101.0,False,08/31/2021,8,3,12,2,2021-08-31,1.5,not_requested,20.0
1456,Cubeverse,1,0,0,0,0,0,0,0,0,3300,1500.0,0.009,1249.0,66.0,False,08/26/2021,76,73,121,8,2021-08-24,0.4424,verified,60.0
1457,Cubreak,1,0,0,0,0,0,0,0,0,5,5.0,0.002,55.0,86.0,False,11/05/2021,2,23,12,1,2021-11-12,0.007,not_requested,2.0
1458,Cuddly Cat Club,1,0,0,0,0,0,0,0,0,100,3.0,0.005,217.0,541.0,False,10/31/2021,4,5,11,3,2021-11-01,0.015,not_requested,181.0
1459,Cuna White Witch,0,1,0,0,0,0,0,0,0,10000,1100.0,0.004,4425.0,152.0,False,01/17/2020,1130,1018,1129,14,2021-11-18,9.15628232604002,approved,43.0
1460,Cunning Foxes,0,1,0,0,0,0,0,0,0,8900,3900.0,0.019,10362.0,290.0,False,06/16/2021,47,47,199,10,2021-06-16,6.917979999999996,verified,0.0
1461,Cunning Foxes Drops,1,0,0,0,0,0,0,0,0,692,102.0,0.01,10362.0,290.0,False,06/16/2021,47,47,199,10,2021-09-02,0.0601,not_requested,678.0
1462,Cupid Love Metaverse,0,1,0,0,0,0,0,0,0,10000,2300.0,0.3,23932.0,49.0,False,10/09/2021,41,38,43,37,2021-12-14,3.358652673,not_requested,178.0
1463,CurioPlusOrg,1,0,0,0,0,0,0,0,0,16,52.0,0.09,32.0,56.0,False,10/04/2021,9,0,16,3,2021-10-07,4.03,not_requested,0.0
1464,Curious point,1,0,0,0,0,0,0,0,0,31,4.0,0.25,9255.0,5935.0,False,03/11/2021,13,37,89,2,2021-09-30,0.5,not_requested,0.0
1465,Curly Goddesses,0,1,0,0,0,0,0,0,0,6,4.0,0.044,1224.0,651.0,False,10/18/2021,11,15,29,2,2021-10-26,0.099,not_requested,0.0
1466,CurrencyPunks,0,1,0,0,0,0,0,0,0,10000,6000.0,0.003,24.0,5.0,False,11/26/2021,2,2,5,1,2021-09-21,2.5204290000099947,approved,116.0
1467,Current Surface,1,0,0,0,0,0,0,0,0,30,19.0,0.06,1617.0,590.0,False,04/20/2009,21,8,50,4,2021-09-15,0.12,not_requested,0.0
1468,Curse NFT Tickets,1,0,0,0,0,0,0,0,0,1000,530.0,0.02,5146.0,3236.0,False,03/25/2021,20,5,55,3,2021-08-17,0.4610250000200001,approved,0.0
1469,Cursed deer,1,0,0,0,0,0,0,0,0,312,274.0,0.002,298.0,1073.0,False,09/20/2021,6,29,12,1,2021-09-02,0.0990153952447036,not_requested,85.0
1470,Custom Pixie Jars Collection,0,1,0,0,0,0,0,0,0,58,43.0,0.065,8323.0,5654.0,False,10/18/2021,8,14,41,3,2021-11-22,0.629,not_requested,0.0
1471,Custom Punks - Rewards,0,1,0,0,0,0,0,0,0,59,26.0,0.03,7806.0,1670.0,False,08/08/2021,498,45,174,6,2021-10-25,0.27,not_requested,7.0
1472,Cute Girl's Profile,1,0,0,0,0,0,0,0,0,17,31.0,0.05,1449.0,529.0,False,05/07/2021,33,32,139,2,2021-10-05,0.24,not_requested,0.0
1473,Cute NFT Cats,1,0,0,0,0,0,0,0,0,100,37.0,0.1,1816.0,4895.0,False,02/26/2021,22,14,79,5,2021-08-30,0.107,not_requested,0.0
1474,Cute NFT Monsters,1,0,0,0,0,0,0,0,0,852,440.0,0.005,1306.0,639.0,False,09/18/2021,106,69,143,7,2021-09-15,0.2347999999999999,not_requested,20.0
1475,Cute NFT Monsters Community,1,0,0,0,0,0,0,0,0,1,141.0,0.001,1306.0,639.0,False,09/18/2021,106,69,143,7,2021-11-19,0.0027,not_requested,0.0
1476,Cute Pigs NFT,0,1,0,0,0,0,0,0,0,10,7.0,0.58,8570.0,776.0,False,05/04/2013,5,4,47,3,2021-11-10,1.6,not_requested,23.0
1477,Cute little monsters,1,0,0,0,0,0,0,0,0,32,5.0,0.01,1842.0,974.0,False,10/08/2013,12,6,22,2,2021-10-07,0.01,not_requested,8.0
1478,CuteCatClub,0,1,0,0,0,0,0,0,0,5000,690.0,0.013,5212.0,162.0,False,09/10/2021,647,281,687,8,2021-11-22,5.854933436199995,not_requested,194.0
1479,CuteGhostNFT,0,1,0,0,0,0,0,0,0,86,41.0,0.007,243.0,198.0,False,11/18/2021,5,6,22,4,2021-11-03,0.3375000000000002,not_requested,80.0
1480,CuteGiraffes,1,0,0,0,0,0,0,0,0,179,3200.0,0.001,379.0,658.0,False,09/02/2019,9,6,40,5,2021-10-09,0.2234251972347105,not_requested,648.0
1481,CutePuppets,0,1,0,0,0,0,0,0,0,33,11.0,0.008,24.0,43.0,False,12/10/2021,2,5,3,0,2021-12-10,0.1859000000000001,not_requested,69.0
1482,CuteScribbles,0,1,0,0,0,0,0,0,0,100,24.0,0.004,1691.0,3271.0,False,11/20/2021,7,7,21,5,2021-11-20,0.116,not_requested,108.0
1483,Cutie Quirks,0,1,0,0,0,0,0,0,0,84,16.0,0.05,700.0,521.0,False,03/20/2021,2,4,10,3,2021-08-09,0.15,not_requested,61.0
1484,Cybee,0,1,0,0,0,0,0,0,0,200,93.0,0.02,133.0,15.0,False,11/03/2021,14,8,18,4,2021-12-09,0.8255000000000001,not_requested,118.0
1485,Cyber Ape Legacy,1,0,0,0,0,0,0,0,0,1200,285.0,0.001,1540.0,36.0,False,11/29/2013,147,110,212,120,2021-11-26,0.9968788989900064,not_requested,181.0
1486,Cyber Burgers,0,1,0,0,0,0,0,0,0,21,12.0,0.05,16.0,11.0,False,08/30/2021,3,2,6,1,2021-09-01,0.011,not_requested,0.0
1487,Cyber Cats Alliance (NFT),0,1,0,0,0,0,0,0,0,2200,4.0,0.08,12479.0,1524.0,False,10/10/2021,53,24,68,4,2021-11-14,2.16,not_requested,0.0
1488,Cyber Chefs,1,0,0,0,0,0,0,0,0,254,99.0,0.001,1632.0,13.0,False,02/11/2019,92,117,83,7,2021-03-05,0.206199,requested,0.0
1489,Cyber Cows NFT assests,0,1,0,0,0,0,0,0,0,4900,17.0,0.003,370.0,16.0,False,11/11/2021,504,15,2749,1,2021-11-28,0.057,not_requested,0.0
1490,Cyber Fish,1,0,0,0,0,0,0,0,0,180,9.0,0.04,566.0,1797.0,False,11/11/2007,13,3,16,3,2021-11-02,0.04,not_requested,0.0
1491,Cyber Globeans,0,1,0,0,0,0,0,0,0,61,30.0,0.04,586.0,230.0,False,10/09/2021,6,6,37,4,2021-10-09,2.1900000000000004,not_requested,31.0
1492,Cyber Halloween Girls,1,0,0,0,0,0,0,0,0,28,27.0,0.009,2867.0,3761.0,False,08/10/2021,93,51,71,7,2021-10-12,0.009,not_requested,57.0
1493,Cyber Hornets Colony Club,0,1,0,0,0,0,0,0,0,8900,2100.0,0.019,61208.0,3267.0,False,01/20/2015,311,306,389,16,2021-10-07,16.057850690199974,verified,349.0
1494,Cyber Monday Music Tracks,0,0,0,1,0,0,0,0,0,40,196.0,0.001,402.0,533.0,False,06/25/2016,3,6,13,2,2021-09-25,0.02106,not_requested,6.0
1495,Cyber Space Punks,0,1,0,0,0,0,0,0,0,327,144.0,0.02,428.0,1829.0,False,09/09/2021,5,3,13,4,2021-09-08,2.04801,not_requested,0.0
1496,Cyber Space Punks the NotOnTrust way,0,1,0,0,0,0,0,0,0,61,12.0,0.006,14.0,162.0,False,11/12/2020,0,1,2,0,2021-12-04,0.0879,not_requested,0.0
1497,Cyber Space Ronin,1,0,0,0,0,0,0,0,0,4,2.0,0.014,270.0,612.0,False,07/19/2021,1,1,3,0,2021-09-07,0.024,not_requested,20.0
1498,Cyber Streets - Collection of 55 Photos Inspired by Cyberpunk,0,0,0,0,1,0,0,0,0,55,37.0,0.4,9304.0,1743.0,False,03/14/2016,54,30,507,3,2021-08-27,0.5800000000000001,not_requested,0.0
1499,Cyber Swag,0,1,0,0,0,0,0,0,0,118,224.0,0.02,319.0,1045.0,False,11/09/2021,39,14,28,6,2021-11-13,0.538,not_requested,0.0
1500,Cyber Swag Voxel,0,1,0,0,0,0,0,0,0,47,11.0,0.008,319.0,1045.0,False,11/09/2021,39,14,28,6,2021-11-27,0.049,not_requested,1.0
1501,CyberArt,1,0,0,0,0,0,0,0,0,38,59.0,0.055,231.0,237.0,False,08/10/2020,7,2,16,1,2020-08-03,0.2160058067355291,verified,52.0
1502,CyberBabies.io,0,1,0,0,0,0,0,0,0,500,464.0,0.95,967.0,20.0,False,08/15/2021,6,3,21,2,2021-09-08,184.01029999999992,verified,171.0
1503,CyberCheetah,0,1,0,0,0,0,0,0,0,862,203.0,0.01,3470.0,293.0,False,10/17/2021,128,85,256,4,2021-10-27,0.0345,not_requested,71.0
1504,CyberChicks Collective,0,1,0,0,0,0,0,0,0,18,4.0,0.033,1799.0,85.0,False,01/14/2021,22,31,150,6,2021-08-23,0.7920000000000005,not_requested,0.0
1505,CyberCrocz,0,1,0,0,0,0,0,0,0,248,135.0,1.0,1609.0,253.0,False,03/16/2021,13,7,33,2,2021-03-16,5.9971,approved,99.0
1506,CyberDoggos,1,1,0,0,0,0,0,0,0,1000,501.0,0.003,2349.0,959.0,False,03/11/2021,8,6,32,5,2021-03-11,0.099011,approved,57.0
1507,CyberDucks,0,1,0,0,0,0,0,0,0,150,92.0,0.085,2344.0,740.0,False,03/13/2021,4,3,13,1,2021-03-13,1.6079000000000003,approved,1.0
1508,CyberGhosties,0,1,0,0,0,0,0,0,0,14,2.0,0.017,32.0,23.0,False,10/04/2021,2,3,9,2,2021-10-15,0.087,not_requested,38.0
1509,CyberKeys,0,0,0,0,0,0,0,1,0,1,276.0,0.087,967.0,20.0,False,08/15/2021,6,3,21,2,2021-11-10,2.150899999999999,not_requested,4.0
1510,CyberKongz,0,1,0,0,0,0,0,0,0,5000,2400.0,6.9,119033.0,305.0,True,03/03/2021,4455,4465,5302,94,2021-04-16,5251.638905420541,verified,139.0
1511,CyberKongz VX,0,1,0,0,0,0,0,0,0,14700,4300.0,1.8,119033.0,305.0,True,03/03/2021,4455,4465,5302,94,2021-08-15,4691.0789142220165,verified,210.0
1512,CyberPunk Pepe,1,0,0,0,0,0,0,0,0,311,82.0,0.04,629.0,851.0,False,03/04/2021,30,32,37,3,2021-06-12,0.023,not_requested,0.0
1513,CyberShrooms,0,1,0,0,0,0,0,0,0,999,518.0,0.01,1110.0,1324.0,False,04/07/2021,53,46,60,2,2021-03-14,0.247,approved,85.0
1514,CyberSisterz,0,1,0,0,0,0,0,0,0,550,47.0,0.01,463.0,2.0,False,12/08/2021,363,373,410,11,2021-12-17,0.069,not_requested,2.0
1515,CyberSquad,0,1,0,0,0,0,0,0,0,54,31.0,0.5,4325.0,3185.0,False,07/20/2020,22,13,54,3,2021-03-26,1.4959999999999998,not_requested,0.0
1516,CyberYetis,0,1,0,0,0,0,0,0,0,10000,589.0,0.004,4352.0,2167.0,False,11/27/2012,81,90,331,3,2021-11-05,4.133676287779979,not_requested,152.0
1517,Cybercubism,1,0,0,0,0,0,0,0,0,7,2.0,0.045,582.0,251.0,False,02/15/2016,72,31,321,17,2021-10-18,0.085,not_requested,0.0
1518,Cybergirl Fashion,0,1,0,0,0,0,0,0,0,3300,508.0,0.02,3818.0,72.0,False,09/24/2021,551,586,605,19,2021-08-23,0.6526000000000002,approved,288.0
1519,Cybergoats,0,1,0,0,0,0,0,0,0,1000,382.0,0.055,2047.0,155.0,False,04/02/2021,134,54,106,6,2021-12-13,5.785,not_requested,1041.0
1520,Cybernators-2026,0,1,0,0,0,0,0,0,0,204,47.0,0.05,7404.0,35.0,False,07/12/2021,5194,135,1761,11,2021-09-05,0.125,not_requested,148.0
1521,Cyberpunk Ape Executives GENESIS,1,1,0,0,0,0,0,0,0,250,171.0,0.3,45132.0,15590.0,False,02/25/2013,16,3,41,1,2021-02-20,37.72324400000001,approved,54.0
1522,Cyborg Ape,0,1,0,0,0,0,0,0,0,98,78.0,0.537,1567.0,92.0,False,12/04/2021,908,874,886,49,2021-12-04,28.036405410989584,not_requested,0.0
1523,Cyborg Billionaire Club,0,1,0,0,0,0,0,0,0,2900,1600.0,0.17,53246.0,171.0,False,09/22/2021,14050,7205,5681,76,2021-12-16,35.178079999999994,approved,182.0
1524,Cyborg Legends - Playable Heroes,0,0,0,0,0,0,0,1,0,325,104.0,0.014,28531.0,182.0,False,09/14/2021,7560,160,2789,15,2021-12-10,15.295800000000002,not_requested,436.0
1525,Cyclope Apes,0,1,0,0,0,0,0,0,0,101,7.0,0.1,156.0,155.0,False,09/13/2021,18,13,118,4,2021-09-30,0.09,not_requested,0.0
1526,Cyclops Ape Yacht Club,0,1,0,0,0,0,0,0,0,301,15.0,0.03,499.0,13.0,False,08/14/2021,235,259,307,71,2021-10-05,0.3600000000000001,not_requested,242.0
1527,Cylindurus,0,1,0,0,0,0,0,0,0,218,133.0,0.1,1964.0,427.0,False,03/19/2021,43,41,58,7,2021-10-24,0.32,not_requested,143.0
1528,Cypher City,0,1,0,0,0,0,0,0,0,8900,2700.0,0.003,6882.0,1164.0,False,07/09/2021,81,79,237,8,2021-07-24,2.397410229999997,verified,142.0
1529,CypherHumans V3,0,1,0,0,0,0,0,0,0,693,382.0,0.018,7279.0,383.0,False,09/17/2021,616,648,572,405,2021-11-11,1.9589000000000008,not_requested,847.0
1530,D'EVOLs,0,1,0,0,0,0,0,0,0,123,90.0,3.75,42986.0,1169.0,False,02/22/2021,182,264,967,27,2021-05-07,14.75,approved,330.0
1531,D.E.E.R official,1,0,0,0,0,0,0,0,0,15,75.0,0.004,993.0,938.0,False,10/16/2021,8,7,21,3,2021-09-14,0.1009,not_requested,9.0
1532,D13 3D RAPS,1,0,0,0,0,0,0,0,0,25,18.0,0.8,1242.0,865.0,False,08/20/2020,15,14,63,4,2021-10-14,0.44,not_requested,18.0
1533,D3SERT PUNK SERIES,1,0,0,0,0,0,0,0,0,4,3.0,0.07,482.0,909.0,False,06/03/2021,8,8,57,4,2021-06-03,0.07,not_requested,5.0
1534,D3VILBOY,0,1,0,0,0,0,0,0,0,10000,2.0,0.011,176.0,44.0,False,10/11/2021,12,4,26,2,2021-10-11,0.0111,not_requested,29.0
1535,DAOrecords,0,0,0,1,0,0,0,0,0,335,77.0,0.04,6899.0,2965.0,False,12/24/2019,11,17,42,3,2020-04-04,0.28,approved,46.0
1536,DARIA KUSTO ART,1,0,0,0,0,0,0,0,0,246,82.0,0.015,1195.0,2910.0,False,07/29/2021,44,36,303,4,2021-07-13,0.16,not_requested,0.0
1537,DATA MASK,0,1,0,0,0,0,0,0,0,30,3.0,0.02,34.0,87.0,False,03/28/2021,10,1,28,3,2021-06-03,0.02,not_requested,0.0
1538,DAVA Humanoids,0,1,0,0,0,0,0,0,0,9800,1600.0,0.059,9498.0,524.0,False,09/23/2021,738,122,329,44,2021-11-16,21.29030000000001,approved,0.0
1539,DAVA Wearables,0,1,0,0,0,0,0,0,0,469,10700.0,0.009,9498.0,524.0,False,09/23/2021,738,122,329,44,2021-11-16,0.286,not_requested,14.0
1540,DB Bush Chooks,0,1,0,0,0,0,0,0,0,2100,589.0,0.022,8357.0,1626.0,False,08/14/2021,76,54,370,21,2021-12-14,0.14,not_requested,127.0
1541,DDOGG Original Art,1,0,0,0,0,0,0,0,0,6,208.0,0.02,868.0,399.0,False,11/10/2009,123,146,266,4,2021-12-06,0.1699999999999999,not_requested,0.0
1542,DEATH PUNK,1,0,0,0,0,0,0,0,0,357,136.0,0.3,2370.0,1617.0,False,02/22/2021,8,4,32,3,2021-03-15,6.845236345133051,not_requested,1091.0
1543,DECEIVED,1,0,0,0,0,0,0,0,0,1,133.0,0.035,3193.0,1054.0,False,06/16/2011,3,16,29,3,2021-07-24,0.05,not_requested,5.0
1544,DECENTRABOARD,0,0,0,0,0,0,0,1,0,304,140.0,0.45,38554.0,133.0,False,04/19/2021,41,23,57,23,2021-08-27,2.6899999999999995,verified,0.0
1545,DEFINE DECADENT,0,0,0,0,1,0,0,0,0,9,4.0,0.1,1629.0,2979.0,False,04/01/2009,3,7,19,0,2021-11-28,0.2,not_requested,7.0
1546,DEFORMS,0,1,0,0,0,0,0,0,0,10,3.0,0.05,1001.0,478.0,False,06/11/2021,13,3,54,3,2021-12-08,0.1,not_requested,0.0
1547,DEGENDARY,0,1,0,0,0,0,0,0,0,56,8.0,0.042,117.0,538.0,False,12/22/2021,6,3,20,1,2021-12-17,0.4619999999999999,not_requested,8.0
1548,DEGENERATE/REGENERATE,0,1,0,0,0,0,0,0,0,7400,4200.0,0.072,192470.0,333.0,True,11/07/2008,160,90,821,67,2021-12-17,1005.6324803253216,verified,302.0
1549,DEKU INU,0,1,0,0,0,0,0,0,0,2,82.0,0.08,8055.0,14.0,False,08/25/2021,188,261,569,9,2021-10-13,0.7999999999999999,not_requested,4.0
1550,DFI-Punks,0,1,0,0,0,0,0,0,0,110,19.0,0.01,46.0,91.0,False,10/12/2021,10,8,18,4,2021-10-10,0.07,not_requested,0.0
1551,DI Animals,0,1,0,0,0,0,0,0,0,8900,4000.0,0.058,11113.0,17.0,False,09/01/2021,888,774,2126,458,2021-12-13,362.2944098575367,approved,111.0
1552,DI Animals Official,1,0,0,0,0,0,0,0,0,228,3.0,0.09,11113.0,17.0,False,09/01/2021,888,774,2126,458,2021-12-15,0.09,not_requested,0.0
1553,DIA ART - BAYC,0,0,0,0,0,0,0,1,0,10,7.0,33.046,49969.0,187.0,False,08/07/2018,1053,187,1619,79,2021-09-08,0.8882369999999999,not_requested,6.0
1554,DIA ART - Cryptovoxel,0,0,0,0,0,0,0,1,0,10,8.0,0.2,49969.0,187.0,False,08/07/2018,1053,187,1619,79,2021-09-08,0.1,not_requested,6.0
1555,DIAMOND-VERSE,1,0,0,0,0,0,0,0,0,11,2.0,0.23,1686.0,166.0,False,09/04/2009,2,6,14,4,2021-11-19,0.16,not_requested,33.0
1556,DIGITALINK COLLECTION,1,0,0,0,0,0,0,0,0,19,46.0,0.05,2046.0,1778.0,False,03/16/2013,11,6,42,6,2021-07-23,0.05,not_requested,0.0
1557,DIMES 2019-20 SILVER PARALLELS,0,0,0,0,0,0,1,0,0,47,2.0,0.05,482.0,515.0,False,05/16/2020,4,2,13,2,2021-11-10,0.125,not_requested,269.0
1558,DINK COIN Genesis Collection,1,0,0,0,0,0,0,0,0,50,3.0,0.08,276.0,958.0,False,06/19/2012,1,4,5,1,2021-12-13,0.24,not_requested,12.0
1559,DJENERATES - CLUB EDITION,0,1,0,0,0,0,0,0,0,10000,1800.0,0.022,5740.0,267.0,False,11/01/2020,96,105,146,9,2021-08-26,3.2978999999999985,verified,512.0
1560,DJENERATES DERIVATIVES,0,1,0,0,0,0,0,0,0,1,296.0,0.035,5740.0,268.0,False,11/01/2020,96,105,146,9,2021-10-04,0.1194,not_requested,0.0
1561,DNA Cultura NFTs,0,1,0,0,0,0,0,0,0,5600,1300.0,0.002,1367.0,126.0,False,09/03/2021,29,23,56,6,2021-10-27,13.019672868879969,not_requested,415.0
1562,DODIKI,1,0,0,0,0,0,0,0,0,12,2.0,0.003,21.0,44.0,False,11/20/2021,1,2,5,1,2021-11-21,0.003,not_requested,0.0
1563,DOGE FOR THE MASSES,1,0,0,0,0,0,0,0,0,67,45.0,0.1,15307.0,4752.0,False,05/05/2017,7,12,64,1,2021-07-29,0.99,not_requested,0.0
1564,DOGEZA-MATERIAL,1,0,0,0,0,0,0,0,0,6,68.0,0.1,20152.0,3755.0,False,01/11/2010,14,10,51,2,2021-12-04,0.033,not_requested,0.0
1565,DOJICREW,0,1,0,0,0,0,0,0,0,5200,973.0,0.01,1777.0,105.0,False,08/19/2021,22,14,75,9,2021-09-24,4.070200000000001,approved,127.0
1566,DOODLESSSSS,1,0,0,0,0,0,0,0,0,7,4.0,0.01,715.0,1338.0,False,07/13/2021,28,5,22,1,2021-07-12,0.017,not_requested,11.0
1567,DOS Bisco Logos Series 1,1,0,0,0,0,0,0,0,0,28,22.0,0.3,17718.0,2090.0,True,04/25/2009,6,10,49,2,2021-10-20,0.71,not_requested,125.0
1568,DOS Phunks,0,1,0,0,0,0,0,0,0,500,19.0,0.02,23403.0,3828.0,False,07/25/2008,65,40,308,13,2021-10-13,0.42,not_requested,0.0
1569,DOS Punks,0,1,0,0,0,0,0,0,0,497,303.0,0.74,23403.0,3828.0,False,07/25/2008,65,40,308,13,2021-10-02,13.890690000000005,not_requested,0.0
1570,DOS-AB,1,0,0,0,0,0,0,0,0,16,6.0,0.01,638.0,3115.0,False,05/06/2008,19,6,141,7,2021-10-22,0.01,not_requested,0.0
1571,DOSPHUNKS,0,1,0,0,0,0,0,0,0,19,5.0,0.02,1908.0,3809.0,False,09/24/2021,4,4,20,1,2021-11-07,0.14,not_requested,0.0
1572,DREAMLAND 1111,1,0,0,0,0,0,0,0,0,11,2.0,0.11,660.0,1801.0,False,11/04/2015,4,3,10,2,2021-11-10,0.22,not_requested,0.0
1573,DRIVE // BY DAVE KRUGMAN,0,0,0,0,1,0,0,0,0,111,83.0,5.25,31887.0,2182.0,True,07/27/2010,66,24,260,15,2021-09-14,1.58,verified,7.0
1574,DRM - Dont Rug Me - Cryptocurrency CCG Official Cards,0,1,0,0,0,0,1,0,0,197,1500.0,0.004,37.0,173.0,False,07/04/2021,0,1,3,1,2020-10-12,9.681,verified,175.0
1575,DROYDS,0,1,0,0,0,0,0,0,0,16,9.0,0.024,1071.0,1250.0,False,07/03/2021,26,25,57,10,2021-07-21,0.024,not_requested,0.0
1576,DRRT,0,1,0,0,0,0,0,0,0,2000,702.0,0.03,6072.0,63.0,False,08/26/2021,110,104,162,28,2021-10-12,1.4465000000000006,not_requested,164.0
1577,DRT ARTS - The Crypto Void,1,0,0,0,0,0,0,0,0,27,23.0,0.006,609.0,2262.0,False,03/01/2017,9,3,73,2,2021-02-16,0.12233,approved,19.0
1578,DSC MATES | DIGITAL IDENTITY,0,1,0,0,0,0,0,0,0,10000,1600.0,0.702,10602.0,700.0,False,05/03/2021,1098,521,1252,30,2021-07-09,315.14240446831013,approved,141.0
1579,DUNES DAY,0,0,0,0,1,0,0,0,0,25,6.0,0.035,851.0,856.0,False,11/20/2011,7,4,50,1,2021-10-14,0.11,not_requested,0.0
1580,"DURAN DURAN x HUXLEY - ""THE INVISIBLE COLLECTION""",1,0,0,0,0,0,0,0,0,100,70.0,0.499,2597.0,4392.0,False,04/04/2013,15,6,84,3,2021-12-08,27.69729999999998,approved,102.0
1581,DXIII,1,0,0,0,0,0,0,0,0,5,2.0,0.2,352.0,313.0,False,10/23/2021,16,11,125,3,2021-11-13,0.3,not_requested,0.0
1582,DaCreeps,0,0,0,0,0,0,1,0,0,4300,44.0,0.001,606.0,3395.0,False,12/08/2021,8,9,26,4,2021-11-28,0.003,not_requested,87.0
1583,Dada Collectible,0,1,0,0,0,0,0,0,0,2300,466.0,0.02,318.0,68.0,False,11/15/2021,12,5,55,6,2019-04-26,0.99691,not_requested,195.0
1584,Daemonica Entities,1,0,0,0,0,0,0,0,0,1100,453.0,0.12,15573.0,149.0,False,03/05/2021,70,15,155,14,2021-12-02,3.14824,approved,4.0
1585,Daikanyama Gallery,1,0,0,0,0,0,0,0,0,42,18.0,0.2,2000.0,1394.0,False,05/05/2021,8,8,22,2,2021-05-03,0.3999999999999999,not_requested,0.0
1586,Daily-girl,0,1,0,0,0,0,0,0,0,8,4.0,0.008,1601.0,1439.0,False,10/19/2021,3,6,11,0,2021-12-06,0.03,not_requested,0.0
1587,Dailydust Collection,1,0,0,0,0,0,0,0,0,17,122.0,0.052,3156.0,569.0,False,04/05/2020,3,3,16,5,2021-08-09,2.935,approved,0.0
1588,Dainty Monsters (DMONS),1,0,0,0,0,0,0,0,0,160,568.0,0.001,366.0,196.0,False,11/25/2021,31,12,28,4,2021-11-27,0.0207052999999999,not_requested,12.0
1589,Daitos (Bushidos),0,1,0,0,0,0,0,0,0,3800,1100.0,0.015,9246.0,235.0,False,08/28/2021,1340,377,1455,71,2021-12-16,5.864699999999998,not_requested,16.0
1590,Dali Art Punks,1,0,0,0,0,0,0,0,0,112,20.0,0.01,1103.0,1055.0,False,04/12/2021,8,5,19,4,2021-04-01,0.015,not_requested,0.0
1591,Damien Hirst - The Currency,1,0,0,0,0,0,0,0,0,2100,1700.0,4.4,8112.0,1142.0,False,01/12/2015,56,28,186,11,2021-07-30,841.8234000000006,verified,76.0
1592,DandySkull,1,0,0,0,0,0,0,0,0,48,32.0,0.01,1215.0,1106.0,False,08/10/2021,5,5,35,2,2021-11-25,0.3897000000000001,not_requested,72.0
1593,Dangerous Allure by Lady of NFT,0,1,0,0,0,0,0,0,0,3,2.0,0.008,20.0,56.0,False,07/26/2021,4,6,7,2,2021-09-16,0.008,not_requested,0.0
1594,Dangerous Otters Gang,0,1,0,0,0,0,0,0,0,60,3.0,0.01,772.0,1143.0,False,02/09/2017,21,43,43,5,2021-08-23,0.15,not_requested,144.0
1595,Danny Kass,1,0,0,0,0,0,0,0,0,21,7.0,0.15,4220.0,5000.0,False,06/11/2009,11,16,59,5,2020-10-29,0.2,approved,0.0
1596,Dario De Siena Paintings,1,0,0,0,0,0,0,0,0,8,11.0,1.25,34076.0,2184.0,False,09/04/2014,25,69,134,2,2021-02-27,0.0125,approved,17.0
1597,Dark & Light,1,0,0,0,0,0,0,0,0,180,84.0,0.032,3567.0,247.0,False,02/17/2021,22,14,145,4,2021-02-28,0.1149999999999999,approved,360.0
1598,Dark Angels,1,0,0,0,0,0,0,0,0,18,9.0,0.05,845.0,3291.0,False,06/09/2008,1,3,7,0,2021-11-11,0.48,not_requested,41.0
1599,Dark Dorm Neighbors,0,1,0,0,0,0,0,0,0,7000,435.0,0.015,404.0,9.0,False,11/20/2021,1,6,8,1,2021-11-20,4.3480000000000025,approved,0.0
1600,Dark GIFs,1,0,0,0,0,0,0,0,0,4,3.0,12.1,3332.0,3109.0,False,03/14/2021,30,11,170,5,2021-04-25,0.16,not_requested,0.0
1601,Dark Goods,1,0,0,0,0,0,0,0,0,38,62.0,0.001,81.0,212.0,False,08/09/2021,0,1,9,1,2021-09-15,0.004,not_requested,67.0
1602,Dark Horizon,1,0,0,0,0,0,0,0,0,8700,3000.0,0.009,13794.0,434.0,False,09/08/2021,408,437,500,20,2021-10-10,7.312299999999984,verified,298.0
1603,DarkEchelon,0,0,0,0,0,0,0,1,0,517,387.0,0.46,4669.0,2.0,False,09/24/2021,643,629,696,24,2021-11-26,65.03673558144924,approved,2.0
1604,Dart Art Abstract,1,0,0,0,0,0,0,0,0,1100,368.0,0.005,1041.0,164.0,False,07/21/2021,158,35,211,9,2021-08-27,0.10820002,verified,0.0
1605,DaruMask house,1,0,0,0,0,0,0,0,0,9,21.0,0.004,857.0,791.0,False,10/19/2021,4,3,26,1,2021-11-16,0.013,not_requested,0.0
1606,Data Sets,1,0,0,0,0,0,0,0,0,115,6.0,0.035,1000.0,1751.0,False,11/29/2020,12,15,92,1,2021-10-01,0.034,not_requested,0.0
1607,Daughter of the Night,0,0,0,0,1,0,0,0,0,9,2.0,0.15,1085.0,571.0,False,05/04/2021,8,9,48,1,2021-11-30,0.25,not_requested,0.0
1608,David Johnston - With Love From Appalachia,0,0,0,0,1,0,0,0,0,50,13.0,0.15,7540.0,5089.0,False,02/21/2011,22,47,292,7,2021-08-09,0.15,not_requested,0.0
1609,David Wiener - The Ferrari F1 Series 2021,1,0,0,0,0,0,0,0,0,11,2.0,0.012,30.0,32.0,False,02/16/2011,1,0,2,0,2021-11-10,0.0245,not_requested,0.0
1610,Dawn of a New Age,1,0,0,0,0,0,0,0,0,10,2.0,0.025,2927.0,4283.0,False,10/28/2008,3,1,7,1,2021-11-15,0.015,not_requested,0.0
1611,Daxio Owls,0,1,0,0,0,0,0,0,0,103,20.0,0.5,372.0,11.0,False,05/20/2020,69,28,131,3,2021-12-15,37.99999999999999,not_requested,33.0
1612,Day of the Dead NFT Collection,1,0,0,0,0,0,0,0,0,422,278.0,0.009,11791.0,372.0,False,09/28/2021,12,16,23,3,2021-11-01,0.3953,not_requested,299.0
1613,Daz 3D,0,1,0,0,0,0,0,0,0,22,77.0,0.177,12607.0,342.0,True,09/20/2008,58,10,138,5,2021-03-17,10.3889,verified,0.0
1614,Dazzling Dots by Diener,1,0,0,0,0,0,0,0,0,179,11.0,0.003,124.0,195.0,False,03/29/2014,1,1,5,1,2021-04-11,0.0025,not_requested,0.0
1615,DeFiChain Jelly Club,0,1,0,0,0,0,0,0,0,151,89.0,0.07,1065.0,80.0,False,09/13/2016,150,156,175,15,2021-10-03,0.3230000000000001,not_requested,0.0
1616,DeFiChain Jelly Punks,0,1,0,0,0,0,0,0,0,100,44.0,0.1,1065.0,80.0,False,09/13/2016,150,156,175,15,2021-09-25,0.1405,not_requested,0.0
1617,DeFiChain Jellyfish Club,0,1,0,0,0,0,0,0,0,100,27.0,0.07,1065.0,80.0,False,09/13/2016,150,156,175,15,2021-11-29,0.48,not_requested,47.0
1618,DeFiChain Jellyfish Icon,0,1,0,0,0,0,0,0,0,30,20.0,0.02,1065.0,80.0,False,09/13/2016,150,156,175,15,2021-11-18,0.04,not_requested,0.0
1619,DeFiChain Punks Reloaded,0,1,0,0,0,0,0,0,0,256,98.0,0.12,1232.0,3606.0,False,10/07/2021,125,108,170,13,2021-11-01,0.44775,not_requested,77.0
1620,DeFiChain Warriors,1,0,0,0,0,0,0,0,0,300,23.0,0.01,1383.0,623.0,False,07/29/2019,12,9,66,1,2021-10-05,0.04,not_requested,0.0
1621,DeFinityLegend Founders Edition,0,1,0,0,0,0,0,0,0,7,5.0,0.22,6022.0,31.0,False,07/24/2021,42,6,450,405,2021-11-12,1.06,not_requested,1.0
1622,DeHorizon,0,0,0,0,0,0,1,0,0,12000,2300.0,0.005,42981.0,53.0,False,07/22/2021,420,119,579,44,2021-09-30,1.6301000000000003,approved,9.0
1623,DeMeta,0,0,0,0,0,0,1,0,0,944,652.0,0.115,42981.0,53.0,False,07/22/2021,420,119,579,44,2021-10-03,10.667099999999998,not_requested,0.0
1624,DeNations,0,0,0,0,0,0,0,0,1,196,925.0,0.013,11597.0,1099.0,False,07/12/2011,1826,409,1274,156,2020-12-08,29.397746710000003,verified,395.0
1625,DeNations Art Open Edition,1,0,0,0,0,0,0,0,0,1,1000.0,0.01,11597.0,1099.0,False,07/12/2011,1826,409,1274,156,2021-07-07,0.0621,not_requested,12.0
1626,DeNations Art by Jacoby,0,0,0,1,0,0,0,0,0,50,12.0,0.124,11597.0,1099.0,False,07/12/2011,1826,409,1274,156,2021-08-18,0.507,not_requested,20.0
1627,DeNations NFT Mint Pass,0,1,0,0,0,0,0,0,0,257,403.0,0.004,11597.0,1099.0,False,07/12/2011,1826,409,1274,156,2021-11-19,0.13865,not_requested,76.0
1628,DeRace Hippodromes,0,1,0,0,0,0,0,0,0,100,3.0,0.65,171831.0,424.0,False,04/25/2021,97,964,383,37,2021-11-26,0.95,not_requested,0.0
1629,DeRace Jockey Club,0,1,0,0,0,0,0,0,0,5000,1900.0,0.286,171831.0,424.0,False,04/25/2021,97,964,383,37,2021-09-26,64.44749898,approved,74.0
1630,DeRacing Horses,0,0,0,0,0,1,0,0,0,82,2.0,0.02,171831.0,424.0,False,04/25/2021,97,964,383,37,2021-10-28,0.021,not_requested,1.0
1631,DeXXad Apes,1,0,0,0,0,0,0,0,0,151,161.0,0.02,5899.0,5813.0,False,03/22/2021,12,108,307,2,2021-05-06,0.3399999999999999,not_requested,9.0
1632,Dead Avatars,0,1,0,0,0,0,0,0,0,1100,332.0,0.064,2166.0,288.0,False,08/30/2021,403,334,1078,55,2021-11-20,0.3352,not_requested,0.0
1633,Dead Bot Nation,0,1,0,0,0,0,0,0,0,52,14.0,0.005,481.0,775.0,False,08/06/2021,5,5,15,1,2021-10-15,0.088,not_requested,0.0
1634,Dead Constellations: Visions from Nowhere,1,0,0,0,0,0,0,0,0,9,6.0,0.2,2444.0,1246.0,False,10/04/2021,3,3,11,1,2021-10-16,0.2,not_requested,0.0
1635,Dead Devil Society,0,1,0,0,0,0,0,0,0,5000,1200.0,0.02,5344.0,1505.0,False,04/29/2021,411,126,438,8,2021-08-06,1.7575799999999997,not_requested,97.0
1636,Dead Dude Society,1,0,0,0,0,0,0,0,0,2300,773.0,0.005,279.0,566.0,False,10/31/2021,39,40,48,6,2021-07-20,0.1409,not_requested,184.0
1637,Dead Freaks,0,1,0,0,0,0,0,0,0,204,103.0,0.093,1862.0,616.0,False,05/19/2021,10,7,41,7,2021-05-21,0.7944,approved,203.0
1638,Dead Handz Genesis,0,1,0,0,0,0,0,0,0,100,84.0,0.15,4688.0,375.0,False,09/11/2021,194,110,220,7,2021-11-05,1.7607,not_requested,66.0
1639,Dead Trademark Agglomeration,0,1,0,0,0,0,0,0,0,148,208.0,0.003,1691.0,668.0,False,08/31/2021,5,3,11,1,2021-09-04,0.11,not_requested,17.0
1640,Dead stars,1,0,0,0,0,0,0,0,0,24,12.0,0.099,766.0,1534.0,False,02/06/2010,6,3,13,2,2021-03-03,0.2,approved,75.0
1641,DeadHeads Skull Troopers,0,1,0,0,0,0,0,0,0,7400,2000.0,0.069,37259.0,284.0,False,06/22/2021,546,563,559,18,2021-11-28,33.446668999999964,approved,175.0
1642,Deadbears Official,0,1,0,0,0,0,0,0,0,10000,2200.0,0.008,4444.0,129.0,False,07/17/2021,86,33,205,16,2021-08-13,0.6950000000000004,verified,123.0
1643,Deadfellaz Infected S1,0,1,0,0,0,0,0,0,0,186,159.0,1.05,64111.0,2084.0,False,07/21/2021,327,275,2142,60,2021-10-28,91.02799999999998,not_requested,24.0
1644,Dear Deer NFT,0,1,0,0,0,0,0,0,0,187,56.0,0.2,733.0,58.0,False,08/08/2021,20,8,39,4,2021-12-08,0.2019999999999999,not_requested,138.0
1645,Deathski,1,0,0,0,0,0,0,0,0,50,38.0,0.06,7542.0,4552.0,False,10/17/2013,5,9,30,1,2021-05-23,0.12,not_requested,0.0
1646,Debonair Ape,0,1,0,0,0,0,0,0,0,500,38.0,0.075,1432.0,602.0,False,09/30/2021,21,7,44,8,2021-11-20,4.175000000000002,not_requested,391.0
1647,Decade of Change 2021,0,0,0,0,1,0,0,0,0,22,8.0,0.125,252743.0,1795.0,True,10/23/2008,28,33,160,6,2021-10-27,0.25,approved,37.0
1648,Decaying Symbols,1,0,0,0,0,0,0,0,0,13,2.0,0.15,1972.0,2494.0,False,12/02/2008,8,3,23,1,2021-11-07,0.3,not_requested,3.0
1649,Decentral Eyes VR - OG Collage - Variant 01,1,0,0,0,0,0,0,0,0,1,39.0,3.0,45269.0,2801.0,False,02/01/2009,185,483,253,77,2021-07-26,3.0,approved,0.0
1650,Decentral Games ICE Poker,0,0,0,0,0,0,0,1,0,7200,2200.0,1.15,75116.0,540.0,False,08/09/2016,77,71,287,26,2021-09-14,1739.188469700008,approved,72.0
1651,Decentraland,0,0,0,0,0,0,0,0,1,97200,6300.0,4.085,464158.0,420.0,False,05/20/2015,1174,576,3863,368,2019-04-26,7403.833335711488,verified,14.0
1652,Decentraland Wearables,0,0,0,0,0,0,0,0,1,71000,10200.0,0.002,464158.0,420.0,False,05/20/2015,1174,576,3863,368,2019-11-14,19.501591249999983,verified,0.0
1653,Decentralized Bone Society,0,1,0,0,0,0,0,0,0,535,218.0,0.02,1910.0,970.0,False,08/26/2021,7,7,28,2,2021-08-31,0.357,not_requested,136.0
1654,Decompression - Cyprus on 35mm Film,0,0,0,0,1,0,0,0,0,11,3.0,0.06,1442.0,1859.0,False,11/07/2020,7,3,45,1,2021-11-12,0.06,not_requested,0.0
1655,Decrypt,0,1,0,0,0,0,0,0,0,150,111.0,0.5,90505.0,1588.0,True,05/07/2018,75,13,201,9,2021-03-17,0.27,verified,108.0
1656,Deep Animal,1,0,0,0,0,0,0,0,0,72,10.0,0.015,346.0,340.0,False,09/06/2021,56,65,59,6,2021-09-03,0.045,not_requested,0.0
1657,Deep Hive Member Tokens,0,0,0,0,0,0,0,1,0,6,54.0,0.125,400.0,140.0,False,04/13/2021,107,90,131,5,2021-12-12,1.2522999999999995,not_requested,7.0
1658,DeepSpaceNFT,0,1,0,0,0,0,0,0,0,26,2.0,0.025,1371.0,1645.0,False,10/17/2021,20,5,41,3,2021-11-01,0.025,not_requested,0.0
1659,Deeper Roots,0,0,0,0,1,0,0,0,0,6,13.0,0.015,1464.0,1247.0,False,11/13/2011,34,6,63,10,2021-07-25,0.03,not_requested,10.0
1660,Deez Dudes,0,1,0,0,0,0,0,0,0,2000,12.0,0.03,136.0,248.0,False,10/26/2021,6,5,12,3,2021-12-03,0.6300000000000003,not_requested,194.0
1661,Defaced 'N' Friends,0,1,0,0,0,0,0,0,0,100,61.0,3.0,40646.0,1691.0,False,05/28/2019,273,86,2435,26,2021-09-07,9.71,verified,0.0
1662,Default Cube Variants,1,0,0,0,0,0,0,0,0,125,247.0,0.001,726.0,1139.0,False,08/13/2015,3,4,12,2,2021-07-21,0.0283,not_requested,15.0
1663,DefinityLegend Happy Apes,0,1,0,0,0,0,0,0,0,7,3.0,0.23,6022.0,31.0,False,07/24/2021,42,6,450,405,2021-11-21,2.06,not_requested,39.0
1664,Degen Art Club Originals,1,0,0,0,0,0,0,0,0,128,84.0,1.4,2174.0,0.0,False,09/23/2021,48,23,251,9,2021-11-20,31.576798999999998,approved,176.0
1665,Degen'$ Farm,0,1,0,0,0,0,0,0,0,960,191.0,0.055,2708.0,1265.0,False,02/27/2021,31,42,56,3,2021-05-24,1.81257,verified,1157.0
1666,Degen'$ Farm Tools,0,1,0,0,0,0,0,0,0,6,28.0,0.05,2708.0,1265.0,False,02/27/2021,31,42,56,3,2021-06-12,0.5875,not_requested,2.0
1667,Degenerate Ape Academy,1,0,0,0,0,0,0,0,0,58,6.0,0.02,0.0,37.0,False,01/17/2018,0,1,2,0,2021-12-15,0.1315,not_requested,0.0
1668,Deities by thesamyadeep,1,0,0,0,0,0,0,0,0,9,4.0,0.12,1468.0,691.0,False,10/05/2012,9,4,28,1,2021-10-27,0.24,not_requested,1.0
1669,Deities of Niasrafeve,1,0,0,0,0,0,0,0,0,5,4.0,1.0,1196.0,524.0,False,04/02/2021,8,6,19,2,2021-10-05,0.135,not_requested,0.0
1670,Delcarmat,0,1,0,0,0,0,0,0,0,33,10.0,0.015,2068.0,934.0,False,04/10/2012,5,3,17,2,2021-02-25,0.105,requested,0.0
1671,Delcarmat avatars,0,1,0,0,0,0,0,0,0,100,20.0,0.01,2068.0,934.0,False,04/10/2012,5,3,17,2,2021-09-16,0.04,not_requested,0.0
1672,Delectable Airdrops,0,1,0,0,0,0,0,0,0,3,1000.0,0.006,16545.0,2259.0,False,02/20/2009,24,20,121,4,2021-11-29,0.1602799999999999,not_requested,7.0
1673,Delectable Ice Creams,1,0,0,0,0,0,0,0,0,40,73.0,0.001,45.0,39.0,False,12/01/2021,6,10,15,2,2021-11-20,0.002,not_requested,0.0
1674,Delectables by Foodmasku,0,1,0,0,0,0,0,0,0,2000,1000.0,0.039,16545.0,2259.0,False,02/20/2009,24,20,121,4,2021-11-09,3.7654200000000007,approved,105.0
1675,Delirious,1,0,0,0,0,0,0,0,0,16,62.0,0.09,13471.0,4230.0,False,08/26/2013,22,41,134,3,2021-11-21,0.19,not_requested,0.0
1676,Delisted Tiny Punks,0,1,0,0,0,0,0,0,0,1000,355.0,0.008,2236.0,401.0,False,08/08/2021,27,25,53,2,2021-08-12,0.0408,not_requested,56.0
1677,Demi-Human NFT,1,0,0,0,0,0,0,0,0,10000,3400.0,0.29,14285.0,853.0,False,10/09/2021,47,19,75,3,2021-11-02,509.21308788693113,approved,544.0
1678,DemiGods Of Rock,0,1,0,0,0,0,0,0,0,996,669.0,0.039,11881.0,797.0,False,06/23/2021,342,326,377,17,2021-10-23,7.742396156991003,not_requested,98.0
1679,Demise of the Dollar,0,1,0,0,0,0,1,0,0,24,8.0,0.03,5721.0,4467.0,False,09/09/2009,1,1,6,2,2021-03-23,0.15,approved,68.0
1680,Democracity by Generative Artworks,1,0,0,0,0,0,0,0,0,1000,600.0,0.16,1904.0,76.0,False,06/24/2020,19,10,63,1,2021-09-16,17.019414773099236,verified,57.0
1681,Demon Spawn,0,1,0,0,0,0,0,0,0,34,17.0,0.02,1060.0,1294.0,False,10/27/2021,29,10,61,5,2021-10-30,0.5900000000000001,not_requested,51.0
1682,DemonCrazy,0,1,0,0,0,0,0,0,0,406,138.0,0.01,695.0,1766.0,False,07/14/2016,12,8,17,2,2021-07-11,0.177,not_requested,256.0
1683,Dennis Rodman's World,0,0,0,0,0,1,0,0,0,7,5.0,0.005,125.0,181.0,False,07/18/2012,24,2,110,4,2021-11-18,0.0104999999999999,not_requested,0.0
1684,Deodand: How to Do Things With Legal Scholarship,1,0,0,0,0,0,0,0,0,47,33.0,0.185,11817.0,4717.0,False,10/23/2011,3,6,36,1,2021-08-24,0.23,not_requested,0.0
1685,Derivatives by Aku Napie,1,0,0,0,0,0,0,0,0,34,20.0,0.1,5603.0,5918.0,False,06/20/2009,15,47,49,2,2021-10-11,0.29,not_requested,58.0
1686,Derpy Birbs,0,1,0,0,0,0,0,0,0,8200,1800.0,0.005,2781.0,281.0,False,07/08/2021,5,5,27,3,2021-08-13,3.296789100009999,verified,264.0
1687,Descendants,1,0,0,0,0,0,0,0,0,360,66.0,0.02,4278.0,2259.0,False,09/25/2020,5,10,24,2,2021-09-04,0.0579,not_requested,11.0
1688,Designer Drugs x Desire Obtain Cherish,1,0,0,0,0,0,0,0,0,11,6.0,0.098,240.0,610.0,False,09/30/2020,19,45,51,3,2021-03-10,0.1,requested,0.0
1689,Designer Nugs,1,0,0,0,0,0,0,0,0,14,5.0,0.018,21.0,126.0,False,10/13/2021,1,1,6,0,2021-10-13,0.018,not_requested,24.0
1690,Desperate ApeWives,1,0,0,0,0,0,0,0,0,10000,4600.0,0.72,31714.0,3162.0,False,09/14/2021,182,251,397,18,2021-10-26,1263.6140026505088,approved,243.0
1691,Destroy Everything I Touch Vol. 1,1,0,0,0,0,0,0,0,0,12,3.0,0.1,4061.0,593.0,False,04/09/2020,60,15,301,2,2021-07-27,0.15,not_requested,0.0
1692,Devil Punks Club,0,1,0,0,0,0,0,0,0,376,2.0,0.01,159.0,518.0,False,09/28/2021,1,1,2,0,2021-09-23,0.01,not_requested,52.0
1693,Devil with capital D,0,1,0,0,0,0,0,0,0,10,3.0,0.5,413.0,289.0,False,11/07/2021,36,47,202,10,2021-12-08,0.5,not_requested,0.0
1694,Devious Affair,1,0,0,0,0,0,0,0,0,12,5.0,0.01,663.0,862.0,False,10/21/2021,17,3,22,12,2021-11-20,0.04,not_requested,54.0
1695,Devious Demon Dudes,0,1,0,0,0,0,0,0,0,2800,770.0,0.01,4935.0,531.0,False,06/22/2021,38,60,60,3,2021-07-07,0.3510999999999999,approved,166.0
1696,DezignerApez,0,1,0,0,0,0,0,0,0,59,18.0,0.004,663.0,198.0,False,12/30/2021,2,0,2,1,2021-10-22,0.2739999999999999,not_requested,4.0
1697,Diamond Dawgs,0,0,0,0,0,1,0,0,0,1500,591.0,0.043,4476.0,191.0,False,09/07/2021,9,25,32,4,2021-10-24,4.692799999999999,approved,165.0
1698,Diamond Derivatives,1,0,0,0,0,0,0,0,0,14,106.0,0.1,2250.0,744.0,False,08/10/2020,26,13,94,6,2021-10-13,0.2778699999999999,not_requested,2.0
1699,Diela Maharanie,1,0,0,0,0,0,0,0,0,36,313.0,0.1,24226.0,5034.0,False,05/23/2009,59,136,228,20,2021-07-07,1.6268999999999998,verified,0.0
1700,Digi Strains by The Peakz Company,0,1,0,0,0,0,0,0,0,321,93.0,0.12,5579.0,4014.0,False,08/15/2021,93,96,131,11,2021-11-11,1.871000000000001,not_requested,371.0
1701,DigiAvatar@DigiNation,0,1,0,0,0,0,0,0,0,1000,312.0,0.235,34890.0,375.0,False,09/03/2021,126,42,141,52,2021-11-18,18.3325,approved,197.0
1702,DigiDawg,0,1,0,0,0,0,0,0,0,420,8.0,0.015,4134.0,2869.0,False,08/06/2011,53,33,104,3,2021-09-11,0.075,not_requested,193.0
1703,DigiRocks,0,1,0,0,0,0,0,0,0,2100,1300.0,0.02,1413.0,402.0,False,03/07/2021,777,101,419,4,2021-03-26,0.4169700000000001,not_requested,182.0
1704,DigiWhales,0,1,0,0,0,0,0,0,0,119,38.0,0.15,407683.0,925.0,False,01/06/2011,2048,909,7839,1296,2021-10-30,2.04,approved,0.0
1705,DigimentaI,1,0,0,0,0,0,0,0,0,246,1400.0,0.001,54708.0,2290.0,False,09/01/2016,895,544,3750,90,2021-11-26,0.5825461121858921,not_requested,0.0
1706,Digissues CV Wearables,0,1,0,0,0,0,0,0,0,80,51.0,0.001,232.0,279.0,False,09/10/2020,32,38,37,2,2021-09-12,0.0244,not_requested,87.0
1707,Digital Dread Collection,1,0,0,0,0,0,0,0,0,6,28.0,0.65,534.0,613.0,False,06/25/2009,3,2,13,2,2021-12-15,0.1719,not_requested,0.0
1708,Digital Fight Club,0,0,0,0,0,0,0,1,0,244,52.0,0.05,1020.0,134.0,False,07/02/2021,10,6,13,3,2021-12-01,0.095,not_requested,662.0
1709,Digital Nomad Ron,1,0,0,0,0,0,0,0,0,19,6.0,0.003,1107.0,1416.0,False,11/05/2021,58,18,62,6,2021-11-13,0.0044,not_requested,0.0
1710,Digital Revolutions,1,0,0,0,0,0,0,0,0,46,4.0,0.045,481.0,562.0,False,02/09/2014,4,6,15,2,2021-11-12,0.135,not_requested,0.0
1711,Digital Soul NFT art,1,0,0,0,0,0,0,0,0,9,3.0,0.05,32.0,137.0,False,12/10/2017,2,3,10,1,2021-06-03,0.01,not_requested,18.0
1712,Digital Sports Card Collection,0,0,0,0,0,0,1,0,0,36,4.0,0.03,18.0,5.0,False,08/16/2019,1,1,3,0,2021-03-09,1.0,requested,38.0
1713,Digital portrait - 00,1,0,0,0,0,0,0,0,0,5,2.0,0.15,423.0,650.0,False,01/27/2017,4,6,19,3,2021-11-19,0.18,not_requested,0.0
1714,Digital/Mixed Media Collage by Idris Veitch,1,0,0,0,0,0,0,0,0,2,5.0,0.07,663.0,664.0,False,09/29/2017,12,7,52,2,2021-10-13,0.14,not_requested,8.0
1715,DigitalDogg's Digital Art,1,0,0,0,0,0,0,0,0,212,51.0,0.002,2301.0,4974.0,False,06/03/2009,9,14,33,3,2021-11-01,0.104,not_requested,189.0
1716,DigitalSaints,0,1,0,0,0,0,0,0,0,64,6.0,0.05,216.0,113.0,False,11/11/2019,3,23,13,3,2021-05-06,0.07,not_requested,15.0
1717,Digital_Dreams,1,0,0,0,0,0,0,0,0,20,16.0,0.156,1304.0,1403.0,False,08/23/2021,4,5,12,1,2021-11-10,9.6233518434431,approved,0.0
1718,DigitalaxGenesis,0,0,0,0,0,0,0,1,0,505,45.0,0.4,10323.0,473.0,False,10/03/2020,15,7,45,3,2020-11-02,0.5,verified,5.0
1719,Digitals Animals,1,0,0,0,0,0,0,0,0,1,2.0,110.0,11113.0,17.0,False,09/01/2021,888,774,2126,458,2021-12-13,0.011,not_requested,0.0
1720,Digitized Celebrities,0,1,0,0,0,0,0,0,0,124,19.0,0.005,138.0,181.0,False,08/28/2021,1,1,6,0,2021-08-26,0.075,not_requested,59.0
1721,Digual by DM,0,1,0,0,0,0,0,0,0,162,74.0,0.001,746.0,920.0,False,05/29/2021,7,1,19,1,2021-05-17,0.026,not_requested,28.0
1722,Dillon Gogarty - Blue Shift,0,0,0,0,1,0,0,0,0,33,3.0,0.18,7949.0,2700.0,False,06/02/2020,16,19,123,1,2021-08-17,0.18,approved,6.0
1723,Dino Gangz NFT,0,1,0,0,0,0,0,0,0,1400,451.0,0.003,4119.0,924.0,False,08/14/2021,341,367,405,22,2021-08-27,0.0239999999999999,approved,969.0
1724,Dino Tad,0,1,0,0,0,0,0,0,0,141,15.0,0.03,1125.0,447.0,False,12/06/2021,19,4,35,1,2021-12-06,0.32,not_requested,57.0
1725,DinoPunksNFT,1,0,0,0,0,0,0,0,0,400,261.0,0.01,12889.0,241.0,False,11/07/2021,40,23,85,9,2021-11-03,0.059,not_requested,91.0
1726,Dinooos,0,1,0,0,0,0,0,0,0,351,17.0,0.001,1763.0,4390.0,False,12/27/2012,3,3,7,3,2021-10-27,0.010027941972049,not_requested,84.0
1727,Dirt Collection,1,0,0,0,0,0,0,0,0,5,61.0,0.02,1187.0,424.0,False,07/31/2021,13,3,75,6,2021-09-07,0.94,not_requested,12.0
1728,Dirtbags,1,0,0,0,0,0,0,0,0,222,142.0,0.169,2013.0,2182.0,False,07/25/2021,90,86,110,12,2021-07-25,1.821,approved,0.0
1729,Dirty Punks,1,1,0,0,0,0,0,0,0,400,62.0,0.01,1012.0,3016.0,False,03/04/2014,7,3,19,2,2021-04-06,0.03,not_requested,2.0
1730,Dirtybird Fine Art,1,0,0,0,0,0,0,0,0,15,121.0,0.07,7980.0,886.0,False,06/14/2021,42,35,103,8,2021-06-16,0.8400000000000003,not_requested,12.0
1731,Dirtybird Flight Club,0,1,0,0,0,0,0,0,0,9100,3600.0,0.022,116089.0,5448.0,True,03/02/2009,32,47,381,7,2021-10-02,16.558448898999952,verified,272.0
1732,Discount Pokes,1,1,0,0,0,0,0,0,0,413,31.0,0.02,16.0,12.0,False,03/17/2021,1,1,6,1,2021-02-20,0.06,approved,30.0
1733,Discovering Discovery,0,0,0,0,1,0,0,0,0,27,5.0,0.05,5251.0,4603.0,False,04/24/2010,20,24,483,4,2021-09-16,0.05,not_requested,0.0
1734,Distant Colors by Baskara Puraga,0,0,0,0,1,0,0,0,0,46,2.0,0.05,2823.0,2543.0,False,09/19/2009,16,5,26,4,2021-11-01,0.05,not_requested,0.0
1735,Distopians Genesis,0,1,0,0,0,0,0,0,0,223,75.0,0.018,1317.0,1124.0,False,06/12/2021,21,26,25,2,2021-06-28,0.06,not_requested,86.0
1736,DistortedToadz,0,1,0,0,0,0,0,0,0,7000,263.0,0.001,459.0,295.0,False,10/26/2021,12,9,30,5,2021-10-26,1.960590999999947,not_requested,245.0
1737,Divergence Divers,0,1,0,0,0,0,0,0,0,7100,7100.0,0.02,42924.0,1011.0,False,02/21/2021,93,39,120,14,2021-09-30,1.8230000000000004,not_requested,16.0
1738,Divine Anarchy,1,0,0,0,0,0,0,0,0,10000,4800.0,0.1,51472.0,137.0,False,05/13/2021,4170,4395,3770,258,2021-11-05,151.49151379530235,verified,663.0
1739,Divine Collages,1,0,0,0,0,0,0,0,0,1,2.0,0.05,781.0,251.0,False,10/23/2009,9,15,33,5,2021-09-13,0.05,not_requested,0.0
1740,Dizzy Dragons,0,1,0,0,0,0,0,0,0,5600,2100.0,0.03,9405.0,970.0,False,06/17/2021,212,210,248,16,2021-07-30,9.216196003691117,verified,222.0
1741,Dizzy Drifters,0,0,0,0,0,0,0,1,0,58,17.0,0.03,1109.0,1028.0,False,10/05/2021,7,3,17,4,2021-10-08,0.15,not_requested,182.0
1742,DnldzeeOnPolygon,1,0,0,0,0,0,0,0,0,286,11.0,0.001,377.0,199.0,False,05/24/2016,5,3,17,1,2021-11-12,0.0041899999999999,not_requested,0.0
1743,Doctor Who - Worlds Apart,0,0,0,0,0,0,1,0,0,416,82.0,0.005,3481.0,162.0,False,08/13/2020,11,27,29,2,2021-06-17,0.2849,verified,244.0
1744,Doctor Who - Worlds Apart Polygon (Matic),0,0,0,0,0,0,1,0,0,2600,138.0,0.001,3481.0,162.0,False,08/13/2020,11,27,29,2,2021-07-19,0.002796,not_requested,384.0
1745,Documentias From The Meta(l)Verse,1,0,0,0,0,0,0,0,0,20,12.0,0.25,4507.0,2253.0,False,09/02/2018,45,13,144,3,2021-08-31,0.008,not_requested,0.0
1746,Documenting in BNW,0,0,0,0,1,0,0,0,0,25,13.0,0.03,3103.0,4199.0,False,05/08/2021,17,4,51,2,2021-09-04,0.06,not_requested,1.0
1747,Dodgers MLB Crypto,0,0,0,0,0,1,0,0,0,40000,39600.0,0.199,3905.0,198.0,False,06/06/2018,32,18,102,8,2019-04-26,0.3,not_requested,10.0
1748,Dog Poodle Sunglasses,1,0,0,0,0,0,0,0,0,15,3.0,0.002,22.0,40.0,False,11/19/2021,2,2,8,2,2021-11-29,0.0045,not_requested,4.0
1749,DogSies Laxy,0,1,0,0,0,0,0,0,0,52,25.0,0.005,771.0,1328.0,False,05/01/2021,3,1,6,1,2021-06-19,0.013,not_requested,279.0
1750,Doge Bro To The Moon,0,1,0,0,0,0,0,0,0,101,87.0,0.005,330.0,332.0,False,08/29/2021,6,4,11,3,2021-10-17,0.6218000000000004,not_requested,47.0
1751,Doge Fight Club,0,1,0,0,0,0,0,0,0,702,276.0,0.02,2475.0,362.0,False,08/19/2021,28,13,44,4,2021-11-13,0.04,not_requested,178.0
1752,Doge Gang,0,1,0,0,0,0,0,0,0,48,17.0,0.01,2027.0,1180.0,False,06/16/2021,2,3,14,2,2021-06-28,0.045,not_requested,0.0
1753,Doge Generals,1,0,0,0,0,0,0,0,0,42,246.0,0.015,3825.0,2131.0,False,09/12/2021,61,60,101,2,2021-09-18,0.3043647,approved,18.0
1754,Doge Generals (Polygon),1,0,0,0,0,0,0,0,0,20,110.0,0.05,3825.0,2131.0,False,09/12/2021,61,60,101,2,2021-10-20,0.0649999999999999,approved,19.0
1755,Doge Heroes,0,0,0,0,0,0,1,0,0,17,80.0,0.001,32.0,51.0,False,06/16/2021,2,2,6,1,2021-09-28,0.0005,not_requested,0.0
1756,Doge Pound Puppies,0,1,0,0,0,0,0,0,0,8100,4700.0,0.329,165674.0,3674.0,False,04/01/2021,198,91,839,21,2021-09-01,200.84958299998996,verified,190.0
1757,Doge Tribe Pup,0,0,0,0,0,0,0,1,0,172,84.0,0.03,20321.0,3.0,False,10/08/2021,42,79,94,8,2021-10-23,0.4885,not_requested,8.0
1758,DogeBit Collection by ZeroARTS,0,1,0,0,0,0,0,0,0,89,47.0,0.004,426.0,2168.0,False,09/11/2021,3,5,14,3,2021-09-02,0.009,not_requested,108.0
1759,DogeByte Collection by ZeroARTS,0,1,0,0,0,0,0,0,0,68,38.0,0.032,426.0,2168.0,False,09/11/2021,3,5,14,3,2021-10-19,0.52108,approved,194.0
1760,DogeElon,0,1,0,0,0,0,0,0,0,5000,1400.0,0.001,1625.0,263.0,False,06/07/2011,28,16,40,5,2021-11-09,0.07904343,not_requested,213.0
1761,DogeHighWorldClub,0,1,0,0,0,0,0,0,0,41,21.0,0.05,183.0,95.0,False,11/11/2021,15,27,16,3,2021-08-27,0.319,not_requested,60.0
1762,DogeNFT Y,0,1,0,0,0,0,0,0,0,80,4.0,0.01,7.0,2.0,False,11/11/2021,2,4,8,1,2021-09-05,0.02144,not_requested,194.0
1763,DogePirates,1,0,0,0,0,0,0,0,0,1100,397.0,0.005,1204.0,403.0,False,08/18/2021,2,2,8,2,2021-08-27,0.144,not_requested,257.0
1764,Dogecoin Card Collection | KriptoKards,0,0,0,0,0,0,1,0,0,2,4900.0,0.006,6757.0,12.0,False,07/28/2021,607,118,435,20,2021-09-30,0.018291117856318,not_requested,2.0
1765,Dogelon Mars Art Club,0,1,0,0,0,0,0,0,0,154,55.0,0.001,494.0,827.0,False,11/19/2021,9,6,21,3,2021-11-01,0.42001,not_requested,0.0
1766,"Dogelon Mars collectible NFT cards, 1st edition.",0,0,0,0,0,0,1,0,0,9,2.0,0.504,102.0,137.0,False,03/14/2021,5,3,36,2,2021-11-16,0.00053,not_requested,0.0
1767,Dogepunks,0,1,0,0,0,0,0,0,0,165,89.0,1.29,5635.0,535.0,False,02/20/2021,107,91,355,5,2021-02-20,5.03,verified,10.0
1768,Dogs Unchained,0,1,0,0,0,0,0,0,0,5900,2200.0,0.03,13395.0,572.0,False,06/28/2021,19,7,61,3,2021-08-21,7.875212666,verified,195.0
1769,Dogs Unchained - Proof of Steak,0,1,0,0,0,0,0,0,0,1400,767.0,0.009,13395.0,572.0,False,06/28/2021,19,7,61,3,2021-08-02,0.982400001,approved,2.0
1770,Dogs Unleashed,0,1,0,0,0,0,0,0,0,303,234.0,0.007,829.0,1747.0,False,10/12/2021,29,11,59,14,2021-09-11,0.2125000000000001,not_requested,27.0
1771,Dogs of Elon,0,1,0,0,0,0,0,0,0,9900,2500.0,0.015,136599.0,12.0,False,08/28/2021,3475,2040,3781,337,2021-10-19,10.227899999999996,approved,118.0
1772,Dojo Trades,0,0,0,0,0,0,0,1,0,1,19.0,0.48,6539.0,2.0,False,05/31/2019,329,80,367,3,2021-09-26,0.35,not_requested,0.0
1773,DojoApe,0,1,0,0,0,0,0,0,0,26,14.0,0.01,40.0,74.0,False,10/02/2021,4,5,8,5,2021-12-17,0.127,not_requested,21.0
1774,Doki Division,1,0,0,0,0,0,0,0,0,149,66.0,0.05,8411.0,11.0,False,09/20/2021,8,8,17,2,2021-10-27,0.1,not_requested,0.0
1775,Doki Doki,0,1,0,0,0,0,0,0,0,591,1500.0,0.007,12714.0,434.0,False,09/15/2020,140,13,1183,6,2020-12-14,45.90105999000001,verified,344.0
1776,Donald Trump Punk Collection,0,1,0,0,0,0,0,0,0,19,6.0,0.008,26.0,21.0,False,08/23/2021,8,2,12,4,2021-08-12,0.05,not_requested,1.0
1777,Donnie Fre$her,0,0,0,0,1,0,0,0,0,23,7.0,0.05,4022.0,4689.0,False,09/22/2020,13,4,27,2,2021-02-28,0.007,not_requested,0.0
1778,Doodle Doges,1,0,0,0,0,0,0,0,0,643,8.0,0.001,60.0,169.0,False,12/23/2021,5,1,10,0,2021-12-17,0.0445999999999999,not_requested,0.0
1779,Doodle Dogs NFT Official,0,1,0,0,0,0,0,0,0,10000,3200.0,0.035,5138.0,749.0,False,10/27/2021,254,99,318,24,2021-12-09,488.24534425920245,approved,213.0
1780,Doodle Fruits,0,1,0,0,0,0,0,0,0,61,21.0,0.005,779.0,0.0,False,09/18/2021,6,8,29,1,2021-12-17,0.02,not_requested,116.0
1781,Doodle Punk Dudes,0,0,0,0,0,0,0,1,0,93,24.0,10.0,883.0,2507.0,False,04/02/2009,3,4,12,5,2021-12-15,0.002559,not_requested,113.0
1782,Doodle art by BigDeebook,1,0,0,0,0,0,0,0,0,33,13.0,0.029,3273.0,3131.0,False,08/22/2021,25,7,71,3,2021-09-16,0.029,not_requested,0.0
1783,Doodle by Burnt Toast,0,1,0,0,0,0,0,0,0,26,15.0,0.029,158584.0,1602.0,True,06/18/2021,1237,2067,13229,162,2021-10-23,0.0698999999999999,not_requested,0.0
1784,Doodled Punks (DUNKS),0,1,0,0,0,0,0,0,0,2500,1300.0,0.05,16163.0,257.0,False,11/10/2021,3714,4200,4455,95,2021-12-07,41.14986301261116,approved,125.0
1785,Doodles Baby Ape Club,0,1,0,0,0,0,0,0,0,10000,601.0,0.001,1495.0,7.0,False,12/03/2021,59,60,75,4,2021-12-03,6.327211060011264,not_requested,190.0
1786,Dope City Club,1,0,0,0,0,0,0,0,0,4000,333.0,0.001,181.0,191.0,False,11/14/2021,6,11,11,2,2021-12-05,0.029962,not_requested,191.0
1787,Dope Shibas,0,1,0,0,0,0,0,0,0,9900,3900.0,0.01,5282.0,264.0,False,03/18/2021,246,265,253,19,2021-07-30,5.901139706997541,verified,182.0
1788,Dope Wars,0,1,0,0,0,0,0,0,0,8000,2100.0,0.13,11967.0,2.0,False,09/01/2021,66,26,341,17,2021-08-31,87.54119759495408,verified,0.0
1789,Dopey Ducklings,1,0,0,0,0,0,0,0,0,2000,860.0,0.03,2952.0,19.0,False,10/09/2021,113,112,194,11,2021-10-25,100.79265689990012,approved,205.0
1790,Doro's Persona world,1,0,0,0,0,0,0,0,0,42,28.0,0.1,789.0,435.0,False,04/03/2020,28,9,85,6,2021-09-15,0.8,approved,150.0
1791,Dot Matrix Gradient Study by Jake Rockland,1,0,0,0,0,0,0,0,0,540,378.0,0.13,128157.0,304.0,False,10/18/2020,171,1073,2587,31,2021-08-28,2.9559999999999995,verified,19.0
1792,Dot Pigeon,1,0,0,0,0,0,0,0,0,1600,129.0,0.759,10594.0,256.0,False,03/14/2018,1225,1263,1416,24,2020-12-31,3.4599,verified,1.0
1793,DotCom Seance,1,0,0,0,0,0,0,0,0,354,157.0,0.145,246.0,73.0,False,12/07/2021,5,5,25,3,2021-12-17,6.482399999999999,not_requested,93.0
1794,Double Game,0,1,0,0,0,0,0,0,0,39,9.0,0.2,4618.0,1024.0,False,07/31/2015,31,12,85,4,2021-08-04,0.18,not_requested,0.0
1795,Double_Exposure,1,0,0,0,0,0,0,0,0,9,2.0,0.1,931.0,3362.0,False,09/26/2020,22,9,33,2,2021-11-17,0.15,not_requested,0.0
1796,Doug TenNapel's Eternal Klay,1,0,0,0,0,0,0,0,0,10000,1000.0,0.02,1110.0,18.0,False,10/01/2021,26,19,46,9,2021-08-30,15.07847399999998,verified,0.0
1797,Dr. Jill Begins,1,0,0,0,0,0,0,0,0,2,1.0,1.35,113.0,170.0,False,08/05/2018,17,3,16,2,2021-12-11,0.5,not_requested,0.0
1798,Draftly 2021 Polygon Sports Collection,0,0,0,0,0,1,0,0,0,105,13.0,0.03,220.0,575.0,False,09/30/2021,4,3,47,4,2021-10-14,0.25,not_requested,63.0
1799,Draftly 2021 Sports Collection,0,0,0,0,0,1,0,0,0,125,17.0,0.01,220.0,575.0,False,09/30/2021,4,3,47,4,2021-10-04,0.365,not_requested,117.0
1800,Dragon Rich Club Official,0,1,0,0,0,0,0,0,0,1200,856.0,0.01,5160.0,33.0,False,11/05/2021,2576,923,2513,30,2021-12-12,20.29496250000001,approved,143.0
1801,DragonBro,0,1,0,0,0,0,0,0,0,22,309.0,0.012,330.0,332.0,False,08/29/2021,6,4,11,3,2021-09-04,0.9120970000000004,not_requested,10.0
1802,Dragons from around the World,1,0,0,0,0,0,0,0,0,8,4.0,0.009,202.0,181.0,False,06/08/2021,14,4,27,2,2021-11-08,0.022,not_requested,6.0
1803,Drakons (Polygon),0,1,0,0,0,0,0,0,0,4200,961.0,0.007,9571.0,416.0,False,10/23/2019,27,12,56,5,2021-03-02,0.0408899999999999,approved,20.0
1804,Drawing and Sketch by Gusti,1,0,0,0,0,0,0,0,0,12,2.0,0.004,239.0,484.0,False,11/08/2021,1,4,8,3,2021-11-10,0.0018,not_requested,0.0
1805,Drawing is growing for PUNIKO,1,0,0,0,0,0,0,0,0,26,23.0,0.01,2488.0,970.0,False,09/04/2021,2,2,15,1,2021-09-18,0.039,not_requested,0.0
1806,Drawings of Bored Apes,1,0,0,0,0,0,0,0,0,5,2.0,0.04,12.0,87.0,False,10/13/2021,0,1,3,1,2021-11-12,0.12,not_requested,0.0
1807,Drawn by Fear,1,0,0,0,0,0,0,0,0,9,9.0,0.48,2123.0,1536.0,False,01/22/2017,5,6,22,1,2021-11-14,2.91,not_requested,0.0
1808,Dream Machine (Alpha Series),1,0,0,0,0,0,0,0,0,272,138.0,0.35,216.0,240.0,False,03/01/2021,5,3,19,4,2021-06-04,0.2,approved,276.0
1809,Dreamer Alpies,0,1,0,0,0,0,0,0,0,5000,1100.0,0.038,72122.0,272.0,False,02/11/2021,36,38,162,6,2021-11-01,3.0886599999999995,not_requested,195.0
1810,Dreamilow,0,1,0,0,0,0,0,0,0,354,21.0,0.004,317.0,462.0,False,11/01/2021,1,1,3,2,2021-12-08,0.011,not_requested,65.0
1811,Dreamloops,0,1,0,0,0,0,0,0,0,9500,1900.0,0.019,8983.0,284.0,False,03/08/2021,22,14,88,3,2021-06-07,4.595428847529,verified,457.0
1812,Dreams of Roya,1,0,0,0,0,0,0,0,0,29,615.0,0.014,2691.0,796.0,False,07/28/2021,380,117,1443,36,2021-07-07,0.288999,not_requested,0.0
1813,Dreamstates,0,0,0,0,1,0,0,0,0,37,56.0,0.488,47021.0,2777.0,False,04/16/2011,84,26,523,4,2021-03-10,15.5449,approved,26.0
1814,Dreamy Geeks,0,0,0,0,0,0,0,1,0,113,56.0,0.1,1663.0,1019.0,False,09/12/2021,7,7,18,3,2021-11-19,0.1,not_requested,254.0
1815,Dreamy Whales,1,0,0,0,0,0,0,0,0,13,11.0,1.0,1133.0,1197.0,False,01/01/2021,1,2,12,0,2021-10-24,0.6,not_requested,0.0
1816,Drip Ballers,0,0,0,0,0,1,0,0,0,90,22.0,0.01,469.0,1152.0,False,10/17/2021,2,7,8,1,2021-10-01,0.122,not_requested,45.0
1817,DripMates,0,1,0,0,0,0,0,0,0,118,56.0,0.05,1144.0,1001.0,False,09/21/2021,4,5,17,4,2021-10-10,1.6250000000000009,not_requested,141.0
1818,Drunken Skylines,0,0,0,0,1,0,0,0,0,15,12.0,0.2,18874.0,908.0,False,11/01/2013,368,13,2423,3,2021-08-31,0.24,not_requested,0.0
1819,Ds Islands passport,0,1,0,0,0,0,0,0,0,4,111.0,0.035,2620.0,144.0,False,10/25/2021,4,4,8,5,2021-11-29,0.07,not_requested,0.0
1820,Dual Soul,1,0,0,0,0,0,0,0,0,220,107.0,0.2,2675.0,341.0,False,08/04/2021,12,11,109,4,2021-08-04,53.12057155000005,not_requested,17.0
1821,Dualism V2,0,0,0,0,1,0,0,0,0,31,3.0,0.1,360.0,590.0,False,03/28/2010,2,4,12,3,2021-04-05,0.2,not_requested,0.0
1822,DubaiPeeps,1,0,0,0,0,0,0,0,0,338,177.0,0.5,1543.0,97.0,False,09/06/2021,5,7,15,4,2021-10-25,8.344000000000003,approved,71.0
1823,DuckDAO Hunters,0,0,0,0,0,0,1,0,0,53,618.0,0.039,132139.0,1949.0,False,08/12/2020,48,54,248,8,2020-11-02,0.236,verified,0.0
1824,Duckzzy,0,1,0,0,0,0,0,0,0,26,8.0,0.02,1691.0,1080.0,False,12/08/2009,2,2,17,1,2021-10-13,0.025,not_requested,0.0
1825,Dugout Punks,0,0,0,0,0,1,0,0,0,35,61.0,0.008,115.0,184.0,False,12/27/2021,19,19,27,2,2021-12-16,2.6265199999999926,not_requested,0.0
1826,Duhverse Events,0,1,0,0,0,0,0,0,0,11,3000.0,0.002,5926.0,455.0,False,07/31/2021,34,24,50,4,2021-09-29,0.07146,not_requested,4.0
1827,Dull Skullz,1,0,0,0,0,0,0,0,0,84,106.0,0.001,375.0,289.0,False,09/23/2021,22,23,22,1,2021-10-20,0.003855,not_requested,0.0
1828,Dumpster Dogs,0,1,0,0,0,0,0,0,0,40,34.0,0.15,1590.0,93.0,False,04/20/2009,6,5,19,3,2021-03-21,0.165,approved,67.0
1829,Dumpster Statements.,0,0,0,0,1,0,0,0,0,40,20.0,0.111,27014.0,1886.0,True,02/26/2009,11,15,51,4,2021-08-09,0.191,approved,0.0
1830,Dune: The Collection,0,0,0,0,1,0,0,0,0,30,24.0,0.1,10837.0,1457.0,False,07/27/2019,20,7,111,0,2021-08-05,0.10000001,not_requested,0.0
1831,Dunk Punks NFT,0,0,0,0,0,1,0,0,0,103,85.0,0.005,389.0,9.0,False,12/03/2021,136,139,150,10,2021-12-06,9.3344,not_requested,88.0
1832,Duppy Season,1,0,0,0,0,0,0,0,0,17,5.0,0.012,500.0,456.0,False,06/26/2016,7,6,29,3,2021-12-13,0.096,not_requested,59.0
1833,Dusk till Dawn,0,0,0,0,1,0,0,0,0,36,31.0,0.2,6910.0,943.0,False,05/28/2013,396,74,3565,36,2021-09-03,0.4,not_requested,0.0
1834,DuskBreakers,0,1,0,0,0,0,0,0,0,10000,3100.0,0.25,8935.0,209.0,False,09/09/2021,466,500,486,84,2021-12-04,522.0004487912568,approved,391.0
1835,DustyJar,0,1,0,0,0,0,0,0,0,23,12.0,0.01,3156.0,569.0,False,04/05/2020,3,3,16,5,2021-10-01,0.01,not_requested,0.0
1836,Dverse Token,0,1,0,0,0,0,0,0,0,1900,603.0,0.018,194569.0,99.0,False,08/16/2020,35975,4895,20614,2602,2021-09-27,1.600599999999999,not_requested,49.0
1837,Dwagons,0,1,0,0,0,0,0,0,0,5600,3.0,0.055,58.0,148.0,False,10/12/2021,2,4,10,4,2021-10-28,0.22,not_requested,70.0
1838,Dwarfs vs Lion,0,1,0,0,0,0,0,0,0,53,2.0,0.1,85.0,76.0,False,10/31/2021,9,4,41,6,2021-11-10,0.125,not_requested,108.0
1839,Dylan Gill Art Studio,1,0,0,0,0,0,0,0,0,143,223.0,0.11,4980.0,1624.0,False,02/29/2016,22,23,139,2,2021-07-04,6.622300000000001,approved,4.0
1840,Dynamic Slices by pxlq,1,0,0,0,0,0,0,0,0,512,250.0,1.75,128157.0,304.0,False,10/18/2020,171,1073,2587,31,2021-08-24,20.43360962818287,verified,17.0
1841,DystoApez:,0,0,0,0,0,0,0,1,0,20,2.0,0.05,27322.0,92.0,False,11/18/2021,4301,4115,4727,107,2021-12-01,0.05,not_requested,0.0
1842,Dystolab Crates,0,1,0,0,0,0,0,0,0,1,541.0,0.16,20975.0,1999.0,False,03/02/2021,2866,2877,2785,207,2021-10-16,29.111388999999985,not_requested,1.0
1843,Dystopian Monkeys,1,0,0,0,0,0,0,0,0,5000,10.0,0.019,388.0,388.0,False,03/17/2021,102,124,104,6,2021-05-18,0.4,approved,149.0
1844,ECOVERSE:GREEN,0,0,0,0,0,0,0,1,0,30,5.0,0.001,6.0,36.0,False,06/03/2008,3,2,10,1,2021-10-10,0.002,not_requested,48.0
1845,EGGTOMATONS MINT PASS,0,1,0,0,0,0,0,0,0,79,68.0,0.1,12164.0,271.0,False,10/12/2021,144,153,147,9,2021-10-21,0.08,approved,0.0
1846,ELECTRIC PEOPLE COMMUNITY BY RAS TERMS,1,0,0,0,0,0,0,0,0,56,88.0,0.15,5655.0,865.0,False,02/27/2014,7,4,22,2,2021-11-06,1.84,not_requested,0.0
1847,EMPTY SIGNS,0,0,0,0,1,0,0,0,0,21,13.0,0.17,6737.0,250.0,False,04/06/2015,390,17,2540,12,2021-08-27,0.38,not_requested,0.0
1848,ENCODE FOUNDER NFTS 2021,0,0,0,0,0,0,0,1,0,4,240.0,0.209,4423.0,2841.0,False,09/22/2020,221,206,245,10,2021-09-03,7.428389997999999,verified,8.0
1849,ENTROPY LOOPS,1,0,0,0,0,0,0,0,0,41,14.0,0.05,772.0,1000.0,False,03/03/2013,8,7,20,2,2021-09-17,0.172,not_requested,65.0
1850,EPIC LANDSCAPES,1,0,0,0,0,0,0,0,0,100,24.0,0.01,5733.0,5356.0,False,01/05/2021,17,11,42,3,2021-02-02,0.03,approved,14.0
1851,ERASERHEADZ OFFICIAL,1,0,0,0,0,0,0,0,0,86,40.0,0.85,367.0,395.0,False,12/23/2016,4,3,10,1,2021-08-28,0.35,not_requested,216.0
1852,ERC-1155 Gameboy,1,0,0,0,0,0,0,0,0,14,3.0,0.005,108.0,1425.0,False,11/05/2021,1,3,5,1,2021-11-18,0.0029,not_requested,0.0
1853,ESAVERSE,1,0,0,0,0,0,0,0,0,4,4.0,50.0,137.0,414.0,False,01/17/2015,2,1,9,3,2021-10-27,0.31,not_requested,0.0
1854,ESL Team Gear,0,0,0,0,0,1,0,0,0,27,148.0,0.05,853161.0,287.0,True,10/22/2008,3144,294,21411,629,2021-12-03,2.127,approved,9.0
1855,ET Clube,1,0,0,0,0,0,0,0,0,110,6.0,0.001,487.0,505.0,False,11/20/2021,12,61,39,3,2021-11-18,0.0145,not_requested,140.0
1856,ETERNAL BLOOM COLLECTION,1,0,0,0,0,0,0,0,0,5,3.0,0.25,4815.0,1382.0,False,04/07/2020,20,19,93,4,2021-11-16,0.75,not_requested,0.0
1857,ETERNAL FRAGMENTS,1,0,0,0,0,0,0,0,0,2800,977.0,0.01,1752.0,130.0,False,09/17/2021,87,86,96,18,2021-09-19,9.198250999996986,verified,47.0
1858,ETH BOY CLIQUE,1,0,0,0,0,0,0,0,0,1000,662.0,0.03,143.0,102.0,False,11/09/2021,5,4,9,4,2021-10-27,0.1224588,not_requested,1129.0
1859,ETH HOLY CHARACTERS,0,1,0,0,0,0,0,0,0,9,4.0,0.1,295.0,569.0,False,03/02/2021,2,1,3,1,2021-11-11,0.3,not_requested,1.0
1860,ETH-MEN Avatars,0,1,0,0,0,0,0,0,0,620,96.0,0.05,4497.0,273.0,False,11/02/2020,441,457,517,17,2020-11-27,0.1,verified,0.0
1861,ETH-MEN RELOADED,1,1,0,0,0,0,0,0,0,61,563.0,0.025,4497.0,273.0,False,11/02/2020,441,457,517,17,2021-01-10,0.553,verified,40.0
1862,ETHEREALS WTF,0,1,0,0,0,0,0,0,0,12300,4800.0,0.009,10362.0,472.0,False,07/30/2021,58,41,267,10,2021-10-01,12.140563887114066,verified,250.0
1863,ETHERRAPCONS MUSIC AWARDS,1,0,0,0,0,0,0,0,0,50,15.0,0.001,17.0,80.0,False,10/08/2021,1,2,6,1,2021-09-27,0.0431,not_requested,0.0
1864,ETHMap Zones,0,1,0,0,0,0,0,0,0,53,41.0,0.168,250.0,71.0,False,08/16/2021,5,3,11,3,2021-08-29,4.337000000000001,not_requested,192.0
1865,ETHNICS,1,0,0,0,0,0,0,0,0,16,3.0,0.009,496.0,392.0,False,09/12/2021,1,4,6,1,2021-12-12,0.066,not_requested,37.0
1866,ETHTerrestrials,0,1,0,0,0,0,0,0,0,100,55.0,1.8,212.0,119.0,False,03/08/2021,21,40,61,37,2021-03-08,3.0,approved,59.0
1867,EUNOIA (20TH ANNIVERSARY),1,0,0,0,0,0,0,0,0,71,8.0,0.025,11799.0,250.0,False,01/23/2009,7,4,25,2,2021-11-18,0.15,not_requested,34.0
1868,EVOLVE by Sim,1,0,0,0,0,0,0,0,0,141,84.0,0.19,19844.0,996.0,False,12/12/2019,38,155,515,3,2021-09-03,0.171,not_requested,0.0
1869,EXPAT MUNKI,0,1,0,0,0,0,0,0,0,91,38.0,0.03,843.0,1830.0,False,10/12/2021,8,20,28,4,2021-12-05,0.0306,not_requested,222.0
1870,EYEVEA,1,0,0,0,0,0,0,0,0,15,11.0,0.02,3425.0,3056.0,False,01/03/2020,29,22,76,6,2021-04-14,0.08,not_requested,0.0
1871,Earn Punks,0,1,0,0,0,0,0,0,0,333,73.0,0.025,188.0,28.0,False,08/19/2021,26,12,63,7,2021-08-19,2.899999999999997,not_requested,131.0
1872,Earth 2 - Legendary Collection,0,0,0,0,0,0,1,0,1,90,25.0,0.004,17.0,4.0,False,03/14/2021,0,2,6,0,2021-03-14,0.117,not_requested,25.0
1873,East Africa,0,0,0,0,1,0,0,0,0,15,4.0,0.15,1067.0,763.0,False,07/01/2021,4,7,35,1,2021-11-08,1.4,not_requested,0.0
1874,Eastern Cybercities,1,0,0,0,0,0,0,0,0,214,3.0,0.01,140.0,800.0,False,12/05/2021,2,1,11,1,2021-09-22,0.04,not_requested,7.0
1875,Eccentrics 2: Orbits by Radix,1,0,0,0,0,0,0,0,0,500,344.0,0.469,2308.0,757.0,False,03/17/2007,36,12,150,8,2021-08-25,14.27298367929404,verified,130.0
1876,Echelon Cache,0,0,0,0,0,0,0,1,0,1,120.0,0.819,79416.0,13583.0,False,02/18/2021,1351,1157,1924,724,2021-11-07,23.4329,verified,1.0
1877,Echoes of Light by Deb Clark,0,0,0,0,1,0,0,0,0,10,2.0,0.07,1602.0,734.0,False,07/30/2015,3,44,88,2,2021-10-27,0.08,not_requested,4.0
1878,Ecole Leger,1,0,0,0,0,0,0,0,0,30,16.0,0.77,633.0,1199.0,False,04/14/2021,21,7,45,2,2021-07-03,0.065,not_requested,0.0
1879,Edgy Veggies,0,1,0,0,0,0,0,0,0,400,110.0,0.008,8419.0,3982.0,False,09/04/2021,32,20,38,4,2021-09-26,0.1199,not_requested,49.0
1880,Edifice by Ben Kovach,1,0,0,0,0,0,0,0,0,975,594.0,2.0,10756.0,1183.0,False,12/14/2011,19,19,253,2,2021-11-01,128.85670001999995,verified,88.0
1881,Edifice of an Envelope,0,0,0,0,1,0,0,0,0,15,4.0,0.25,3074.0,1010.0,False,07/23/2020,58,8,222,2,2021-10-16,0.25,not_requested,0.0
1882,Edition365,0,0,0,0,1,0,0,0,0,366,40.0,0.19,252743.0,1795.0,True,10/23/2008,28,33,160,6,2021-11-19,0.25,approved,236.0
1883,EggBois,0,1,0,0,0,0,0,0,0,78,39.0,0.5,4014.0,2884.0,False,03/10/2021,11,5,36,1,2021-03-11,0.2,not_requested,179.0
1884,Eggzilla,0,1,0,0,0,0,0,0,0,184,120.0,0.04,11047.0,2915.0,False,05/01/2015,36,15,104,10,2021-12-13,0.037,not_requested,190.0
1885,Eguono - Love,1,0,0,0,0,0,0,0,0,18,54.0,0.04,2478.0,879.0,False,10/12/2021,24,13,121,3,2021-10-15,17.615099999999995,approved,0.0
1886,EightBitMafia,0,1,0,0,0,0,0,0,0,694,245.0,0.018,1796.0,145.0,False,10/09/2021,100,24,115,8,2021-11-15,0.513,not_requested,122.0
1887,"Einstein, Chaplin, Wright Brothers X Wolfe, Odious, Parrott",1,0,0,0,0,0,0,0,0,3,83.0,0.21,2153.0,33.0,False,03/09/2021,135,78,995,28,2021-11-18,1.429,verified,0.0
1888,Ekos Nocturnos II,0,0,0,1,0,0,0,0,0,2,9.0,0.005,407.0,631.0,False,05/21/2009,1,4,7,2,2021-08-17,0.0001,not_requested,0.0
1889,EldenNFT - Elemental Wizards,0,1,0,0,0,0,0,0,0,103,8.0,0.007,518.0,902.0,False,11/09/2021,2,12,12,4,2021-11-17,0.04,not_requested,39.0
1890,Electric Sea,0,0,0,0,1,0,0,0,0,13,2.0,0.05,375.0,422.0,False,10/02/2021,25,9,147,4,2021-11-05,0.06,not_requested,0.0
1891,Ellepleure,1,0,0,0,0,0,0,0,0,48,137.0,0.025,4289.0,2856.0,False,04/06/2020,72,47,86,4,2021-08-06,0.4589,not_requested,27.0
1892,EllioTrades NFT Collection,1,0,0,0,0,0,0,0,0,1900,684.0,2.29,633700.0,1025.0,True,01/04/2018,6723,7259,8533,434,2021-02-13,127.03448750000004,verified,18.0
1893,Elon's Space Party,0,1,0,0,0,0,0,0,0,8700,333.0,0.08,1302.0,1040.0,False,10/12/2021,3,4,11,1,2021-03-16,17.70386969689997,approved,224.0
1894,ElonMonst,0,1,0,0,0,0,0,0,0,9900,6200.0,0.002,347.0,37.0,False,10/15/2021,43,10,55,3,2021-11-18,17.67695434204,not_requested,570.0
1895,Elons Musks,0,1,0,0,0,0,0,0,0,9800,64.0,0.049,823.0,2662.0,False,11/01/2021,9,5,32,1,2021-02-09,0.4649999999999999,approved,528.0
1896,Elves of the North Official,0,1,0,0,0,0,0,0,0,8900,1800.0,0.002,2199.0,83.0,False,10/12/2021,43,40,57,5,2021-11-23,0.7852100000000003,approved,149.0
1897,Elysian Fields,0,0,0,0,0,0,1,0,0,196,1100.0,0.001,7.0,80.0,False,05/27/2021,0,1,1,0,2021-09-25,0.3894104999999999,not_requested,88.0
1898,Ember Sword Badge,0,1,0,0,0,0,0,0,0,4,6100.0,0.242,81349.0,68.0,False,07/26/2018,64,35,289,12,2021-10-14,134.99961855499006,verified,0.0
1899,Ember Sword Land,0,1,0,0,0,0,0,0,1,40000,6000.0,0.229,81349.0,68.0,False,07/26/2018,64,35,289,12,2021-05-25,271.9733046690001,verified,9.0
1900,Emblem Vault [Ethereum],0,0,0,0,0,0,0,1,0,21600,4700.0,0.028,4644.0,310.0,False,09/22/2017,53,18,131,18,2020-09-09,2476.1622834166537,approved,0.0
1901,Emblem Vault [Polygon],0,0,0,0,0,0,0,1,0,4600,940.0,0.005,4643.0,310.0,False,09/22/2017,53,18,131,18,2021-01-06,32.329399000000016,approved,0.0
1902,Emoji Keys,0,0,0,0,0,0,0,1,0,10000,1400.0,0.015,2829.0,79.0,False,11/13/2021,91,18,165,8,2021-11-30,38.88955089000006,approved,1300.0
1903,Endless Collab,1,0,0,0,0,0,0,0,0,32,14.0,0.06,17696.0,11093.0,False,07/06/2010,832,847,893,29,2021-10-21,0.94,not_requested,17.0
1904,Energy Sketch,1,0,0,0,0,0,0,0,0,110,57.0,0.1,6345.0,1639.0,False,03/20/2013,219,15,1630,6,2021-08-17,0.4,not_requested,0.0
1905,Enlightened Apez Saturn Club,0,1,0,0,0,0,0,1,0,1700,505.0,0.02,8061.0,1011.0,False,09/07/2021,28,12,63,7,2021-10-31,1.4229000000000005,not_requested,131.0
1906,Entities MultiPass,0,0,0,0,0,0,0,1,0,4000,1400.0,0.01,6049.0,216.0,False,07/25/2021,88,76,130,12,2021-09-01,0.4792000000000001,approved,0.0
1907,Epic Eagles225,1,0,0,0,0,0,0,0,0,27,4.0,0.09,142.0,562.0,False,08/26/2021,3,4,12,3,2021-10-21,0.75,not_requested,191.0
1908,EpoStory by ART AI,1,0,0,0,0,0,0,0,0,1300,767.0,0.3,16436.0,443.0,False,10/11/2019,109,76,390,42,2021-11-06,31.6979,not_requested,1.0
1909,Eric Lefaure's miscellaneous,1,0,0,0,0,0,0,0,0,6,10.0,0.1,21432.0,773.0,False,02/05/2018,6072,77,41951,89,2021-08-06,2.5000000000000004,not_requested,0.0
1910,Erik Siador,1,0,0,0,0,0,0,0,0,8,3.0,0.13,268.0,823.0,False,06/09/2012,6,4,18,2,2021-03-02,0.13,approved,0.0
1911,Erotic Mints,1,0,0,0,0,0,0,0,0,9,2.0,0.13,491.0,313.0,False,02/12/2014,11,17,95,5,2021-11-02,0.57,not_requested,0.0
1912,Erotical Art,1,0,0,0,0,0,0,0,0,101,1200.0,0.001,1532.0,449.0,False,11/11/2011,2,1,4,0,2021-10-31,0.0139599,not_requested,0.0
1913,Erto Collectibles,1,0,0,0,0,0,0,0,0,34,124.0,0.05,1491.0,1429.0,False,12/29/2020,30,16,60,9,2021-01-30,0.549,approved,74.0
1914,Escaped Souls,1,0,0,0,0,0,0,0,0,99,49.0,0.11,6461.0,644.0,False,10/06/2013,9,11,85,1,2021-08-13,0.03,approved,100.0
1915,Esoteric Memetics,0,0,0,0,0,0,0,0,1,225,7.0,0.003,416.0,224.0,False,06/12/2011,2,2,11,3,2021-03-15,0.001,not_requested,0.0
1916,Especial Orbs,1,0,0,0,0,0,0,0,0,265,216.0,0.03,2896.0,2867.0,False,01/19/2021,11,10,41,2,2021-09-02,0.02001,not_requested,18.0
1917,Essence of Africa - Vol 1,0,0,0,0,1,0,0,0,0,25,3.0,0.1,2222.0,2580.0,False,03/10/2009,10,19,38,2,2021-10-06,0.65,not_requested,17.0
1918,Eternal Butterfly,0,1,0,0,0,0,0,0,0,23,15.0,0.1,1214.0,1340.0,False,04/14/2021,1,6,6,0,2021-10-10,0.5750000000000001,not_requested,0.0
1919,Eternal Royals Official,0,1,0,0,0,0,0,0,0,9200,2000.0,0.02,5281.0,794.0,False,08/12/2021,50,101,85,11,2021-10-01,12.820789999999985,verified,413.0
1920,Eth Sneakz,0,1,0,0,0,0,0,0,0,125,37.0,0.045,31.0,12.0,False,11/01/2021,2,3,4,1,2021-03-22,0.225,not_requested,0.0
1921,EthEaters,0,1,0,0,0,0,0,0,0,577,61.0,0.01,9.0,4.0,False,12/19/2021,1,1,2,0,2021-08-31,0.3550000000000001,not_requested,169.0
1922,Ethemerals (MERALS),0,1,0,0,0,0,0,0,0,1000,258.0,0.042,593.0,486.0,False,05/09/2021,11,9,50,3,2021-09-25,0.8653,not_requested,270.0
1923,Ether Burrito,1,0,0,0,0,0,0,0,0,96,11.0,0.011,1572.0,290.0,False,08/28/2021,4,6,15,4,2021-08-28,0.045,not_requested,45.0
1924,Ether Cards Founder,0,0,0,0,0,0,1,0,0,10000,1600.0,0.278,19221.0,690.0,False,09/04/2016,167,37,199,5,2021-03-17,81.39433273379302,verified,119.0
1925,Ether Diamonds NFT,0,0,0,0,0,0,0,1,0,267,101.0,0.1,552.0,121.0,False,08/27/2021,26,5,126,10,2021-08-27,1.8000000000000005,not_requested,74.0
1926,Ether Elons,1,0,0,0,0,0,0,0,0,70,50.0,0.035,3027.0,2410.0,False,08/04/2011,80,26,152,7,2021-09-01,1.1751000000000005,not_requested,4.0
1927,Ether Iris,1,0,0,0,0,0,0,0,0,100,2.0,0.05,126.0,336.0,False,04/02/2009,0,2,5,1,2021-10-08,0.01,not_requested,0.0
1928,Ether Jam,0,0,0,0,0,1,1,0,0,26,164.0,0.01,124.0,141.0,False,05/17/2013,2,3,10,2,2021-03-01,3.130234323332357,approved,7.0
1929,Ether Legends,0,0,0,0,0,0,1,0,0,21900,2000.0,0.003,8450.0,464.0,False,12/10/2017,90,91,215,4,2019-09-03,0.07443,verified,149.0
1930,Ether Moon (NFT series),0,1,0,0,0,0,0,0,0,11,4.0,0.1,39.0,251.0,False,07/23/2021,4,2,9,2,2021-07-29,0.8,not_requested,52.0
1931,Ether Pillz V1,0,1,0,0,0,0,0,0,0,639,65.0,0.02,1434.0,4996.0,False,09/26/2020,6,6,20,1,2021-08-30,0.04,not_requested,0.0
1932,Ether Reindeers,0,1,0,0,0,0,0,0,0,1500,98.0,0.017,1061.0,655.0,False,11/05/2021,60,71,75,11,2021-12-16,1.2435000000000005,not_requested,428.0
1933,EtherBallCards,0,0,0,0,0,0,1,0,0,255,4.0,0.001,148.0,754.0,False,10/31/2021,2,1,2,1,2021-10-01,0.01,not_requested,0.0
1934,EtherBat Trading Cards,0,0,0,0,0,0,1,0,0,22,344.0,0.001,3255.0,3782.0,False,11/28/2017,7,3,14,1,2021-10-23,0.02505,not_requested,90.0
1935,EtherBears,1,1,0,0,0,0,0,0,0,5000,1300.0,0.015,736.0,228.0,False,03/20/2021,42,36,44,7,2021-03-19,3.17499,approved,76.0
1936,EtherCats,0,1,0,0,0,0,0,0,0,1500,401.0,0.009,844.0,14.0,False,11/21/2020,7,5,15,3,2021-01-18,0.12571,verified,69.0
1937,EtherCharm,0,1,0,0,0,0,0,0,0,100,3.0,0.08,853.0,4209.0,False,11/14/2021,2,3,9,3,2021-10-14,0.8799999999999999,not_requested,23.0
1938,EtherFishing,0,0,0,0,0,0,0,1,0,1000,258.0,0.06,2797.0,573.0,False,03/25/2021,75,45,81,9,2021-03-25,5.558435841049382,approved,336.0
1939,EtherFreakers,0,0,0,0,0,0,0,1,0,409,60.0,0.2,66.0,18.0,False,03/28/2021,3,1,6,1,2021-03-22,0.0001,not_requested,28.0
1940,EtherGals,1,0,0,0,0,0,0,0,0,5500,2300.0,0.011,4815.0,1075.0,False,08/24/2021,30,25,78,5,2021-09-24,67.04315233423253,approved,187.0
1941,EtherGlass,0,1,0,0,0,0,0,0,0,74,1200.0,0.004,2696.0,1973.0,False,08/30/2021,27,26,35,4,2021-08-28,0.56396,not_requested,37.0
1942,EtherLIVE,0,1,0,0,0,0,0,0,0,171,102.0,0.001,3023.0,973.0,False,03/28/2020,28,19,56,3,2021-09-17,0.0452999999999999,not_requested,0.0
1943,EtherLambos,0,1,0,0,0,0,0,0,0,1600,736.0,0.8,7323.0,1817.0,False,12/23/2017,81,77,281,19,2019-04-26,239.61069999999992,verified,65.0
1944,EtherMints,1,0,0,0,0,0,0,0,0,111,38.0,0.01,329.0,447.0,False,10/28/2021,7,3,21,3,2021-10-11,0.1321,not_requested,4.0
1945,EtherPebble,0,1,0,0,0,0,0,0,0,100,70.0,0.12,1033.0,440.0,False,04/11/2021,16,8,75,5,2021-04-17,0.41,not_requested,0.0
1946,EtherTulips (Legacy),0,1,0,0,0,0,0,0,0,7300,905.0,0.033,1947.0,611.0,False,12/21/2017,28,10,34,3,2019-04-26,124.9861490000001,verified,149.0
1947,Ethereal Collective Art Supporter,0,1,0,0,0,0,0,0,0,477,261.0,0.173,3952.0,653.0,False,10/06/2021,17,5,56,4,2021-10-23,2.9470000000000014,not_requested,1.0
1948,Ethereal Woman,1,0,0,0,0,0,0,0,0,25,23.0,1.0,2342.0,1363.0,False,12/30/2018,48,56,314,17,2021-11-13,3.18,not_requested,0.0
1949,Ethereum Card Collection | KriptoKrazed,0,0,0,0,0,0,1,0,0,4,10900.0,0.001,6757.0,12.0,False,07/28/2021,608,118,435,20,2021-10-02,0.0589916826815737,not_requested,4.0
1950,Ethereum Cash,0,0,0,0,0,0,0,1,0,9,302.0,0.049,346.0,737.0,False,09/04/2021,0,2,3,2,2021-11-07,0.000938,not_requested,0.0
1951,Ethereum Fear and Greed Index,0,1,0,0,0,0,0,0,0,100,55.0,0.039,91701.0,19.0,False,06/07/2021,83,29,625,8,2021-11-08,0.1879,not_requested,7.0
1952,Ethereum Folk Art2,1,0,0,0,0,0,0,0,0,92,39.0,0.008,5807.0,5508.0,False,08/15/2021,27,25,86,13,2021-08-26,0.121,not_requested,36.0
1953,Ethereum Homies,0,1,0,0,0,0,0,0,0,207,137.0,0.22,1927.0,167.0,False,12/31/2021,71,20,146,6,2021-08-23,1.43,not_requested,441.0
1954,Ethereum Homies Genesis Collection,0,1,0,0,0,0,0,0,0,84,50.0,0.65,1927.0,167.0,False,12/31/2021,71,20,146,6,2021-06-27,1.46069,not_requested,410.0
1955,Ethereum Towers,0,1,0,0,0,0,0,0,0,1700,947.0,0.4,15027.0,98.0,False,09/14/2021,1500,1489,1592,61,2021-09-13,167.6240598016371,approved,104.0
1956,Etheric City,0,0,0,0,0,0,0,0,1,78,13.0,0.015,632.0,1242.0,False,09/16/2021,10,4,20,2,2021-09-28,0.015,not_requested,34.0
1957,Etherium Art,0,0,0,0,0,0,0,1,0,20,288.0,0.004,3043.0,1569.0,False,12/09/2021,439,494,485,18,2021-09-21,0.08749,not_requested,0.0
1958,Etherium Art (Utility Edition),0,0,0,0,0,0,1,0,0,9,34.0,0.01,3043.0,1569.0,False,12/09/2021,439,494,485,18,2021-12-13,0.2952,not_requested,0.0
1959,Etherland,0,0,0,0,0,0,0,0,1,302,169.0,0.322,4167.0,243.0,False,10/29/2017,416,18,157,5,2020-12-03,14.820076186661248,verified,972.0
1960,Ethermon,0,1,0,0,0,0,0,0,0,294500,63700.0,0.001,19738.0,383.0,False,06/23/2020,133,69,162,8,2019-04-26,4.796279894434424,verified,327.0
1961,Ethermore,1,0,0,0,0,0,0,0,0,15000,2900.0,0.015,4301.0,417.0,False,02/20/2021,9,9,53,3,2021-05-15,2.7302000008,verified,138.0
1962,Ethernals Universe,0,1,0,0,0,0,0,0,0,2300,1000.0,0.01,6860.0,1027.0,False,09/12/2021,155,808,526,7,2021-10-15,0.5817999,not_requested,174.0
1963,Ethernity's Master Collection,0,0,0,0,0,0,1,0,0,21100,8800.0,0.019,112079.0,185.0,True,10/08/2020,110,75,742,16,2021-03-02,103.37787018334848,verified,128.0
1964,Etherworlds,0,0,0,0,0,0,0,0,1,415,85.0,0.01,460.0,16.0,False,03/15/2021,9,6,25,3,2021-04-10,0.06,not_requested,141.0
1965,Ethlings,0,1,0,0,0,0,0,0,0,7900,1100.0,0.008,4457.0,225.0,False,03/25/2021,20,24,65,19,2021-05-28,1.081939,verified,533.0
1966,Ethnic Animals,0,1,0,0,0,0,0,0,0,17,6.0,0.002,265.0,361.0,False,05/27/2021,2,5,6,2,2021-10-06,0.003,not_requested,1.0
1967,Ethside Union Member Card,0,1,0,0,0,0,0,0,0,2,90.0,0.029,3038.0,1630.0,False,08/02/2021,13,12,23,8,2021-09-07,0.3509,not_requested,1.0
1968,EulerBeats Genesis,0,0,0,1,0,0,0,0,0,54,460.0,1.5,13965.0,36.0,False,01/22/2021,7,11,31,3,2021-02-15,1.601,verified,97.0
1969,Evaverse,0,1,0,0,0,0,0,0,0,10000,3400.0,0.079,13857.0,1545.0,False,03/17/2021,170,157,227,17,2021-07-14,47.51513000000003,verified,87.0
1970,Event64,1,0,0,0,0,0,0,0,0,193,1100.0,0.001,6337.0,1032.0,False,02/25/2021,54,132,239,3,2021-09-11,0.0149109999999999,not_requested,1021.0
1971,Ever Growing Rubli,1,0,0,0,0,0,0,0,0,13,2.0,0.02,691.0,797.0,False,08/06/2021,2,4,9,0,2021-10-22,0.02,not_requested,20.0
1972,EverScapes,1,0,0,0,0,0,0,0,0,30500,4100.0,0.001,356.0,23.0,False,09/22/2021,74,55,60,5,2021-09-25,0.0226,not_requested,0.0
1973,Every Icon,1,0,0,0,0,0,0,0,0,512,292.0,0.21,769.0,107.0,False,11/08/2021,22,9,123,7,2021-12-10,8.779699999999997,not_requested,0.0
1974,Everything Is Dark Now,0,0,0,0,1,0,0,0,0,30,11.0,0.05,24881.0,993.0,False,07/22/2015,346,22,2218,9,2021-09-12,0.15,not_requested,0.0
1975,Everything of Art,1,0,0,0,0,0,0,0,0,42,1200.0,0.013,365.0,532.0,False,12/19/2021,9,7,36,3,2021-12-10,0.0522879999999999,not_requested,0.0
1976,Evil Teddy Bear Club,0,1,0,0,0,0,0,0,0,4100,1000.0,0.005,6057.0,233.0,False,08/11/2021,279,269,277,8,2021-08-16,0.3729,approved,184.0
1977,EvoSnails NFT,0,1,0,0,0,0,0,0,0,5600,869.0,0.06,6668.0,130.0,False,10/06/2021,520,553,588,33,2021-11-01,22.03428899999,approved,227.0
1978,Exeedme MLP Moments Packs,0,1,0,0,0,0,0,0,0,3,140.0,0.004,50433.0,105.0,False,04/20/2018,40,21,222,15,2021-08-30,0.038,not_requested,0.0
1979,Exoplanets: The 4001 Project.,0,1,0,0,0,0,0,0,0,4000,920.0,0.009,1632.0,518.0,False,04/11/2021,48,10,88,6,2021-05-29,0.5011000852828297,verified,1863.0
1980,Expandables Official,0,1,0,0,0,0,0,0,0,3500,899.0,0.028,2626.0,72.0,False,10/20/2021,365,409,391,11,2021-12-06,46.864177999000056,not_requested,256.0
1981,ExpansionPunks,0,1,0,0,0,0,0,0,0,10000,3100.0,0.34,20287.0,303.0,False,07/07/2021,167,72,448,24,2021-08-15,2477.185821572119,approved,0.0
1982,Experimental Drone Shorts,1,0,0,0,0,0,0,0,0,7,3.0,0.05,408.0,128.0,False,09/22/2016,10,2,57,3,2021-06-28,0.07,not_requested,0.0
1983,Experimental Project,1,0,0,0,0,0,0,0,0,7,3.0,0.025,1142.0,3022.0,False,10/09/2021,1,1,3,0,2021-11-19,0.2,not_requested,0.0
1984,Experiments with AI,1,0,0,0,0,0,0,0,0,7,3.0,0.04,1129.0,681.0,False,09/04/2021,3,4,13,2,2021-11-16,0.042,not_requested,0.0
1985,Explore the Alps,0,0,0,0,1,0,0,0,0,12,1.0,0.25,3091.0,798.0,False,05/11/2019,38,61,380,1,2021-09-24,0.25,not_requested,0.0
1986,Exploring Crystals,1,0,0,0,0,0,0,0,0,36,4.0,0.009,546.0,800.0,False,06/11/2013,4,4,17,3,2021-11-25,0.5,not_requested,0.0
1987,Explosion Series,0,1,0,0,0,0,0,0,0,1,5.0,0.02,9535.0,1075.0,False,08/26/2010,71,156,646,15,2021-07-26,0.02,not_requested,1.0
1988,Explosion of Color - THE RESERVE,1,0,0,0,0,0,0,0,0,3,3.0,22.0,3078.0,2.0,False,09/10/2021,20,32,128,11,2021-09-17,3.2,approved,0.0
1989,Explosion of Color by AIIV,1,0,0,0,0,0,0,0,0,100,74.0,2.5,3078.0,2.0,False,09/10/2021,20,32,128,11,2021-09-10,5.13,verified,0.0
1990,ExpressionismHub,1,0,0,0,0,0,0,0,0,610,223.0,0.001,40008.0,535.0,False,02/06/2011,15,17,16,1,2021-07-12,0.004633,not_requested,1.0
1991,Expressionist Collection,1,0,0,0,0,0,0,0,0,23,4.0,0.06,241.0,247.0,False,11/10/2021,9,23,88,5,2021-12-16,0.14,not_requested,0.0
1992,Exterior,1,0,0,0,0,0,0,0,0,150,88.0,0.14,847.0,304.0,False,03/28/2013,9,4,57,2,2021-08-20,0.201,verified,0.0
1993,Eyes of Destiny [GEN 2],0,1,0,0,0,0,0,0,0,100,22.0,0.05,13360.0,6058.0,False,04/21/2021,227,22,219,4,2021-11-04,0.15,not_requested,3.0
1994,F1 Delta Time,0,1,0,0,0,1,0,0,0,39200,1700.0,0.001,40166.0,131.0,False,01/15/2019,21,7,52,1,2019-05-23,10.550353740000002,verified,344.0
1995,FACA (Fine-Ass CryptoApes),0,1,0,0,0,0,0,0,0,1800,642.0,0.003,3965.0,1246.0,False,08/10/2021,90,88,118,46,2021-09-15,0.1454,not_requested,206.0
1996,FACEMETA,1,0,0,0,0,0,0,0,0,46,2.0,0.5,16.0,277.0,False,03/02/2020,1,1,3,0,2021-11-20,0.05,not_requested,0.0
1997,FACES by Kiggs,1,0,0,0,0,0,0,0,0,48,96.0,0.1,3891.0,4573.0,False,12/25/2015,19,7,34,1,2021-07-07,1.3770000000000002,not_requested,4.0
1998,FAETECH SPACESHIPS,0,1,0,0,0,0,0,0,0,102,58.0,0.01,3654.0,2134.0,False,02/28/2011,3,5,15,1,2021-10-01,0.0755,not_requested,47.0
1999,FAMILIJA #1,1,0,0,0,0,0,0,0,0,40,3.0,0.025,1642.0,565.0,False,02/19/2009,10,8,42,1,2021-10-07,0.014,not_requested,0.0
2000,FATBOIS by GOMEZ,0,1,0,0,0,0,0,0,0,1600,246.0,0.003,256.0,376.0,False,09/14/2021,69,72,66,4,2021-09-25,0.22285,not_requested,103.0
2001,FEEL GOOD NFT,0,0,0,0,0,0,0,1,0,2200,810.0,0.018,10664.0,703.0,False,09/15/2021,200,232,225,5,2021-10-13,0.9367000000000002,not_requested,83.0
2002,FEWK; Far East White Kingdom Collaboration Collection on Polygon/Matic,0,1,0,0,0,0,0,0,0,34,101.0,0.02,2638.0,4558.0,False,07/18/2021,59,23,81,4,2021-11-06,1.3881800000000006,not_requested,0.0
2003,FEWK; Far East White Kingdom Universe NFT Art Card Collection.,0,1,0,0,0,0,0,0,0,111,90.0,0.02,2638.0,4558.0,False,07/18/2021,59,23,81,4,2021-10-11,1.415,not_requested,0.0
2004,FEWOCiOUS,1,0,0,0,0,0,0,0,0,1700,738.0,1.83,101281.0,1758.0,True,07/21/2015,176,180,1292,39,2020-10-31,194.77139000000005,verified,17.0
2005,FF Street Photography,0,0,0,0,1,0,0,0,0,1000,14.0,0.01,1853.0,1196.0,False,08/28/2009,3,2,12,1,2021-07-30,0.02,not_requested,0.0
2006,FF00FFink Drawings,1,0,0,0,0,0,0,0,0,27,13.0,0.015,1217.0,662.0,False,11/23/2014,27,5,125,2,2021-10-19,0.019,not_requested,0.0
2007,FILM SOULS,0,0,0,0,1,0,0,0,0,60,7.0,0.07,1573.0,2368.0,False,03/28/2021,5,7,12,3,2021-09-05,0.07,not_requested,0.0
2008,FINALLY FREE Collection,1,0,0,0,0,0,0,0,0,8,2.0,0.033,22.0,18.0,False,08/16/2021,3,1,6,1,2021-09-12,0.033,not_requested,10.0
2009,FINGERZ,1,0,0,0,0,0,0,0,0,557,2.0,0.001,36.0,16.0,False,02/08/2018,3,3,11,3,2021-12-08,0.01,not_requested,26.0
2010,FLASH FRIENDS!,0,1,0,0,0,0,0,0,0,39,25.0,0.05,2725.0,247.0,False,07/02/2018,333,37,3895,13,2021-09-24,0.1,not_requested,0.0
2011,FLUF World,0,1,0,0,0,0,0,0,0,10000,3600.0,3.375,24096.0,1107.0,False,07/08/2021,1088,1029,1428,181,2021-08-05,7154.727550353039,verified,299.0
2012,FLUF World: Thingies,0,1,0,0,0,0,0,0,0,9100,2700.0,0.99,24096.0,1107.0,False,07/08/2021,1088,1029,1428,181,2021-10-19,968.4166156343406,verified,0.0
2013,FM Gallery,1,0,0,0,0,0,0,0,0,81,282.0,0.02,5727.0,161.0,False,02/19/2021,58,18,372,6,2021-03-20,1.04,verified,0.0
2014,FOMOPOETS [Special Editions],1,0,0,0,0,0,0,0,0,13,12.0,0.012,871.0,1492.0,False,03/29/2021,12,10,66,5,2021-11-05,0.0096424801505339,not_requested,3.0
2015,FOR YOUR SMILE,1,0,0,0,0,0,0,0,0,3,2.0,0.04,512.0,547.0,False,08/20/2021,1,3,2,0,2021-09-04,0.04,not_requested,2.0
2016,FOREVERLANDS Explorer,0,0,0,0,0,0,0,1,0,1,693.0,0.089,4402.0,260.0,False,09/27/2021,36,18,184,8,2021-12-13,2.84388888888,not_requested,0.0
2017,FOZIE,1,0,0,0,0,0,0,0,0,15,19.0,0.02,51.0,24.0,False,03/18/2021,1,4,8,3,2021-11-12,0.145,not_requested,0.0
2018,FREAKOLOCOS! - by Jon Lovac,1,1,0,0,0,0,0,0,0,168,129.0,0.016,5641.0,5877.0,False,04/01/2021,15,7,40,1,2021-03-29,0.053,not_requested,260.0
2019,FRUIT RANGERS,0,1,0,0,0,0,0,0,0,26,15.0,0.008,4119.0,4478.0,False,08/14/2021,3,11,69,1,2021-08-19,0.065,not_requested,0.0
2020,FRXCTALS,1,0,0,0,0,0,0,0,0,8,5.0,0.04,253.0,388.0,False,09/01/2020,1,3,23,2,2021-08-14,0.04,not_requested,0.0
2021,FTBLV First Collection,0,0,0,0,0,1,0,0,0,26,2.0,0.001,270.0,2616.0,False,11/22/2021,4,4,16,3,2021-12-12,0.0005,not_requested,58.0
2022,FTP (For The People),0,0,0,0,1,0,0,0,0,60,44.0,0.05,3966.0,2356.0,False,04/10/2021,11,7,44,2,2021-08-31,0.715,approved,5.0
2023,FUR BRAWLS - Dark Bunnies,0,1,0,0,0,0,0,0,0,4400,1700.0,0.016,13873.0,833.0,False,07/28/2021,362,360,447,36,2021-08-25,6.639591,verified,195.0
2024,FUR BRAWLS - Light Bunnies,0,1,0,0,0,0,0,0,0,4500,1700.0,0.02,13873.0,833.0,False,07/28/2021,362,360,447,36,2021-08-25,7.540170999999994,verified,194.0
2025,FUTURE IS YOUNG,0,0,0,0,1,0,0,0,0,22,4.0,0.2,2165.0,2825.0,False,07/18/2017,2,5,18,0,2021-10-24,0.2,not_requested,0.0
2026,FabeeoBreen,0,0,0,0,0,0,0,0,1,71,14.0,0.03,426.0,309.0,False,02/21/2021,14,8,35,3,2020-12-28,0.438,approved,0.0
2027,Fabric Punks,0,1,0,0,0,0,0,0,0,26,3.0,0.09,29674.0,113.0,False,05/10/2021,184,354,369,120,2021-10-03,0.06,not_requested,0.0
2028,Fabulous Fancy Fish NFT V2,0,1,0,0,0,0,0,0,0,3300,194.0,0.001,64.0,223.0,False,01/07/2021,39,20,42,2,2021-10-02,0.01155,not_requested,221.0
2029,Face Mask 2020,1,0,0,0,0,0,0,0,0,11,2.0,0.12,190.0,573.0,False,03/19/2021,4,3,9,2,2021-10-09,0.1,not_requested,27.0
2030,Face of Blanks,1,0,0,0,0,0,0,0,0,10,2.0,0.05,1019.0,291.0,False,10/10/2021,16,5,31,6,2021-10-11,0.15,not_requested,29.0
2031,FaceArt NFT,1,0,0,0,0,0,0,0,0,105,5.0,0.01,826.0,1125.0,False,02/18/2021,5,4,21,2,2021-08-25,0.05,not_requested,0.0
2032,Faceless Dimension,1,0,0,0,0,0,0,0,0,25,18.0,0.17,118.0,95.0,False,10/07/2021,4,6,21,4,2021-02-20,1.13,approved,0.0
2033,Faceless Portraits,1,0,0,0,0,0,0,0,0,361,179.0,0.03,522.0,53.0,False,11/07/2021,93,14,116,5,2021-06-25,0.085,not_requested,0.0
2034,Faces By Babo,1,0,0,0,0,0,0,0,0,43,6.0,0.05,971.0,1940.0,False,06/28/2021,6,4,10,1,2021-08-01,0.07,not_requested,21.0
2035,Faces of Khlongtoey - Black & White Street Portraits from a Bangkok You've Never Seen,0,0,0,0,1,0,0,0,0,36,7.0,0.3,2586.0,2080.0,False,04/12/2021,11,11,57,1,2021-09-19,0.8999999999999999,not_requested,0.0
2036,Faces of Open Source,0,0,0,0,1,0,0,0,0,10,10.0,0.05,2485.0,736.0,False,06/07/2017,227,4,652,7,2021-03-18,0.3999999999999999,not_requested,129.0
2037,Faces of Zanzibar,1,0,0,0,0,0,0,0,0,12,2.0,0.2,2032.0,2998.0,False,04/22/2021,38,769,593,2,2021-12-11,0.2,not_requested,0.0
2038,"Faces, moments, and Japan",0,0,0,0,1,0,0,0,0,9,5.0,0.1,1011.0,1144.0,False,11/29/2018,5,15,31,3,2021-09-01,0.1,not_requested,18.0
2039,FacialPunks - ETH 6Yrs,0,1,0,0,0,0,0,0,0,140,21.0,0.096,26.0,81.0,False,09/09/2021,9,2,8,1,2021-09-07,0.2,not_requested,0.0
2040,Factory girl (FTG),1,0,0,0,0,0,0,0,0,31,19.0,0.016,984.0,549.0,False,08/05/2021,262,214,294,2,2021-12-16,0.29197645,not_requested,80.0
2041,Faded Dreams,0,0,0,0,1,0,0,0,0,40,6.0,0.1,4387.0,522.0,False,05/19/2021,492,24,3100,14,2021-09-22,0.5,not_requested,0.0
2042,Fairy market,1,0,0,0,0,0,0,0,0,19,31.0,0.009,1560.0,639.0,False,09/04/2019,6,9,68,2,2021-12-07,0.134,not_requested,2.0
2043,False Ape Yacht Club (FAYC),0,1,0,0,0,0,0,0,0,84,78.0,0.01,1077.0,2984.0,False,07/06/2021,102,99,119,7,2021-08-30,0.2995,not_requested,149.0
2044,FameLadySquad,1,0,0,0,0,0,0,0,0,8900,3700.0,0.12,20234.0,3571.0,False,08/10/2021,9,8,45,1,2021-07-12,196.62797526309157,verified,196.0
2045,Famous Ape Movie Club (Official),0,1,0,0,0,0,0,0,0,160,109.0,0.04,5413.0,419.0,False,11/11/2021,591,661,637,44,2021-12-05,0.4199999999999999,not_requested,177.0
2046,Famous ApeMovie,0,1,0,0,0,0,0,0,0,16,2.0,0.08,5413.0,419.0,False,11/11/2021,591,661,637,44,2021-11-14,0.1,not_requested,0.0
2047,Famous Giants,1,0,0,0,0,0,0,0,0,7,9.0,0.98,2935.0,455.0,False,03/24/2011,3553,82,46704,171,2021-11-03,0.02,not_requested,6.0
2048,Famous Historical Figures,1,0,0,0,0,0,0,0,0,57,17.0,0.001,3.0,4.0,False,09/18/2021,0,1,4,2,2021-09-05,0.002,not_requested,40.0
2049,Famous Monkey Club,0,1,0,0,0,0,0,0,0,100,64.0,0.5,476.0,40.0,False,09/20/2021,3,2,7,0,2021-09-24,3.2900000000000005,not_requested,132.0
2050,Famous Polygonians - Male Edition,1,0,0,0,0,0,0,0,0,2000,71.0,0.001,346.0,1379.0,False,09/01/2021,0,1,1,0,2021-09-09,0.3094140000000003,not_requested,5.0
2051,Fan Futures,0,0,0,0,0,1,0,0,0,32,34.0,0.001,678.0,260.0,False,06/22/2021,2,5,8,2,2021-08-16,0.07,not_requested,0.0
2052,Fanart / CryptoNinja,1,0,0,0,0,0,0,0,0,5,12.0,0.005,528.0,140.0,False,05/30/2021,16,4,33,3,2021-10-06,0.002,not_requested,5.0
2053,Fanart Collection,1,0,0,0,0,0,0,0,0,2,2.0,0.04,10345.0,926.0,False,03/05/2016,801,8,4017,0,2021-11-20,0.05,not_requested,0.0
2054,Fanart by mowmow,1,0,0,0,0,0,0,0,0,7,9.0,0.001,579.0,641.0,False,09/19/2021,10,5,27,1,2021-10-02,0.00265,not_requested,0.0
2055,Fanatic Stickers,1,0,0,0,0,0,0,0,0,56,226.0,0.002,2556.0,1020.0,False,09/29/2021,4,8,57,5,2021-10-03,0.058,not_requested,6.0
2056,Fanatical Boy,1,0,0,0,0,0,0,0,0,9,39.0,0.02,1862.0,985.0,False,07/08/2013,8,9,57,1,2021-08-27,0.02,not_requested,25.0
2057,Fang Gang,0,1,0,0,0,0,0,0,0,8900,4100.0,0.289,23814.0,506.0,False,06/28/2021,394,129,909,38,2021-08-28,600.4026975517932,verified,184.0
2058,Fang Gang Goodies,0,1,0,0,0,0,0,0,0,17,3600.0,0.004,23814.0,506.0,False,06/28/2021,394,129,909,38,2021-10-30,0.6719050969000001,not_requested,0.0
2059,FantastiCat,1,0,0,0,0,0,0,0,0,17,6.0,0.012,1522.0,2989.0,False,04/03/2021,2,2,4,0,2021-11-18,0.0123,not_requested,2.0
2060,FantasticAlien,0,1,0,0,0,0,0,0,0,10000,811.0,0.001,264.0,346.0,False,04/20/2021,8,9,17,2,2021-11-21,0.5288679999900003,not_requested,98.0
2061,Fantasy Islands - Sandbox,0,0,0,0,0,0,0,1,0,7,600.0,0.14,11872.0,999.0,False,10/15/2016,265,102,1106,23,2021-08-20,62.098422999999976,verified,0.0
2062,Fantasy Queens,1,0,0,0,0,0,0,0,0,199,14.0,0.003,2567.0,7.0,False,09/20/2021,26,11,116,6,2021-09-19,0.0375,not_requested,1.0
2063,Fantrade,0,0,0,0,0,1,0,0,0,316,14.0,0.005,14.0,360.0,False,01/12/2021,6,5,8,0,2021-08-30,2.31e-05,not_requested,2.0
2064,Far West Texas: Landscapes,1,0,0,0,0,0,0,0,0,36,5.0,0.045,625.0,996.0,False,10/28/2021,0,1,4,1,2021-11-09,0.7200000000000001,not_requested,0.0
2065,Fara Land,0,1,0,0,0,0,0,0,0,20,2.0,0.065,145947.0,55.0,False,04/10/2021,853,287,1090,241,2021-09-18,0.049,not_requested,0.0
2066,Farah's Labyrinth,1,0,0,0,0,0,0,0,0,8,186.0,0.017,3571.0,908.0,False,07/06/2012,397,404,455,11,2021-07-30,0.1386,approved,4.0
2067,Faraland NFT,0,1,0,0,0,0,0,0,0,20,4.0,0.049,145947.0,55.0,False,04/10/2021,853,287,1090,241,2021-09-18,0.325,not_requested,0.0
2068,Farmer Apes (FAYC),0,1,0,0,0,0,0,0,0,535,296.0,0.005,13299.0,954.0,False,10/30/2021,69,57,97,4,2021-12-13,5.833489999999999,not_requested,131.0
2069,Farmers Marketverse Patrons,0,1,0,0,0,0,0,0,0,5000,1500.0,0.01,6350.0,2390.0,False,07/06/2021,51,37,57,4,2021-08-31,0.6876800000000003,not_requested,207.0
2070,Farsite Blueprints,0,1,0,0,0,0,0,0,0,2200,404.0,0.081,53821.0,1.0,False,09/01/2020,5885,3097,5917,5109,2021-05-31,0.53,not_requested,3.0
2071,Farsite Ship Hulls,0,1,0,0,0,0,0,0,0,2600,543.0,0.022,53821.0,1.0,False,09/01/2020,5885,3097,5917,5109,2021-05-31,0.407,approved,9.0
2072,Fast Food Apes Club,0,1,0,0,0,0,0,0,0,500,20.0,0.008,280.0,258.0,False,07/04/2021,24,25,29,3,2021-10-04,0.072,approved,71.0
2073,Fast Food Baby Punks,0,1,0,0,0,0,0,0,0,987,459.0,0.024,2236.0,401.0,False,08/08/2021,27,25,53,2,2021-08-07,0.4962,requested,0.0
2074,Fast Food Baby Punks 3D,0,1,0,0,0,0,0,0,0,490,169.0,0.008,1398.0,706.0,False,08/12/2021,682,748,830,52,2021-08-11,0.045,not_requested,70.0
2075,Fast Food Bored Apes Official,0,1,0,0,0,0,0,0,0,27,17.0,0.125,14.0,9.0,False,04/07/2021,4,4,8,0,2021-08-14,0.2648,not_requested,0.0
2076,Fast Food DOS Punks,0,1,0,0,0,0,0,0,0,111,15.0,0.01,260.0,388.0,False,04/11/2021,5,1,24,0,2021-10-11,0.01,not_requested,0.0
2077,Fast Food Frens Collection,0,1,0,0,0,0,0,0,0,5600,1900.0,0.07,7763.0,1236.0,False,08/09/2021,12,14,77,2,2021-08-28,18.773269999999997,approved,102.0
2078,Fast Food Lil Baby Apes Club,0,1,0,0,0,0,0,0,0,2000,802.0,0.001,370.0,33.0,False,11/15/2021,50,44,84,12,2021-11-15,0.22782,not_requested,114.0
2079,Fast Food Meebits,0,1,0,0,0,0,0,0,0,1000,391.0,0.001,899.0,25.0,False,08/07/2021,359,385,345,6,2021-08-05,0.0931,not_requested,224.0
2080,Fast Food Penguins,0,1,0,0,0,0,0,0,0,1500,754.0,0.015,1558.0,1409.0,False,08/10/2021,2,3,11,1,2021-08-11,0.4139900000000002,approved,30.0
2081,Fast Food Punks,0,1,0,0,0,0,0,0,0,1000,347.0,0.3,17278.0,1079.0,False,06/19/2021,14,18,60,4,2021-06-30,17.653467599999995,approved,2.0
2082,Fast Food Punks Burgers,0,1,0,0,0,0,0,0,0,708,349.0,0.015,17278.0,1079.0,False,06/19/2021,14,18,60,4,2021-10-10,0.24,not_requested,70.0
2083,Fast Food Punks ERC-721,0,1,0,0,0,0,0,0,0,359,187.0,0.45,17278.0,1079.0,False,06/19/2021,14,18,60,4,2021-11-13,7.657,not_requested,111.0
2084,Fast Food Splatter Punks!,0,1,0,0,0,0,0,0,0,666,234.0,0.015,1300.0,739.0,False,08/09/2021,11,7,29,7,2021-08-11,0.01880110000001,not_requested,0.0
2085,Fast Food Wolf Game (FFWG),0,0,0,0,0,0,0,1,0,45800,694.0,0.003,1576.0,15.0,False,11/26/2021,291,276,344,21,2021-12-07,32.808007995656546,not_requested,172.0
2086,Fast Food XCopy Punks,1,0,0,0,0,0,0,0,0,367,6.0,0.01,799.0,768.0,False,05/11/2020,13,4,39,3,2021-12-05,0.03,not_requested,0.0
2087,Fast Food Zunks,1,0,0,0,0,0,0,0,0,350,64.0,0.005,130.0,94.0,False,08/15/2021,32,30,42,4,2021-08-10,0.01,not_requested,0.0
2088,Fat Ape Club,1,0,0,0,0,0,0,0,0,10000,5400.0,0.093,31746.0,9.0,False,10/12/2021,1897,4716,5242,186,2021-10-31,65.29152689150003,approved,156.0
2089,Fat Ape Rocket Crew,0,1,0,0,0,0,0,0,0,10000,276.0,0.005,689.0,2093.0,False,08/31/2021,7,4,13,2,2021-09-11,0.1397,not_requested,78.0
2090,Fat Ape Yacht Club,0,1,0,0,0,0,0,0,0,100,2.0,0.08,0.0,1.0,False,10/30/2021,0,0,0,0,2021-10-30,0.08,not_requested,0.0
2091,Fat Punks Official,0,1,0,0,0,0,0,0,0,999,450.0,0.01,177.0,3.0,False,08/30/2021,23,9,29,1,2021-09-01,1.08423,not_requested,64.0
2092,FatPenguins,0,1,0,0,0,0,0,0,0,999,60.0,0.02,1045.0,1905.0,False,06/22/2021,5,4,20,0,2021-11-09,1.260000000000001,approved,0.0
2093,Fatales,0,1,0,0,0,0,0,0,0,10000,3500.0,0.015,8045.0,115.0,False,08/29/2021,117,107,173,15,2021-08-30,147.89014768122763,verified,190.0
2094,Fatrido,0,0,0,0,0,0,1,0,0,152,113.0,0.001,629.0,304.0,False,10/10/2021,49,50,61,6,2021-09-23,0.0006,not_requested,32.0
2095,Fatty Penguin,1,0,0,0,0,0,0,0,0,12,3.0,0.015,503.0,138.0,False,12/18/2009,1,1,6,2,2021-10-24,0.02,not_requested,18.0
2096,Favourite NFTs,0,0,0,0,1,0,0,0,0,4,1.0,0.3,507.0,1644.0,False,04/28/2021,0,1,4,0,2021-11-20,2.0,not_requested,24.0
2097,FayleSof,1,0,0,0,0,0,0,0,0,60,20.0,0.003,284.0,637.0,False,07/17/2020,0,2,1,0,2021-11-20,0.092,not_requested,145.0
2098,Fecoliths,0,1,0,0,0,0,0,0,0,91,41.0,0.012,101.0,216.0,False,03/10/2021,4,1,7,1,2021-08-10,0.02,not_requested,113.0
2099,Felix da Cat,1,0,0,0,0,0,0,0,0,100,44.0,0.05,8641.0,271.0,False,03/26/2014,111,7,755,4,2021-09-11,0.13,not_requested,0.0
2100,FemPunks,1,0,0,0,0,0,0,0,0,22,4.0,0.03,94.0,266.0,False,11/04/2021,3,1,6,2,2021-11-05,0.08,not_requested,0.0
2101,Feminist Protest,1,0,0,0,0,0,0,0,0,12,22.0,0.05,4648.0,1447.0,False,06/12/2019,59,22,310,8,2021-09-19,0.8,not_requested,0.0
2102,Feral File #009 - Unsupervised,1,0,0,0,0,0,0,0,0,567,300.0,0.15,6210.0,686.0,False,11/03/2020,22,6,95,4,2021-11-25,40.80671000000001,approved,0.0
2103,Fermata Collection,1,0,0,0,0,0,0,0,0,46,77.0,0.22,4991.0,3014.0,False,07/21/2014,25,13,98,5,2021-04-08,1.866397540043126,not_requested,0.0
2104,Ferrati Peace Club,0,1,0,0,0,0,0,0,0,1400,923.0,0.025,349.0,112.0,False,08/26/2021,56,67,68,17,2021-09-15,0.0694999999999999,not_requested,95.0
2105,Feudalz,0,1,0,0,0,0,0,0,0,4400,386.0,0.25,14438.0,51.0,False,09/24/2021,160,133,187,6,2021-11-21,237.5103980032308,approved,95.0
2106,Feudalz Elvez,0,1,0,0,0,0,0,0,0,2000,667.0,0.025,14438.0,51.0,False,09/24/2021,160,133,187,6,2021-12-04,5.2006099999999975,approved,86.0
2107,Feudalz Landz,0,1,0,0,0,0,0,0,0,4100,1500.0,0.072,14438.0,51.0,False,09/24/2021,160,133,187,6,2021-12-13,107.6929856238999,not_requested,155.0
2108,Feudalz Orcz,0,1,0,0,0,0,0,0,0,4900,810.0,0.037,14438.0,51.0,False,09/24/2021,160,133,187,6,2021-12-04,13.313659995896488,not_requested,56.0
2109,FiRez's Pixel Art,1,0,0,0,0,0,0,0,0,6,6.0,0.02,21581.0,2348.0,False,11/12/2018,52,4,394,1,2021-02-24,0.0249,approved,0.0
2110,Fibonacci Absolute Punks,0,1,0,0,0,0,0,0,0,81,6.0,0.045,12801.0,66.0,False,06/28/2021,509,201,503,14,2021-10-11,0.05,not_requested,245.0
2111,Fibonacci checks,0,1,0,0,0,0,0,0,0,5100,299.0,0.005,36.0,97.0,False,09/12/2021,1,3,4,0,2021-09-08,0.023,not_requested,0.0
2112,Fictional Punks,0,1,0,0,0,0,0,0,0,1000,7.0,0.01,1695.0,1152.0,False,04/02/2021,3,12,12,4,2021-05-10,0.02,not_requested,65.0
2113,Fictitious Advertising SNNS,1,0,0,0,0,0,0,0,0,15,19.0,0.01,712.0,348.0,False,10/22/2021,4,7,50,2,2021-11-27,0.2499999999999999,not_requested,0.0
2114,Fifty days by Boine,1,0,0,0,0,0,0,0,0,50,7.0,0.1,635.0,958.0,False,04/09/2009,3,3,15,2,2021-10-27,0.92,not_requested,2.0
2115,Fighter punks nft,0,1,0,0,0,0,0,0,0,38,12.0,0.001,36.0,26.0,False,11/30/2021,3,3,9,4,2021-11-21,0.1048,not_requested,8.0
2116,FighterNFT,0,1,0,0,0,0,0,0,0,13,5.0,0.025,409.0,257.0,False,08/03/2021,1,1,6,1,2021-08-11,0.05,not_requested,32.0
2117,Fighting Punks,0,0,0,0,0,1,0,0,0,34,13.0,0.1,3527.0,107.0,False,06/03/2016,20,22,48,5,2021-08-30,0.5,not_requested,0.0
2118,Figure Punks,0,1,0,0,0,0,0,0,0,454,35.0,0.01,212.0,140.0,False,08/20/2021,5,6,11,2,2021-08-13,1.3199800000000002,not_requested,0.0
2119,FigureHedz - Fiat Disruption,0,1,0,0,0,0,0,0,0,20,2.0,0.05,54.0,72.0,False,03/20/2021,17,7,20,2,2021-04-23,0.05,not_requested,29.0
2120,Figureverse,0,1,0,0,0,0,0,0,0,472,234.0,0.04,4679.0,1226.0,False,10/11/2021,350,345,411,9,2021-12-01,1.6825,not_requested,155.0
2121,Filaments - Generative Pixel Art,1,0,0,0,0,0,0,0,0,500,358.0,0.88,10610.0,1389.0,False,08/25/2021,85,76,579,13,2021-10-26,49.86942069420694,approved,45.0
2122,Film Punks,0,0,0,0,1,0,0,0,0,101,42.0,0.039,569.0,472.0,False,08/06/2021,98,29,96,2,2021-08-09,0.66,not_requested,59.0
2123,Film Rekindled,0,0,0,0,1,0,0,0,0,36,2.0,0.02,978.0,342.0,False,05/17/2020,4,9,15,1,2021-10-22,0.04,not_requested,8.0
2124,Fin Arts,1,0,0,0,0,0,0,0,0,22,491.0,0.001,1968.0,1181.0,False,07/18/2019,12,23,46,3,2021-09-05,0.0127099999999999,not_requested,6.0
2125,Final NFT,0,1,0,0,0,0,0,0,0,21,3.0,0.001,1220.0,645.0,False,08/26/2021,3,2,20,1,2021-08-29,0.011,not_requested,0.0
2126,Finding Paradise,0,0,0,0,1,0,0,0,0,6,5.0,2.0,2372.0,1531.0,False,09/17/2021,11,13,55,1,2021-11-11,0.7000000000000001,not_requested,0.0
2127,Fine Art Conceptual Portraits,1,1,0,0,0,0,0,0,0,12,2.0,1.0,10499.0,46.0,False,02/08/2012,35,9,215,5,2021-03-21,2.05,not_requested,1.0
2128,Fine Art Punks,1,1,0,0,0,0,0,0,0,899,338.0,0.03,1816.0,1173.0,False,01/22/2021,10,3,24,2,2021-02-26,0.100004,approved,121.0
2129,Fine Wearables,0,1,0,0,0,0,0,0,0,231,189.0,0.001,2542.0,2569.0,False,07/14/2017,1,2,10,0,2021-05-11,0.0415,approved,264.0
2130,FingerX,0,1,0,0,0,0,0,0,0,349,130.0,0.049,4018.0,1072.0,False,05/23/2021,1140,112,474,9,2021-06-02,6.455999999999997,approved,900.0
2131,Finns Punks,1,0,0,0,0,0,0,0,0,111,46.0,0.003,1856.0,603.0,False,08/05/2021,32,395,278,3,2021-08-23,0.077,not_requested,1.0
2132,FireBot.gg,0,1,0,0,0,0,0,0,0,10000,145.0,0.081,5650.0,0.0,False,09/27/2021,14,21,19,3,2021-10-30,34.69109999999999,approved,118.0
2133,FireStarter Metaverse Champion Hiros,0,1,0,0,0,0,0,0,0,200,15.0,0.04,59660.0,149.0,False,03/02/2021,910,385,1680,49,2021-10-13,0.562,not_requested,0.0
2134,First Ever NFT Soccer Team,0,0,0,0,0,1,0,0,0,170,39.0,0.04,6938.0,544.0,False,08/29/2021,1,1,2,0,2021-09-09,5.39,not_requested,8.0
2135,First First NFTs,1,0,0,0,0,0,0,0,0,5000,1800.0,0.08,32206.0,905.0,False,02/20/2021,22,52,474,6,2021-09-06,21.164200000000008,verified,0.0
2136,First Rose by tamaco,1,0,0,0,0,0,0,0,0,7,2.0,0.003,394.0,739.0,False,09/02/2021,2,3,18,2,2021-10-18,0.003,not_requested,0.0
2137,Fishbowl Heads,0,1,0,0,0,0,0,0,0,1500,671.0,0.015,3404.0,69.0,False,07/20/2021,185,194,403,158,2021-10-29,1.4319999999999995,approved,242.0
2138,Fishes in the water,1,0,0,0,0,0,0,0,0,3,34.0,0.005,1295.0,1478.0,False,03/23/2021,2,1,4,1,2021-12-06,0.015,not_requested,0.0
2139,Fishtank-NFT,1,0,0,0,0,0,0,0,0,540,183.0,0.087,687.0,703.0,False,10/06/2021,15,13,27,9,2021-11-08,1.7150000000000003,not_requested,181.0
2140,Fiumani,1,1,0,0,0,0,0,0,0,19,12.0,0.1,188.0,514.0,False,06/30/2019,6,5,21,3,2021-02-20,0.35,approved,9.0
2141,Fjord Ape Social Club,0,1,0,0,0,0,0,0,0,65,17.0,0.007,423.0,1723.0,False,08/16/2021,1,26,17,1,2021-10-28,0.0781,not_requested,128.0
2142,Fkn Apes Club,0,1,0,0,0,0,0,0,0,1500,671.0,0.02,1814.0,11.0,False,08/16/2021,143,210,183,12,2021-10-19,6.014137999999997,not_requested,672.0
2143,Flag Punk,1,0,0,0,0,0,0,0,0,2000,7600.0,0.001,3014.0,1958.0,False,10/06/2021,71,84,82,5,2021-09-18,0.4797131418066903,not_requested,95.0
2144,Flamingo Flutter,1,0,0,0,0,0,0,0,0,500,360.0,0.25,37561.0,207.0,False,09/18/2020,8,42,96,4,2021-12-09,74.17088674816263,approved,422.0
2145,Flappy Sack,0,0,0,0,0,0,0,1,0,2600,491.0,0.037,39125.0,136.0,False,04/29/2021,4020,820,4382,107,2021-11-29,1.6886982660335683,not_requested,125.0
2146,FlappyBird,0,1,0,0,0,0,0,0,0,50,11.0,0.015,66.0,12.0,False,08/12/2021,2,3,11,1,2021-08-12,0.02,not_requested,33.0
2147,FlappyBirds,1,0,0,0,0,0,0,0,0,300,15.0,0.01,228.0,113.0,False,09/02/2021,1,2,12,3,2021-09-01,0.02,not_requested,0.0
2148,Flat-head,0,1,0,0,0,0,0,0,0,101,36.0,0.005,162.0,831.0,False,12/08/2021,2,5,15,4,2021-12-07,0.21077,not_requested,73.0
2149,Flat_doggies,0,1,0,0,0,0,0,0,0,46,33.0,0.01,1249.0,573.0,False,10/17/2021,6,21,93,2,2021-10-27,0.4748000000000001,not_requested,0.0
2150,Flaunt (FLS Song) by iamNAX,0,1,0,0,0,0,0,0,0,3,275.0,0.014,2279.0,522.0,False,07/30/2017,7,3,31,0,2021-09-16,0.034,not_requested,0.0
2151,Flesh Empire,1,0,0,0,0,0,0,0,0,64,37.0,0.09,2242.0,573.0,False,08/30/2021,49,25,369,14,2021-09-23,0.7,not_requested,0.0
2152,Flight Club : An Aerial Experience by Misshattan,0,0,0,0,1,0,0,0,0,30,28.0,0.27,15232.0,890.0,True,03/21/2009,232,66,1476,29,2021-08-31,0.18,not_requested,0.0
2153,Flight Facilities x Babekuhl,0,0,0,1,0,0,0,0,0,4,56.0,0.25,34965.0,787.0,True,02/18/2010,103,21,586,13,2021-06-08,0.35,verified,14.0
2154,Flip Phones,0,1,0,0,0,0,0,0,0,741,3.0,0.013,1738.0,9.0,False,10/08/2021,8,6,42,2,2021-10-07,0.3093333333,not_requested,43.0
2155,Floating Emotions,1,0,0,0,0,0,0,0,0,22,9.0,0.03,1311.0,2058.0,False,06/20/2021,7,4,22,1,2021-09-25,0.03,not_requested,10.0
2156,Floki Punks,0,1,0,0,0,0,0,0,0,222,67.0,0.045,244.0,4.0,False,08/10/2021,94,29,110,11,2021-08-11,0.25,not_requested,0.0
2157,Flokitars,0,1,0,0,0,0,0,0,0,10000,2200.0,0.05,278300.0,35.0,False,06/26/2021,1390,720,5607,117,2021-09-18,18.704700000000013,approved,104.0
2158,Floor App,0,0,0,0,0,0,0,1,0,1,349.0,1.25,7653.0,1280.0,False,09/26/2021,154,323,170,7,2021-10-06,83.07630000000002,not_requested,4.0
2159,Floor App Beta Gen II,0,0,0,0,0,0,0,1,0,878,649.0,0.22,7653.0,1280.0,False,09/26/2021,154,323,170,7,2021-11-01,33.3271,not_requested,4.0
2160,Florida Landscapes,0,0,0,0,1,0,0,0,0,7,4.0,0.025,4669.0,2070.0,False,05/02/2021,6,6,44,0,2021-05-07,0.075,not_requested,0.0
2161,Florist Girls,0,1,0,0,0,0,0,0,0,4,2.0,0.01,426.0,257.0,False,11/03/2021,7,4,27,4,2021-11-10,0.01,not_requested,0.0
2162,Flower Block Series,0,0,0,0,1,0,0,0,0,50,33.0,0.2,4864.0,3677.0,False,04/28/2013,22,34,264,2,2021-08-25,9.5646189071,approved,16.0
2163,Flower Distortion,1,0,0,0,0,0,0,0,0,37,7.0,0.06,979.0,1763.0,False,06/19/2021,4,2,14,4,2021-08-31,0.19,not_requested,49.0
2164,Flower and people,1,0,0,0,0,0,0,0,0,16,10.0,0.08,183.0,173.0,False,09/03/2021,19,8,26,3,2021-08-25,0.08,not_requested,0.0
2165,Flower from Animal,0,1,0,0,0,0,0,0,0,4,2.0,0.04,2415.0,1787.0,False,04/12/2010,10,4,130,1,2021-10-17,0.04,not_requested,13.0
2166,Flower plastic,1,0,0,0,0,0,0,0,0,30,2.0,0.04,979.0,1763.0,False,06/19/2021,4,2,14,4,2021-12-17,0.26,not_requested,8.0
2167,Flowerpatch,0,1,0,0,0,0,0,0,0,86800,11100.0,0.001,5723.0,152.0,False,12/30/2018,181,156,176,19,2019-04-26,6.872397244545531,verified,0.0
2168,Flowers by onChainCo,1,0,0,0,0,0,0,0,0,4100,1100.0,0.001,1625.0,387.0,False,09/20/2021,4,3,77,1,2021-10-02,0.4027202813465708,not_requested,156.0
2169,Flowmingos,0,1,0,0,0,0,0,0,0,30,4.0,0.01,6.0,70.0,False,09/20/2021,4,2,16,2,2021-09-20,0.01,not_requested,0.0
2170,Flowtys,0,1,0,0,0,0,0,0,0,10000,3700.0,0.08,9888.0,725.0,False,08/16/2021,13,5,39,2,2021-09-04,116.68651020799952,verified,118.0
2171,Flowtys Collabs & Drops,0,1,0,0,0,0,0,0,0,13,4200.0,0.001,9888.0,725.0,False,08/16/2021,13,5,39,2,2021-10-14,0.3581199999999999,not_requested,8.0
2172,Fluffy Omelet !,0,1,0,0,0,0,0,0,0,55,25.0,0.006,3994.0,1316.0,False,01/08/2020,25,18,55,3,2021-10-14,0.0385,not_requested,34.0
2173,Fluffy Polar Bears,0,1,0,0,0,0,0,0,0,9400,4300.0,0.125,3456617.0,652.0,True,06/02/2009,372,61,1712,9,2021-10-25,526.9817981177686,approved,356.0
2174,Fly Frogs,0,1,0,0,0,0,0,0,0,10000,3900.0,0.065,5320.0,121.0,False,08/22/2021,5,5,23,2,2021-09-03,81.06087387303616,verified,186.0
2175,Fly Teddie NFT,0,1,0,0,0,0,0,0,0,53,4.0,0.01,265.0,1582.0,False,03/13/2012,3,1,5,1,2021-09-21,0.01225,not_requested,61.0
2176,Follow Cel,1,0,0,0,0,0,0,0,0,76,60.0,0.07,3574.0,143.0,False,09/13/2009,3,4,29,1,2021-09-11,0.6799999999999999,not_requested,0.0
2177,Follow your daydreams - 35 1/1 images captured on film,1,0,0,0,0,0,0,0,0,35,10.0,0.15,3037.0,4136.0,False,02/23/2021,2,3,12,2,2021-05-04,0.605,not_requested,24.0
2178,FoodleTown,0,1,0,0,0,0,0,0,0,642,41.0,0.01,7573.0,5767.0,False,05/19/2021,29,6,44,6,2021-12-12,0.0875,not_requested,35.0
2179,Football Punks Legends,0,1,0,0,0,0,0,0,0,100,33.0,0.015,104.0,231.0,False,10/31/2021,3,5,9,2,2021-11-04,0.9845000000000004,not_requested,163.0
2180,Footballerz,0,0,0,0,0,1,0,0,0,200,37.0,0.01,287.0,32.0,False,11/12/2021,37,40,44,5,2021-11-04,0.044,not_requested,0.0
2181,FootieFanz,0,1,0,0,0,0,0,0,0,63,9.0,0.003,317.0,26.0,False,09/05/2021,9,3,19,3,2021-09-28,0.0501,not_requested,93.0
2182,For Our Parks,0,0,0,0,1,0,0,0,0,23,3.0,0.1,2697.0,1639.0,False,10/22/2010,45,21,372,2,2021-09-11,0.3,not_requested,0.0
2183,Forbidden Coast of Greenland,0,0,0,0,1,0,0,0,0,50,6.0,0.35,5159.0,692.0,False,06/11/2015,207,61,1626,20,2021-12-04,1.4,not_requested,0.0
2184,Forest Protectorate I,0,0,0,0,0,0,0,1,0,6,5.0,79.98,93.0,352.0,False,11/02/2021,9,2,9,3,2021-11-18,0.03,not_requested,7.0
2185,Forest.io NFT collection,0,0,0,0,0,0,0,1,0,1000,5.0,1.0,2829.0,20.0,False,02/29/2012,0,1,2,0,2021-12-09,2.0,not_requested,0.0
2186,Forever Fomo Duck Squad,0,1,0,0,0,0,0,1,0,7700,1600.0,0.145,75936.0,569.0,False,05/24/2021,882,368,749,565,2021-09-17,143.1768299999998,approved,880.0
2187,Forgotten Cyber DJ Ape Punks,0,1,0,0,0,0,0,0,0,82,5.0,0.01,613.0,700.0,False,04/28/2021,2,3,9,1,2021-07-31,0.017,not_requested,0.0
2188,Forgotten Runes Wizards Cult,1,1,0,0,0,0,0,0,0,9400,2600.0,2.67,20938.0,592.0,False,05/21/2021,42,42,216,6,2021-06-29,3449.434074810228,verified,344.0
2189,Forgotten Skies,0,0,0,0,1,0,0,0,0,11,5.0,0.2,1888.0,976.0,False,03/29/2012,28,11,162,3,2021-12-08,1.0,not_requested,0.0
2190,Forgotten Souls,0,1,0,0,0,0,0,0,0,582,333.0,5.0,20938.0,592.0,False,05/21/2021,42,42,216,6,2021-10-31,418.8349,approved,925.0
2191,Formations - Volume 01,1,0,0,0,0,0,0,0,0,20,9.0,0.12,15028.0,3372.0,False,03/29/2021,8,4,39,3,2021-08-11,0.12,not_requested,0.0
2192,Formulae by Shvembldr,1,0,0,0,0,0,0,0,0,179,134.0,0.4,15489.0,427.0,False,03/15/2015,20,18,334,3,2021-08-11,2.416,verified,0.0
2193,Fortuitous Five,1,0,0,0,0,0,0,0,0,50,40.0,0.05,2896.0,2867.0,False,01/19/2021,11,10,41,2,2021-10-04,0.01,not_requested,5.0
2194,Forza Colori,1,0,0,0,0,0,0,0,0,42,9.0,0.01,2350.0,3984.0,False,03/02/2010,2,2,7,3,2021-11-29,0.01,not_requested,0.0
2195,Foundation (FND),1,0,0,0,0,0,0,0,0,115600,16600.0,0.05,252486.0,821.0,True,02/26/2020,204,1487,2825,34,2021-01-20,59.76090400000001,verified,0.0
2196,Fox Game Official,1,0,0,0,0,0,0,0,0,18500,1100.0,0.004,11289.0,1.0,False,11/21/2021,754,705,789,26,2021-11-28,55.37016658805445,approved,216.0
2197,FoxFam,0,1,0,0,0,0,0,0,0,10000,3200.0,0.49,12908.0,804.0,False,04/24/2021,196,320,699,311,2021-10-02,1178.489048271961,approved,522.0
2198,Foxy Foxes Official,0,1,0,0,0,0,0,0,0,41,30.0,0.01,305.0,893.0,False,10/23/2021,2,1,6,1,2021-10-01,0.008,not_requested,75.0
2199,FoxyFam,0,1,0,0,0,0,0,0,0,3300,1500.0,0.099,5191.0,604.0,False,08/17/2021,9,4,41,2,2021-09-07,61.15156000000003,verified,211.0
2200,Fractal Art,1,0,0,0,0,0,0,0,0,300,200.0,0.01,1469.0,1042.0,False,02/16/2021,6,3,41,3,2021-02-13,0.0896,approved,0.0
2201,FractalArtWork: The Beginning of a Journey,1,0,0,0,0,0,0,0,0,25,12.0,0.05,449.0,764.0,False,09/02/2013,4,8,8,5,2021-11-21,0.2495,not_requested,0.0
2202,Fraction,0,1,0,0,0,0,0,0,0,25,2.0,0.26,1337.0,41.0,False,04/20/2021,17,7,52,2,2021-08-30,0.5,not_requested,2.0
2203,Fracture Boi,0,1,0,0,0,0,0,0,0,100,33.0,0.005,11184.0,2764.0,True,03/23/2010,12,17,960,1,2021-09-24,0.062879,not_requested,113.0
2204,Fragments of Gotham - Collection of 55 Gritty NYC Photos,0,0,0,0,1,0,0,0,0,55,38.0,0.8,9304.0,1743.0,False,03/14/2016,59,31,583,4,2021-08-04,0.9,not_requested,0.0
2205,Fragments of Man,1,0,0,0,0,0,0,0,0,32,17.0,0.1,406.0,215.0,False,09/21/2021,7,5,46,3,2021-09-16,0.8335275,not_requested,33.0
2206,Fragments of Woman,1,0,0,0,0,0,0,0,0,15,5.0,0.1,406.0,215.0,False,09/21/2021,7,5,46,3,2021-09-24,0.2,not_requested,23.0
2207,Fragments of my daily life,0,0,0,0,1,0,0,0,0,14,11.0,0.1,12721.0,467.0,False,04/30/2009,137,13,1113,4,2021-10-02,0.7,not_requested,0.0
2208,Fragments of the Past,0,0,0,0,1,0,0,0,0,10,6.0,0.25,5784.0,746.0,False,09/28/2011,136,49,1103,8,2021-10-13,1.0,not_requested,0.0
2209,Framergence by Arihz,1,1,0,0,0,0,0,0,0,772,267.0,1.4,5386.0,774.0,False,03/28/2021,81,21,152,78,2021-03-30,16.457,verified,15.0
2210,Frames by MABLAB,1,0,0,0,0,0,0,0,0,33,22.0,0.25,3957.0,3285.0,False,06/01/2021,37,12,58,2,2021-09-14,0.05,not_requested,0.0
2211,Frank Ape - Frank Friends - Series 1,1,0,0,0,0,0,0,0,0,50,37.0,0.6,355.0,38.0,False,02/04/2018,3,4,21,3,2021-04-10,9.97,verified,3.0
2212,Frank Miller: Sin City 30th Anniversary,1,0,0,0,0,0,0,0,0,1700,924.0,0.14,272476.0,135.0,False,07/29/2020,670,183,2407,145,2021-09-15,202.31815956298087,verified,0.0
2213,Frankie Sutera - Southwest Wonders - A Collection of 50 Southwest Landscape Photos,0,0,0,0,1,0,0,0,0,50,41.0,0.25,8751.0,2933.0,False,09/29/2010,154,68,1270,35,2021-07-14,0.28,not_requested,0.0
2214,Franks Little Achievers,0,1,0,0,0,0,0,0,0,5,205.0,0.009,815.0,282.0,False,09/19/2021,28,12,34,5,2021-11-25,0.13444,approved,2.0
2215,Freak O Punks,0,1,0,0,0,0,0,0,0,360,71.0,0.002,284.0,882.0,False,11/27/2021,1,1,3,0,2021-11-26,0.4606300000000003,not_requested,7.0
2216,FreakG.O.A.Ts,1,0,0,0,0,0,0,0,0,28,4.0,0.008,485.0,212.0,False,03/23/2021,1,2,5,0,2021-12-14,0.024,not_requested,0.0
2217,Freaky Frog Eggs,0,0,0,0,0,0,0,1,0,115,52.0,0.003,2110.0,2089.0,False,03/09/2021,20,12,117,3,2021-10-18,0.023,not_requested,54.0
2218,Free Art World,1,0,0,0,0,0,0,0,0,49,17.0,0.05,584.0,1165.0,False,09/30/2021,8,13,63,6,2021-09-30,0.2,not_requested,0.0
2219,FreeNFT,1,0,0,0,0,0,0,0,0,43,440.0,0.001,444.0,200.0,False,09/19/2021,10,7,13,1,2021-09-13,0.00333,not_requested,0.0
2220,Freestylo,1,0,0,0,0,0,0,0,0,7,4.0,0.1,3875.0,1454.0,False,03/11/2015,14,15,57,2,2021-08-26,0.27,not_requested,0.0
2221,Freight Punks,1,0,0,0,0,0,0,0,0,952,247.0,0.01,7005.0,458.0,False,09/01/2021,28,20,38,4,2021-10-29,0.0999999999999999,not_requested,65.0
2222,FrenToadz by AffenBrot,0,1,0,0,0,0,0,0,0,79,43.0,0.05,805.0,1215.0,False,10/02/2021,7,13,72,2,2021-10-08,0.069,not_requested,0.0
2223,Frenly Flut Fles,0,1,0,0,0,0,0,0,0,100,6.0,0.015,37.0,54.0,False,09/13/2021,2,4,15,2,2021-10-03,0.06,not_requested,112.0
2224,Frenly Frogs,0,1,0,0,0,0,0,0,0,100,74.0,0.45,644.0,53.0,False,05/15/2021,14,18,73,5,2021-08-25,0.8420000000000001,approved,69.0
2225,Frens - The First 100,0,1,0,0,0,0,0,0,0,100,70.0,0.42,239.0,38.0,False,03/03/2021,6,7,83,11,2021-09-03,1.0890000999999998,not_requested,0.0
2226,Fresh Apes,1,0,0,0,0,0,0,0,0,676,277.0,0.065,2782.0,432.0,False,10/31/2021,86,73,515,5,2021-11-06,5.645699999999998,approved,192.0
2227,Freshman Math Class,1,0,0,0,0,0,0,0,0,7,5.0,0.215,1146.0,571.0,False,03/30/2008,1,2,11,1,2021-08-30,0.2,not_requested,0.0
2228,Friday Night Punks: Heisman Trophy Winners Legends,0,0,0,0,0,1,0,1,0,49,106.0,0.044,1675.0,528.0,False,05/24/2017,125,87,134,17,2021-10-17,4.815799999999999,not_requested,67.0
2229,Friendly Ghosts NFT,0,1,0,0,0,0,0,0,0,691,285.0,0.053,1580.0,40.0,False,10/13/2021,619,446,772,166,2021-12-10,0.3049,not_requested,173.0
2230,Friendly-Skull,0,1,0,0,0,0,0,0,0,44,20.0,0.018,803.0,2066.0,False,01/19/2016,1,1,3,0,2021-09-11,0.029,not_requested,46.0
2231,FriendsCity,0,1,0,0,0,0,0,0,0,221,99.0,0.03,829.0,150.0,False,09/20/2021,47,27,62,3,2021-09-27,0.80517933,not_requested,20.0
2232,Fright_NIght_Skullys,0,0,0,0,0,1,0,0,0,906,119.0,0.003,310.0,834.0,False,09/29/2021,1,1,6,1,2021-10-05,0.006,not_requested,125.0
2233,FroBrosNFT,0,1,0,0,0,0,0,0,0,2500,919.0,0.001,1018.0,38.0,False,11/06/2021,94,134,118,3,2021-10-31,0.1346410000000001,not_requested,17.0
2234,Froggies Beginnings,0,1,0,0,0,0,0,0,0,4100,1600.0,0.008,8032.0,100.0,False,09/04/2021,24,40,65,3,2021-10-03,0.13135,approved,308.0
2235,Froggies Halloween,0,1,0,0,0,0,0,0,0,150,123.0,0.02,8032.0,100.0,False,09/04/2021,24,40,65,3,2021-10-30,0.008,not_requested,153.0
2236,Frogland Notorious Artistes,0,1,0,0,0,0,0,0,0,17,9.0,0.01,1249.0,919.0,False,04/09/2009,7,6,30,2,2021-09-08,0.01,not_requested,0.0
2237,"From New York, With Love.",1,0,0,0,0,0,0,0,0,10,6.0,0.2,12414.0,785.0,False,10/18/2018,30,18,225,3,2021-08-17,0.2,approved,4.0
2238,Fruitinoid,0,1,0,0,0,0,0,0,0,86,15.0,0.01,288.0,280.0,False,04/05/2020,2,1,4,3,2021-10-24,0.02,not_requested,0.0
2239,Fuck it!,0,0,0,0,1,0,0,0,0,5,2.0,0.1,2477.0,1006.0,False,08/20/2021,4,25,59,2,2021-09-01,0.075,not_requested,19.0
2240,Fud Society,0,1,0,0,0,0,0,0,0,1100,673.0,0.003,12067.0,34.0,False,09/28/2021,9,13,44,1,2021-10-22,0.13,not_requested,152.0
2241,FuegoPass,0,0,0,0,0,0,0,1,0,550,164.0,0.001,3957.0,716.0,False,10/28/2020,10,13,82,2,2021-08-27,0.01111,not_requested,207.0
2242,FullBodyApeClub,1,0,0,0,0,0,0,0,0,1100,539.0,0.099,1920.0,47.0,False,11/11/2021,38,36,222,29,2021-11-15,17.267489999999984,approved,271.0
2243,Fundamental Fox,0,1,0,0,0,0,0,0,0,5100,301.0,0.015,1469.0,944.0,False,08/21/2021,24,650,414,2,2021-08-26,1.300999999999999,approved,960.0
2244,Fungles Assets,1,1,0,0,0,0,0,0,0,20900,404.0,0.021,6794.0,7294.0,False,11/18/2013,15,12,20,5,2021-02-11,4.0739,approved,198.0
2245,Funguy Family,0,1,0,0,0,0,0,0,0,2500,117.0,0.025,452.0,7.0,False,09/05/2021,63,58,87,6,2021-09-04,2.503999999999996,not_requested,69.0
2246,Funk Ducks Club,1,0,0,0,0,0,0,0,0,10900,8.0,0.025,1.0,1.0,False,09/17/2021,0,1,3,1,2021-10-31,0.00399,not_requested,66.0
2247,Funkey Monkey Club NFT- Earth and beyond,0,1,0,0,0,0,0,0,0,123,647.0,0.001,1.0,22.0,False,12/14/2021,1,1,1,0,2021-11-21,0.0349,not_requested,296.0
2248,Funky Alien Pixel Club,0,1,0,0,0,0,0,0,0,521,19.0,0.011,158.0,233.0,False,10/30/2021,102,6,103,2,2021-12-15,0.1649999999999999,not_requested,92.0
2249,Funky Monkey Frat House GENESIS Customs,0,1,0,0,0,0,0,0,0,192,102.0,0.5,1761.0,266.0,False,07/28/2019,42,17,65,4,2021-09-13,3.259,not_requested,834.0
2250,Funky Monkey Space Force,0,0,0,0,0,0,0,1,0,200,93.0,1.0,291.0,56.0,False,12/08/2021,27,10,36,4,2021-11-28,13.917899999999998,approved,9.0
2251,Funky Otters,0,1,0,0,0,0,0,0,0,5600,2000.0,0.009,2604.0,177.0,False,10/09/2021,156,159,203,8,2021-10-22,13.954676302546144,approved,184.0
2252,Funky Shrooms,0,1,0,0,0,0,0,0,0,295,133.0,0.06,2906.0,208.0,False,09/22/2021,101,1260,116,9,2021-10-01,5.296900000000001,not_requested,9.0
2253,Funny Crocodiles NFT,1,0,0,0,0,0,0,0,0,100,9.0,0.001,5.0,33.0,False,11/10/2021,0,0,2,0,2021-11-03,0.0119999999999999,not_requested,0.0
2254,Funny Looking Strangers,0,1,0,0,0,0,0,0,0,831,301.0,0.014,3306.0,879.0,False,09/05/2021,18,14,43,8,2021-10-06,0.3335000000000001,not_requested,127.0
2255,Funny Seals,0,1,0,0,0,0,0,0,0,1000,16.0,0.015,1333.0,0.0,False,10/22/2021,20,7,24,2,2021-10-18,0.12,not_requested,75.0
2256,Funny Teengirl Polygon,1,0,0,0,0,0,0,0,0,9,2.0,0.004,466.0,484.0,False,09/23/2021,21,2,26,3,2021-12-06,0.0035,not_requested,4.0
2257,Furballs.com Official,0,1,0,0,0,0,0,0,0,6900,1100.0,0.94,23266.0,74.0,False,09/28/2021,1333,1351,1409,28,2021-11-05,869.0323560000007,approved,124.0
2258,Furbits,0,1,0,0,0,0,0,0,0,1000,205.0,0.01,1247.0,959.0,False,08/07/2021,1,1,4,1,2021-08-04,0.01,not_requested,172.0
2259,Furcuties,0,1,0,0,0,0,0,0,0,12,31.0,0.01,324.0,222.0,False,04/29/2021,7,8,73,3,2021-08-13,0.06,not_requested,0.0
2260,Furious Alpha Gym Club,0,1,0,0,0,0,0,0,0,1900,1000.0,0.01,11352.0,185.0,False,09/05/2021,21,6,38,3,2021-10-09,0.3532999998,not_requested,180.0
2261,Furry Tales,1,0,0,0,0,0,0,0,0,3,102.0,0.014,1476.0,1605.0,False,07/16/2020,2,3,10,1,2021-09-21,0.01,not_requested,0.0
2262,Fuseballs,0,1,0,0,0,0,0,0,0,18,34.0,14.95,2522.0,45.0,False,08/19/2021,58,61,149,9,2021-09-05,2.699999999999997,not_requested,0.0
2263,Fusion by Hideki Tsukamoto,1,0,0,0,0,0,0,0,0,1000,595.0,0.39,10815.0,474.0,False,11/19/2020,25,13,175,9,2021-10-15,23.79673000000001,verified,1394.0
2264,FusionApes,0,1,0,0,0,0,0,0,0,4200,1700.0,0.078,7845.0,66.0,False,08/27/2021,282,292,330,13,2021-09-01,12.47180009999999,approved,27.0
2265,Future Land: Inward Expansion,1,0,0,0,0,0,0,0,0,133,10.0,0.01,2.0,81.0,False,02/08/2017,7,0,0,0,2021-07-29,0.2700000000000001,not_requested,19.0
2266,Future Thinkers Smart Village,0,1,0,0,0,0,0,0,0,11,69.0,0.08,11915.0,5194.0,False,10/28/2013,51,43,42,7,2021-05-29,0.12,approved,0.0
2267,FuzziesNFT,0,1,0,0,0,0,0,0,0,10000,24.0,0.005,610.0,3.0,False,10/01/2021,43,38,39,1,2021-10-02,0.013,not_requested,4.0
2268,Fv773n,0,1,0,0,0,0,0,0,0,143,42.0,0.125,1486.0,173.0,False,05/04/2021,15,7,33,6,2021-09-26,0.6100000000000001,not_requested,7.0
2269,Fvckrender,1,0,0,0,0,0,0,0,0,1000,174.0,1.5,146623.0,2713.0,True,02/22/2016,175,250,3027,14,2020-12-03,11.08,verified,15.0
2270,Fxck Face,0,1,0,0,0,0,0,0,0,5300,1900.0,0.009,2522.0,310.0,False,07/16/2021,116,46,147,5,2021-07-05,1.3379678899999998,verified,741.0
2271,G Girl Series,1,0,0,0,0,0,0,0,0,6,3.0,0.07,307.0,244.0,False,08/16/2009,4,4,14,2,2021-10-08,0.1,not_requested,1.0
2272,G H O S T G A N G,0,0,0,1,0,0,0,0,0,5,2.0,1.0,91.0,36.0,False,11/28/2012,4,2,6,1,2021-12-14,0.001,not_requested,0.0
2273,G-Bots by GAMEE,0,0,0,0,0,0,0,1,0,2700,1900.0,0.038,62849.0,162.0,False,05/18/2014,502,235,431,24,2021-10-30,81.06549639999994,verified,37.0
2274,G-CryptoSpooks NFT-old,0,1,0,0,0,0,0,0,0,5,3.0,0.025,2947.0,814.0,False,04/15/2020,23,23,122,14,2021-09-27,0.095,not_requested,29.0
2275,G-Liners,1,0,0,0,0,0,0,0,0,196,143.0,0.15,3443.0,373.0,False,06/20/2018,1,11,34,0,2021-06-26,9.576000000000002,not_requested,0.0
2276,G-WORLD,1,0,0,0,0,0,0,0,0,72,21.0,0.02,2128.0,3788.0,False,04/04/2021,32,14,78,4,2021-04-06,0.455,not_requested,156.0
2277,GABLE MOODS,1,0,0,0,0,0,0,0,0,73,38.0,0.024,1873.0,4088.0,False,11/01/2012,68,47,361,3,2021-06-13,0.025,not_requested,0.0
2278,GAIA | BONDING WITH NATURE,1,0,0,0,0,0,0,0,0,15,7.0,0.1,314.0,283.0,False,01/09/2018,10,6,24,3,2021-11-14,0.51,not_requested,34.0
2279,GALAXER,0,0,0,0,0,0,0,1,0,1500,221.0,0.009,35.0,0.0,False,10/04/2021,6,1,15,4,2021-09-25,0.026,not_requested,97.0
2280,GALchans,1,0,0,0,0,0,0,0,0,27,52.0,0.007,1823.0,783.0,False,09/24/2020,11,6,29,6,2021-10-06,0.0648,not_requested,0.0
2281,GAME DISEASE - GENE$IS -,1,0,0,0,0,0,0,0,0,661,220.0,0.53,10025.0,3.0,False,07/29/2021,401,431,690,33,2021-03-31,8.299000000000001,verified,0.0
2282,GAME-MO,0,1,0,0,0,0,0,0,0,62,7.0,0.01,221.0,156.0,False,07/11/2019,2,6,28,2,2021-09-15,0.01,not_requested,87.0
2283,GAMEBROS,0,1,0,0,0,0,0,0,0,132,82.0,0.35,8665.0,2606.0,False,11/08/2018,18,10,60,6,2021-06-15,8.597999989999998,not_requested,9.0
2284,GAMEX Cards,0,0,0,0,0,0,0,1,0,250,195.0,0.42,36276.0,207.0,False,10/21/2021,3014,141,1152,14,2021-11-26,10.97,approved,6.0
2285,GAN APES,1,0,0,0,0,0,0,0,0,1800,1100.0,0.012,1221.0,57.0,False,08/18/2021,92,105,125,14,2021-09-08,0.5539000000000002,not_requested,0.0
2286,GAN Faces,1,0,0,0,0,0,0,0,0,448,237.0,0.028,1221.0,57.0,False,08/18/2021,92,105,125,14,2021-10-03,0.489,not_requested,0.0
2287,GAN Space,1,0,0,0,0,0,0,0,0,270,151.0,0.022,1221.0,57.0,False,08/18/2021,92,105,125,14,2021-10-21,0.059,not_requested,0.0
2288,GANGSTER ALL STAR UNIVERSE,0,1,0,0,0,0,0,0,0,111,82.0,0.08,3898.0,927.0,False,06/10/2021,55,9,148,6,2021-09-27,1.14,not_requested,169.0
2289,GANGSTERS SCHOOL,0,1,0,0,0,0,0,0,0,180,68.0,0.015,2698.0,1683.0,False,04/23/2017,23,8,28,2,2021-08-04,0.2570000000000001,not_requested,376.0
2290,GANJAMAN,0,1,0,0,0,0,0,0,0,1,21.0,0.006,1575.0,843.0,False,03/18/2021,0,0,1,0,2021-10-20,0.0105,not_requested,0.0
2291,GANoadz,1,0,0,0,0,0,0,0,0,95,10.0,0.089,4765.0,3290.0,False,07/11/2007,2,3,20,2,2021-12-08,0.089,not_requested,0.0
2292,GATE Artifacts,0,0,0,0,0,0,0,1,0,1,660.0,0.042,5443.0,9.0,False,11/16/2021,1411,366,973,29,2021-12-17,21.44563603878897,not_requested,0.0
2293,GAWDS,0,1,0,0,0,0,0,0,0,4800,1400.0,0.035,1516.0,625.0,False,04/18/2021,6,7,51,2,2021-10-01,2.4475000000019995,approved,265.0
2294,GEN.ART Airdrop Collection,1,0,0,0,0,0,0,0,0,8100,2700.0,0.002,11663.0,378.0,False,08/17/2021,16,11,162,6,2021-09-03,2.702609999999996,verified,0.0
2295,GEN.ART Drop Collection,1,0,0,0,0,0,0,0,0,8400,2100.0,0.03,11663.0,378.0,False,08/17/2021,16,11,162,6,2021-09-29,105.62069,approved,0.0
2296,GEN.ART Membership,0,0,0,0,0,0,0,1,0,5100,2400.0,0.499,11663.0,378.0,False,08/17/2021,16,11,162,6,2021-08-27,174.6518899999,verified,2.0
2297,GENESIS Bored Aped Punk,0,1,0,0,0,0,0,0,0,56,48.0,0.289,2171.0,283.0,False,06/24/2021,14,6,36,2,2021-06-01,0.12,approved,149.0
2298,GENESIS HAPE,0,1,0,0,0,0,0,0,0,35,33.0,44.0,54711.0,2290.0,False,09/01/2016,896,545,3756,90,2021-07-12,193.059,approved,0.0
2299,GENESIS LIONS of ZATHENA,0,0,0,0,0,0,0,1,0,26,16.0,0.111,139.0,18.0,False,11/12/2021,11,4,13,3,2021-12-01,0.455898,not_requested,0.0
2300,GENESIS SLOTH,1,1,0,0,0,0,0,0,0,75,59.0,0.59,44986.0,5014.0,False,01/29/2009,10,15,111,3,2021-03-26,11.000000000000002,not_requested,0.0
2301,GENESIS SYNCRONAUTS,1,0,0,0,0,0,0,0,0,777,177.0,0.25,7969.0,39.0,False,08/26/2020,24,15,76,11,2021-10-31,2.058,approved,473.0
2302,GERMINATE HUMAN,1,0,0,0,0,0,0,0,0,47,5.0,0.005,2939.0,622.0,False,09/04/2021,138,86,134,7,2021-09-04,0.005,not_requested,10.0
2303,GET PWND,0,1,0,0,0,0,0,0,0,129,110.0,0.007,88763.0,7586.0,False,01/30/2014,38,165,531,15,2020-11-20,0.2466107707025,approved,38.0
2304,GFC <> BYOPills,0,0,0,0,0,0,0,1,0,5,1300.0,0.029,52312.0,193.0,False,07/05/2021,613,55,335,21,2021-12-08,8.677903100000002,not_requested,5.0
2305,GFC Genesis Key,0,0,0,0,0,0,0,1,0,3,560.0,0.127,52312.0,193.0,False,07/05/2021,613,55,335,21,2021-11-12,48.031949,not_requested,4.0
2306,GFC Genesis Mystery Item,0,0,0,0,0,0,0,1,0,2,431.0,0.139,52312.0,193.0,False,07/05/2021,613,55,335,21,2021-12-10,25.53350000000001,not_requested,2.0
2307,GFC Weapon,0,1,0,0,0,0,0,0,0,507,329.0,0.339,52312.0,193.0,False,07/05/2021,613,55,335,21,2021-08-22,16.2566,approved,2.0
2308,GGDAO - Characters,0,0,0,0,0,0,0,1,0,9,298.0,0.023,1569.0,543.0,False,09/19/2021,16,8,29,3,2021-10-22,0.065,not_requested,14.0
2309,GGDAO - Items & Accessories,0,0,0,0,0,0,0,1,0,12,154.0,0.002,1569.0,543.0,False,09/19/2021,16,8,29,3,2021-10-22,0.002,not_requested,13.0
2310,GG_Alcohol Ink Art,1,0,0,0,0,0,0,0,0,18,13.0,0.35,54518.0,898.0,False,09/28/2015,5135,17,11415,107,2021-10-10,1.05,not_requested,0.0
2311,GHOST STORIES || BY DECLAN RMC,0,0,0,0,1,0,0,0,0,25,14.0,0.3,12891.0,1213.0,False,03/25/2021,39,18,309,2,2021-11-02,2.1,not_requested,34.0
2312,GIANT BABY Comics,1,0,0,0,0,0,0,0,0,521,125.0,0.006,4139.0,412.0,False,09/21/2021,1838,1857,1889,57,2021-11-08,0.08369262,not_requested,14.0
2313,GIGABOATs,1,0,0,0,0,0,0,0,0,1300,22.0,0.09,8.0,40.0,False,10/06/2021,2,2,6,0,2021-09-30,0.4849999999999999,not_requested,138.0
2314,GJT,1,0,0,0,0,0,0,0,0,2,2.0,0.042,3414.0,873.0,False,09/17/2013,34,21,95,12,2021-08-25,0.025,not_requested,7.0
2315,GLEWME CITY,1,0,0,0,0,0,0,0,1,2400,350.0,0.024,908.0,80.0,False,03/11/2021,118,34,130,4,2021-01-31,6.140950031107499,requested,0.0
2316,GLOOPEEZ,0,1,0,0,0,0,0,0,0,2500,219.0,0.001,490.0,123.0,False,05/14/2021,13,10,21,5,2021-11-14,0.2007800000000001,not_requested,80.0
2317,GM Bored Mug,0,1,0,0,0,0,0,0,0,50,45.0,0.25,10159.0,1622.0,False,05/04/2021,35,43,447,5,2021-11-19,1.0800000000000003,not_requested,0.0
2318,GM PUNKS,0,1,0,0,0,0,0,0,0,303,181.0,0.49,94561.0,1108.0,True,12/24/2009,251,221,576,12,2021-09-16,7.5,approved,244.0
2319,GM Sunshine,0,0,0,0,1,0,0,0,0,98,19.0,0.055,5443.0,1006.0,False,08/24/2009,5,6,59,2,2021-10-06,0.385,not_requested,0.0
2320,GM TOADZ,0,1,0,0,0,0,0,0,0,163,189.0,0.027,94561.0,1108.0,True,12/24/2009,251,221,576,12,2021-10-21,0.5347999999999999,not_requested,112.0
2321,GM! Everyone,1,0,0,0,0,0,0,0,0,16,91.0,0.005,3063.0,1038.0,False,06/19/2021,14,9,44,5,2021-12-12,0.1079999999999999,not_requested,0.0
2322,GM:MF,0,0,0,1,0,0,0,0,0,150,24.0,0.08,711.0,2622.0,False,07/14/2016,3,3,8,3,2021-11-03,0.37,not_requested,81.0
2323,GMETRY,0,0,0,0,1,0,0,0,0,3,2.0,0.02,43.0,106.0,False,12/01/2021,1,2,4,1,2021-12-02,0.02,not_requested,0.0
2324,GOA GIRLS GANG,1,0,0,0,0,0,0,0,0,130,18.0,0.004,2090.0,1307.0,False,06/02/2021,16,6,30,2,2021-08-14,0.1469,not_requested,35.0
2325,GOATz,0,1,0,0,0,0,0,0,0,7500,2900.0,0.17,18805.0,1399.0,False,06/10/2021,201,64,838,47,2021-07-08,305.0831377691775,verified,161.0
2326,GOBLIN PLANET,1,0,0,0,0,0,0,0,0,41,16.0,0.015,3483.0,1408.0,False,05/06/2021,124,77,143,6,2021-09-08,0.11,not_requested,165.0
2327,GODKILLER,0,1,0,0,0,0,0,0,0,14,12.0,0.75,7315.0,847.0,False,03/05/2021,569,585,669,20,2021-09-09,0.3189,not_requested,0.0
2328,GOLDMINE1221,0,1,0,0,0,0,0,0,0,388,385.0,0.05,34.0,30.0,False,06/15/2019,6,2,9,0,2021-12-16,0.075,not_requested,7.0
2329,GOLF by CAVY,1,0,0,0,0,0,0,0,0,50,16.0,0.03,1029.0,614.0,False,05/10/2012,3,3,12,2,2021-11-18,0.7700000000000001,not_requested,0.0
2330,GRAYCRAFT2,0,1,0,0,0,0,0,0,0,5200,1500.0,0.175,9364.0,3147.0,False,07/01/2021,215,195,308,25,2021-08-16,111.0783086866914,verified,496.0
2331,GREG MIKE,1,0,0,0,0,0,0,0,0,1700,156.0,0.2,20223.0,1736.0,True,10/12/2008,35,37,333,7,2021-02-24,4.5200000000000005,verified,0.0
2332,GRILLZ CURATED,1,0,0,0,0,0,0,0,0,3,3200.0,0.001,7947.0,402.0,False,05/14/2021,23,12,56,6,2021-10-31,0.05604,not_requested,4.0
2333,GRILLZ GANG OG BADGE,0,0,0,0,0,0,0,1,0,555,437.0,0.16,7947.0,402.0,False,05/14/2021,23,12,56,6,2021-07-31,4.8939,verified,2.0
2334,GRUMPY HOUNDS,1,0,0,0,0,0,0,0,0,5,244.0,0.001,824.0,2834.0,False,04/30/2021,6,4,11,1,2021-10-20,0.0057859999999999,not_requested,6.0
2335,GRUNTS,0,1,0,0,0,0,0,0,0,87,48.0,0.15,4885.0,869.0,False,12/04/2014,140,14,889,5,2021-07-10,0.1,not_requested,207.0
2336,GRZ,1,0,0,0,0,0,0,0,0,4,5.0,0.1,5.0,20.0,False,09/24/2021,3,1,5,1,2021-10-28,0.1,not_requested,9.0
2337,GU GA GIRL,1,0,0,0,0,0,0,0,0,17,14.0,0.005,756.0,760.0,False,09/01/2021,41,4,63,3,2021-09-08,0.01,not_requested,10.0
2338,GURACORP,0,1,0,0,0,0,0,0,0,100,59.0,0.79,1106.0,36.0,False,10/04/2021,33,13,63,27,2021-10-13,4.01,not_requested,0.0
2339,GWAJA's Pencil Edition,1,0,0,0,0,0,0,0,0,3,8.0,0.06,1467.0,184.0,False,05/22/2010,31,10,52,5,2021-03-21,0.15,not_requested,1.0
2340,Gab's Beach Club,0,0,0,0,1,0,0,0,0,4,66.0,0.3,13984.0,1559.0,True,03/25/2011,51,74,655,3,2021-03-17,38.3774,approved,0.0
2341,Gaburi Cats,0,1,0,0,0,0,0,0,0,83,35.0,0.005,232.0,111.0,False,09/28/2021,16,4,40,18,2021-09-09,0.03,not_requested,0.0
2342,Gaegul Society Club,0,1,0,0,0,0,0,0,0,5600,244.0,0.008,2321.0,615.0,False,10/26/2021,422,440,461,32,2021-11-08,2.7401570600000063,not_requested,109.0
2343,GaiaEliteClub,0,1,0,0,0,0,0,0,0,3400,1300.0,0.039,29422.0,2.0,False,09/04/2021,9301,5956,12491,7784,2021-10-01,1.8806000000000005,not_requested,84.0
2344,Galactic Monkey Federation,0,1,0,0,0,0,0,0,0,7000,264.0,0.02,868.0,53.0,False,04/24/2021,28,23,34,5,2021-12-05,7.663049999999997,not_requested,286.0
2345,GalacticApes,0,1,0,0,0,0,0,0,0,10000,3400.0,0.43,27022.0,1162.0,False,03/21/2021,521,269,1078,78,2021-09-26,511.2942769320695,approved,183.0
2346,GalacticApes Genesis,0,1,0,0,0,0,0,0,0,151,87.0,15.0,27022.0,1162.0,False,03/21/2021,521,269,1078,78,2021-03-23,49.197,approved,0.0
2347,GalacticMonkes,0,1,0,0,0,0,0,0,0,9200,2400.0,0.155,27022.0,1162.0,False,03/21/2021,521,269,1078,78,2021-11-22,123.62572990000004,approved,145.0
2348,Galaktic Gang,0,1,0,0,0,0,0,0,0,5600,2600.0,0.27,11090.0,114.0,False,11/09/2021,232,139,526,35,2021-12-14,639.078928439576,approved,369.0
2349,Galaxy Fight Club,0,1,0,0,0,0,0,0,0,10100,2600.0,0.799,52312.0,193.0,False,07/05/2021,613,55,335,21,2021-08-02,840.6819911917172,verified,191.0
2350,Galaxy Geekz,0,1,0,0,0,0,0,0,0,273,2.0,0.055,176.0,8.0,False,11/09/2021,15,12,27,12,2021-12-01,0.055,not_requested,3.0
2351,Galaxy Girls NFT,0,1,0,0,0,0,0,0,0,176,23.0,0.028,1102.0,0.0,False,11/13/2021,31,18,52,1,2021-11-13,1.262,not_requested,91.0
2352,Galaxy Mix,1,0,0,0,0,0,0,0,0,16,3.0,0.07,1752.0,2781.0,False,08/19/2009,4,4,13,2,2021-09-16,0.07,not_requested,12.0
2353,GalaxyApes,0,1,0,0,0,0,0,0,0,50,40.0,0.3,6572.0,305.0,False,05/28/2021,45,17,99,6,2021-05-05,1.728,approved,0.0
2354,Gallery Gone Bad,1,0,0,0,0,0,0,0,0,15,2.0,0.005,864.0,2837.0,False,05/23/2021,12,8,50,3,2021-11-09,0.005,not_requested,0.0
2355,Gallery Of My Painting,1,0,0,0,0,0,0,0,0,10,2.0,0.08,4971.0,4261.0,False,01/19/2021,18,13,68,3,2021-10-19,0.544,not_requested,26.0
2356,Game of Allure,0,0,0,0,0,0,1,0,0,135,12.0,0.001,1149.0,1579.0,False,11/16/2021,7,11,23,1,2021-11-14,0.106,not_requested,0.0
2357,GameFi Protocol Meow Box,0,0,0,0,0,0,1,0,0,8,3.0,0.253,54658.0,33.0,False,08/10/2021,3160,717,3157,312,2021-12-03,0.022,not_requested,0.0
2358,GameOfBlocks,0,1,0,0,0,0,0,0,0,2300,1200.0,0.349,7410.0,264.0,False,01/12/2018,374,346,431,28,2021-11-12,62.20622138476275,approved,263.0
2359,Gamer BITboy Art Toy NFT,0,1,0,0,0,0,0,0,0,20,9.0,0.02,196.0,20.0,False,05/30/2020,12,4,13,4,2021-12-14,0.37,not_requested,9.0
2360,Gamer NFT Collection,0,0,0,0,0,1,1,0,0,13,12.0,1.15,15116.0,4.0,True,04/10/2019,70,6,1177,30,2021-03-28,1.6392624999999998,verified,0.0
2361,Garden Girls,1,0,0,0,0,0,0,0,0,7,7.0,0.03,1161.0,1581.0,False,12/12/2018,6,8,17,1,2021-11-08,0.055,not_requested,0.0
2362,Garrison Fortress,0,0,0,1,0,0,0,0,0,1,79.0,0.001,494.0,2510.0,False,02/22/2021,3,5,10,1,2021-02-23,5e-05,not_requested,4.0
2363,Gasha Machine,0,1,0,0,0,0,0,0,0,95,39.0,0.003,1270.0,1093.0,False,09/22/2021,102,60,108,6,2021-11-06,0.1610000000000001,not_requested,2.0
2364,Gasper,1,0,0,0,0,0,0,0,0,302,42.0,0.03,1660.0,697.0,False,07/19/2021,135,422,266,7,2021-08-23,0.005,not_requested,1.0
2365,Gather Masternode NFTs,0,1,0,0,0,0,0,0,0,181,119.0,5.0,11600.0,118.0,False,04/30/2018,66,50,178,19,2021-09-01,1.3,not_requested,128.0
2366,Gator World NFT,0,1,0,0,0,0,0,0,0,3000,1300.0,0.013,2307.0,386.0,False,09/02/2021,8,6,43,3,2021-09-04,1.90357981233881,verified,173.0
2367,Gaussian Timepieces by Takens Theorem,0,1,0,0,0,0,0,0,0,100,76.0,1.9,7258.0,797.0,False,10/23/2019,828,75,2652,73,2021-09-12,0.99,not_requested,13.0
2368,Gearheads,0,1,0,0,0,0,0,0,0,85,45.0,0.03,1079.0,1357.0,False,03/31/2021,13,11,91,1,2021-03-31,0.03,not_requested,61.0
2369,GelSneakerz by Danny Zareto,1,0,0,0,0,0,0,0,0,6,3.0,0.1,235.0,313.0,False,09/02/2021,5,4,20,2,2021-10-18,0.2,not_requested,0.0
2370,GenSys.X,0,0,0,0,0,0,1,0,0,8,150.0,0.158,65448.0,370.0,False,09/02/2020,791,23,565,14,2020-12-08,0.39,approved,11.0
2371,Gene Therapy by Sean Conte,1,0,0,0,0,0,0,0,0,39,15.0,0.085,1549.0,924.0,False,09/11/2021,1,2,9,0,2021-11-14,1.1739999999999997,not_requested,4.0
2372,Gener8tive K-Compositions,1,0,0,0,0,0,0,0,0,250,140.0,1.4,1293.0,539.0,False,04/26/2019,3,3,14,2,2019-04-26,2.559,verified,3.0
2373,Gener8tive Mutations,1,0,0,0,0,0,0,0,0,257,165.0,0.07,1293.0,539.0,False,04/26/2019,3,3,14,2,2021-05-03,0.18,not_requested,49.0
2374,Gener8tive Tones,0,0,0,1,0,0,0,0,0,125,84.0,0.15,1293.0,539.0,False,04/26/2019,3,3,14,2,2021-06-30,0.0149,not_requested,13.0
2375,Generation: Habibi Mint Pass,0,1,0,0,0,0,0,0,0,3,47.0,0.45,26082.0,1376.0,False,01/05/2009,50,94,537,5,2021-10-17,8.400690000000003,approved,2.0
2376,Generative Art Synthesizer,1,0,0,0,0,0,0,0,0,16,379.0,0.001,23.0,20.0,False,12/27/2021,3,1,6,0,2021-12-04,0.0172016792345,not_requested,0.0
2377,Generative Art by Scott Oppenheim,1,0,0,0,0,0,0,0,0,39,4.0,0.012,962.0,1518.0,False,06/22/2009,8,3,59,1,2021-11-12,0.086,not_requested,8.0
2378,Generative Emma,0,1,0,0,0,0,0,0,0,2700,511.0,0.001,1846.0,3.0,False,07/01/2021,338,324,379,15,2021-12-06,0.0597388604324948,not_requested,120.0
2379,Generative Miners,0,1,0,0,0,0,0,0,0,1100,108.0,0.05,1196.0,446.0,False,08/28/2021,34,36,59,10,2021-08-30,1.58699,not_requested,6.0
2380,Generative Sapiens,0,1,0,0,0,0,0,0,0,49,26.0,0.35,1690.0,407.0,False,09/04/2021,42,24,126,2,2021-09-04,2.28,approved,5.0
2381,Generative-ishNinja,0,1,0,0,0,0,0,0,0,5000,576.0,0.001,7778.0,476.0,False,10/05/2021,116,33,113,135,2021-11-14,0.0708116999999999,not_requested,9.0
2382,Generativemasks,1,1,0,0,0,0,0,0,0,10000,3500.0,0.09,6088.0,199.0,False,07/24/2021,17,7,50,7,2021-08-12,29.04068999999995,verified,8.0
2383,Genesis Adventurers (for Loot),0,1,0,0,0,0,0,0,0,414,175.0,3.0,1859.0,305.0,False,09/05/2021,19,11,50,5,2021-09-16,13.334,not_requested,0.0
2384,Genesis Africa,1,0,0,0,0,0,0,0,0,13,3.0,0.22,155.0,97.0,False,10/20/2021,35,26,154,6,2021-10-20,0.44,not_requested,0.0
2385,Genesis Blocks Art,1,0,0,0,0,0,0,0,0,2500,1200.0,0.038,1345.0,46.0,False,08/26/2021,182,67,212,8,2021-09-15,2.436669,verified,88.0
2386,Genesis Cube,1,0,0,0,0,0,0,0,0,2,8.0,0.5,1097.0,893.0,False,01/18/2014,3,3,14,3,2021-11-11,0.02,not_requested,7.0
2387,Genesis Dragons,0,1,0,0,0,0,0,0,0,249,140.0,0.25,726.0,128.0,False,10/31/2021,37,22,45,4,2021-03-28,4.079000000000001,approved,36.0
2388,Genesis Ethlizards,0,1,0,0,0,0,0,0,0,100,68.0,1.69,227.0,100.0,False,08/29/2021,57,50,68,3,2021-08-26,14.4759,not_requested,3.0
2389,Genesis Mana (for Loot),0,1,0,0,0,0,0,0,0,7300,590.0,0.134,1858.0,305.0,False,09/05/2021,19,11,50,5,2021-09-08,26.15549999999997,approved,0.0
2390,Genesis Rocks,0,1,0,0,0,0,0,0,0,38,31.0,5.0,3745.0,16.0,False,08/05/2021,30,17,125,7,2021-09-01,26.5,not_requested,2.0
2391,Genesis aXos,0,1,0,0,0,0,0,0,0,88,54.0,0.15,1164.0,340.0,False,01/07/2016,37,160,101,4,2021-06-27,1.063,not_requested,280.0
2392,Genesis.sol - solSeedlings,1,0,0,0,0,0,0,0,0,512,299.0,0.1,870.0,5.0,False,07/30/2021,28,35,45,19,2021-08-06,1.1118,verified,17.0
2393,Genetic Chain - Chain Gang Pass,0,0,0,0,0,0,0,1,0,1300,1200.0,0.086,18969.0,99.0,False,08/14/2021,263,235,327,15,2021-10-22,11.37438,approved,0.0
2394,Genetic Chain - Founders Pass,0,0,0,0,0,0,0,1,0,1000,997.0,0.197,18969.0,99.0,False,08/14/2021,263,235,327,15,2021-10-22,24.076389999999897,approved,0.0
2395,Genetic Chain - Geneticists Pass,0,0,0,0,0,0,0,1,0,443,426.0,0.2,18969.0,99.0,False,08/14/2021,263,235,327,15,2021-10-22,27.676950538839797,approved,0.0
2396,Genetic Chain - Ikebana,1,0,0,0,0,0,0,0,0,1200,1100.0,0.02,18969.0,99.0,False,08/14/2021,263,235,327,15,2021-11-10,0.7211000000000003,approved,58.0
2397,GeniePunks,0,0,0,0,0,0,1,0,0,124,21.0,0.01,1828.0,5.0,False,03/22/2021,3,4,115,1,2021-04-06,0.028004,not_requested,0.0
2398,Genius Punks,1,1,0,0,0,0,0,0,0,34,11.0,0.2,339.0,488.0,False,03/14/2021,2,1,5,0,2021-03-15,0.39,approved,2.0
2399,Genpalette Collection,1,0,0,0,0,0,0,0,0,124,80.0,0.03,2053.0,1939.0,False,08/27/2021,7,5,19,2,2021-09-10,0.28500001,not_requested,30.0
2400,Gentle Retrospection,0,0,0,0,1,0,0,0,0,30,2.0,0.2,6878.0,980.0,False,02/19/2012,460,19,2594,6,2021-12-16,0.2,not_requested,0.0
2401,Genzee,0,1,0,0,0,0,0,0,0,9900,3800.0,0.099,5633.0,212.0,False,10/04/2021,117,77,347,15,2021-10-13,520.367022797029,verified,328.0
2402,Geo Zoo Remix,1,0,0,0,0,0,0,0,0,60,60.0,0.15,8923.0,1184.0,False,04/30/2021,51,40,235,7,2021-07-11,0.16,not_requested,2.0
2403,GeoCuts,1,0,0,0,0,0,0,0,0,50,28.0,1.25,3472.0,431.0,False,03/15/2007,86,21,1104,6,2021-03-14,0.353,not_requested,0.0
2404,Geohashes (Genesis Collection),0,0,0,0,0,0,0,1,0,1300,274.0,0.009,188.0,0.0,False,09/13/2021,5,5,27,5,2021-09-20,0.009,not_requested,0.0
2405,Geometry Runners by Rich Lord,1,0,0,0,0,0,0,0,0,1000,687.0,1.725,17342.0,647.0,False,08/18/2009,860,164,6640,90,2021-08-27,148.4961,verified,380.0
2406,Geopolis,1,0,0,0,0,0,0,0,0,42,3.0,0.001,7.0,10.0,False,09/15/2021,0,0,0,0,2021-09-26,0.011,not_requested,0.0
2407,Gfarm v2,0,0,0,0,0,0,0,1,0,5,34.0,0.05,5280.0,34.0,False,01/02/2021,126,66,409,19,2021-10-31,0.075,not_requested,15.0
2408,Ghetto Ape Club,1,0,0,0,0,0,0,0,0,42,38.0,0.07,428.0,815.0,False,05/22/2021,19,20,166,4,2021-11-14,1.0109,not_requested,0.0
2409,Ghetto Granny Club,1,0,0,0,0,0,0,0,0,10000,827.0,0.005,2889.0,653.0,False,10/02/2021,24,11,58,5,2021-11-15,9.140571000000026,not_requested,195.0
2410,GhostSoftware CD-ROM,0,0,0,0,0,0,0,1,0,622,618.0,0.019,6962.0,0.0,False,05/14/2012,90,38,390,27,2021-10-27,0.066,not_requested,1.0
2411,Ghostkitties,1,0,0,0,0,0,0,0,0,64,34.0,0.17,1053.0,996.0,False,07/13/2021,9,9,62,2,2021-10-04,0.15,not_requested,135.0
2412,GhostxVerse,0,0,0,0,0,0,0,1,0,34,488.0,0.002,7365.0,136.0,False,11/12/2015,2,9,12,1,2021-11-26,0.0035,not_requested,23.0
2413,Ghoulies NFT,0,1,0,0,0,0,0,0,0,1300,520.0,0.06,6536.0,150.0,False,08/14/2021,6,4,14,1,2021-12-16,0.334,not_requested,148.0
2414,Ghouls n GANs,0,1,0,0,0,0,0,0,0,666,273.0,0.001,160.0,38.0,False,10/16/2021,9,9,17,4,2021-10-18,0.2225000000000001,not_requested,22.0
2415,Ghxsts,1,1,0,0,0,0,0,0,0,349,518.0,4.2,92537.0,963.0,False,05/02/2021,447,419,2988,62,2021-05-02,211.80900000000003,verified,176.0
2416,Ghxsts Cxlture,0,1,0,0,0,0,0,0,0,15,697.0,0.15,92537.0,963.0,False,05/02/2021,447,419,2988,62,2021-06-07,22.38404900000001,verified,3.0
2417,Ginger Girl,0,1,0,0,0,0,0,0,0,102,42.0,0.002,82072.0,6629.0,False,05/21/2010,17,7,56,2,2021-08-22,0.018,not_requested,55.0
2418,Giraffes At The Bar,0,1,0,0,0,0,0,0,0,1800,822.0,0.001,15065.0,34.0,False,07/18/2021,998,1068,953,54,2021-09-06,0.12,not_requested,173.0
2419,Girl Attention,1,0,0,0,0,0,0,0,0,29,14.0,0.008,779.0,606.0,False,07/14/2021,47,2,43,6,2021-11-22,0.117,not_requested,6.0
2420,Girls with Their Souls,1,0,0,0,0,0,0,0,0,7,2.0,0.2,954.0,931.0,False,02/26/2019,4,4,17,1,2021-10-24,0.2,not_requested,25.0
2421,GirlsGoneCryptoNFT,1,0,0,0,0,0,0,0,0,54,14.0,0.15,3441.0,4976.0,False,09/15/2021,24,19,77,3,2021-09-22,0.625,not_requested,240.0
2422,GitTrees,1,0,0,0,0,0,0,0,0,256,137.0,0.075,227.0,6.0,False,08/08/2021,27,25,25,14,2021-08-09,0.12,not_requested,423.0
2423,Give Love <3,1,0,0,0,0,0,0,0,0,4,2.0,0.07,1860.0,1006.0,False,03/23/2021,5,6,20,1,2021-12-09,0.07,not_requested,0.0
2424,Give me cows,0,1,0,0,0,0,0,0,0,608,71.0,0.001,225.0,238.0,False,06/13/2021,4,7,12,2,2021-11-07,0.0324,not_requested,0.0
2425,Giving is Beautiful,1,0,0,0,0,0,0,0,0,12,5.0,0.125,1288.0,519.0,False,05/19/2011,2,2,6,1,2021-12-07,0.875,not_requested,0.0
2426,Giza Maker,1,0,0,0,0,0,0,0,0,9,5.0,0.1,161.0,243.0,False,03/19/2020,0,1,6,0,2021-02-10,0.2,approved,0.0
2427,Glamour Pusses,0,1,0,0,0,0,0,0,0,5000,8.0,0.01,1047.0,1285.0,False,10/20/2021,5,4,9,1,2021-11-23,0.02,not_requested,424.0
2428,GlewmeWear,0,0,0,0,0,0,0,0,1,94,23.0,0.025,51.0,1.0,False,03/16/2021,4,1,5,2,2021-03-20,0.0777,not_requested,25.0
2429,Glitch Girls by GHOST GIRL,1,0,0,0,0,0,0,0,0,1600,527.0,0.025,3332.0,243.0,False,09/15/2021,33,10,103,8,2021-10-19,2.7064000000000004,approved,290.0
2430,Glitch Relics,1,0,0,0,0,0,0,0,0,28,21.0,0.25,9742.0,3166.0,False,05/31/2021,47,342,211,4,2021-10-02,0.4999,not_requested,0.0
2431,Glitched MAYC,0,1,0,0,0,0,0,0,0,42,3.0,0.02,4280.0,2833.0,False,04/22/2021,1,0,1,0,2021-11-18,0.04,not_requested,0.0
2432,Glizzy Gang NFT,0,1,0,0,0,0,0,0,0,251,47.0,0.629,3478.0,151.0,False,11/24/2021,592,514,676,14,2021-11-24,48.6137,approved,174.0
2433,Global Road Trip,0,0,0,0,1,0,0,0,0,23,4.0,0.15,139.0,348.0,False,04/14/2021,2,3,16,2,2021-12-13,0.035,not_requested,4.0
2434,Global-Travels,0,0,0,0,0,0,1,0,0,6,2.0,0.001,588.0,1432.0,False,04/01/2021,1,2,2,0,2021-09-18,0.0001,not_requested,0.0
2435,GlobalLotto,0,1,0,0,0,0,0,0,0,132200,7.0,0.015,13.0,14.0,False,12/24/2021,0,5,4,1,2021-11-20,0.2250000000000001,not_requested,0.0
2436,Gloomy Frankenstein,0,1,0,0,0,0,0,0,0,132,62.0,0.009,204.0,64.0,False,09/02/2017,1,2,2,1,2021-12-16,2.396829999999996,not_requested,11.0
2437,Glow Sessions,1,0,0,0,0,0,0,0,0,20,12.0,0.1,1221.0,2370.0,False,05/08/2012,5,5,30,1,2021-03-24,0.1,not_requested,0.0
2438,Glue Factory Show,0,1,0,0,0,0,0,0,0,10000,3500.0,0.049,6476.0,1204.0,False,07/13/2021,23,13,86,4,2021-08-09,23.466619,verified,143.0
2439,Go BaBy Go !!,0,1,0,0,0,0,0,0,0,409,199.0,0.3,6993.0,1373.0,False,07/19/2021,31,38,205,3,2021-08-25,35.5731,not_requested,32.0
2440,Go somewhere,1,0,0,0,0,0,0,0,0,14,5.0,0.08,2294.0,1355.0,False,08/20/2021,85,54,84,3,2021-08-30,0.05,not_requested,20.0
2441,Go-D / NFT MUSIC,1,0,0,0,0,0,0,0,0,35,18.0,0.016,397.0,333.0,False,10/07/2021,33,9,46,2,2021-11-21,0.0523475,not_requested,7.0
2442,Goat Universe,0,1,0,0,0,0,0,0,0,48,29.0,0.012,101.0,126.0,False,12/23/2021,1,2,4,1,2021-11-28,0.2063,not_requested,40.0
2443,Goaty || Art Bambina V2,1,0,0,0,0,0,0,0,0,57,7.0,0.01,187.0,511.0,False,09/19/2021,5,4,19,3,2021-09-30,0.0375,not_requested,0.0
2444,God flows out of me,1,0,0,0,0,0,0,0,0,20,3.0,0.05,1028.0,944.0,False,09/12/2021,4,3,23,4,2021-09-17,0.67,not_requested,0.0
2445,Godflowsoutofme,1,0,0,0,0,0,0,0,0,3,5.0,0.02,1028.0,944.0,False,09/12/2021,4,3,23,4,2021-09-17,0.04,not_requested,0.0
2446,Gods Of Rock,0,1,0,0,0,0,0,0,0,7000,2300.0,0.02,11881.0,797.0,False,06/23/2021,342,326,377,17,2021-10-08,7.745599999999896,approved,220.0
2447,Godspeed Metaverse Genesis,0,1,0,0,0,0,0,0,0,383,229.0,0.05,8305.0,116.0,False,08/29/2021,60,56,95,5,2021-10-16,0.516,not_requested,320.0
2448,Goku Inu,0,1,0,0,0,0,0,0,0,6,61.0,0.007,198.0,840.0,False,09/24/2021,4,4,10,3,2021-10-10,0.02,not_requested,0.0
2449,GokuPunksClub,0,1,0,0,0,0,0,0,0,40,3.0,0.04,14.0,123.0,False,12/24/2020,1,1,2,0,2021-09-02,0.031495,not_requested,69.0
2450,Gold Hunt Game,0,1,0,0,0,0,0,0,0,40000,1400.0,0.002,7284.0,0.0,False,07/24/2021,355,115,995,34,2021-11-27,46.48772688789988,approved,172.0
2451,Golden Celebs,1,0,0,0,0,0,0,0,0,42,5.0,0.006,661.0,892.0,False,10/16/2021,3,2,10,3,2021-10-15,0.034,not_requested,0.0
2452,Golden Future by Brendan North,1,0,0,0,0,0,0,0,0,1,178.0,0.22,25122.0,1376.0,False,12/10/2017,103,31,524,12,2021-11-14,2.8193,approved,0.0
2453,Golden Kanji Promo,0,0,0,0,0,0,0,1,0,1,202.0,0.001,134.0,296.0,False,08/04/2021,3,1,15,3,2021-09-28,0.0012758290311452,not_requested,0.0
2454,Golden Light Collection,1,0,0,0,0,0,0,0,0,15,5.0,0.02,6006.0,2342.0,False,10/08/2011,24,18,322,0,2021-09-25,0.11,not_requested,0.0
2455,Golden Secret Card,0,0,0,0,0,0,1,0,0,9,308.0,0.001,1980.0,1425.0,False,11/03/2014,26,28,29,2,2021-10-09,0.0019449,not_requested,21.0
2456,Golden State Warriors Legacy Collection,0,1,0,0,0,1,0,0,0,343,97.0,1.4,7072125.0,914.0,True,03/24/2009,16427,640,24249,717,2021-04-26,8.299999999999999,verified,29.0
2457,Goo Goos,0,0,0,0,0,0,0,1,0,501,76.0,0.195,3519.0,44.0,False,09/19/2021,344,19,1297,7,2021-11-28,0.75,not_requested,72.0
2458,Good Illumination,0,0,0,0,0,0,0,1,0,24,216.0,0.03,418.0,1756.0,False,07/06/2021,24,29,31,1,2021-09-05,0.0009,not_requested,5.0
2459,Good Morning Cafe,1,0,0,0,0,0,0,0,0,273,237.0,0.79,1077.0,416.0,False,04/28/2010,37,60,198,3,2021-09-21,26.503874,approved,571.0
2460,Goodbye Punks,0,1,0,0,0,0,0,0,0,100,88.0,0.24,477.0,858.0,False,10/10/2021,14,10,26,3,2021-10-03,1.038,approved,85.0
2461,Goofball Gang,0,1,0,0,0,0,0,0,0,2100,848.0,0.028,1036.0,440.0,False,09/14/2021,201,40,216,7,2021-10-01,8.861600009999995,not_requested,119.0
2462,Goon Bods of Balatroon,0,1,0,0,0,0,0,0,0,2800,715.0,0.045,20159.0,1207.0,False,07/14/2021,174,168,202,11,2021-10-29,1.4228899999999998,not_requested,257.0
2463,Goons of Balatroon,0,1,0,0,0,0,0,0,0,9700,3400.0,0.12,20159.0,1207.0,False,07/14/2021,174,168,202,11,2021-08-09,84.993509674733,verified,284.0
2464,Gorgls,1,0,0,0,0,0,0,0,0,18,5.0,0.008,516.0,538.0,False,12/12/2021,48,14,113,5,2021-12-12,0.031,not_requested,0.0
2465,Gorilla Mafia,0,1,0,0,0,0,0,0,0,351,76.0,0.07,263.0,469.0,False,09/13/2021,6,6,17,3,2021-09-11,2.4866000000000006,approved,931.0
2466,Gorilla Mansion 3D,0,1,0,0,0,0,0,0,0,327,180.0,0.012,5548.0,3641.0,False,11/18/2021,48,16,56,5,2021-11-19,4.321799999999993,not_requested,153.0
2467,Gorilla Nemesis,0,1,0,0,0,0,0,0,0,5000,1300.0,0.077,11649.0,1295.0,False,04/22/2021,46,34,102,8,2021-06-27,9.0592,verified,160.0
2468,Gorixel,1,0,0,0,0,0,0,0,0,1000,17.0,0.006,96.0,157.0,False,11/14/2021,5,11,15,6,2021-11-14,0.129,not_requested,385.0
2469,Goro's Art Works,1,1,0,0,0,0,0,0,0,216,107.0,0.045,5721.0,4911.0,False,05/03/2021,19,18,106,8,2021-04-07,0.583,not_requested,0.0
2470,Got Goats Sanctuary,1,0,0,0,0,0,0,0,0,40,22.0,0.015,230.0,70.0,False,08/27/2021,147,127,100,3,2021-08-27,0.08,not_requested,0.0
2471,Gotchimon,1,1,0,0,0,0,0,0,0,90,16.0,0.01,465.0,442.0,False,03/28/2021,111,123,136,12,2021-04-03,0.01,approved,25.0
2472,Gradis,0,1,0,0,0,0,0,0,0,4200,917.0,0.009,1220.0,526.0,False,06/28/2021,34,38,56,4,2021-10-29,6.882599999999994,not_requested,191.0
2473,Graffiti FACE,0,1,0,0,0,0,0,0,0,37,24.0,0.08,1002.0,1162.0,False,10/10/2021,9,5,17,3,2021-11-09,0.6970000000000004,not_requested,0.0
2474,Graffiti town,1,0,0,0,0,0,0,0,0,13,3.0,0.049,1002.0,1162.0,False,10/10/2021,9,5,17,3,2021-10-29,0.108,not_requested,0.0
2475,Gravity Evolutions,0,1,0,0,0,0,0,0,0,18,28.0,0.1,731.0,106.0,False,02/24/2021,37,36,174,2,2021-11-06,2.3000000000000003,not_requested,0.0
2476,Gravity Footwear,1,1,0,0,0,0,0,0,0,25,17.0,1.0,731.0,106.0,False,02/24/2021,37,36,174,2,2021-02-27,2.0,approved,2.0
2477,Gray Boys,0,0,0,0,0,0,0,1,0,10000,3100.0,0.29,4914.0,51.0,False,11/19/2021,411,426,627,57,2021-11-24,1286.460732782012,approved,589.0
2478,Great Ape Society,0,1,0,0,0,0,0,0,0,10000,4300.0,0.06,25969.0,171.0,False,08/04/2021,563,532,632,19,2021-08-02,54.16916627993405,verified,172.0
2479,Great Gramps,0,1,0,0,0,0,0,0,0,145,5.0,0.025,79.0,130.0,False,08/30/2021,6,6,14,4,2021-08-16,0.075,not_requested,293.0
2480,Greedy Bears,0,1,0,0,0,0,0,0,0,110,23.0,0.017,147.0,94.0,False,11/19/2021,26,7,44,1,2021-11-17,0.0987344999999999,not_requested,91.0
2481,Greek Lego Gods (GLG),1,0,0,0,0,0,0,0,0,17,20.0,0.01,67.0,122.0,False,11/12/2021,1,2,13,4,2021-11-04,0.124,requested,0.0
2482,Greetings from Giza,1,0,0,0,0,0,0,0,0,208,182.0,0.158,8112.0,1142.0,False,01/12/2015,56,28,186,11,2021-10-21,3.523000000000001,approved,29.0
2483,Greyscale Punks,1,0,0,0,0,0,0,0,0,2500,992.0,0.001,2510.0,1.0,False,08/08/2021,129,70,147,15,2021-08-08,0.164200000001,not_requested,0.0
2484,Gridiron Goofs,0,0,0,0,0,1,1,0,0,63,108.0,0.01,563.0,966.0,False,02/27/2021,4,4,16,2,2021-02-27,0.4975000000000001,approved,23.0
2485,Grim Tales of a Wassie,1,0,0,0,0,0,0,0,0,111,75.0,0.05,579.0,40.0,False,06/10/2020,26,10,67,5,2021-10-27,0.20001,not_requested,111.0
2486,Grind Ape Club (GAC),0,1,0,0,0,0,0,0,0,54,22.0,0.1,7.0,24.0,False,01/13/2022,0,1,2,0,2021-12-16,2.52,not_requested,56.0
2487,Groovy Crypto Funks,0,0,0,1,0,0,0,0,0,100,2.0,0.021,100.0,148.0,False,03/22/2021,18,21,25,4,2021-10-01,0.049,not_requested,52.0
2488,Grouchy Tiger Social Club,0,1,0,0,0,0,0,0,0,10000,636.0,0.01,1856.0,268.0,False,12/12/2021,93,55,78,17,2021-12-12,59.47412000000012,approved,103.0
2489,Grumpkins,0,1,0,0,0,0,0,0,0,120,93.0,0.15,2875.0,637.0,False,08/11/2021,18,21,91,2,2021-08-11,5.8625669,approved,659.0
2490,GrumpyOwls,0,1,0,0,0,0,0,0,0,1900,11.0,0.01,53.0,134.0,False,04/15/2021,1,2,6,2,2021-11-02,0.03,not_requested,132.0
2491,Guardians of the Metaverse,0,1,0,0,0,0,0,0,0,10000,4300.0,0.04,24240.0,213.0,False,07/22/2021,861,849,966,69,2021-09-05,22.09466373579588,verified,261.0
2492,Guardians of the Underworld,0,1,0,0,0,0,0,0,0,59,96.0,0.037,1282.0,1106.0,False,09/27/2015,10,34,132,1,2021-05-31,0.127,not_requested,67.0
2493,Guess What!,1,0,0,0,0,0,0,0,0,110,40.0,0.1,7294.0,2301.0,False,05/01/2021,26,38,174,5,2021-10-06,0.7499999999999999,not_requested,27.0
2494,Guild Bois,1,0,0,0,0,0,0,0,0,30,8.0,0.002,86.0,202.0,False,12/26/2021,1,4,5,2,2021-12-04,0.0465,not_requested,26.0
2495,Guild of Guardians Heroe,0,1,0,0,0,0,0,0,0,29,7.0,0.06,111264.0,343.0,False,10/06/2020,69,80,369,14,2021-10-15,0.62,not_requested,113.0
2496,Guinea Piggy Adventure,1,0,0,0,0,0,0,0,0,57,2.0,0.001,33.0,86.0,False,01/13/2010,2,1,7,1,2021-10-08,0.003,not_requested,56.0
2497,Gullys,0,1,0,0,0,0,0,0,0,103,16.0,0.004,1102.0,498.0,False,11/19/2021,7,13,48,4,2021-11-19,0.172,not_requested,0.0
2498,Gummo Land,0,0,0,0,1,0,0,0,0,30,5.0,0.3,2517.0,1907.0,False,05/29/2009,8,6,43,3,2021-03-05,0.3,approved,4.0
2499,Gun Lord,1,0,0,0,0,0,0,0,0,79,485.0,0.001,400.0,933.0,False,12/31/2018,11,9,26,7,2021-08-28,0.0678159999,not_requested,55.0
2500,Gundog Millionaires,0,1,0,0,0,0,0,0,0,9700,702.0,0.001,2043.0,4887.0,False,10/11/2021,82,63,82,6,2021-10-13,0.0637445,not_requested,306.0
2501,Gunslingers Collection,0,1,0,0,0,0,0,0,0,7800,3500.0,0.14,5695.0,389.0,False,09/01/2021,164,165,453,17,2021-12-10,1244.216771471784,approved,452.0
2502,Gutter Art,0,1,0,0,0,0,0,0,0,27,5500.0,0.003,65322.0,2866.0,False,05/11/2021,450,166,1502,157,2021-09-11,4.2475848993399925,not_requested,0.0
2503,Gutter Cat Gang,0,1,0,0,0,0,0,0,0,3000,1800.0,6.4,65322.0,2866.0,False,05/11/2021,450,166,1502,157,2021-06-08,2415.4993712319806,verified,117.0
2504,Gutter Cat'lacs,0,1,0,0,0,0,0,0,0,2200,1000.0,0.03,65322.0,2866.0,False,05/11/2021,450,166,1502,157,2021-07-27,1.2449000000000006,not_requested,9.0
2505,Gutter Dogs,0,1,0,0,0,0,0,0,0,2900,1900.0,1.7,65322.0,2866.0,False,05/11/2021,450,166,1502,157,2021-10-02,1240.562133679529,verified,156.0
2506,Gutter Merch,0,1,0,0,0,0,0,0,0,57,679.0,0.085,65322.0,2866.0,False,05/11/2021,450,166,1502,157,2021-08-20,5.647589000000002,not_requested,17.0
2507,Gutter Merch 2.0,0,1,0,0,0,0,0,0,0,2,305.0,0.034,65322.0,2866.0,False,05/11/2021,450,166,1502,157,2021-10-31,1.0720600000000005,not_requested,0.0
2508,Gutter Pigeons,0,1,0,0,0,0,0,0,0,2900,1900.0,1.24,65322.0,2866.0,False,05/11/2021,450,166,1502,157,2021-10-02,965.7840349696962,verified,150.0
2509,Gutter Rats,0,1,0,0,0,0,0,0,0,3000,1800.0,1.25,65322.0,2866.0,False,05/11/2021,450,166,1502,157,2021-07-10,640.6316809137203,verified,139.0
2510,Gutter Species Mint Pass,0,1,0,0,0,0,0,0,0,196,111.0,2.25,65322.0,2866.0,False,05/11/2021,450,166,1502,157,2021-09-04,105.92639,verified,0.0
2511,Gym Dogs,1,0,0,0,0,0,0,0,0,9900,26.0,0.001,246.0,3112.0,False,12/27/2021,1,2,4,1,2021-12-01,0.027,not_requested,8.0
2512,Gyre by Shvembldr,1,0,0,0,0,0,0,0,0,140,88.0,1.8,15489.0,427.0,False,03/15/2015,20,18,334,3,2021-08-04,11.65,verified,0.0
2513,H3RB5,1,0,0,0,0,0,0,0,0,10,3.0,0.05,63.0,461.0,False,03/21/2021,1,5,137,1,2021-11-04,0.225,not_requested,0.0
2514,HACHI's 100 friends,0,1,0,0,0,0,0,0,0,74,57.0,0.05,1606.0,916.0,False,09/23/2021,3,6,22,2,2021-09-23,0.204,not_requested,57.0
2515,HANAFUDA Frog,0,1,0,0,0,0,0,0,0,1,4.0,0.005,430.0,278.0,False,10/07/2021,213,201,237,12,2021-10-23,0.1169999999999999,not_requested,0.0
2516,HAPEBEAST PRIME GANG,1,0,0,0,0,0,0,0,0,37,426.0,0.008,54711.0,2290.0,False,09/01/2016,896,545,3755,90,2021-12-02,0.2539,not_requested,0.0
2517,HARUBANGs,0,1,0,0,0,0,0,0,0,56,20.0,0.012,1128.0,479.0,False,11/10/2021,77,24,109,2,2021-12-07,0.12179905,not_requested,109.0
2518,HARUVA,1,0,0,0,0,0,0,0,0,151,63.0,0.001,265.0,1060.0,False,12/15/2021,3,1,12,2,2021-12-16,0.0093999999999999,not_requested,0.0
2519,HASH by POB,1,1,0,0,0,0,0,0,0,6600,2400.0,0.02,6606.0,6.0,False,09/22/2020,20,18,53,5,2021-01-12,1.87141,verified,0.0
2520,HCalderon Day of the Dead,1,1,0,0,0,0,0,0,0,36,5.0,0.002,138.0,70.0,False,05/01/2009,1,1,7,1,2021-03-01,0.06,not_requested,5.0
2521,HDPunks,0,1,0,0,0,0,0,0,0,10000,1200.0,0.015,4613.0,31.0,False,03/28/2021,518,179,588,13,2021-06-29,2.8498999999999994,approved,109.0
2522,HEAD HONCHO,1,0,0,0,0,0,0,0,0,96,3.0,0.014,890.0,2141.0,False,07/05/2017,8,3,24,3,2021-09-14,0.014,not_requested,110.0
2523,HEAD5 by deadmau5,0,1,0,0,0,0,0,0,0,2900,1400.0,0.1,3791.0,135.0,False,10/22/2021,473,64,308,13,2021-11-14,16.075799999999994,verified,188.0
2524,HEAVEN XI - DAY ONE,1,0,0,0,0,0,0,0,0,3,16.0,0.06,1989.0,799.0,False,10/27/2020,10,8,42,2,2021-09-13,0.06,not_requested,13.0
2525,HEAVY MetaHats,1,0,0,0,0,0,0,0,0,4,10.0,0.036,426.0,195.0,False,02/20/2013,6,5,42,2,2021-11-02,0.2918,not_requested,8.0
2526,HEM'S HIDEOUT,0,1,0,0,0,0,0,0,0,182,2200.0,0.001,9087.0,142.0,False,01/18/2021,354,338,389,10,2021-11-22,0.4237193964287313,not_requested,0.0
2527,HEY SUSHI,1,0,0,0,0,0,0,0,0,34,29.0,0.006,3963.0,3239.0,False,06/03/2011,5,2,13,2,2021-11-06,0.076,not_requested,20.0
2528,HIDDEN IN NOISE,1,0,0,0,0,0,0,0,0,1000,651.0,0.46,2416.0,3.0,False,08/18/2021,19,6,77,2,2021-10-12,18.8642,verified,27.0
2529,HIGHER 2020,1,0,0,0,0,0,0,0,0,12,20.0,0.057,1106.0,174.0,False,02/04/2019,3,3,10,1,2021-09-06,0.062,not_requested,0.0
2530,HIP HOP HEADS FOR HIP HOP HEADS,0,1,0,0,0,0,0,0,0,10,3.0,0.042,615.0,1261.0,False,09/09/2011,3,2,8,1,2021-11-10,0.0415,not_requested,0.0
2531,HIT CITY APE,0,1,0,0,0,0,0,0,0,112,1800.0,0.001,135.0,444.0,False,11/14/2021,2,4,15,3,2021-12-05,0.1479454202489627,not_requested,0.0
2532,HIYOKO Collections,1,0,0,0,0,0,0,0,0,19,23.0,0.005,570.0,670.0,False,02/05/2015,57,18,68,4,2021-11-02,0.009,not_requested,0.0
2533,HOCKEY by CAVY,1,0,0,0,0,0,0,0,0,18,6.0,0.03,1029.0,614.0,False,05/10/2012,3,3,12,2,2021-12-09,0.22,not_requested,0.0
2534,HODL GANG,1,0,0,0,0,0,0,0,0,3000,1100.0,0.02,260.0,32.0,False,10/23/2021,27,12,40,5,2021-08-01,0.9153700000000004,verified,173.0
2535,HODL MY HAND,0,1,0,0,0,0,0,0,0,68,28.0,0.069,4658.0,3034.0,False,11/19/2013,7,2,17,0,2021-09-24,0.25,not_requested,43.0
2536,HODL Punk,1,0,0,0,0,0,0,0,0,2300,853.0,0.004,2277.0,37.0,False,07/28/2021,1133,2214,1152,24,2021-10-25,0.1187699,not_requested,0.0
2537,HOG HOMIES,1,0,0,0,0,0,0,0,0,16,9.0,10.0,94011.0,9499.0,True,01/19/2010,1854,94,1646,4,2021-10-05,6.799999999999998,not_requested,0.0
2538,HOGE Punks,0,1,0,0,0,0,0,0,0,100,22.0,0.05,692.0,2126.0,False,03/15/2021,110,65,280,5,2021-12-01,1.075,not_requested,55.0
2539,HOK Main,0,0,0,0,0,0,0,1,0,1500,1200.0,0.045,15903.0,905.0,False,04/10/2021,180,166,233,17,2021-05-21,50.891148999999984,verified,439.0
2540,HOLD MAGIC,0,1,0,0,0,0,0,0,0,36,2.0,0.01,21.0,74.0,False,07/09/2021,2,5,13,4,2021-05-24,0.06,not_requested,0.0
2541,HOLOHEADZ,0,1,0,0,0,0,0,0,0,141,63.0,0.02,111.0,436.0,False,12/08/2021,8,2,19,4,2021-08-26,2.0840000000000005,not_requested,101.0
2542,HOPPERS,0,1,0,0,0,0,0,0,0,120,76.0,2.0,16977.0,1103.0,False,07/27/2011,160,304,541,49,2021-08-02,13.8,approved,0.0
2543,HOW THE UNIVERSE CREATED,1,0,0,0,0,0,0,0,0,8,3.0,0.25,860.0,930.0,False,06/02/2013,3,10,51,2,2021-10-10,1.2,not_requested,0.0
2544,HUXLEY Comics,0,1,0,0,0,0,0,0,0,10600,2500.0,0.07,15002.0,195.0,False,06/13/2021,46,13,184,6,2021-10-14,74.5181448414486,approved,7.0
2545,HYPETOBER,1,0,0,0,0,0,0,0,0,31,4.0,0.031,44.0,202.0,False,06/02/2020,2,3,8,1,2021-10-19,0.062,not_requested,0.0
2546,Ha_Ning+_Mini Organs,0,1,0,0,0,0,0,0,0,50,12.0,0.01,5372.0,2561.0,False,09/29/2021,9,7,32,4,2021-10-22,0.075,not_requested,0.0
2547,Ha_Ning+_Organs,1,0,0,0,0,0,0,0,0,47,20.0,0.09,5372.0,2561.0,False,09/29/2021,9,7,32,4,2021-09-29,0.5599999999999999,not_requested,2.0
2548,Habanitas,1,0,0,0,0,0,0,0,0,8,2.0,0.05,163.0,187.0,False,10/15/2021,3,1,10,1,2021-10-15,0.1,not_requested,0.0
2549,Habbo Avatars,0,1,0,0,0,0,0,0,0,11600,4400.0,0.125,11910.0,365.0,True,09/23/2021,49,68,201,15,2021-09-24,142.6501471809477,verified,270.0
2550,Habbo Portraits,0,1,0,0,0,0,0,0,0,2800,953.0,0.016,11910.0,365.0,True,09/23/2021,49,68,201,15,2021-10-29,3.436400000000001,verified,217.0
2551,Habibis,1,0,0,0,0,0,0,0,0,56,36.0,3.5,26082.0,1376.0,False,01/05/2009,50,94,537,5,2021-03-19,1.6788946267774416,verified,113.0
2552,Habibis editions,1,1,0,0,0,0,0,0,0,24,234.0,0.23,26082.0,1376.0,False,01/05/2009,50,94,537,5,2021-04-30,3.726,approved,56.0
2553,Hackatao,1,0,0,0,0,0,0,0,0,358,165.0,5.925,58592.0,1989.0,False,09/20/2008,134,120,221,9,2020-04-06,55.44,verified,6.0
2554,Haematopoiesis by Ruben,0,0,0,0,1,0,0,0,0,282,105.0,0.129,1647.0,1082.0,False,09/22/2012,16,5,43,4,2021-09-01,9.874000000000002,approved,62.0
2555,HaktDAO,0,0,0,0,0,0,0,1,0,100,63.0,0.15,298.0,0.0,False,09/01/2021,2,2,5,2,2021-10-12,0.34,not_requested,68.0
2556,Hammys,0,1,0,0,0,0,0,0,0,1000,428.0,0.17,9390.0,7916.0,False,04/30/2021,74,17,188,7,2021-07-08,11.091499999999998,verified,487.0
2557,Hamsterz,0,1,0,0,0,0,0,0,0,54,47.0,0.78,24.0,33.0,False,08/01/2021,1,5,6,2,2021-08-25,0.77,not_requested,73.0
2558,Hana-Chan,1,0,0,0,0,0,0,0,0,21,8.0,0.02,1589.0,2048.0,False,10/25/2021,5,1,8,0,2021-12-10,0.16,not_requested,0.0
2559,Handiedan | Editions,1,0,0,0,0,0,0,0,0,12,29.0,0.11,2535.0,794.0,False,06/03/2009,8,8,44,3,2021-03-12,0.11,not_requested,9.0
2560,Handjabs Collection,1,0,0,0,0,0,0,0,0,487,188.0,0.02,1612.0,257.0,False,08/16/2021,32,31,45,3,2021-11-29,0.2749999999999999,not_requested,177.0
2561,Hands Lingo,0,0,0,0,1,0,0,0,0,6,3.0,0.015,1345.0,750.0,False,05/05/2021,14,10,35,3,2021-08-30,0.112,not_requested,20.0
2562,Hands Off Our Girls for #StandUpForUnity NFTs,1,0,0,0,0,0,0,0,0,31,9.0,0.1,933.0,1508.0,False,02/04/2015,12,2,22,4,2021-09-19,0.3,not_requested,0.0
2563,Hap-hazard,1,0,0,0,0,0,0,0,0,19,10.0,0.06,1066.0,497.0,False,06/18/2018,5,6,16,0,2021-11-24,0.48,not_requested,0.0
2564,Hapoochi,0,1,0,0,0,0,0,0,0,118,31.0,0.008,1489.0,1473.0,False,09/16/2021,21,4,38,3,2021-08-31,0.2491000000000001,not_requested,134.0
2565,Happiness Flower Power Collection,1,0,0,0,0,0,0,0,0,14,25.0,0.01,571.0,304.0,False,10/11/2016,4,10,54,2,2021-12-14,0.049,not_requested,0.0
2566,Happy Apes Family,1,0,0,0,0,0,0,0,1,1000,117.0,0.052,57.0,175.0,False,03/12/2018,2,1,4,1,2021-03-18,5.495099999999999,approved,424.0
2567,Happy Haunts,1,0,0,0,0,0,0,0,0,135,44.0,0.018,3351.0,3365.0,False,08/22/2021,11,20,50,3,2021-08-22,0.5090000000000001,not_requested,511.0
2568,Happy Hornets Pollination DAO,0,1,0,0,0,0,0,0,0,1000,202.0,0.003,200.0,2.0,False,11/28/2021,47,57,73,3,2021-11-12,0.4781840000000005,not_requested,37.0
2569,Happy Owl Collection,1,0,0,0,0,0,0,0,0,19,12.0,0.001,347.0,350.0,False,09/28/2021,3,4,16,1,2021-09-30,0.008,not_requested,0.0
2570,HappyAstronauts,0,1,0,0,0,0,0,0,0,109,53.0,0.099,7139.0,183.0,False,08/26/2021,208,268,223,3,2021-10-07,0.197,not_requested,552.0
2571,HappyClouds,0,1,0,0,0,0,0,0,0,50,3.0,0.02,886.0,1579.0,False,11/30/2012,4,2,23,1,2021-09-04,0.02,not_requested,0.0
2572,HappyJourney Black,1,0,0,0,0,0,0,0,0,100,12.0,0.035,1247.0,907.0,False,02/16/2010,18,6,51,2,2021-04-21,0.277,not_requested,3.0
2573,HappyLand Gummy Bears Official,0,1,0,0,0,0,0,0,0,9600,4100.0,0.025,14988.0,900.0,False,06/14/2021,48,17,109,13,2021-08-17,7.762977574408367,verified,135.0
2574,HappyMonsters Founders Collection,0,1,0,0,0,0,0,0,0,200,67.0,0.004,10725.0,7031.0,False,09/08/2021,27,6,45,5,2021-09-08,0.0549,not_requested,0.0
2575,Hapunk's,1,0,0,0,0,0,0,0,0,60,17.0,0.001,71.0,250.0,False,12/04/2021,2,5,11,2,2021-11-27,0.03865,not_requested,0.0
2576,Harako Dolls,1,1,0,0,0,0,0,0,0,25,142.0,0.045,1644.0,643.0,False,02/06/2021,73,14,185,4,2021-02-15,1.099,approved,0.0
2577,Harambe Club NFT,0,1,0,0,0,0,0,0,0,592,109.0,0.03,957.0,909.0,False,04/21/2021,3,10,12,2,2021-12-01,0.4656,not_requested,93.0
2578,HarborBcgTreasureP,0,0,0,0,0,0,0,1,0,517,93.0,0.002,243.0,236.0,False,03/20/2020,5,1,22,1,2021-04-13,0.105,approved,87.0
2579,Hard Rock Crypto,1,0,0,0,0,0,0,0,0,12,8.0,0.033,5331.0,298.0,False,01/19/2018,31,22,202,3,2021-02-01,0.0018,not_requested,0.0
2580,Hash Head,0,1,0,0,0,0,0,0,0,1500,212.0,0.005,1025.0,449.0,False,03/05/2021,3,3,9,2,2021-03-08,3.322999999999982,approved,0.0
2581,HashBastards,1,1,0,0,0,0,0,0,0,707,246.0,0.08,11800.0,6013.0,False,03/28/2021,18,31,115,1,2021-03-28,6.1738111111111085,approved,427.0
2582,HashStags,0,1,0,0,0,0,0,0,0,1000,364.0,0.01,1110.0,1324.0,False,04/07/2021,53,46,60,2,2021-04-04,0.1656,not_requested,176.0
2583,HashVerse,0,1,0,0,0,0,0,0,0,2,462.0,0.01,2128.0,332.0,False,05/12/2021,27,23,38,7,2021-09-14,0.018,not_requested,0.0
2584,Hashmasks,1,0,0,0,0,0,0,0,0,16400,5100.0,0.725,33414.0,5.0,False,10/12/2020,56,15,249,10,2021-01-28,373.5487719572,verified,76.0
2585,Hashrunes,1,1,0,0,0,0,0,0,0,1400,558.0,0.088,1927.0,41.0,False,09/16/2019,9,9,34,31,2021-03-06,1.329300002,verified,17.0
2586,Hasworld Phantoms,1,0,0,0,0,0,0,0,0,59,4.0,0.01,979.0,91.0,False,10/17/2010,2,4,11,2,2021-09-21,0.01,not_requested,10.0
2587,Hatchables,0,1,0,0,0,0,0,0,1,164,97.0,0.05,495.0,360.0,False,03/18/2021,27,39,50,2,2021-03-28,2.5,approved,196.0
2588,Hatchmate,1,0,0,0,0,0,0,0,0,4,3.0,0.08,1217.0,1161.0,False,09/20/2020,16,10,24,1,2021-11-06,0.25,not_requested,0.0
2589,Haus Twelve,0,1,0,0,0,0,0,0,0,36,8.0,0.07,2157.0,1489.0,False,02/27/2021,16,9,135,7,2021-10-16,0.07,not_requested,192.0
2590,Havana [L/N]ights,0,0,0,0,1,0,0,0,0,25,2.0,0.1,3607.0,2607.0,False,10/01/2021,11,18,60,1,2021-10-19,0.1,not_requested,0.0
2591,Havnfell,0,0,0,0,0,0,0,0,1,89,55.0,0.048,522.0,311.0,False,03/19/2021,187,204,191,13,2021-05-07,0.4149,approved,9.0
2592,Hawhaan The Duck,0,1,0,0,0,0,0,0,0,16,5.0,0.003,524.0,684.0,False,11/26/2021,25,4,28,2,2021-08-15,0.0193,not_requested,69.0
2593,Haylo Relics,1,0,0,0,0,0,0,0,0,4,60.0,0.07,7219.0,1410.0,False,05/20/2021,9,21,78,3,2021-05-28,0.07,approved,0.0
2594,Haylos,1,0,0,0,0,0,0,0,0,271,252.0,0.08,7219.0,1410.0,False,05/20/2021,9,21,78,3,2021-05-20,4.9179,verified,170.0
2595,Haylos Spirit Faces,1,0,0,0,0,0,0,0,0,7,75.0,0.039,7219.0,1410.0,False,05/20/2021,9,21,78,3,2021-07-15,0.08,approved,0.0
2596,Head of House,1,0,0,0,0,0,0,0,0,25,12.0,0.125,54.0,101.0,False,12/19/2021,7,2,21,2,2021-12-16,2.0250000000000004,not_requested,29.0
2597,Headlights,0,0,0,0,1,0,0,0,0,18,2.0,0.05,2657.0,1111.0,False,06/28/2021,11,43,81,1,2021-10-19,0.05,not_requested,0.0
2598,Heads by Jacob Shedevrs,1,0,0,0,0,0,0,0,0,80,29.0,0.02,2322.0,1974.0,False,11/24/2020,7,6,30,1,2021-09-02,0.02,not_requested,7.0
2599,Healing from the metaverse,1,0,0,0,0,0,0,0,0,32,16.0,0.035,2153.0,1875.0,False,05/17/2009,5,10,28,2,2021-08-08,0.04,not_requested,52.0
2600,Healing time,1,0,0,0,0,0,0,0,0,50,30.0,0.02,981.0,4362.0,False,08/19/2021,7,3,13,2,2021-07-08,0.025,not_requested,0.0
2601,HeartBeats by Humans.ai,0,0,0,0,0,0,0,1,0,1000,365.0,0.29,224.0,286.0,False,11/18/2012,11,17,40,1,2021-12-06,6.374999999999999,not_requested,114.0
2602,HeartClub,1,0,0,0,0,0,0,0,0,1000,142.0,0.002,17297.0,29.0,False,09/26/2021,4604,37,4574,4,2021-09-16,0.0270999,not_requested,918.0
2603,Heartbreak Bear Official,0,0,0,0,0,0,0,1,0,1200,315.0,0.028,1048.0,230.0,False,09/21/2021,57,52,62,5,2021-12-04,1.2562999999999998,not_requested,254.0
2604,Heaven in my lens,1,0,0,0,0,0,0,0,0,20,2.0,2.85,5250.0,1591.0,False,03/13/2018,7,6,18,3,2021-11-18,0.15,not_requested,0.0
2605,HeavenComputer,0,1,0,0,0,0,0,0,0,7800,2900.0,0.048,6962.0,0.0,False,05/14/2012,90,38,390,27,2021-08-15,41.04752253157043,verified,977.0
2606,Heavens Gate Social Club,1,0,0,0,0,0,0,0,0,4,155.0,0.1,2073.0,8.0,False,09/29/2020,117,26,187,6,2020-10-03,0.05,verified,4.0
2607,HeavyMetal Punks,0,1,0,0,0,0,0,0,0,35,17.0,0.015,445.0,78.0,False,12/28/2021,3,5,13,2,2021-10-01,0.11,not_requested,69.0
2608,Hello fam! NFT Winery,0,0,0,0,0,0,0,1,0,769,209.0,0.05,1810.0,1851.0,False,08/06/2021,73,20,58,6,2021-08-31,0.28,not_requested,136.0
2609,Hells Hornets,0,1,0,0,0,0,0,0,0,220,8.0,0.008,1432.0,98.0,False,12/14/2021,13,9,27,3,2021-12-15,0.032,not_requested,0.0
2610,Hellscapes - Pick your own personal Hell,1,0,0,0,0,0,0,0,0,121,3.0,0.001,87.0,138.0,False,10/19/2021,3,1,4,0,2021-10-24,0.0025,not_requested,0.0
2611,Heptaverse by Final NFT,0,1,0,0,0,0,0,0,0,78,48.0,0.001,1220.0,645.0,False,08/26/2021,3,2,20,1,2021-10-18,0.3423829914176644,not_requested,0.0
2612,Her Rules 22,1,0,0,0,0,0,0,0,0,44,4.0,0.06,650.0,1413.0,False,07/02/2013,5,1,11,2,2021-12-17,0.18,not_requested,0.0
2613,Her Sight,0,1,0,0,0,0,0,0,0,79,42.0,0.13,3460.0,1161.0,False,07/27/2017,32,36,62,5,2021-09-01,1.0799999999999998,not_requested,6.0
2614,Hero Toadz,1,0,0,0,0,0,0,0,0,14,13.0,0.3,355.0,6.0,False,10/29/2021,11,13,210,2,2021-10-29,0.72,not_requested,16.0
2615,Hero among us - It's you,0,1,0,0,0,0,1,0,0,15,2.0,0.01,546.0,521.0,False,03/17/2021,2,3,19,3,2021-03-15,0.01,not_requested,0.0
2616,HeroPuppets,0,1,0,0,0,0,0,0,0,81,50.0,0.04,272.0,260.0,False,05/14/2021,15,18,21,3,2021-04-17,0.4999999999999999,not_requested,81.0
2617,Heroes 'n' Villains Punks,1,0,0,0,0,0,0,0,0,32,5.0,0.006,1403.0,3618.0,False,03/07/2018,2,2,6,1,2021-11-20,0.0419999999999999,not_requested,0.0
2618,Hevey Art,1,0,0,0,0,0,0,0,0,48,22.0,0.1,3567.0,247.0,False,02/17/2021,22,14,145,4,2021-11-09,0.2164550615531764,not_requested,1.0
2619,Hexarchia Equipment,0,1,0,0,0,0,0,0,0,1000,500.0,0.01,12552.0,281.0,False,02/12/2021,204,21,98,8,2021-08-02,0.0289,not_requested,12.0
2620,Hi Alien... I'm World,0,1,0,0,0,0,0,0,0,60,322.0,0.002,1071.0,1378.0,False,10/28/2021,7,7,22,3,2021-10-27,0.2467320000000001,not_requested,54.0
2621,Hidden Flowers,1,0,0,0,0,0,0,0,0,10,3.0,0.01,334.0,522.0,False,11/11/2021,82,81,84,4,2021-12-12,0.006,not_requested,0.0
2622,Hidden-World,0,0,0,0,1,0,0,0,0,56,29.0,0.23,16050.0,7994.0,False,03/21/2013,17,7,57,6,2021-08-07,1.0,approved,0.0
2623,HiddenGemsNFT,1,0,0,0,0,0,0,0,0,30,14.0,0.001,1544.0,615.0,False,09/29/2020,12,13,74,2,2021-10-05,0.0112,not_requested,62.0
2624,High Giraffe Academy Official,0,1,0,0,0,0,0,0,0,647,347.0,0.006,9504.0,89.0,False,09/06/2021,16,26,44,3,2021-11-25,0.027,not_requested,192.0
2625,HighPunks,0,1,0,0,0,0,0,0,0,175,89.0,0.014,2359.0,523.0,False,07/15/2021,92,103,124,8,2021-07-16,0.015,not_requested,26.0
2626,Highways of Colour,0,0,0,0,1,0,0,0,0,50,36.0,0.149,7252.0,1155.0,False,11/15/2015,33,25,340,5,2021-08-29,0.02,not_requested,0.0
2627,Hikaru Punks Vol 1,1,1,0,0,0,0,0,0,0,147,35.0,0.015,757.0,537.0,False,03/31/2021,90,92,98,2,2021-03-31,0.015,not_requested,8.0
2628,HilariousHuskies,0,1,0,0,0,0,0,0,0,220,88.0,0.009,2853.0,824.0,False,08/29/2021,3,2,21,2,2021-09-05,0.034,not_requested,32.0
2629,Hip Ass Ape's,1,0,0,0,0,0,0,0,0,120,73.0,0.03,16719.0,5787.0,False,07/26/2021,271,71,881,15,2021-07-29,0.152,not_requested,0.0
2630,Hip Hop Cards,1,1,0,0,0,0,1,0,0,30,35.0,0.151,4856.0,1912.0,False,04/25/2008,5,8,15,1,2021-02-06,0.7943,approved,31.0
2631,Hippos del Mar Beach Club,1,0,0,0,0,0,0,0,0,11100,70.0,0.02,997.0,362.0,False,09/06/2021,1,1,3,1,2021-10-06,0.6445000000000002,not_requested,300.0
2632,Hiro Kuguhara Artworks,1,0,0,0,0,0,0,0,0,10,28.0,0.05,1661.0,282.0,False,04/02/2015,11,7,34,1,2021-12-08,0.5609999999999999,not_requested,9.0
2633,Hissing Neco Cats,1,0,0,0,0,0,0,0,0,20,11.0,0.005,316.0,296.0,False,09/10/2021,4,1,20,1,2021-10-03,0.008,not_requested,11.0
2634,Historic Signed Crypto Punk & Commissioned Piece,1,0,0,0,0,0,0,0,0,4,40.0,0.25,165.0,1589.0,False,12/11/2012,2,8,23,2,2020-12-29,0.724,verified,0.0
2635,History Journey of Haetae,1,0,0,0,0,0,0,0,0,14,11.0,0.007,1414.0,1575.0,False,06/24/2021,16,8,39,2,2021-06-30,0.008,not_requested,37.0
2636,HistoryMen,1,0,0,0,0,0,0,0,0,6,3.0,0.005,830.0,1262.0,False,11/06/2021,30,23,60,1,2021-11-15,0.01,not_requested,0.0
2637,Hogeman Club,0,0,0,0,0,0,0,1,0,761,85.0,0.064,8913.0,1158.0,False,09/16/2021,158,34,221,12,2021-09-29,0.7830475,approved,517.0
2638,Holding a Cat,0,1,0,0,0,0,0,0,0,55,35.0,0.11,1215.0,763.0,False,10/28/2017,83,58,125,7,2021-08-18,4.844999999999999,not_requested,4.0
2639,Holiday Ceramics,0,1,0,0,0,0,0,0,0,3,5.0,0.08,389.0,100.0,False,07/14/2021,28,7,59,5,2021-11-07,0.16,not_requested,0.0
2640,Holly Cows,0,1,0,0,0,0,0,0,0,20,3.0,0.01,280.0,729.0,False,06/30/2021,2,4,12,3,2021-08-17,0.01,not_requested,144.0
2641,Hollywood Apes,0,0,0,0,0,0,0,1,0,971,213.0,0.038,4700.0,264.0,False,11/05/2021,125,23,83,3,2021-11-23,1.6909033276914958,not_requested,677.0
2642,Holo Mission Patches,0,1,0,0,0,0,0,0,0,505,59.0,0.008,1598.0,757.0,False,03/26/2021,25,16,84,3,2021-10-19,0.307,not_requested,524.0
2643,Holo Things,1,1,0,0,0,0,0,0,0,47,191.0,0.09,6120.0,1068.0,False,11/02/2020,12,53,240,5,2021-03-02,0.39,not_requested,0.0
2644,Holy Cows,0,1,0,0,0,0,0,0,0,5000,1800.0,0.015,3123.0,3.0,False,08/18/2021,116,97,154,14,2021-09-13,5.56075990345192,verified,195.0
2645,Holy Primes,1,0,0,0,0,0,0,0,0,233,155.0,0.03,1439.0,2791.0,False,08/30/2021,8,4,24,2,2021-08-30,0.1549,verified,0.0
2646,Holy Rock NFT Project,1,0,0,0,0,0,0,0,0,1800,1000.0,0.071,303.0,0.0,False,11/19/2021,2,10,13,1,2021-11-27,3.5589989999999987,approved,61.0
2647,HolySheikhs,0,1,0,0,0,0,0,0,0,31,26.0,1.0,654.0,4012.0,False,10/26/2021,4,2,8,1,2021-11-17,0.2700000000000001,not_requested,34.0
2648,Home story,0,1,0,0,0,0,0,0,0,8,8.0,0.08,475.0,738.0,False,08/18/2021,67,8,70,4,2021-09-19,0.049,not_requested,40.0
2649,HomeCourt,1,0,0,0,0,0,0,0,0,55,34.0,0.08,1058.0,1002.0,False,01/08/2011,2,2,10,1,2021-02-28,0.49,approved,97.0
2650,Homecoming by Ibraheem Leone,0,0,0,0,1,0,0,0,0,20,14.0,0.1,3456.0,1900.0,False,03/24/2012,16,4,116,4,2021-11-04,1.5000000000000002,not_requested,0.0
2651,Homie Gs,0,1,0,0,0,0,0,0,0,3900,1700.0,0.045,1928.0,167.0,False,12/31/2021,70,20,146,6,2021-10-28,32.77809000000002,not_requested,233.0
2652,Honey Hives Deluxe,1,0,0,0,0,0,0,0,0,5000,2000.0,0.208,22664.0,9.0,False,09/21/2021,2159,2316,2428,90,2021-11-28,181.7592676900001,approved,11.0
2653,Honeybunch's Unmeltables,0,1,0,0,0,0,0,0,0,42,36.0,0.001,6097.0,3575.0,False,08/02/2021,4,2,12,1,2021-10-20,0.0180999999999999,not_requested,0.0
2654,Hong Kong At Night,0,0,0,0,1,0,0,0,0,15,3.0,0.08,6717.0,1435.0,False,10/28/2011,49,13,538,1,2021-08-10,0.16,approved,0.0
2655,Hong Kong Impressions,1,0,0,0,0,0,0,0,0,14,2.0,0.05,7.0,76.0,False,02/17/2014,1,2,4,1,2021-11-07,0.05,not_requested,0.0
2656,Hong Kong Stories by @hurtingbombz (2006 - 2021),0,0,0,0,1,0,0,0,0,50,8.0,0.06,3751.0,2109.0,False,11/26/2008,7,12,128,2,2021-08-16,0.05,not_requested,0.0
2657,Honorary Ape Kids Club,1,0,0,0,0,0,0,0,0,206,150.0,1.49,89231.0,2417.0,False,05/03/2021,4265,4243,4733,96,2021-06-02,16.080000000000002,approved,430.0
2658,Honorary Fast Food Punks for the Ronald McDonald Foundation,0,1,0,0,0,0,0,0,0,26,20.0,6.942,17278.0,1079.0,False,06/19/2021,14,18,60,4,2021-08-20,2.5205565,not_requested,0.0
2659,Hoodie Ape Club,0,1,0,0,0,0,0,0,0,233,121.0,0.049,550.0,2.0,False,08/22/2021,240,281,214,14,2021-08-22,0.92,not_requested,583.0
2660,Hoodie Jin,0,1,0,0,0,0,0,0,0,4,2.0,0.005,749.0,133.0,False,03/22/2013,2,2,13,1,2021-07-03,0.01,not_requested,4.0
2661,Hoodie brothers collection,0,1,0,0,0,0,0,0,0,72,46.0,0.005,812.0,319.0,False,10/07/2021,17,4,45,2,2021-10-08,0.0614999999999999,not_requested,0.0
2662,HoodiePunks,0,1,0,0,0,0,0,0,0,134,33.0,0.04,6.0,3.0,False,01/09/2022,1,4,12,1,2021-08-06,0.7200000000000002,not_requested,95.0
2663,Hoodiez,0,1,0,0,0,0,0,0,0,333,47.0,0.003,150.0,248.0,False,09/13/2021,28,22,33,4,2021-09-16,0.0147999999999999,not_requested,105.0
2664,Hoodlin Mania,0,1,0,0,0,0,0,0,0,35,13.0,0.01,23.0,56.0,False,09/08/2021,2,2,3,1,2021-09-04,0.02,not_requested,2.0
2665,Hoodlum Society,0,1,0,0,0,0,0,0,0,215,113.0,0.025,801.0,302.0,False,09/22/2021,12,8,35,3,2021-09-23,0.32,not_requested,406.0
2666,Hoop Habitats,1,0,0,0,0,0,0,0,0,4,2.0,0.08,10631.0,905.0,False,06/06/2012,927,44,10259,112,2021-10-28,0.08,not_requested,2.0
2667,Hoop Nation Vol 1,0,0,0,0,1,0,0,0,0,9,9.0,0.3,2148.0,412.0,False,10/05/2021,32,59,70,2,2021-10-26,0.4499999999999999,not_requested,0.0
2668,Hope by Nelly Baksht,1,1,0,0,0,0,0,0,0,103,94.0,0.5,6288.0,1573.0,False,07/12/2011,79,15,1986,5,2020-03-16,0.7649999999999999,verified,0.0
2669,Hope of a better manana,1,0,0,0,0,0,0,0,0,4,4.0,2.99,1920.0,3106.0,False,12/28/2020,4,17,30,1,2021-12-08,0.44,not_requested,7.0
2670,Hor1zon Troopers,0,1,0,0,0,0,0,0,0,7000,4000.0,0.01,20715.0,308.0,False,08/25/2021,2978,2894,3617,465,2021-11-04,15.229470999999942,approved,65.0
2671,Hord.app Champions' Pools NFT Tickets,0,0,0,0,0,0,0,1,0,32,576.0,0.028,21916.0,42.0,False,02/24/2021,84,36,299,20,2021-05-27,1.1479,not_requested,0.0
2672,Horror Bestiary,1,0,0,0,0,0,0,0,0,12,3.0,0.3,1039.0,656.0,False,07/16/2010,29,27,128,13,2021-08-09,0.3,not_requested,0.0
2673,Horseman Beings,1,0,0,0,0,0,0,0,0,64,24.0,0.03,954.0,1651.0,False,08/30/2021,33,57,54,1,2021-09-08,0.04,not_requested,135.0
2674,Hot Box,0,0,0,0,0,0,0,1,0,2,2.0,30.0,135.0,330.0,False,11/21/2021,0,1,3,1,2021-11-03,0.003,not_requested,0.0
2675,Hot Hamsters,0,1,0,0,0,0,0,0,0,85,42.0,0.025,168.0,37.0,False,08/27/2021,8,6,33,5,2021-08-27,0.38,not_requested,159.0
2676,HotDogesNFT,0,1,0,0,0,0,0,0,0,115,26.0,0.01,50.0,63.0,False,11/09/2015,13,2,24,2,2021-08-21,0.18,not_requested,123.0
2677,Hotel Art for the Metaverse,1,0,0,0,0,0,0,0,0,48,3.0,0.004,2.0,42.0,False,12/16/2021,0,1,1,0,2021-12-14,0.01,not_requested,0.0
2678,House of Goblins,0,0,0,0,0,0,0,1,0,7200,1200.0,0.005,3130.0,1733.0,False,08/31/2021,64,62,124,5,2021-10-24,0.5748900000000001,approved,0.0
2679,House of Warlords,0,1,0,0,0,0,0,0,0,3000,779.0,0.06,4343.0,390.0,False,09/23/2020,118,115,139,15,2021-11-27,18.68322651650726,approved,1012.0
2680,How ghosts found me,0,0,0,0,1,0,0,0,0,10,8.0,0.3,10881.0,1519.0,False,06/03/2017,28,21,104,3,2021-09-25,0.3,not_requested,0.0
2681,Hozer Classic,1,0,0,0,0,0,0,0,0,10,16.0,0.03,425.0,460.0,False,11/06/2021,23,6,52,2,2021-12-01,0.7350000000000002,not_requested,0.0
2682,Hubristic Fox,0,1,0,0,0,0,0,0,0,45,15.0,0.01,2562.0,1273.0,False,09/01/2021,126,89,123,6,2021-09-04,0.05,not_requested,97.0
2683,Humach,0,0,0,0,0,0,0,1,0,1600,447.0,0.025,3966.0,258.0,False,07/24/2021,162,173,191,8,2021-11-13,1.5419000000000005,not_requested,205.0
2684,Human Faces World,0,1,0,0,0,0,0,0,0,100,6.0,0.05,103.0,119.0,False,11/25/2021,3,4,20,4,2021-11-22,0.6,not_requested,61.0
2685,Human History Collectible Cards,0,0,0,0,0,0,1,0,0,22,96.0,0.007,130.0,138.0,False,02/27/2021,7,3,11,6,2021-09-29,0.0057,not_requested,49.0
2686,"Humans Alway Small, Black and White photography.",0,0,0,0,1,0,0,0,0,70,5.0,0.05,1600.0,2857.0,False,09/12/2021,4,1,11,0,2021-10-12,0.2299999999999999,not_requested,0.0
2687,Hungry Punks Funk Club,0,1,0,0,0,0,0,0,0,504,348.0,0.001,1071.0,231.0,False,09/16/2021,17,5,29,2,2021-12-08,0.1201118,not_requested,99.0
2688,Hungry Wolves,0,1,0,0,0,0,0,0,0,6000,1400.0,0.08,6337.0,150.0,False,10/18/2021,152,157,267,126,2021-12-06,145.3124940000002,not_requested,145.0
2689,HungryBunz,0,1,0,0,0,0,0,0,0,910,273.0,0.01,9052.0,0.0,False,10/17/2021,925,911,1098,127,2021-12-09,5.5471999999999975,not_requested,204.0
2690,HungryWolves,0,0,0,0,0,0,0,1,0,20,4.0,0.05,6337.0,150.0,False,10/18/2021,152,157,267,126,2021-11-30,0.06,not_requested,0.0
2691,Hunnys,0,1,0,0,0,0,0,0,0,1200,468.0,0.02,14741.0,2114.0,False,04/02/2021,18,30,121,5,2021-09-08,1.6769000000000005,not_requested,254.0
2692,Hunnys OGs,0,1,0,0,0,0,0,0,0,140,96.0,0.12,14741.0,2114.0,False,04/02/2021,18,30,121,5,2021-06-15,1.0575,not_requested,321.0
2693,Hunting Trophy SNNS,1,0,0,0,0,0,0,0,0,32,23.0,0.05,712.0,348.0,False,10/22/2021,4,7,51,2,2021-10-22,0.4600000000000001,not_requested,10.0
2694,Hxringverse,1,0,0,0,0,0,0,0,0,66,28.0,0.025,356.0,420.0,False,04/11/2021,9,4,25,7,2021-04-27,0.03,not_requested,0.0
2695,Hybrid Bouquet,1,0,0,0,0,0,0,0,0,26,10.0,0.03,2410.0,916.0,False,03/20/2021,19,10,49,3,2021-11-10,0.6300000000000002,not_requested,0.0
2696,Hype Cycles,0,0,0,0,0,1,0,0,0,42,3.0,0.01,17.0,18.0,False,12/28/2020,2,1,9,4,2021-10-30,0.02,not_requested,23.0
2697,Hype Garage,1,0,0,0,0,0,0,0,0,18,4.0,0.003,311.0,469.0,False,09/24/2021,1,1,11,3,2021-11-06,0.0044,not_requested,31.0
2698,Hype Kitty Clan,0,1,0,0,0,0,0,0,0,10000,4900.0,0.001,3602.0,105.0,False,08/29/2021,809,707,997,385,2021-10-14,0.3122899,not_requested,114.0
2699,HypeBomb,0,1,0,0,0,0,0,0,0,1200,4.0,0.007,53.0,0.0,False,09/21/2021,1,0,4,0,2021-10-21,0.023,not_requested,86.0
2700,Hypenotics Factory,0,1,0,0,0,0,0,0,0,2,1.0,0.003,365.0,742.0,False,03/28/2021,2,2,6,3,2021-11-17,0.125,not_requested,3.0
2701,Hypno Apes,0,1,0,0,0,0,0,0,0,177,17.0,0.03,744.0,1304.0,False,07/29/2021,42,19,103,2,2021-07-22,0.3350000000000001,not_requested,227.0
2702,HypnosisPunks,0,1,0,0,0,0,0,0,0,155,9.0,0.003,1074.0,646.0,False,10/06/2021,2,1,4,0,2021-10-02,0.012,not_requested,0.0
2703,I AM NOT BANKSY,1,0,0,0,0,0,0,0,0,93,1500.0,0.001,347.0,37.0,False,10/15/2021,42,11,55,3,2021-10-18,0.121591,not_requested,1.0
2704,I Am George,0,1,0,0,0,0,0,0,0,13,11.0,5.0,185509.0,50.0,False,06/21/2017,76,865,2251,12,2021-08-17,1.3629,approved,39.0
2705,I Live Here Now,0,0,0,0,1,0,0,0,0,100,61.0,1.65,6391.0,2416.0,True,10/03/2011,95,141,354,17,2021-08-26,5.140000000000001,approved,0.0
2706,I See a Whale in the Sky,0,1,0,0,0,0,0,0,0,22,9.0,0.015,333.0,660.0,False,11/19/2021,7,4,30,5,2021-11-01,0.1,not_requested,0.0
2707,I Went Swimming,0,0,0,0,1,0,0,0,0,24,7.0,0.2,1998.0,914.0,False,12/15/2009,13,12,86,0,2021-08-28,0.6000000000000001,not_requested,0.0
2708,I had a bad trip,1,0,0,0,0,0,0,0,0,3,8.0,0.03,1797.0,1581.0,False,01/10/2012,3,4,13,1,2021-09-12,0.15,not_requested,0.0
2709,I had a dream and now it's real,1,0,0,0,0,0,0,0,0,14,236.0,0.244,984.0,22.0,False,11/11/2021,256,295,335,18,2021-12-02,28.500189989999992,approved,30.0
2710,"I'll pay off my debt in 100 days, pipipi",1,0,0,0,0,0,0,0,0,34,25.0,0.05,3023.0,785.0,False,01/09/2021,21,33,186,4,2021-12-04,0.5300000000000002,not_requested,0.0
2711,I'm Frank,0,1,0,0,0,0,0,0,0,10000,912.0,0.035,815.0,282.0,False,09/19/2021,28,12,34,5,2021-10-20,19.195016761499986,approved,247.0
2712,I'm Gonna Make It IGMI,0,0,0,0,1,0,0,0,0,6,3.0,0.2,3565.0,3791.0,False,05/08/2021,12,7,23,4,2021-10-25,0.2,not_requested,14.0
2713,I-Gon,0,1,0,0,0,0,0,0,0,145,73.0,0.002,2105.0,2210.0,False,06/17/2016,34,9,69,8,2021-10-31,0.0218,not_requested,0.0
2714,I-snail,0,1,0,0,0,0,0,0,0,2500,66.0,0.019,655.0,1279.0,False,10/04/2021,5,29,21,2,2021-10-04,0.4700000000000001,approved,660.0
2715,ID Rockityz,1,0,0,0,0,0,0,0,0,14,11.0,0.25,1032.0,941.0,False,07/31/2011,5,8,52,5,2021-10-10,0.329,not_requested,65.0
2716,IEM Cologne POG Collection,0,0,0,0,0,1,0,0,0,123,193.0,0.01,1112366.0,623.0,True,04/21/2009,524,231,4259,418,2021-07-05,0.1214999999999999,verified,31.0
2717,IKONIKS,0,1,0,0,0,0,0,0,0,19,113.0,0.11,1534.0,16.0,False,09/29/2021,131,316,146,8,2021-09-21,3.5035000000000016,not_requested,0.0
2718,IMMORTAL CONQUEST,0,0,0,0,0,0,0,1,0,26,7.0,0.08,803.0,969.0,False,02/07/2015,1,4,8,1,2021-09-29,1.0,not_requested,3.0
2719,IMXBears:,0,0,0,0,0,0,0,1,0,30,2.0,0.07,11576.0,9.0,False,11/09/2020,1642,1788,1807,41,2021-10-17,0.14,not_requested,0.0
2720,IMXPunks Pre-Sale,0,0,0,0,0,0,0,1,0,25,4.0,0.035,20459.0,20.0,False,10/04/2021,1854,527,1180,59,2021-10-10,0.035,not_requested,0.0
2721,IN TO THE LIGHT,0,0,0,0,1,0,0,0,0,29,17.0,0.39,2669.0,2252.0,False,10/09/2019,1,1,5,0,2021-08-31,0.55,not_requested,32.0
2722,INARI Heroes,0,1,0,0,0,0,0,0,0,223,219.0,0.005,1553.0,443.0,False,08/21/2021,5,3,29,2,2021-08-20,0.028,not_requested,32.0
2723,INCEPTION PUNKS,0,1,0,0,0,0,0,0,0,95,22.0,0.015,851.0,1909.0,False,04/14/2021,8,2,17,2,2021-04-14,0.025,not_requested,0.0
2724,INFINITY VOID (LUXURY SEGMENT PARCELS),0,0,0,0,0,0,0,0,1,19,6.0,1.005,298.0,72.0,False,12/02/2021,8,7,16,2,2021-12-01,1.0051,not_requested,0.0
2725,INFLUENCERZ,0,0,0,0,0,0,1,0,0,126,100.0,0.125,1491.0,1.0,False,03/25/2021,529,74,383,10,2021-11-01,0.5650000000000001,not_requested,134.0
2726,INKTOBER.2021,1,0,0,0,0,0,0,0,0,32,3.0,0.07,632.0,479.0,False,03/06/2021,8,5,112,3,2021-11-04,0.07,not_requested,0.0
2727,INSECT TALAN,1,0,0,0,0,0,0,0,0,23,8.0,0.018,1291.0,1703.0,False,08/22/2021,14,54,49,3,2021-08-14,0.06,not_requested,22.0
2728,INVKR,1,0,0,0,0,0,0,0,0,4,18.0,0.066,1015.0,667.0,False,10/06/2009,18,8,75,5,2021-08-02,0.07,not_requested,3.0
2729,IRL GALZ,1,0,0,0,0,0,0,0,0,13,3.0,0.05,752.0,865.0,False,06/06/2021,3,6,20,1,2021-10-26,0.15,not_requested,0.0
2730,IRL Graffiti Colection,0,1,0,0,0,0,0,0,0,34,3.0,0.035,1082.0,209.0,False,05/10/2010,4,3,16,1,2021-08-07,0.037,not_requested,6.0
2731,ISO ART NFT,1,0,0,0,0,0,0,0,0,41,681.0,0.001,191.0,27.0,False,09/23/2021,3,3,8,1,2021-09-25,0.0133403271472193,not_requested,96.0
2732,IT'S THE GUY!,0,1,0,0,0,0,0,0,0,10,5.0,0.15,646.0,929.0,False,05/23/2008,1,4,18,1,2021-10-22,0.4499999999999999,not_requested,16.0
2733,IX Panther,0,1,0,0,0,0,0,0,0,35,5.0,0.02,6751.0,40.0,False,09/21/2021,67,46,119,14,2021-10-28,0.195,not_requested,0.0
2734,IX Panthers Official,0,0,0,0,0,0,0,1,0,1700,708.0,0.039,6751.0,40.0,False,09/21/2021,67,46,119,14,2021-11-29,5.749600000000001,not_requested,203.0
2735,Ice Cream Shades,0,1,0,0,0,0,0,0,0,195,59.0,0.03,56.0,234.0,False,05/15/2021,6,4,23,2,2021-09-01,3.7748999999999984,not_requested,57.0
2736,Ice-Cream Van,0,1,0,0,0,0,0,0,0,2100,13.0,0.02,2271.0,1555.0,False,09/11/2021,6,10,11,3,2021-09-12,0.08,not_requested,289.0
2737,Iceland Wonders,0,0,0,0,1,0,0,0,0,30,2.0,0.15,1963.0,498.0,False,09/18/2012,0,1,3,0,2021-03-06,0.8999999999999999,not_requested,0.0
2738,Icelandic Aerials,0,0,0,0,1,0,0,0,0,10,3.0,0.15,1886.0,1429.0,False,11/19/2017,27,12,190,6,2021-11-14,0.15,not_requested,0.0
2739,Icon Bears on Canvas,1,0,0,0,0,0,0,0,0,15,195.0,0.001,8273.0,203.0,False,03/07/2021,385,425,382,12,2021-10-02,0.02246,not_requested,1.0
2740,Iconic Japan,0,0,0,0,1,0,0,0,0,22,19.0,0.525,117873.0,565.0,False,04/11/2017,503,21,3029,16,2021-10-15,3.75,approved,0.0
2741,IconicApes,1,0,0,0,0,0,0,0,0,53,2.0,0.005,862.0,0.0,False,11/24/2021,4,6,38,6,2021-11-23,0.01,not_requested,0.0
2742,Icy Founders Club,0,1,0,0,0,0,0,0,0,1200,1200.0,0.465,23237.0,1513.0,False,04/07/2021,12,15,96,4,2021-10-12,42.045100000000026,not_requested,48.0
2743,IdVH,1,0,0,0,0,0,0,0,0,40,13.0,0.05,605.0,1105.0,False,02/14/2020,8,3,48,1,2021-11-12,0.2,not_requested,0.0
2744,Idle Girl,1,0,0,0,0,0,0,0,0,26,12.0,0.015,1013.0,1249.0,False,09/19/2021,133,95,174,14,2021-09-25,0.015,not_requested,0.0
2745,Idol Girl to stage,1,0,0,0,0,0,0,0,0,10,4.0,0.02,459.0,517.0,False,12/20/2020,25,23,77,3,2021-11-01,0.04,not_requested,0.0
2746,Idol Mafia,0,1,0,0,0,0,0,0,0,18,9.0,0.78,1496.0,560.0,False,10/23/2021,153,38,188,7,2021-10-28,1.8000000000000005,not_requested,0.0
2747,If thats what you call love,0,0,0,0,1,0,0,0,0,31,26.0,1.75,102470.0,1873.0,False,03/11/2012,197,47,2764,14,2021-07-25,8.115359999999999,approved,0.0
2748,Iketeru Mens Collection,1,0,0,0,0,0,0,0,0,9,20.0,0.018,3977.0,448.0,False,07/02/2021,97,148,119,5,2021-11-10,0.072,not_requested,0.0
2749,IlluminatiNFT,0,0,0,0,0,0,0,1,0,8100,4100.0,0.5,14442.0,2.0,False,12/18/2020,112,46,334,34,2021-12-07,3485.064909244596,approved,294.0
2750,IlluminatiNFT (Gold),0,0,0,0,0,0,0,1,0,187,137.0,7.2,14442.0,2.0,False,12/18/2020,112,46,334,34,2021-12-06,88.87650729335493,approved,0.0
2751,Illusionist Dreamers,1,0,0,0,0,0,0,0,0,157,6.0,0.01,6338.0,1032.0,False,02/25/2021,68,133,243,3,2021-12-05,0.04,not_requested,4.0
2752,Illuvium,0,1,0,0,0,0,0,0,1,21,1900.0,0.269,252586.0,207.0,True,10/26/2020,718,130,3368,109,2021-04-05,186.3379025,verified,0.0
2753,Imaginary.Landscapes,1,0,0,0,0,0,0,0,0,10,4.0,0.1,713.0,1613.0,False,09/11/2021,17,10,95,1,2021-10-08,0.2,not_requested,0.0
2754,Imagined Color,1,0,0,0,0,0,0,0,0,99,62.0,1.5,2852.0,614.0,False,06/25/2008,39,15,259,3,2021-03-22,1.6,approved,0.0
2755,Imbued Art,1,0,0,0,0,0,0,0,0,100,39.0,0.4,57.0,179.0,False,01/09/2017,3,1,7,3,2021-11-26,8.760000000000002,not_requested,2.0
2756,Immense Universe,0,1,0,0,0,0,0,0,0,6,4.0,0.08,1038.0,1454.0,False,11/10/2019,9,4,19,1,2021-12-06,0.2299999999999999,not_requested,10.0
2757,Immortal Monks,0,0,0,0,0,0,0,1,0,2500,1100.0,0.4,10078.0,0.0,False,11/22/2021,1705,489,1687,58,2021-12-16,155.08791418811796,approved,81.0
2758,ImpactXP,0,0,0,0,0,0,1,0,0,7,36.0,0.03,198.0,840.0,False,09/24/2021,4,4,10,3,2021-12-17,0.02,not_requested,0.0
2759,ImpastoPunks3D,0,1,0,0,0,0,0,0,0,45,8.0,0.02,147.0,400.0,False,04/03/2021,3,27,21,0,2021-03-12,0.025,requested,0.0
2760,Imperfect Beauty,1,0,0,0,0,0,0,0,0,9,8.0,0.02,4926.0,3187.0,False,10/03/2021,30,19,95,4,2021-11-22,0.08,not_requested,0.0
2761,Impermanent Digital,0,1,0,0,0,0,0,0,0,3100,1500.0,0.023,3928.0,254.0,False,09/07/2021,35,31,108,3,2021-09-19,5.889039999999998,approved,1376.0
2762,Impossible Blocks,1,1,0,0,0,0,0,0,0,499,184.0,0.05,3459.0,225.0,False,10/26/2015,6,5,20,3,2021-02-22,6.0216301564000005,approved,11.0
2763,Impossible Jewellery by bendansie3d,1,0,0,0,0,0,0,0,0,80,39.0,0.1,144.0,333.0,False,09/12/2021,7,2,21,2,2021-10-21,0.7,not_requested,0.0
2764,Impressions of Boston,0,0,0,0,1,0,0,0,0,31,13.0,0.2,27088.0,1370.0,False,02/18/2020,120,14,1221,5,2021-03-19,0.8999999999999999,not_requested,0.0
2765,Imps by SuperNfty,0,1,0,0,0,0,0,0,0,10000,4300.0,0.11,14199.0,2050.0,False,03/02/2021,520,494,716,22,2021-12-16,1027.0457880116653,approved,281.0
2766,Imps of Duergar,1,0,0,0,0,0,0,0,0,1000,139.0,0.01,7499.0,2566.0,False,10/05/2021,2,1,3,0,2021-10-26,1.1880000000000006,approved,24.0
2767,In A Bubble,1,0,0,0,0,0,0,0,0,50,21.0,0.05,2674.0,2314.0,False,06/20/2021,42,15,180,11,2021-10-15,0.15,not_requested,0.0
2768,In Between Dreams...,1,0,0,0,0,0,0,0,0,23,3.0,0.1,302.0,469.0,False,07/06/2021,23,8,76,3,2021-10-02,0.05,not_requested,2.0
2769,In Infinitum,1,0,0,0,0,0,0,0,0,5,104.0,0.158,1293.0,518.0,False,03/13/2021,11,6,60,4,2021-12-08,0.655688650236312,not_requested,0.0
2770,In My Utopia,1,0,0,0,0,0,0,0,0,16,10.0,0.017,846.0,615.0,False,09/13/2021,11,15,27,2,2021-11-15,0.081,not_requested,22.0
2771,In Silent Agony,0,0,0,1,0,0,0,0,0,30,18.0,0.01,676.0,2157.0,False,08/22/2014,3,2,7,2,2021-02-28,0.03,approved,0.0
2772,In The Hidden Depths,0,0,0,0,1,0,0,0,0,25,5.0,0.1,1510.0,733.0,False,11/12/2021,10,9,50,2,2021-11-20,0.4,not_requested,0.0
2773,In Your Dreams,1,0,0,0,0,0,0,0,0,102,27.0,0.009,19343.0,15013.0,False,05/12/2021,45,28,93,3,2021-09-24,0.0149,not_requested,0.0
2774,In the Highlands,0,0,0,0,1,0,0,0,0,12,10.0,0.07,2537.0,1192.0,False,11/08/2021,10,50,170,2,2021-11-15,0.35,not_requested,0.0
2775,In_My_Mind,1,0,0,0,0,0,0,0,0,55,7.0,0.001,47.0,123.0,False,10/01/2021,1,1,6,0,2021-10-10,0.005,not_requested,0.0
2776,Inaugural Digital Breeder's Cup,0,0,0,0,0,0,0,1,0,13,8.0,60.0,64.0,5.0,False,11/09/2021,15,7,15,4,2021-11-09,0.1272,not_requested,16.0
2777,Incidental View,0,0,0,0,1,0,0,0,0,61,2.0,0.14,532.0,319.0,False,08/06/2021,6,20,49,3,2021-11-23,0.7000000000000001,not_requested,0.0
2778,Incognito,1,0,0,0,0,0,0,0,0,10000,3300.0,0.05,14523.0,1895.0,False,06/29/2021,41,34,116,6,2021-08-13,27.405045461918384,verified,101.0
2779,Incognito: Extras,0,1,0,0,0,0,0,0,0,1,2500.0,0.01,14523.0,1895.0,False,06/29/2021,41,34,116,6,2021-11-12,0.0724,not_requested,4.0
2780,Indian Photography,1,0,0,0,0,0,0,0,0,3,3.0,0.008,145.0,731.0,False,02/12/2018,1,2,5,1,2021-09-19,0.004,not_requested,0.0
2781,Indigenas,1,0,0,0,0,0,0,0,0,3,2.0,0.1,3679.0,3577.0,False,07/15/2021,13,6,51,1,2021-09-23,0.1,not_requested,4.0
2782,Indonesia Cultural Art,1,0,0,0,0,0,0,0,0,57,32.0,0.05,5402.0,5093.0,False,08/31/2016,4,1,11,2,2021-07-29,1.8525000000000005,not_requested,2.0
2783,Indonesian Crypto Punk,1,0,0,0,0,0,0,0,0,16,2.0,0.06,27.0,2.0,False,09/02/2017,2,2,5,1,2021-10-04,0.007,not_requested,0.0
2784,Indopunks,1,0,0,0,0,0,0,0,0,220,53.0,0.005,105.0,94.0,False,09/27/2021,1,4,5,1,2021-09-27,0.3188000000000001,not_requested,0.0
2785,IneffableNFT,1,0,0,0,0,0,0,0,0,6,133.0,0.005,25.0,60.0,False,06/10/2021,5,1,6,0,2021-11-13,0.0075,not_requested,12.0
2786,Inertial Moment,1,0,0,0,0,0,0,0,0,150,113.0,0.2,2852.0,614.0,False,06/25/2008,39,15,259,3,2021-04-18,4.43999999999,verified,0.0
2787,Inevitable Streets,0,0,0,0,1,0,0,0,0,20,5.0,0.1,2856.0,3263.0,False,10/15/2019,2,3,12,1,2021-10-04,0.1,not_requested,42.0
2788,Infected Bodies,0,1,0,0,0,0,0,0,0,549,241.0,0.04,11834.0,862.0,False,09/16/2021,13,14,28,6,2021-10-31,2.204300000000001,approved,254.0
2789,Infested Tigers,0,1,0,0,0,0,0,0,0,97,19.0,0.001,439.0,544.0,False,10/28/2021,141,144,160,5,2021-11-19,0.06014,not_requested,72.0
2790,Infinite Curves and Colors of Beauty,1,0,0,0,0,0,0,0,0,100,7.0,0.02,2320.0,450.0,False,06/23/2021,15,20,27,2,2021-10-19,0.025,not_requested,0.0
2791,Infinite Grid,1,0,0,0,0,0,0,0,0,716,403.0,0.075,1127.0,1014.0,False,11/02/2021,110,104,233,9,2021-12-10,3.5151299999999988,not_requested,106.0
2792,Infinite Realities by Ian Robert Yao,0,0,0,0,1,0,0,0,0,40,4.0,0.3,1150.0,1845.0,False,05/04/2011,3,8,13,1,2021-11-29,0.8,not_requested,0.0
2793,Infinite Tiles,0,1,0,0,0,0,0,0,0,1900,947.0,0.009,1435.0,98.0,False,07/12/2021,12,5,56,13,2021-07-16,0.08,approved,0.0
2794,Infinites AI,1,0,0,0,0,0,0,0,0,512,293.0,0.75,3714.0,2221.0,False,01/06/2017,29,11,178,4,2021-09-03,8.662732486534207,verified,116.0
2795,Infinites IRL,1,0,0,0,0,0,0,0,0,993,456.0,0.2,3714.0,2221.0,False,01/06/2017,29,11,178,4,2021-09-18,4.618,verified,193.0
2796,Influence Asteroids,0,0,0,0,0,0,0,0,1,11100,2200.0,0.023,7532.0,380.0,False,03/07/2018,14,37,98,2,2021-04-04,34.57119999999998,verified,63.0
2797,InfraRare,0,0,0,0,1,0,0,0,0,14,7.0,0.4,7252.0,1155.0,False,11/15/2015,33,25,361,5,2021-12-09,3.2,not_requested,23.0
2798,Inglorious Orcs,0,1,0,0,0,0,0,0,0,22,2.0,0.05,11242.0,396.0,False,08/20/2021,544,583,510,28,2021-09-19,0.08,not_requested,0.0
2799,Ink Book,1,0,0,0,0,0,0,0,0,7,24.0,0.005,3257.0,1782.0,False,06/24/2020,72,121,79,1,2021-09-21,0.123,not_requested,0.0
2800,Innkeeper's Melodies,0,0,0,0,0,0,0,1,0,7,349.0,0.005,514.0,9.0,False,10/30/2021,29,49,54,3,2021-12-05,0.04484,not_requested,4.0
2801,InsectAdoption,0,0,0,0,0,0,0,1,0,3,18.0,0.001,1290.0,651.0,False,05/11/2013,7,3,11,1,2021-09-14,0.000450884,not_requested,32.0
2802,Insectorum,1,0,0,0,0,0,0,0,0,43,8.0,0.001,795.0,872.0,False,09/08/2021,3,6,6,3,2021-12-07,0.004,not_requested,0.0
2803,Inside Out Icons,1,0,0,0,0,0,0,0,0,10,5.0,0.05,51.0,76.0,False,07/28/2021,3,3,14,4,2021-10-27,0.15,not_requested,0.0
2804,Insidious Jokers Genesis Collection,0,1,0,0,0,0,0,0,0,4200,926.0,0.002,728.0,16.0,False,11/24/2021,72,67,77,5,2021-12-08,8.530639035087816,not_requested,103.0
2805,Intellectual Property Tokens for Press Pass: Season 1,0,0,0,0,0,0,0,1,0,3,22.0,0.018,174.0,591.0,False,05/18/2021,4,1,5,2,2021-03-24,0.1365,not_requested,40.0
2806,Intelligent Alien Civilization,0,1,0,0,0,0,0,0,0,10000,11.0,0.01,1696.0,1152.0,False,04/02/2021,3,12,12,4,2021-10-09,0.125,not_requested,238.0
2807,InterfacesWGMI,1,0,0,0,0,0,0,0,0,925,8.0,0.05,112012.0,404.0,False,09/28/2021,698,639,4067,61,2021-12-16,0.7300000000000001,not_requested,0.0
2808,Intergalactic Alien Tribe,1,0,0,0,0,0,0,0,0,8900,329.0,0.019,835.0,797.0,False,02/24/2021,21,13,26,3,2021-02-24,2.520999999999999,approved,171.0
2809,Internal Awareness,0,0,0,0,1,0,0,0,0,9,2.0,0.2,5783.0,830.0,False,05/28/2021,27,27,163,5,2021-08-04,0.8,not_requested,0.0
2810,Internet NFT's,0,1,0,0,0,0,0,0,0,6,2.0,0.01,17.0,8.0,False,11/18/2021,12,4,13,5,2021-11-18,0.01,not_requested,0.0
2811,Interspecies Communication,1,0,0,0,0,0,0,0,0,4,2.0,0.15,2277.0,2001.0,False,11/02/2008,26,228,153,1,2021-10-30,0.15,not_requested,0.0
2812,Intimate Portraits,0,0,0,0,1,0,0,0,0,9,8.0,0.07,3103.0,4199.0,False,05/08/2021,5,4,22,2,2021-10-30,0.35,not_requested,0.0
2813,Into Liquid,1,0,0,0,0,0,0,0,0,30,11.0,0.42,1977.0,1600.0,False,09/02/2021,28,20,177,14,2021-09-29,1.06,not_requested,0.0
2814,Into the Cryptoverse NFTs,1,0,0,0,0,0,0,0,0,8,623.0,0.088,541239.0,128.0,False,12/20/2017,563,1150,6601,65,2021-08-06,0.3658,approved,0.0
2815,Into the Vortex,0,0,0,0,1,0,0,0,0,11,6.0,0.05,3351.0,3918.0,False,01/21/2021,19,13,36,2,2021-01-28,0.15,approved,0.0
2816,Inventor Club,0,1,0,0,0,0,0,0,0,200,70.0,0.115,1262.0,260.0,False,11/06/2021,125,25,89,9,2021-11-15,0.935,not_requested,7.0
2817,Inventory V2,1,0,0,0,0,0,0,0,0,1200,600.0,0.05,5329.0,37.0,False,08/03/2020,54,18,169,19,2020-09-23,2.4050000010000003,approved,0.0
2818,Investa Pioneers,0,0,0,0,0,0,0,1,0,2,104.0,0.12,21644.0,21.0,False,08/02/2014,41,25,168,75,2021-11-25,0.37,not_requested,4.0
2819,Iraneon,1,0,0,0,0,0,0,0,0,3,2.0,0.21,1092.0,1219.0,False,10/21/2020,88,86,248,17,2021-04-10,0.21,not_requested,0.0
2820,Iris Deep,1,0,0,0,0,0,0,0,0,511,7.0,0.003,375.0,810.0,False,08/29/2021,4,6,16,1,2021-11-15,0.01,not_requested,0.0
2821,IronManPunks,1,0,0,0,0,0,0,0,0,133,3.0,0.02,11.0,27.0,False,05/26/2021,2,1,5,1,2021-10-31,0.06,not_requested,83.0
2822,IronPlanetCryptoBots,0,1,0,0,0,0,0,0,0,12,3.0,0.02,23.0,30.0,False,04/24/2017,3,2,8,0,2021-08-23,0.02,not_requested,16.0
2823,Isaboleting Movies,1,0,0,0,0,0,0,0,0,6,3.0,0.045,1683.0,91.0,False,03/02/2019,1041,11,3628,17,2021-10-25,0.09,not_requested,13.0
2824,Ish's VIP Pass + NFT Mktg Playbook,0,0,0,0,0,0,0,1,0,20,136.0,0.09,44171.0,2993.0,False,03/14/2010,13,14,114,1,2021-12-05,1.8870000000000005,not_requested,25.0
2825,Island Apes,0,1,0,0,0,0,0,0,0,2100,54.0,0.01,6788.0,2708.0,False,12/28/2019,483,152,2490,68,2021-11-06,0.1878,not_requested,50.0
2826,Iso Architecture,1,0,0,0,0,0,0,0,0,28,16.0,2.7,35.0,23.0,False,07/16/2021,1,4,6,2,2021-11-26,0.5320000000000001,not_requested,18.0
2827,It's Because You're Pretty,1,0,0,0,0,0,0,0,0,100,85.0,0.5,17681.0,3904.0,False,08/18/2010,14,20,164,4,2021-09-30,4.6850000000000005,approved,0.0
2828,It's all about her,1,0,0,0,0,0,0,0,0,5,2.0,0.1,721.0,375.0,False,06/01/2017,2,2,10,2,2021-10-21,0.1,not_requested,4.0
2829,It's line cat,1,0,0,0,0,0,0,0,0,120,51.0,0.005,3109.0,662.0,False,07/14/2021,16,2,22,2,2021-08-11,0.01,not_requested,0.0
2830,J48BAFORMS,1,0,0,0,0,0,0,0,0,4800,1000.0,0.03,2827.0,2843.0,False,03/27/2021,16,11,70,1,2021-04-17,1.4998000000000005,verified,15.0
2831,JRNY CLUB OFFICIAL,0,0,0,0,0,0,0,1,0,10000,7600.0,2.339,141624.0,2.0,False,11/01/2021,870,675,6263,49,2021-11-19,1886.696993976034,approved,0.0
2832,JUGGERNAUT Digitals,0,0,0,0,0,0,0,1,0,8,31.0,0.002,115.0,489.0,False,11/23/2021,31,35,76,3,2021-12-04,0.02,not_requested,19.0
2833,Jack's Crazy Art,1,0,0,0,0,0,0,0,0,53,28.0,0.05,5950.0,1996.0,False,01/23/2021,3,10,24,0,2021-03-04,0.2,requested,0.0
2834,Jacobs Spooky Limited Editions 2021,1,0,0,0,0,0,0,0,0,13,5.0,0.01,236.0,214.0,False,05/03/2021,12,5,34,2,2021-10-23,0.07998,not_requested,20.0
2835,Jadu Hoverboard,0,1,0,0,0,0,0,0,0,6700,3300.0,0.72,18357.0,0.0,False,02/14/2021,896,845,3015,823,2021-12-12,1521.6542137736642,verified,22.0
2836,Jadu Jetpack,0,1,0,0,0,0,0,0,0,1100,690.0,4.89,18357.0,0.0,False,02/14/2021,896,845,3015,823,2021-09-16,487.9210399999999,verified,4.0
2837,Jaeyeol Han Sculptures,1,0,0,0,0,0,0,0,0,10,8.0,0.1,275.0,374.0,False,09/14/2016,8,7,18,4,2021-12-17,1.2500000000000002,not_requested,0.0
2838,Jake Nordstrum,1,0,0,0,0,0,0,0,0,117,126.0,0.1,5404.0,1425.0,False,08/17/2020,4,25,53,3,2021-07-21,2.66,approved,0.0
2839,Jake's World Editions,1,0,0,0,0,0,0,0,0,10,155.0,1.8,41492.0,5023.0,False,04/15/2010,35,26,238,4,2021-07-07,38.3,verified,70.0
2840,Jakebots,1,0,0,0,0,0,0,0,0,20,5.0,0.004,2593.0,932.0,False,12/15/2008,1,4,37,1,2021-11-08,0.008,not_requested,18.0
2841,Jamie Inklings Art Collection,1,0,0,0,0,0,0,0,0,24,15.0,0.75,471.0,929.0,False,06/04/2021,7,8,83,2,2021-05-24,1.84,not_requested,0.0
2842,Jangala Crypto Clusters,1,0,0,0,0,0,0,0,0,27,3.0,0.02,1594.0,882.0,False,09/15/2011,37,25,160,3,2021-12-14,0.177,not_requested,2.0
2843,Jannotti Beat Series,0,0,0,1,0,0,0,0,0,38,8.0,0.03,852.0,1295.0,False,04/28/2009,7,14,14,2,2021-08-15,0.06,not_requested,57.0
2844,Japanese 72 Seasons,1,0,0,0,0,0,0,0,0,19,13.0,0.005,566.0,578.0,False,09/09/2021,2,9,21,2,2021-10-08,0.025,not_requested,38.0
2845,Japanese Bear 47,1,0,0,0,0,0,0,0,0,12,11.0,0.36,15227.0,1201.0,False,04/30/2014,65,12,211,18,2021-10-12,0.5900000000000001,not_requested,0.0
2846,Japanese Space 47,1,0,0,0,0,0,0,0,0,5,2.0,0.005,600.0,119.0,False,03/29/2020,31,8,153,2,2021-11-19,0.005,not_requested,18.0
2847,Japanese Workers,0,1,0,0,0,0,0,0,0,50,24.0,0.02,627.0,583.0,False,09/07/2021,1,4,12,4,2021-09-23,0.1,not_requested,0.0
2848,Japanese flowers photograph,1,0,0,0,0,0,0,0,0,22,14.0,0.008,413.0,731.0,False,08/13/2021,4,5,9,1,2021-07-30,0.02,not_requested,0.0
2849,Jason Balducci Collection,1,0,0,0,0,0,0,0,0,44,31.0,0.101,3395.0,537.0,False,01/31/2020,10,18,58,5,2021-02-16,2.557,approved,2.0
2850,Jasper York Glitch Collection,1,1,0,0,0,0,0,0,0,29,51.0,0.07,1327.0,2336.0,False,02/27/2021,9,21,141,5,2021-03-02,0.449,approved,0.0
2851,Jay Pegs Auto Mart,1,0,0,0,0,0,0,0,0,6400,1300.0,0.01,2998.0,180.0,False,08/24/2021,32,16,136,11,2021-09-21,0.381901,not_requested,161.0
2852,Jay's illustration room,1,0,0,0,0,0,0,0,0,6,3.0,0.035,1024.0,308.0,False,01/02/2020,100,4,657,3,2021-11-27,0.139,not_requested,0.0
2853,JeffJag Illustrations & Derivatives,1,0,0,0,0,0,0,0,0,21,26.0,0.025,3970.0,1696.0,False,12/15/2008,11,5,33,2,2021-07-06,0.12,not_requested,188.0
2854,Jelly Pals,0,1,0,0,0,0,0,0,0,100,4.0,0.08,3475.0,4645.0,False,05/10/2011,4,19,44,3,2021-06-14,0.16,not_requested,361.0
2855,Jenkins the Valet: The Writer's Room,0,0,0,0,0,0,0,1,0,6900,2800.0,0.79,31748.0,4350.0,False,05/18/2021,73,58,481,21,2021-08-04,1077.3876308624738,verified,4.0
2856,JenniferO - Life In Colour,1,0,0,0,0,0,0,0,0,17,2.0,0.06,390.0,599.0,False,08/15/2021,3,2,18,1,2021-10-11,0.06,not_requested,0.0
2857,Jesse Doyle Art,1,0,0,0,0,0,0,0,0,44,20.0,0.2,1289.0,1010.0,False,11/14/2011,4,18,38,2,2021-10-14,0.575,not_requested,0.0
2858,Jessie W design,1,0,0,0,0,0,0,0,0,21,12.0,0.01,231.0,58.0,False,12/12/2010,1,2,9,4,2021-11-15,0.058,not_requested,0.0
2859,Jewel Cases,1,0,0,0,0,0,0,0,0,119,64.0,0.111,3029.0,2284.0,False,01/31/2021,5,6,39,4,2021-02-25,0.4449999999999999,approved,34.0
2860,Jibaros,1,0,0,0,0,0,0,0,0,265,115.0,0.021,452.0,459.0,False,12/04/2021,14,4,36,4,2021-12-05,1.1516000000000004,not_requested,129.0
2861,Jiggling Cat,1,0,0,0,0,0,0,0,0,19,9.0,0.005,585.0,847.0,False,10/17/2021,2,1,11,0,2021-10-22,0.0269,not_requested,9.0
2862,Jigsaw Puzzle Party,0,1,0,0,0,0,0,0,0,10,8.0,0.025,204.0,69.0,False,11/13/2021,6,4,35,1,2021-11-20,0.05,not_requested,0.0
2863,Jigsaw Puzzle Party - Girls Imagery,0,1,0,0,0,0,0,0,0,7,22.0,0.002,204.0,69.0,False,11/13/2021,6,4,35,1,2021-11-29,0.07,not_requested,10.0
2864,Jillian Suzanne Art,1,0,0,0,0,0,0,0,0,25,13.0,0.6,1168.0,389.0,False,09/13/2021,16,17,91,3,2021-10-17,1.7999999999999998,not_requested,0.0
2865,Jitka Zdvihalova,1,0,0,0,0,0,0,0,0,3,2.0,0.25,2581.0,1671.0,False,05/01/2021,10,14,56,0,2021-11-22,0.25,not_requested,0.0
2866,Joe Tamponi: Editions,1,0,0,0,0,0,0,0,0,8,71.0,0.05,2281.0,2443.0,False,08/11/2021,24,10,152,5,2021-08-23,0.04,not_requested,0.0
2867,Joe Tamponi: Neon Weirdos,1,0,0,0,0,0,0,0,0,10,78.0,0.2,2281.0,2443.0,False,08/11/2021,24,10,152,5,2021-10-09,1.4388999999999998,not_requested,0.0
2868,Joe Tamponi: Trading Cards,0,0,0,0,0,0,1,0,0,58,466.0,0.022,2281.0,2443.0,False,08/11/2021,24,10,152,5,2021-08-27,0.7359000000000002,approved,0.0
2869,Jolly Bully Squad,0,1,0,0,0,0,0,0,0,24,21.0,0.123,994.0,917.0,False,07/12/2021,3,5,27,5,2021-08-23,0.1,not_requested,120.0
2870,Jolly Elves,1,0,0,0,0,0,0,0,0,594,352.0,0.007,4086.0,326.0,False,10/20/2021,86,64,179,9,2021-12-09,1.3028999999999995,not_requested,190.0
2871,Jolly YumSkulls,1,0,0,0,0,0,0,0,0,4800,37.0,0.001,304.0,258.0,False,10/19/2021,2,3,8,0,2021-11-04,0.2335970000000001,not_requested,122.0
2872,Jon Burgerman,1,1,0,0,0,0,0,0,0,1300,205.0,0.065,26789.0,1342.0,True,04/28/2008,22,18,324,2,2020-05-07,0.935,verified,44.0
2873,Jonny Cotton Voodoo Dolls,0,1,0,0,0,0,0,0,0,78,32.0,0.015,6815.0,1242.0,False,03/29/2009,7,1,7,1,2021-10-14,0.3945000000000002,not_requested,332.0
2874,JorrParivar,0,1,0,0,0,0,0,0,0,1300,169.0,0.05,25316.0,604.0,True,05/03/2015,6,10,55,2,2021-07-22,0.599,not_requested,126.0
2875,JosWorld,0,1,0,0,0,0,0,0,0,56,14.0,0.01,297.0,361.0,False,11/18/2021,5,4,53,3,2021-12-09,0.1,not_requested,0.0
2876,Joseon Dynasty,0,1,0,0,0,0,0,0,0,1400,447.0,0.11,2514.0,333.0,False,09/09/2021,215,213,245,6,2021-10-12,23.786879750000004,approved,71.0
2877,Josephine LF film collection,1,0,0,0,0,0,0,0,0,10,3.0,0.025,618.0,1144.0,False,01/29/2016,9,5,23,2,2021-11-13,0.025,not_requested,0.0
2878,Joshua Buscay Editions,0,0,0,0,1,0,0,0,0,1,2.0,0.03,1164.0,2328.0,False,09/29/2021,2,4,24,2,2021-12-15,0.03,not_requested,5.0
2879,Josie,1,0,0,0,0,0,0,0,0,361,166.0,5.0,21199.0,1448.0,False,01/12/2018,122,116,649,32,2019-06-20,37.0,verified,36.0
2880,Journey of Colour by Ben Savage,0,0,0,0,1,0,0,0,0,40,27.0,0.25,6586.0,1423.0,False,12/07/2020,15,8,90,4,2021-08-31,0.25,not_requested,0.0
2881,Journey of Stardust,1,0,0,0,0,0,0,0,0,32,20.0,0.15,2457.0,1.0,False,11/22/2021,37,32,40,15,2021-11-22,1.6499999999999997,not_requested,2.0
2882,Jovan Yudistira,0,0,0,1,0,0,0,0,0,11,39.0,0.002,1568.0,970.0,False,06/27/2010,12,5,16,3,2021-08-12,0.0081,not_requested,4.0
2883,Judgmental Pigeons,1,0,0,0,0,0,0,0,0,90,39.0,0.003,1847.0,1177.0,False,08/15/2021,1,1,2,0,2021-08-16,0.024,not_requested,6.0
2884,Juggernauts by PC,0,0,0,0,0,1,0,0,0,412,242.0,0.12,14214.0,132.0,True,11/02/2018,156,64,792,21,2021-09-10,10.37869696969697,not_requested,46.0
2885,Juice Eternal,1,0,0,0,0,0,0,0,0,4,2.0,0.025,786.0,1469.0,False,03/23/2019,10,3,12,2,2021-11-17,0.04,not_requested,0.0
2886,JuicyCephalopods in JuicyOcean,0,1,0,0,0,0,0,0,0,6,2.0,0.015,21.0,79.0,False,09/26/2021,3,1,6,3,2021-09-27,0.015,not_requested,0.0
2887,Julia Set Collection,1,0,0,0,0,0,0,0,0,4200,913.0,0.001,3792.0,557.0,False,08/19/2021,37,39,50,23,2021-09-16,1.062425,not_requested,47.0
2888,JungilPunx,0,1,0,0,0,0,0,0,0,20,5.0,0.01,237.0,177.0,False,10/12/2014,2,4,7,1,2021-08-31,0.012,not_requested,64.0
2889,Junior Punks,0,0,0,0,0,0,0,1,0,5600,2700.0,0.12,4655.0,29.0,False,11/19/2021,1701,215,1790,24,2021-12-17,350.9602355499991,approved,85.0
2890,Junkie Catz,0,1,0,0,0,0,0,0,0,448,208.0,0.009,2429.0,16.0,False,09/28/2021,4241,5472,3624,61,2021-11-01,0.2105,not_requested,231.0
2891,JurassicPunks,1,0,0,0,0,0,0,0,0,250,69.0,0.019,536.0,932.0,False,11/08/2011,5,3,41,3,2021-01-06,0.075,approved,191.0
2892,Just Llamas,0,1,0,0,0,0,0,0,0,25,7.0,0.004,42.0,68.0,False,09/22/2021,4,3,10,4,2021-11-07,0.008,not_requested,81.0
2893,Just Punk Art,1,0,0,0,0,0,0,0,0,900,61.0,0.001,325.0,310.0,False,04/23/2017,3,2,6,2,2021-09-28,0.0135710425154596,not_requested,0.0
2894,Just cement,0,1,0,0,0,0,0,0,0,398,95.0,0.015,148.0,6.0,False,11/25/2021,48,6,42,4,2021-11-25,0.6400000000000003,not_requested,65.0
2895,Justin Beaver,1,0,0,0,0,0,0,0,0,13,2.0,0.01,165.0,153.0,False,04/10/2021,67,6,178,4,2021-12-07,0.01,not_requested,8.0
2896,Justin Roiland,1,0,0,0,0,0,0,0,0,3700,430.0,0.06,744771.0,1967.0,True,06/18/2012,2387,527,22925,290,2021-01-19,0.5270000000000001,verified,0.0
2897,Juu Juu Gallery,0,0,0,0,0,0,0,1,0,9,4.0,0.184,2402.0,153.0,False,01/03/2018,9,18,106,3,2021-11-21,0.092,not_requested,27.0
2898,K-Sunbee Unique NFT Jiduhwa Collection,1,0,0,0,0,0,0,0,0,4,3.0,0.04,51.0,57.0,False,10/16/2021,40,19,37,1,2021-10-29,0.074,not_requested,0.0
2899,KALEIDOSCOPE DOODLE Collection,1,0,0,0,0,0,0,0,0,8,11.0,0.002,17031.0,16217.0,False,06/24/2021,37,9,60,1,2021-10-13,0.002,not_requested,0.0
2900,KAMIMART,1,1,0,0,0,0,0,0,0,23,14.0,0.022,2434.0,748.0,False,05/03/2017,1,2,6,1,2020-05-11,0.022,approved,2.0
2901,KAWAII DROPS,1,0,0,0,0,0,0,0,0,11,8.0,1.5,2285.0,298.0,False,10/23/2011,4,5,78,2,2021-11-04,1.538043378107227,not_requested,0.0
2902,KHEMIA,1,0,0,0,0,0,0,0,0,15,5.0,0.196,6925.0,2774.0,False,05/29/2008,8,64,97,2,2021-08-26,0.7,not_requested,0.0
2903,KIA: CASE FILES,1,0,0,0,0,0,0,0,0,7,5600.0,0.001,32145.0,1006.0,False,07/22/2021,44,162,161,6,2021-10-16,0.049151,not_requested,7.0
2904,KIBOT PROJEKT,0,1,0,0,0,0,0,0,0,30,18.0,0.04,86.0,172.0,False,10/11/2021,6,3,24,2,2021-10-06,0.2,not_requested,52.0
2905,KIMAGURE STICKERS,1,0,0,0,0,0,0,0,0,40,6.0,0.007,565.0,90.0,False,01/07/2017,9,1,65,1,2021-11-07,0.0195,not_requested,0.0
2906,KING'S GALA,1,0,0,0,0,0,0,0,0,3600,679.0,0.049,4685.0,6.0,False,08/29/2021,71,61,228,9,2021-10-30,2.1169,approved,206.0
2907,KIRU THE CAT,1,0,0,0,0,0,0,0,0,25,3.0,0.006,1046.0,1369.0,False,08/21/2021,11,3,20,3,2021-11-18,0.012,not_requested,0.0
2908,KISS-VERSE,1,0,0,0,0,0,0,0,0,18,158.0,0.135,4032.0,1108.0,False,11/22/2011,365,111,397,13,2021-07-28,1.106,verified,0.0
2909,KL After Hours,0,0,0,0,1,0,0,0,0,11,2.0,0.03,11989.0,784.0,False,03/23/2012,64,174,169,2,2021-07-23,0.03,not_requested,14.0
2910,KLAY APE CLUB,0,1,0,0,0,0,0,0,0,10000,1200.0,0.041,4116.0,36.0,False,10/21/2021,678,689,684,28,2021-10-30,54.53841156999995,approved,113.0
2911,KLAYBLOX,0,1,0,0,0,0,0,0,0,62,46.0,0.825,5143.0,8.0,False,11/18/2021,1918,1941,1906,112,2021-12-16,0.3651216,not_requested,32.0
2912,KLAYGIANTBABY,1,0,0,0,0,0,0,0,0,551,156.0,0.04,4139.0,412.0,False,09/21/2021,1838,1857,1889,57,2021-10-30,6.0334782000000144,not_requested,194.0
2913,KLAYRock,0,1,0,0,0,0,0,0,0,181,114.0,4.647,2233.0,199.0,False,08/25/2021,37,15,65,7,2021-09-03,20.97813119,approved,0.0
2914,KNEECAPs,0,1,0,0,0,0,0,0,0,1100,256.0,0.009,255.0,327.0,False,06/11/2021,29,31,37,3,2021-06-22,0.0123,not_requested,60.0
2915,KONOFUKU,0,1,0,0,0,0,0,0,0,58,53.0,0.03,2140.0,1317.0,False,08/21/2012,39,20,54,4,2021-11-15,0.011,not_requested,0.0
2916,KOXEL,0,0,0,0,0,0,0,1,0,200,2200.0,0.003,953.0,130.0,False,05/17/2021,19,6,44,6,2021-07-16,0.019,not_requested,203.0
2917,KPPC Cards,0,1,0,0,0,0,0,0,0,32,13.0,0.015,60.0,151.0,False,11/28/2021,9,7,13,1,2021-12-13,0.1477,not_requested,0.0
2918,KRYPTON SPRAY PAINT,0,1,0,0,0,0,0,0,0,36,3.0,0.004,12.0,77.0,False,11/29/2021,0,2,25,1,2021-12-08,0.024,not_requested,3.0
2919,KYUKYU,0,1,0,0,0,0,0,0,0,32,6.0,0.009,2449.0,985.0,False,07/19/2021,95,66,82,6,2021-09-09,0.031,not_requested,10.0
2920,Kahncept: Art,1,0,0,0,0,0,0,0,0,5,7.0,0.15,2442.0,2435.0,False,03/03/2009,5,16,32,5,2021-10-27,1.75,not_requested,0.0
2921,Kaiju Goons,0,1,0,0,0,0,0,0,0,115,34.0,0.085,8274.0,75.0,False,01/06/2010,5,3,31,1,2021-09-06,0.255,not_requested,10.0
2922,KaijuKingz Club,0,1,0,0,0,0,0,0,0,190,56.0,0.01,54653.0,285.0,False,10/04/2021,5126,1012,5647,69,2021-10-20,0.1236500000000001,not_requested,9.0
2923,Kaleidohex,1,0,0,0,0,0,0,0,0,24,4.0,0.008,625.0,1393.0,False,11/23/2018,11,7,26,2,2021-09-22,0.024,not_requested,0.0
2924,Kalen Iwamoto,1,0,0,0,0,0,0,0,0,22,50.0,0.08,2454.0,1463.0,False,02/04/2018,28,9,33,2,2021-02-17,0.16,approved,7.0
2925,Kalpha,0,0,0,0,0,0,0,1,0,6,86.0,20.0,12476.0,27.0,False,03/18/2020,3279,197,932,45,2021-08-31,19.45,not_requested,6.0
2926,Kampai-S,1,0,0,0,0,0,0,0,0,18,11.0,0.004,1638.0,1126.0,False,07/07/2021,11,2,18,5,2021-11-18,0.0125,not_requested,2.0
2927,Kana & Riku,1,0,0,0,0,0,0,0,0,44,32.0,0.01,4970.0,5098.0,False,02/28/2021,1,1,8,0,2021-10-25,0.042,not_requested,11.0
2928,Kane Mayfield - Rare Finds / Missing Music,0,0,0,1,0,0,0,0,0,2,66.0,0.055,3982.0,1923.0,False,06/13/2009,13,8,37,6,2021-05-03,1.2256999999999998,not_requested,0.0
2929,Kang Universe,0,1,0,0,0,0,0,0,0,25,3.0,0.03,48.0,201.0,False,08/24/2021,3,10,4,0,2021-09-26,0.03,not_requested,56.0
2930,Kaponga | Ferns Unfurl,1,0,0,0,0,0,0,0,0,8,3.0,0.05,56.0,81.0,False,10/05/2021,2,4,18,3,2021-11-18,0.12,not_requested,1.0
2931,Kapook Piggie Original,0,1,0,0,0,0,0,0,0,102,3.0,0.1,304.0,1412.0,False,08/26/2021,36,2,36,2,2021-10-31,0.2,not_requested,155.0
2932,Kar: Istanbul Under Snow,0,0,0,0,1,0,0,0,0,33,4.0,0.13,5929.0,5601.0,False,07/02/2009,7,32,84,1,2021-11-22,0.52,approved,0.0
2933,Karen Mason Blair Grunge Collection - Flannel Years,1,0,0,0,0,0,0,0,0,51,16.0,0.15,346.0,42.0,False,02/08/2016,8,2,51,3,2021-10-15,6.000000000000004,not_requested,41.0
2934,Karin NFT Collection,1,0,0,0,0,0,0,0,0,13,10.0,0.075,964.0,365.0,False,11/09/2021,6,2,21,2,2021-11-09,0.895,not_requested,6.0
2935,Karrie Ross Art,1,0,0,0,0,0,0,0,0,24,73.0,0.023,6890.0,1714.0,False,06/29/2008,31,10,112,13,2021-09-25,0.066,not_requested,26.0
2936,Kate Samuels,1,0,0,0,0,0,0,0,0,8,45.0,0.005,15402.0,7492.0,False,04/14/2020,41,20,122,5,2021-07-28,0.32,not_requested,0.0
2937,Kate the Cursed 13 Editions,1,0,0,0,0,0,0,0,0,11,89.0,0.21,14868.0,2304.0,False,01/07/2019,43,28,257,7,2021-07-31,1.26,not_requested,3.0
2938,Kawaii Demon-chan,1,0,0,0,0,0,0,0,0,59,23.0,0.024,3878.0,1753.0,False,06/04/2021,48,14,114,11,2021-08-01,0.215,not_requested,95.0
2939,Kawaii Dog,1,0,0,0,0,0,0,0,0,37,17.0,0.002,278.0,318.0,False,10/19/2021,3,2,21,2,2021-11-05,0.0135,not_requested,0.0
2940,Kawaii Girls & Animals Collection Collectibles,0,1,0,0,0,0,0,0,0,14,71.0,0.05,1251.0,574.0,False,10/21/2021,7,8,47,3,2021-12-02,1.0455000000000003,not_requested,0.0
2941,Kawaii Penthouse,1,0,0,0,0,0,0,0,0,15,3.0,0.05,715.0,521.0,False,07/04/2010,5,3,15,3,2021-10-22,0.08,not_requested,0.0
2942,Kawaii Skull,0,1,0,0,0,0,0,0,0,10000,485.0,0.005,7136.0,747.0,False,09/09/2020,11,7,77,3,2021-07-23,2.2314000000000003,not_requested,721.0
2943,Kawaii Wong,1,0,0,0,0,0,0,0,0,3,18.0,0.19,834.0,925.0,False,01/29/2021,5,5,31,1,2021-11-20,0.0625,not_requested,8.0
2944,KawaiiCat,0,1,0,0,0,0,0,0,0,175,78.0,0.02,1194.0,559.0,False,01/04/2018,19,5,32,5,2021-08-08,0.156,not_requested,513.0
2945,Kayfabe Superstars (Jobbers),0,0,0,0,0,0,1,0,0,11,12.0,0.014,37.0,55.0,False,09/17/2021,11,8,16,6,2021-10-04,0.1862999999999999,not_requested,70.0
2946,Keith Harings People #1,1,0,0,0,0,0,0,0,0,11,2.0,0.008,81.0,591.0,False,10/11/2021,0,2,3,0,2021-10-07,0.024,not_requested,0.0
2947,Kenny G Lies and Zombies,0,1,0,0,0,0,0,0,0,6,8.0,0.05,50595.0,4255.0,False,05/09/2020,663,124,1866,62,2021-12-11,0.2598999999999999,not_requested,0.0
2948,Kewl Club,0,0,0,0,0,0,0,1,0,187,96.0,0.11,10894.0,5013.0,False,08/17/2009,3,7,26,1,2021-09-30,0.285,not_requested,0.0
2949,Keys to the Metaverse,0,0,0,0,0,0,0,1,0,2800,292.0,0.004,696.0,112.0,False,03/03/2021,59,17,206,5,2021-10-25,1.854122399999993,not_requested,395.0
2950,KickDrops,1,1,0,0,0,0,0,0,0,12,6.0,0.03,20.0,61.0,False,03/23/2021,2,1,7,0,2021-03-26,0.03,not_requested,12.0
2951,Kid Art Projects (KAP) KidArtProjects.com,1,1,0,0,0,0,0,0,0,32,18.0,0.022,1861.0,4989.0,False,03/26/2021,18,5,42,4,2021-03-26,0.2769999999999999,not_requested,12.0
2952,KidPunks,0,1,0,0,0,0,0,0,0,999,290.0,0.049,5348.0,1545.0,False,07/03/2021,36,34,46,4,2021-07-07,1.3901500000000002,not_requested,1079.0
2953,Kiersten's Beautiful Mind,1,0,0,0,0,0,0,0,0,6,3.0,0.006,492.0,435.0,False,07/31/2017,4,2,11,1,2021-11-13,0.0177,not_requested,0.0
2954,Kiki City,0,1,0,0,0,0,0,0,0,615,214.0,0.02,1652.0,144.0,False,07/01/2021,33,14,68,12,2021-11-26,0.13,not_requested,0.0
2955,Killer Bunny Club,0,1,0,0,0,0,0,0,0,48,15.0,0.008,298.0,1285.0,False,08/26/2021,8,14,21,4,2021-08-27,0.0375,not_requested,116.0
2956,Killer Burger,1,0,0,0,0,0,0,0,0,18,4.0,0.008,3676.0,4806.0,False,04/07/2009,4,12,26,1,2021-11-20,0.037,not_requested,0.0
2957,Kimono Fabrics,1,0,0,0,0,0,0,0,0,49,8.0,0.1,8.0,237.0,False,03/30/2021,5,1,19,0,2021-05-14,0.15,not_requested,0.0
2958,Kimono Girls Catalog,1,0,0,0,0,0,0,0,0,30,18.0,0.008,472.0,250.0,False,10/05/2021,4,9,48,2,2021-10-15,0.085,not_requested,0.0
2959,KimonoGirl NFT,0,1,0,0,0,0,0,0,0,14,14.0,0.5,2299.0,545.0,False,11/13/2016,15,23,59,5,2021-10-11,0.305,not_requested,23.0
2960,KimonoNinjaPunks,1,0,0,0,0,0,0,0,0,673,230.0,0.01,3934.0,653.0,False,08/13/2021,15,31,138,4,2021-05-23,1.2962999999999998,not_requested,0.0
2961,Kinesis Art,1,0,0,0,0,0,0,0,0,5200,2000.0,0.008,2721.0,48.0,False,09/08/2021,187,193,247,21,2021-09-15,0.8844231100000003,verified,193.0
2962,KingRabbit,0,0,0,0,0,0,0,1,0,65,40.0,0.1,1633.0,1005.0,False,07/15/2013,11,3,23,3,2021-03-04,0.7489999999999999,requested,0.0
2963,Kingdom Cats,1,0,0,0,0,0,0,0,0,95,3.0,0.002,33.0,152.0,False,11/18/2021,2,4,7,2,2021-11-19,0.0055,not_requested,71.0
2964,Kingdom of Dwarves NFT,0,1,0,0,0,0,0,0,0,22,4.0,0.06,15043.0,659.0,False,10/10/2021,967,873,1295,324,2021-11-04,0.23,not_requested,0.0
2965,KinkySkullx,0,1,0,0,0,0,0,0,0,493,152.0,1.95,25620.0,600.0,False,03/12/2021,152,148,232,16,2021-03-12,22.046,verified,188.0
2966,Kino's Friends,0,1,0,0,0,0,0,0,0,8,2.0,0.2,2991.0,33.0,False,11/07/2021,2427,51,755,8,2021-11-20,0.15,not_requested,0.0
2967,Kinochromes,1,0,0,0,0,0,0,0,0,512,213.0,0.037,65.0,1.0,False,11/09/2021,3,1,6,0,2021-11-09,0.9614,not_requested,42.0
2968,KiraKiraWorld,1,0,0,0,0,0,0,0,0,14,12.0,0.12,1237.0,533.0,False,10/03/2021,0,5,13,1,2021-10-05,0.16,not_requested,0.0
2969,KireevArt Photography,0,0,0,0,1,0,0,0,0,500,36.0,0.04,3518.0,1273.0,False,03/14/2021,2,2,5,1,2021-08-26,0.22,not_requested,3.0
2970,Kishuverse,1,0,0,0,0,0,0,0,0,6900,1400.0,0.01,370435.0,61.0,False,11/30/2020,947,733,3563,33,2021-11-01,0.6885000000000002,approved,126.0
2971,Kitenge Squad,1,0,0,0,0,0,0,0,0,10,8.0,0.055,1173.0,1062.0,False,08/30/2021,22,5,72,2,2021-10-06,0.055,not_requested,0.0
2972,Kitticon,0,1,0,0,0,0,0,0,0,242,663.0,0.008,2759.0,4942.0,False,05/28/2021,34,498,296,8,2021-07-15,0.1524802,not_requested,922.0
2973,Kitty Cones Special Editions,0,1,0,0,0,0,0,0,0,16,12.0,0.06,258.0,34.0,False,06/22/2021,21,15,37,5,2021-10-24,0.075,not_requested,0.0
2974,Kitty Punks,0,1,0,0,0,0,0,0,0,1000,3.0,0.001,23.0,31.0,False,10/13/2021,0,0,2,0,2021-10-27,0.0099999999999999,not_requested,47.0
2975,KittyVerse 88 Zephir,1,0,0,0,0,0,0,0,0,15,5.0,0.088,267.0,213.0,False,09/13/2021,6,4,44,4,2021-10-16,0.088,not_requested,0.0
2976,Kkakdugi Universe,0,1,0,0,0,0,0,0,0,220,78.0,0.013,3733.0,7.0,False,11/09/2021,962,937,971,253,2021-11-29,0.0894872999999999,not_requested,0.0
2977,Klay Hamster,0,1,0,0,0,0,0,0,0,220,51.0,0.006,212.0,149.0,False,09/06/2021,23,15,42,1,2021-11-11,0.3943697699999999,not_requested,161.0
2978,Klay Hodori,0,1,0,0,0,0,0,0,0,1700,274.0,0.023,234.0,0.0,False,11/21/2021,33,5,40,4,2021-12-01,1.2408341699999998,not_requested,40.0
2979,Klay Museum,0,0,0,0,0,0,0,1,0,5500,675.0,0.011,2337.0,316.0,False,11/14/2021,718,724,789,42,2021-12-17,13.236326004999968,not_requested,0.0
2980,Klay Mystery Egg,0,1,0,0,0,0,0,0,0,10000,1000.0,0.01,598.0,4.0,False,11/07/2021,173,48,129,24,2021-09-19,25.31017975000036,approved,160.0
2981,Klay Teddy Castle,0,1,0,0,0,0,0,0,0,10000,103.0,0.016,1743.0,1137.0,False,09/18/2021,94,88,95,10,2021-11-24,0.303453536,not_requested,8.0
2982,Klay World,1,0,0,0,0,0,0,0,0,61,23.0,0.005,965.0,289.0,False,12/03/2021,32,8,55,3,2021-12-01,0.11945514,not_requested,15.0
2983,KlayBunnies,0,1,0,0,0,0,0,0,0,155,54.0,0.016,1056.0,676.0,False,09/26/2021,63,32,80,1,2021-10-21,0.3782130138000001,not_requested,0.0
2984,KlayChicken,0,1,0,0,0,0,0,0,0,1000,256.0,0.02,3435.0,464.0,False,09/08/2021,377,346,383,13,2021-09-11,4.692835213749998,not_requested,170.0
2985,KlayDogesFriend,1,0,0,0,0,0,0,0,0,4000,1100.0,0.015,12095.0,109.0,False,11/15/2018,462,357,568,11,2021-09-04,5.6654774270000265,not_requested,93.0
2986,KlayFox,0,1,0,0,0,0,0,0,0,328,187.0,0.021,2465.0,180.0,False,09/02/2021,232,202,257,3,2021-09-18,7.4738988500000065,not_requested,76.0
2987,KlayMojis,0,1,0,0,0,0,0,0,0,422,119.0,0.018,1212.0,107.0,False,09/07/2021,153,134,176,8,2021-09-14,0.37632552,not_requested,0.0
2988,KlayMole,1,0,0,0,0,0,0,0,0,91,31.0,0.008,855.0,479.0,False,11/28/2021,388,321,443,4,2021-12-02,0.2841322179999999,not_requested,6.0
2989,KlayPeople,1,0,0,0,0,0,0,0,0,25,17.0,0.012,1066.0,738.0,False,11/02/2021,84,19,127,1,2021-12-14,0.1933605,not_requested,0.0
2990,KlayRabbit,0,1,0,0,0,0,0,0,0,9700,2000.0,0.012,5735.0,186.0,False,09/17/2021,1657,1130,1717,40,2021-10-12,22.61416409999998,not_requested,122.0
2991,KlaySimians,0,1,0,0,0,0,0,0,0,1400,284.0,0.009,1148.0,113.0,False,10/19/2021,74,47,82,2,2021-10-30,1.179567479999999,not_requested,71.0
2992,KlayWeasel,0,1,0,0,0,0,0,0,0,126,63.0,0.041,2077.0,117.0,False,09/08/2020,1378,1374,1131,221,2021-10-08,1.53521008,not_requested,12.0
2993,KlayWoman,1,0,0,0,0,0,0,0,0,160,25.0,0.033,378.0,99.0,False,09/30/2021,31,29,59,1,2021-12-15,2.222680164000001,not_requested,296.0
2994,Klaydobermann,1,0,0,0,0,0,0,0,0,111,57.0,0.236,3601.0,4120.0,False,09/21/2021,288,278,318,12,2021-09-26,1.02116931,not_requested,2.0
2995,Klminjeongeum NFT,0,1,0,0,0,0,0,0,0,11200,188.0,0.017,1743.0,1137.0,False,09/18/2021,94,88,95,10,2021-09-16,0.08520732,not_requested,30.0
2996,Klubs Arts,1,0,0,0,0,0,0,0,0,1600,369.0,0.002,1960.0,1.0,False,10/28/2021,105,89,202,17,2021-12-09,0.11421295,not_requested,0.0
2997,Klumba #1,1,0,0,0,0,0,0,0,0,258,2.0,0.5,560.0,20.0,False,11/20/2021,21,7,43,2,2021-11-20,0.1,not_requested,69.0
2998,Knights of Chain,1,0,0,0,0,0,0,0,0,569,268.0,0.08,11735.0,224.0,False,10/04/2021,640,543,921,11,2021-12-05,10.365598000000002,not_requested,346.0
2999,Knights of Degen - Knights!,0,0,0,0,0,1,0,0,0,8900,2500.0,0.235,13102.0,176.0,False,08/26/2021,144,29,156,10,2021-09-21,425.9897405983119,approved,190.0
3000,KnownOrigin,1,0,0,0,0,0,0,0,0,44100,9200.0,0.01,92697.0,9046.0,False,01/24/2018,15,147,249,2,2019-04-26,152.89969999999997,verified,0.0
3001,Koala Intelligence Agency,0,1,0,0,0,0,0,0,0,10000,5100.0,0.179,32146.0,1006.0,False,07/22/2021,44,162,161,6,2021-08-21,324.48417765938694,verified,195.0
3002,Koala Kool,0,1,0,0,0,0,0,0,0,6300,39.0,0.001,8815.0,9072.0,False,09/14/2021,25,11,47,2,2021-10-30,0.185,not_requested,130.0
3003,Kobe Bryant 24,1,0,0,0,0,0,0,0,0,25,33.0,0.002,1.0,14.0,False,11/03/2021,0,0,2,1,2021-11-29,0.0533,not_requested,0.0
3004,Kobe Bryant Lakers,0,0,0,0,0,1,0,0,0,17,9.0,0.001,23.0,211.0,False,05/08/2021,1,30,22,1,2021-07-07,0.0188,not_requested,4.0
3005,Kobe Bryant Special,0,1,0,0,0,0,0,0,0,101,4.0,0.015,1347.0,1215.0,False,08/11/2021,6,1,8,2,2021-08-20,0.04,not_requested,0.0
3006,Koguns,0,1,0,0,0,0,0,0,0,6000,105.0,0.009,1359.0,333.0,False,11/01/2021,7,2,15,1,2021-10-21,0.07,not_requested,293.0
3007,Kohi Kintsugi,1,0,0,0,0,0,0,0,0,1000,525.0,0.5,1390.0,3.0,False,09/21/2021,25,10,72,7,2021-10-08,15.493598,verified,87.0
3008,Kohi x eepmon CityLights,1,0,0,0,0,0,0,0,0,1200,580.0,0.089,1526.0,391.0,False,01/15/2009,6,5,32,3,2021-11-22,8.140999999999996,approved,0.0
3009,Koi Boi NFT,1,0,0,0,0,0,0,0,0,1600,344.0,0.01,4037.0,647.0,False,09/20/2021,77,69,109,12,2021-10-08,0.0293199999999999,not_requested,155.0
3010,Koi Metaverse,0,1,0,0,0,0,0,0,0,934,242.0,0.049,25815.0,37.0,False,06/24/2021,8512,1754,5947,1265,2021-10-02,4.429799999999999,not_requested,30.0
3011,Koin Games Dev Squad,0,1,0,0,0,0,0,0,0,5600,1800.0,0.423,10344.0,1046.0,False,05/03/2021,246,222,364,25,2021-09-05,91.11281071254696,verified,591.0
3012,KoleMozter Club,0,1,0,0,0,0,0,0,0,129,56.0,0.002,2910.0,4962.0,False,06/05/2009,5,9,14,1,2021-11-15,0.0609,not_requested,332.0
3013,Kolectiv,1,0,0,0,0,0,0,0,0,670,352.0,0.089,8523.0,482.0,False,02/09/2021,31,12,64,8,2021-06-10,55.56869,verified,1117.0
3014,Komainu heroes clab,0,1,0,0,0,0,0,0,0,8,7.0,0.008,111.0,65.0,False,11/07/2021,23,13,30,5,2021-12-04,0.008,not_requested,5.0
3015,Kongo Kingz,0,1,0,0,0,0,0,0,0,10000,227.0,0.002,822.0,477.0,False,10/20/2021,57,46,76,2,2021-12-04,0.9860889999999932,not_requested,271.0
3016,KoniCats,0,1,0,0,0,0,0,0,0,58,8.0,0.008,919.0,773.0,False,11/07/2021,4,8,33,1,2021-11-06,0.018,not_requested,0.0
3017,Korbinian Vogt - Human Nature,0,0,0,0,1,0,0,0,0,100,47.0,0.15,4578.0,1981.0,False,12/18/2017,5,2,27,1,2021-02-22,0.35,approved,5.0
3018,Korbinian Vogt - Small Scale Projects,0,0,0,0,1,0,0,0,0,17,11.0,0.985,4578.0,1981.0,False,12/18/2017,5,2,27,1,2021-10-25,0.7773,not_requested,8.0
3019,Korbinian Vogt - Unique Works,0,0,0,0,1,0,0,0,0,45,29.0,0.2,4578.0,1981.0,False,12/18/2017,5,2,27,1,2021-09-06,0.4476,not_requested,18.0
3020,Korzenie,1,0,0,0,0,0,0,0,0,14,7.0,0.004,339.0,83.0,False,11/22/2019,4,2,12,3,2021-11-12,0.003,not_requested,0.0
3021,Kosium Pioneers,0,0,0,0,0,0,0,1,0,520,227.0,0.11,2813.0,503.0,False,09/06/2021,141,57,125,9,2021-11-30,1.6250124447596703,not_requested,303.0
3022,Koukousei girl,0,1,0,0,0,0,0,0,0,20,9.0,0.02,1465.0,1418.0,False,02/24/2021,68,19,133,21,2021-11-27,0.3326,not_requested,5.0
3023,Kratos Punk,1,0,0,0,0,0,0,0,0,17,29.0,0.005,158.0,193.0,False,10/07/2021,35,22,39,6,2021-10-06,0.008,not_requested,0.0
3024,Krazy Koalas NFT,0,1,0,0,0,0,0,0,0,10000,3700.0,0.01,8533.0,692.0,False,08/02/2021,357,395,420,7,2021-08-16,4.252895899999986,verified,152.0
3025,Kristoph Galland,0,1,0,1,0,0,0,0,0,15,3000.0,0.004,30055.0,2039.0,False,08/06/2009,8,4,8,2,2020-12-26,0.2126835176506137,approved,63.0
3026,Kronic Katz,0,1,0,0,0,0,0,0,0,79,55.0,0.045,8921.0,1399.0,False,03/14/2011,50,13,71,5,2021-08-20,0.76,not_requested,219.0
3027,Krown Chakras NFTS,0,1,0,0,0,0,0,0,0,3,11.0,2.5,102.0,21.0,False,11/26/2020,5,3,20,1,2021-11-29,0.144308,not_requested,0.0
3028,Krypto Ballers,0,0,0,0,0,0,1,0,0,4,2.0,0.024,2.0,2.0,False,10/26/2021,0,0,0,0,2021-10-26,0.025,not_requested,10.0
3029,Krypto Dose,0,1,0,0,0,0,0,0,0,55,7.0,0.026,117.0,11.0,False,12/10/2021,31,34,43,6,2021-12-14,0.052,not_requested,0.0
3030,Krypto Kuma's,0,1,0,0,0,0,0,0,0,16,7.0,0.009,1539.0,1289.0,False,05/15/2019,4,3,16,2,2021-11-08,0.0269999999999999,not_requested,22.0
3031,Krypto the Cryptonian Pixel Art Collection,0,1,0,0,0,0,0,0,0,3200,223.0,0.001,274.0,137.0,False,09/12/2011,10,7,29,3,2021-10-30,0.0952032999999,not_requested,179.0
3032,KryptoBoredApes,0,1,0,0,0,0,0,0,0,30,20.0,0.078,20.0,8.0,False,12/22/2021,2,2,9,1,2021-12-01,1.1148999999999998,not_requested,8.0
3033,KryptoGlyphs,1,0,0,0,0,0,0,0,0,25,4.0,0.049,4062.0,4166.0,False,07/25/2021,32,15,126,4,2021-11-24,0.221,not_requested,0.0
3034,Kryptomon.,0,1,0,0,0,0,0,0,0,19,6.0,0.06,119958.0,26.0,False,04/01/2021,22,43,135,4,2021-09-11,0.185,not_requested,14.0
3035,Kuki Metabots,0,0,0,0,0,0,0,1,0,103,47.0,0.101,398.0,446.0,False,03/11/2020,12,5,26,3,2021-11-09,3.434,not_requested,0.0
3036,Kuma Cash,0,0,0,0,0,0,0,1,0,1,9.0,479.999,85.0,92.0,False,12/06/2021,57,25,71,12,2021-12-07,0.012,not_requested,0.0
3037,Kumo x Collabs,0,1,0,0,0,0,0,0,0,12,9.0,1.8,12819.0,52.0,False,08/16/2021,861,771,1011,18,2021-10-06,0.9872,approved,8.0
3038,Kumo x World Residents,0,0,0,0,0,0,0,1,0,6600,3500.0,0.388,12819.0,52.0,False,08/16/2021,861,771,1011,18,2021-11-10,2053.925861801682,approved,525.0
3039,Kumoni,1,0,0,0,0,0,0,0,0,76,286.0,0.001,1273.0,145.0,False,10/05/2021,59,3,81,3,2021-10-21,0.0589999999999999,not_requested,0.0
3040,Kungfu Hero,0,1,0,0,0,0,0,0,0,5600,1300.0,0.001,3762.0,1158.0,False,06/06/2021,188,222,234,25,2021-07-10,0.0291,not_requested,186.0
3041,Kyoto City,0,0,0,1,0,0,0,0,0,11,5.0,0.01,407.0,631.0,False,05/21/2009,1,4,7,3,2021-07-04,0.01,not_requested,20.0
3042,L I N U R,1,0,0,0,0,0,0,0,0,300,133.0,0.14,949.0,208.0,False,10/02/2021,2,8,32,2,2021-10-08,2.4026999999999994,not_requested,36.0
3043,L*** is the Mission by HIN,1,0,0,0,0,0,0,0,0,13,8.0,0.005,236.0,515.0,False,05/16/2021,26,7,62,5,2021-06-20,0.03,not_requested,0.0
3044,L.A Memoirs,0,0,0,0,1,0,0,0,0,16,4.0,0.06,9183.0,2372.0,False,10/24/2019,29,15,218,2,2021-10-19,0.06,not_requested,0.0
3045,LATTE LATTE,0,1,0,0,0,0,0,0,0,117,125.0,0.004,16785.0,498.0,False,07/26/2021,109,54,129,8,2021-10-27,0.16636,not_requested,0.0
3046,LAYLAY'S MEMORY,1,0,0,0,0,0,0,0,0,5,5.0,1.5,4190.0,2280.0,False,04/10/2021,81,74,219,8,2021-04-22,0.07,not_requested,0.0
3047,LCD BOY / NFT,0,1,0,0,0,0,0,0,0,312,113.0,0.01,8495.0,3331.0,False,08/09/2015,1,45,21,0,2021-07-16,0.118,not_requested,40.0
3048,LE Madness,0,0,0,0,1,0,0,0,0,15,3.0,0.1,224.0,627.0,False,05/06/2021,1,2,8,2,2021-12-15,0.2,not_requested,0.0
3049,LEAFCAT,0,1,0,0,0,0,0,0,0,122,55.0,0.005,1253.0,949.0,False,07/31/2021,0,1,1,0,2021-11-08,0.2478489000000001,not_requested,0.0
3050,LEAGUEOFANCIENTS,0,0,0,0,0,1,0,0,0,4,2.0,0.005,196815.0,33.0,False,09/17/2021,12343,3760,7620,2590,2021-12-09,0.04,not_requested,22.0
3051,LEGENDS art collectible series,0,1,0,0,0,0,0,0,0,27,8.0,0.02,2072.0,935.0,False,03/08/2021,41,16,111,5,2021-03-22,0.02,not_requested,8.0
3052,LEGENDZ,1,1,0,0,0,0,0,0,0,1200,492.0,0.046,4004.0,3302.0,False,05/03/2021,9,3,58,2,2021-05-16,6.404799999999999,verified,3.0
3053,LES DIEZ GRACIAS,1,0,0,0,0,0,0,0,0,30,21.0,0.15,4453.0,933.0,False,03/15/2021,34,35,377,6,2021-10-09,0.62,approved,0.0
3054,LIFE OF THE PARTY?,1,0,0,0,0,0,0,0,0,51,8.0,0.005,152.0,417.0,False,11/17/2021,9,14,27,2,2021-12-07,0.01,not_requested,126.0
3055,LIFEX,1,0,0,0,0,0,0,0,0,10,2.0,0.03,151584.0,228.0,True,05/09/2007,5,13,96,4,2021-04-21,0.04,not_requested,0.0
3056,LILLIPUT - The World Of Small,0,0,0,0,1,0,0,0,0,10,3.0,0.1,1199.0,2212.0,False,01/04/2015,17,15,36,7,2021-10-06,0.28,not_requested,0.0
3057,LIMITLESS TREASURES,1,0,0,0,0,0,0,0,0,104,678.0,0.002,1370.0,4457.0,False,05/23/2021,10,3,48,1,2021-09-15,0.014645,not_requested,3.0
3058,LINEPUNK,1,0,0,0,0,0,0,0,0,296,101.0,0.101,5195.0,874.0,False,04/12/2021,23,117,222,2,2021-05-26,0.11,not_requested,251.0
3059,LIT Project One,0,1,0,0,0,0,0,0,0,892,816.0,1.28,10089.0,86.0,False,11/30/2021,237,92,587,62,2021-12-05,261.4805999999999,approved,900.0
3060,LOES Tarrafal,1,0,0,0,0,0,0,0,0,8600,230.0,0.001,225.0,4.0,False,11/17/2021,160,214,187,14,2021-11-16,0.0126509999999999,not_requested,142.0
3061,LONDON GIFT by POB,1,0,0,0,0,0,0,0,0,8900,2800.0,0.05,6606.0,6.0,False,09/22/2020,20,18,53,5,2021-08-05,4.551099293223646,verified,35.0
3062,LOS MALANDROS,0,1,0,0,0,0,0,0,0,196,97.0,0.369,3988.0,1059.0,False,02/17/2021,41,38,127,7,2021-08-18,28.3273778125,approved,0.0
3063,LOST Series,1,0,0,0,0,0,0,0,0,12,27.0,1.0,3317.0,921.0,False,07/27/2009,73,47,129,6,2021-03-20,6.5,not_requested,0.0
3064,LOSTPOETS,1,0,0,0,0,0,0,0,0,27600,8500.0,0.8,31995.0,1.0,False,08/29/2021,59,84,527,8,2021-09-03,958.8509475605392,verified,0.0
3065,LOVE MIRAI RAINBOW,0,0,0,0,0,0,1,0,0,101,164.0,0.001,3668.0,4939.0,False,09/02/2021,10,9,24,2,2021-09-20,0.006,not_requested,0.0
3066,LOVE NATURE by Angel Rivas,1,0,0,0,0,0,0,0,0,171,94.0,0.01,3803.0,2774.0,False,03/17/2020,6,8,29,3,2021-09-30,0.049,not_requested,0.0
3067,LOVE-STORY,0,0,0,0,1,0,0,0,0,6,2.0,0.08,895.0,963.0,False,12/06/2020,6,14,49,0,2021-12-07,0.1,not_requested,0.0
3068,LOVEBEING 1 of 1,1,0,0,0,0,0,0,0,0,66,16.0,0.3,758.0,511.0,False,09/02/2021,2,4,22,1,2021-09-24,0.66,not_requested,0.0
3069,LOVEIS4LOVERS,1,0,0,0,0,0,0,0,0,16,13.0,42.0,651.0,1284.0,False,06/01/2020,8,3,28,2,2021-10-05,1.0,not_requested,8.0
3070,LOreaI Paris Reds of Worth,1,0,0,0,0,0,0,0,0,5,20.0,5.482,505548.0,1865.0,True,11/03/2009,97,31,364,19,2021-12-14,0.12345,not_requested,0.0
3071,LSD Gummy Bear PFPs,1,0,0,0,0,0,0,0,0,112,169.0,0.005,18653.0,18513.0,False,03/03/2021,25,7,55,2,2021-09-05,0.0098999999999999,not_requested,0.0
3072,LSDGB:CHARITY,1,0,0,0,0,0,0,0,0,101,382.0,0.005,18653.0,18513.0,False,03/03/2021,25,7,55,2,2021-10-30,0.19748,not_requested,0.0
3073,LU Surf Club,0,0,0,0,0,0,0,1,0,100,6.0,0.1,330.0,180.0,False,11/10/2021,3,1,5,0,2021-11-26,0.28,not_requested,29.0
3074,LUCKY CAT CLUB,1,0,0,0,0,0,0,0,0,7,330.0,0.003,824.0,2834.0,False,04/30/2021,6,4,11,1,2021-09-30,0.0267120726833656,not_requested,7.0
3075,LXST SOULS,1,0,0,0,0,0,0,0,0,34,48.0,0.03,345.0,9.0,False,10/25/2012,7,6,23,3,2021-12-17,0.5306970000000002,not_requested,0.0
3076,LaMelo Ball Collectibles,0,0,0,0,0,1,0,0,0,8100,3000.0,0.021,1324.0,28.0,False,05/27/2021,1,6,10,0,2021-06-04,16.461662829261662,verified,12.0
3077,Labo NFT,0,1,0,0,0,0,0,0,0,6700,1300.0,0.002,1773.0,449.0,False,09/30/2021,401,454,507,10,2021-10-23,5.519407265879953,not_requested,205.0
3078,Labrats NFT Official,0,0,0,0,0,0,0,1,0,982,429.0,0.039,19088.0,1513.0,False,09/13/2021,4022,65,1053,6,2021-12-12,7.724491400187499,not_requested,306.0
3079,Lady Apes Of Space Official,0,1,0,0,0,0,0,0,0,2600,1200.0,0.02,19445.0,847.0,False,06/29/2021,494,479,989,24,2021-12-17,4.581999999999998,not_requested,101.0
3080,Lake Effect,0,0,0,0,1,0,0,0,0,25,5.0,0.1,11626.0,721.0,False,12/27/2012,375,16,2242,10,2021-08-31,0.2,not_requested,0.0
3081,LamB_NFT,1,0,0,0,0,0,0,0,0,9,4.0,0.007,486.0,168.0,False,04/03/2020,5,2,18,2,2021-10-09,0.015,not_requested,0.0
3082,Lamacat,0,1,0,0,0,0,0,0,0,665,165.0,0.001,205.0,527.0,False,09/07/2021,3,5,18,3,2021-08-05,0.0503,not_requested,1164.0
3083,Lamb Duhs,0,1,0,0,0,0,0,0,0,8500,2600.0,0.015,5926.0,455.0,False,07/31/2021,34,24,50,4,2021-08-21,3.847545749989995,verified,113.0
3084,Land : Joseon Dynasty,0,1,0,0,0,0,0,0,0,350,204.0,0.233,2514.0,333.0,False,09/09/2021,215,213,245,6,2021-11-22,11.5333998,not_requested,7.0
3085,Land DAO,0,0,0,0,0,0,0,1,0,256,137.0,0.69,3581.0,26.0,False,02/29/2020,519,124,722,344,2021-09-04,22.435169,approved,0.0
3086,Land DAO Genesis,1,0,0,0,0,0,0,0,0,1500,412.0,0.033,3581.0,26.0,False,02/29/2020,519,124,722,344,2021-09-17,2.475500000008,approved,185.0
3087,LandVault Creation Game,0,0,0,0,0,0,0,1,0,2000,686.0,0.002,7983.0,295.0,False,05/23/2021,265,41,344,5,2021-10-02,0.03301,not_requested,2.0
3088,LandVault: Genesis,0,0,0,0,0,0,0,1,0,1,218.0,0.399,7983.0,295.0,False,05/23/2021,265,41,344,5,2021-06-27,3.2783014400000003,approved,1.0
3089,Larissas Nudity,0,0,0,0,1,0,0,0,0,18,18.0,0.2,861.0,1612.0,False,11/17/2021,2,4,19,2,2021-12-07,2.1,not_requested,42.0
3090,Laser Garden,1,0,0,0,0,0,0,0,0,22,8.0,0.017,3887.0,3104.0,False,08/10/2021,10,2,21,1,2021-10-22,0.145,not_requested,14.0
3091,Last Daughters,1,0,0,0,0,0,0,0,0,10,7.0,0.1,1658.0,2900.0,False,10/04/2013,11,8,29,1,2021-09-09,0.4,not_requested,0.0
3092,Last Plastic Project,0,1,0,0,0,0,0,0,0,73,47.0,0.005,578.0,2353.0,False,10/06/2021,6,3,10,2,2021-09-03,0.0999999999999999,not_requested,8.0
3093,Lastraums Last Slice,0,0,0,0,0,0,0,1,0,250,190.0,0.2,2667.0,882.0,False,03/29/2021,13,10,71,4,2021-05-20,10.149999999999997,not_requested,0.0
3094,Launch Photography,0,0,0,0,1,0,0,0,0,6,2.0,0.025,33.0,122.0,False,10/07/2021,6,2,42,1,2021-10-20,0.01,not_requested,0.0
3095,Lawless Lemmings,0,1,0,0,0,0,0,0,0,763,356.0,0.01,17107.0,3419.0,False,08/16/2021,332,19,383,4,2021-10-19,0.0637,not_requested,107.0
3096,Laws of Abstraction,0,0,0,0,1,0,0,0,0,36,25.0,0.248,3339.0,1226.0,False,06/14/2011,3,7,24,2,2021-08-22,0.3,not_requested,0.0
3097,Lazers-A Light Trail Collection,1,0,0,0,0,0,0,0,0,40,12.0,0.1,2767.0,1118.0,False,03/22/2009,5,16,32,0,2021-09-11,0.4499999999999999,not_requested,0.0
3098,Lazlo Lissitsky,1,0,0,0,0,0,0,0,0,383,179.0,0.38,3851.0,679.0,False,09/24/2020,18,6,54,3,2021-02-26,1.575,verified,11.0
3099,Lazy Bunny NFT,0,1,0,0,0,0,0,0,0,5600,3100.0,0.365,36367.0,48.0,False,10/19/2021,5621,1015,1534,32,2021-11-11,328.374874674445,approved,123.0
3100,Lazy CryptoCats,0,1,0,0,0,0,0,0,0,909,354.0,0.02,1371.0,117.0,False,06/12/2021,98,112,122,9,2021-06-11,1.7470650000000003,not_requested,235.0
3101,Lazy Lions,0,1,0,0,0,0,0,0,0,10100,5000.0,1.6,72172.0,788.0,False,07/27/2021,281,128,796,35,2021-08-06,2310.8629174770786,verified,173.0
3102,Lazy Lions Bungalows,0,1,0,0,0,0,0,0,0,10300,4400.0,0.039,72172.0,788.0,False,07/27/2021,281,128,796,35,2021-09-25,58.60258590787511,verified,107.0
3103,Lazy Lions Collectibles,0,1,0,0,0,0,0,0,0,16,46900.0,0.001,72172.0,788.0,False,07/27/2021,281,128,796,35,2021-11-16,1.7722461268519216,not_requested,4.0
3104,Lazyeation,1,0,0,0,0,0,0,0,0,76,3.0,0.018,780.0,1118.0,False,08/31/2021,2,1,4,0,2021-08-31,0.027,not_requested,43.0
3105,LeGentPunkS,0,1,0,0,0,0,0,0,0,550,934.0,0.001,651.0,1781.0,False,05/27/2019,6,6,11,1,2021-12-04,1.4141139838899996,not_requested,208.0
3106,Leaders Fund,0,0,0,0,0,0,0,1,0,1700,586.0,0.019,11888.0,121.0,False,09/03/2021,662,714,752,33,2021-10-13,0.18573,not_requested,0.0
3107,League of Extraordinary Women,1,0,0,0,0,0,0,0,0,51,23.0,0.45,7526.0,5641.0,False,08/31/2021,22,17,204,9,2021-09-02,3.03,not_requested,0.0
3108,League of Kingdoms (Ethereum),0,1,0,0,0,0,0,0,0,5200,1700.0,0.077,24731.0,130.0,False,03/30/2020,544,458,751,128,2020-05-24,589.2823964479215,verified,0.0
3109,League of Kingdoms (Polygon),0,1,0,0,0,0,0,0,0,186000,6400.0,0.001,24731.0,130.0,False,03/30/2020,544,458,751,128,2021-08-05,5.413926206926058,not_requested,0.0
3110,LeagueDAO Nomo Player Token,0,0,0,0,0,1,0,0,0,2000,116.0,0.08,3317.0,125.0,False,08/16/2021,63,10,91,9,2021-11-16,0.904,not_requested,133.0
3111,LeapN Next Gen: Alpha Plot Mint Passes,0,0,0,0,0,0,0,1,0,10,10.0,2.0,11414.0,337.0,False,08/20/2021,82,41,188,13,2021-11-14,0.75,not_requested,0.0
3112,Leatherfaces,0,1,0,0,0,0,0,0,0,905,362.0,0.019,31178.0,254.0,False,10/11/2020,20,12,42,6,2021-11-11,0.372,not_requested,232.0
3113,Lebo Art Collection,1,0,0,0,0,0,0,0,0,41,64.0,0.09,13973.0,160.0,False,08/01/2008,17,17,100,1,2021-06-21,1.49,not_requested,0.0
3114,LeeRunners,1,0,0,0,0,0,0,0,0,28,20.0,1.0,3775.0,3151.0,False,07/07/2009,68,30,349,4,2021-12-09,1.2,not_requested,43.0
3115,Legacy Crafts,1,0,0,0,0,0,0,0,0,33,65.0,0.001,129.0,182.0,False,11/30/2021,6,6,15,3,2021-12-17,0.00153,not_requested,79.0
3116,LegacyPunks,0,1,0,0,0,0,0,0,0,109,51.0,0.06,1215.0,4007.0,False,04/29/2021,6,4,19,3,2021-04-26,0.23,not_requested,871.0
3117,Legendary Era | Baskeball Highlights | Mixtapes and Ankle Breaks,0,0,0,0,0,1,0,0,0,6,5.0,0.002,73.0,281.0,False,12/25/2020,1,11,12,4,2021-11-06,0.004,not_requested,21.0
3118,Legendary's Stories,1,0,0,0,0,0,0,0,0,58,201.0,0.001,153.0,795.0,False,11/08/2021,7,22,13,2,2021-11-08,0.3749939,not_requested,0.0
3119,Legends of Wondermist,0,0,0,0,0,0,1,0,0,46,305.0,0.01,21121.0,459.0,False,07/07/2021,330,202,3817,25,2021-11-29,3.373699999999999,approved,24.0
3120,LegoPunks,0,1,0,0,0,0,0,0,0,262,115.0,0.099,1461.0,834.0,False,03/20/2021,5,3,22,2,2021-03-17,2.2880040000000004,approved,79.0
3121,LegoToadz,0,1,0,0,0,0,0,0,0,103,35.0,0.011,75.0,401.0,False,09/27/2021,3,4,8,1,2021-09-27,0.06,not_requested,145.0
3122,Lenia NFT - Artificial Life collection,0,1,0,0,0,0,0,0,0,202,155.0,0.123,449.0,208.0,False,08/18/2021,60,57,79,11,2021-10-07,0.339,not_requested,60.0
3123,LetsWalk,1,1,0,0,0,0,0,0,0,54,277.0,3.0,105059.0,878.0,False,05/07/2018,1302,1122,2809,52,2021-03-16,658.9360299999994,verified,0.0
3124,Levitated Vibes V3,0,1,0,0,0,0,0,0,0,101,62.0,0.06,3800.0,780.0,False,02/11/2021,17,9,36,5,2021-08-24,0.57,not_requested,99.0
3125,Levitating Chance,0,0,0,0,1,0,0,0,0,9,2.0,0.05,805.0,430.0,False,05/24/2021,4,11,18,3,2021-12-12,0.05,not_requested,0.0
3126,Liberated Consciousness,1,0,0,0,0,0,0,0,0,10,4.0,0.05,1635.0,1375.0,False,12/03/2021,71,40,98,1,2021-12-15,0.25,not_requested,0.0
3127,Library of Obsolescence by Mickey Smith,0,0,0,0,1,0,0,0,0,21,6.0,0.321,1169.0,1115.0,False,01/15/2011,8,9,42,2,2021-10-21,0.963,not_requested,7.0
3128,Life In Leaves,1,0,0,0,0,0,0,0,0,8,2.0,0.17,13.0,70.0,False,10/08/2021,2,3,5,2,2021-10-11,0.15,not_requested,5.0
3129,Life Is A Garden,1,0,0,0,0,0,0,0,0,15,3.0,0.25,385.0,453.0,False,09/12/2021,10,10,55,3,2021-11-02,0.25,not_requested,0.0
3130,Life Through A Purple Visor,1,0,0,0,0,0,0,0,0,19,4.0,0.029,3500.0,2352.0,False,07/09/2014,35,7,69,5,2021-08-08,0.06,not_requested,0.0
3131,Life and St. Louis,0,0,0,0,1,0,0,0,0,14,2.0,0.05,1703.0,852.0,False,09/22/2008,12,4,27,3,2021-09-10,0.05,not_requested,0.0
3132,Life in New Zealand,0,0,0,0,1,0,0,0,0,13,2.0,0.05,78.0,214.0,False,10/07/2020,1,4,12,2,2021-08-07,0.1,not_requested,0.0
3133,Life in the Dark.,0,0,0,0,1,0,0,0,0,20,66.0,0.01,1265.0,4195.0,False,05/08/2021,2,7,16,0,2021-09-30,0.565,not_requested,11.0
3134,Life is Better at Sea,1,0,0,0,0,0,0,0,0,3,2.0,0.002,88.0,171.0,False,05/12/2008,13,1,43,0,2021-11-08,0.002,not_requested,0.0
3135,Life of punks,0,1,0,0,0,0,0,0,0,10000,16.0,0.001,6.0,0.0,False,09/17/2021,1,5,1,0,2021-09-13,0.014,not_requested,0.0
3136,Lifescapes,1,0,0,0,0,0,0,0,0,34,9.0,0.07,598.0,318.0,False,08/26/2021,12,7,57,3,2021-12-07,0.8400000000000003,not_requested,0.0
3137,Light Avatar,0,1,0,0,0,0,0,0,0,915,949.0,0.001,1090.0,2530.0,False,12/07/2021,68,64,68,2,2021-12-09,0.12158,not_requested,0.0
3138,Light Cult Crypto Club,1,0,0,0,0,0,0,0,0,4800,1300.0,0.02,5115.0,1555.0,False,09/27/2021,79,99,106,15,2021-11-16,14.056156900999992,not_requested,738.0
3139,Light Holders,1,0,0,0,0,0,0,0,0,6,4.0,0.05,254.0,342.0,False,01/05/2020,4,17,16,3,2021-09-14,0.05,not_requested,0.0
3140,Light the darkness,0,0,0,0,1,0,0,0,0,9,4.0,0.06,951.0,1440.0,False,10/02/2021,2,6,16,1,2021-09-27,0.18,not_requested,0.0
3141,Lights of Frankfurt,0,0,0,0,1,0,0,0,0,19,20.0,0.009,2191.0,2217.0,False,04/08/2009,5,6,26,2,2021-07-19,0.09,not_requested,9.0
3142,Lil Baby Ape Club,0,1,0,0,0,0,0,0,0,5000,2400.0,0.09,8432.0,0.0,False,11/15/2021,736,769,848,20,2021-11-16,210.4663288216213,approved,144.0
3143,Lil Baby Doodles X,0,1,0,0,0,0,0,0,0,3000,1400.0,0.039,956.0,13.0,False,01/07/2022,73,46,181,11,2021-10-29,26.72550269999996,not_requested,109.0
3144,Lil Baby Lazy Lions Club,0,1,0,0,0,0,0,0,0,1000,422.0,0.023,5321.0,89.0,False,10/08/2021,119,14,185,6,2021-11-29,4.68208,not_requested,92.0
3145,Lil Ballers,0,0,0,0,0,1,0,0,0,594,359.0,0.005,266.0,15.0,False,09/12/2021,17,15,21,3,2021-09-22,0.07279,not_requested,367.0
3146,Lil Ghost,1,0,0,0,0,0,0,0,0,1100,10.0,0.012,384.0,158.0,False,11/18/2021,10,25,31,1,2021-11-04,0.24,not_requested,1075.0
3147,Lil ShibaDoges Club,1,0,0,0,0,0,0,0,0,8900,65.0,0.04,449.0,199.0,False,09/23/2021,1,3,7,2,2021-09-01,2.4664900000000016,approved,16.0
3148,Lil Snootz NFT Collection,1,0,0,0,0,0,0,0,0,564,64.0,0.003,339.0,594.0,False,10/14/2021,9,3,14,4,2021-09-07,0.012,not_requested,64.0
3149,Lil' Boomies,0,0,0,0,0,0,0,1,0,893,318.0,0.001,5089.0,5502.0,False,07/20/2021,329,57,443,10,2021-08-30,0.0196,not_requested,321.0
3150,Lilith Queen of Chaos,0,1,0,0,0,0,0,0,0,6700,189.0,0.002,742.0,141.0,False,12/03/2021,7,6,17,4,2021-12-09,0.1454200000000001,not_requested,529.0
3151,Lily Pass,0,0,0,0,0,0,0,1,0,200,145.0,0.17,17050.0,96.0,False,10/11/2021,1244,1289,1370,26,2021-11-11,30.23579000000001,not_requested,0.0
3152,Line Faces,1,0,0,0,0,0,0,0,0,676,4.0,0.001,1265.0,731.0,False,02/15/2021,20,16,42,2,2021-08-30,0.0825,not_requested,0.0
3153,Line of Misery,1,0,0,0,0,0,0,0,0,17,5.0,0.01,680.0,706.0,False,11/29/2019,3,2,14,0,2021-12-04,0.09,not_requested,0.0
3154,Lioncat Punks,0,1,0,0,0,0,0,0,0,133,47.0,0.005,1399.0,1312.0,False,04/05/2021,12,14,27,4,2021-09-05,0.099,not_requested,310.0
3155,Liquid Singularity,0,0,0,0,1,0,0,0,0,30,13.0,0.3,16050.0,7994.0,False,03/21/2013,17,7,57,6,2021-10-11,0.4499999999999999,approved,0.0
3156,Liquids 1/1,1,0,0,0,0,0,0,0,0,112,39.0,0.08,4287.0,3826.0,False,04/03/2021,33,15,115,5,2021-04-09,3.07,not_requested,123.0
3157,Lit Punks Club,1,0,0,0,0,0,0,0,0,38,23.0,0.015,394.0,138.0,False,03/18/2009,2,5,13,4,2021-11-30,0.7070000000000001,not_requested,0.0
3158,Litquidity,0,1,0,0,0,0,0,0,0,83,28.0,69.0,192879.0,852.0,True,11/20/2017,326,267,4050,23,2021-03-11,1.759,requested,3.0
3159,Little Alien Club,0,1,0,0,0,0,0,0,0,753,249.0,0.014,3089.0,2255.0,False,05/11/2021,18,10,23,3,2021-08-27,0.9715860000000004,approved,421.0
3160,Little Demons Club,0,1,0,0,0,0,0,0,0,10000,44.0,0.08,3421.0,64.0,False,09/05/2021,1,1,3,0,2021-09-11,0.08,not_requested,182.0
3161,Little Dixie,0,1,0,0,0,0,0,0,0,154,58.0,0.019,4655.0,661.0,False,07/21/2021,4,8,30,3,2021-06-17,1.5704,not_requested,216.0
3162,Little Lemon Friends Genesis,0,1,0,0,0,0,0,0,0,24,22.0,22.22,24098.0,582.0,False,07/11/2021,3715,3850,4282,90,2021-07-09,12.89,not_requested,75.0
3163,Little Ocean,1,0,0,0,0,0,0,0,0,5,3.0,0.008,490.0,267.0,False,07/24/2021,92,15,194,2,2021-08-30,0.008,not_requested,20.0
3164,Little Pink Auction,1,0,0,0,0,0,0,0,0,25,9.0,0.01,1546.0,1771.0,False,02/22/2016,4,4,25,1,2021-10-10,1.1345,not_requested,121.0
3165,Little Vagrant,0,1,0,0,0,0,0,0,0,11,10.0,0.07,716.0,91.0,False,09/30/2021,28,23,93,49,2021-10-15,0.095,not_requested,0.0
3166,Little Villain,1,0,0,0,0,0,0,0,0,16,2.0,0.019,1529.0,2274.0,False,03/21/2021,19,6,50,4,2021-11-07,0.066,not_requested,0.0
3167,LittleBoos V2,1,0,0,0,0,0,0,0,0,475,185.0,0.001,642.0,13.0,False,08/25/2021,91,10,107,72,2021-10-09,0.029,not_requested,223.0
3168,Liverboy,0,1,0,0,0,0,0,0,0,200,80.0,0.44,1571.0,1042.0,False,06/16/2021,11,5,34,3,2021-07-03,17.643490000000007,approved,24.0
3169,Living Painting,1,1,0,0,0,0,0,0,0,6,16.0,0.01,2985.0,2635.0,False,04/27/2014,29,105,121,2,2021-02-24,0.025,not_requested,12.0
3170,LivingOilArt,1,0,0,0,0,0,0,0,0,2500,36.0,0.02,641.0,2.0,False,06/03/2021,17,13,24,4,2021-03-28,0.05,not_requested,0.0
3171,Llamas Club,0,1,0,0,0,0,0,0,0,303,142.0,0.009,737.0,1107.0,False,09/29/2021,3,8,14,3,2021-10-13,0.2208,not_requested,922.0
3172,Llamaverse:,0,0,0,0,0,0,0,1,0,20,3.0,0.05,33983.0,44.0,False,10/05/2021,1736,2343,1957,74,2021-12-02,0.15,not_requested,0.0
3173,Loaded Baked Potato,0,1,0,0,0,0,0,0,0,1000,65.0,0.009,1961.0,1586.0,False,11/07/2021,61,24,156,8,2021-10-28,0.149,not_requested,96.0
3174,Loaded Lions!,0,1,0,0,0,0,0,0,0,524,4.0,0.015,52088.0,1628.0,True,02/25/2021,800,475,1813,135,2021-12-02,0.06,not_requested,0.0
3175,Lobster Beach Club,1,0,0,0,0,0,0,0,0,1200,573.0,0.018,7277.0,3985.0,False,08/27/2021,63,1112,684,7,2021-10-05,1.207600000000001,not_requested,249.0
3176,Lockdown Forms,1,0,0,0,0,0,0,0,0,106,83.0,0.075,5633.0,1445.0,False,10/26/2011,3,4,16,0,2021-08-26,0.7469999999999999,not_requested,73.0
3177,Lockdown Lemmings,0,1,0,0,0,0,0,0,0,10000,3800.0,0.008,17107.0,3419.0,False,08/16/2021,332,19,383,4,2021-09-11,1.2667501010001991,verified,200.0
3178,LogicBots series 2021 [Universe 1],0,1,0,0,0,0,0,0,0,20,16.0,0.59,967.0,151.0,False,10/06/2014,18,13,70,2,2021-10-07,0.76,not_requested,0.0
3179,Lollipop Squad,0,1,0,0,0,0,0,0,0,14,5.0,0.012,2289.0,1621.0,False,05/11/2020,5,7,15,1,2021-11-19,0.054,not_requested,0.0
3180,Lollipops Lolly Lolly,0,1,0,0,0,0,0,0,0,38,1400.0,0.002,25.0,9.0,False,09/01/2021,0,2,1,0,2021-09-22,0.0124847652828594,not_requested,0.0
3181,London In Gold,1,0,0,0,0,0,0,0,0,20,16.0,0.3,12277.0,1042.0,False,05/25/2021,42,33,202,15,2021-07-22,0.3,not_requested,0.0
3182,London Through The Films,1,0,0,0,0,0,0,0,0,60,4.0,0.02,86.0,329.0,False,02/16/2020,1,4,10,3,2021-11-16,0.01,not_requested,3.0
3183,Lone Road,0,0,0,0,1,0,0,0,0,26,2.0,0.2,1691.0,2296.0,False,09/30/2021,4,4,20,3,2021-11-17,0.1,not_requested,0.0
3184,Lonely Alien Space Club,0,1,0,0,0,0,0,0,0,10000,3900.0,0.075,33792.0,2977.0,False,06/13/2021,548,121,630,17,2021-07-16,57.31747900000006,verified,205.0
3185,Lonely Frog Lambo Club,0,1,0,0,0,0,0,0,0,10000,3600.0,0.033,9555.0,16.0,False,09/02/2021,942,76,905,25,2021-09-15,39.06007135432542,approved,196.0
3186,Lonely Planet Space Observatory,0,1,0,0,0,0,0,0,0,4900,2400.0,0.001,33792.0,2977.0,False,06/13/2021,548,121,630,17,2021-09-05,0.1088,not_requested,184.0
3187,Lonely Roads,1,0,0,0,0,0,0,0,0,50,31.0,0.055,5529.0,1000.0,False,04/03/2009,1,4,20,0,2021-08-27,0.3485,not_requested,25.0
3188,Lonely Saturdays,1,0,0,0,0,0,0,0,0,3,4.0,0.04,2199.0,798.0,False,10/18/2010,17,11,198,5,2021-12-14,0.12,not_requested,0.0
3189,Lonely Shadows,0,1,0,0,0,0,0,0,0,491,228.0,0.005,1533.0,76.0,False,09/13/2021,21,20,66,4,2021-11-18,0.12982,not_requested,182.0
3190,Long Neck Punks Original,1,0,0,0,0,0,0,0,0,225,164.0,0.019,506.0,539.0,False,08/15/2021,5,5,13,3,2021-08-15,0.0809,not_requested,71.0
3191,Long Neckie Ladies,0,1,0,0,0,0,0,0,0,3300,1500.0,0.2,16776.0,3454.0,False,03/07/2021,27,47,239,7,2021-07-26,159.69108990000012,verified,100.0
3192,Long Starry Nights,1,0,0,0,0,0,0,0,0,23,16.0,0.25,10919.0,1889.0,False,06/26/2021,49,52,192,10,2021-09-03,0.3,not_requested,8.0
3193,Long WeenClub,0,1,0,0,0,0,0,0,0,33,2.0,0.05,16208.0,167.0,False,09/05/2021,293,249,346,97,2021-11-18,0.025,not_requested,0.0
3194,Longest sword,0,1,0,0,0,0,0,0,0,251,101.0,0.03,282.0,5.0,False,09/16/2021,24,7,39,4,2021-09-21,0.2,not_requested,89.0
3195,"Longing, Home",0,0,0,0,1,0,0,0,0,20,11.0,0.1,1383.0,349.0,False,01/22/2010,190,25,1536,4,2021-12-14,1.2000000000000002,not_requested,0.0
3196,Look At My Raccoon,0,1,0,0,0,0,0,0,0,4300,613.0,0.008,6954.0,285.0,False,03/24/2021,217,230,266,7,2021-11-20,2.1113999899999984,approved,147.0
3197,Look up to the sky and see,0,0,0,0,1,0,0,0,0,24,4.0,0.15,1886.0,1429.0,False,11/19/2017,28,12,206,6,2021-05-11,0.15,not_requested,0.0
3198,Looking through 35mm,0,0,0,0,1,0,0,0,0,35,2.0,0.03,198.0,467.0,False,08/21/2017,9,4,43,3,2021-11-09,0.03,not_requested,17.0
3199,Loomways,1,0,0,0,0,0,0,0,0,836,413.0,0.03,18969.0,99.0,False,08/14/2021,263,235,327,15,2021-12-06,1.3672000000000002,approved,346.0
3200,Loopy Donuts,1,0,0,0,0,0,0,0,0,10000,3800.0,0.025,13618.0,1020.0,False,08/05/2021,45,43,223,14,2021-09-02,8.368645643749963,approved,121.0
3201,Loot : Joseon Dynasty,0,1,0,0,0,0,0,0,0,460,165.0,0.011,2514.0,333.0,False,09/09/2021,215,213,245,6,2021-10-20,1.981535592,not_requested,4.0
3202,Loot for Spark Era,0,0,0,0,0,0,1,0,0,49000,9700.0,0.001,87088.0,86.0,False,09/12/2021,1592,337,1861,225,2021-09-10,0.02767,not_requested,0.0
3203,Lootland (for Creators),0,1,0,0,0,0,0,0,0,401,235.0,0.01,28625.0,38.0,False,08/01/2021,976,495,1615,1241,2021-09-08,0.01891,not_requested,0.0
3204,Lord of the Sacred Land,0,1,0,0,0,0,0,0,0,796,143.0,0.003,1488.0,4270.0,False,10/13/2021,27,15,44,5,2021-11-17,1.46094,not_requested,95.0
3205,Lords & Ladies,1,0,0,0,0,0,0,0,0,30,15.0,1.5,124.0,2.0,False,11/28/2021,4,2,20,3,2021-09-13,1.0004025250000002,not_requested,1.0
3206,Los Angeles Lakers Legends Style,0,0,0,0,0,1,0,0,0,13,3.0,0.006,125.0,181.0,False,07/18/2012,24,2,110,4,2021-11-18,0.0278,not_requested,0.0
3207,Los Samos,0,1,0,0,0,0,0,0,0,125,97.0,5.5,3397.0,1852.0,False,06/18/2021,230,251,249,14,2021-07-19,41.061886624068975,not_requested,0.0
3208,Los Tesoros del Mar,0,0,0,0,1,0,0,0,0,37,6.0,0.035,3743.0,2969.0,False,05/05/2021,8,28,31,1,2021-10-22,0.16,approved,0.0
3209,"Los gorditos ""Chunky World""",1,0,0,0,0,0,0,0,0,97,55.0,0.004,1202.0,474.0,False,10/19/2010,9,210,129,6,2021-09-02,0.080999,not_requested,0.0
3210,LoserChick-BossChick,0,1,0,0,0,0,0,0,0,8400,200.0,0.003,61390.0,53.0,False,07/27/2010,66,48,98,5,2021-07-29,4.384369989999998,not_requested,73.0
3211,Lost Souls Yacht Club,0,1,0,0,0,0,0,0,0,10000,300.0,0.019,1754.0,55.0,False,03/27/2021,168,105,178,13,2021-12-10,0.3876749300000001,not_requested,121.0
3212,"Lost Symphony ""Chapter III""",1,0,0,0,0,0,0,0,0,32,2.0,0.1,61.0,419.0,False,12/11/2021,2,1,5,1,2021-12-13,0.012,not_requested,0.0
3213,Lost in deserts,0,0,0,0,1,0,0,0,0,21,2.0,0.02,1000.0,1232.0,False,03/20/2016,1,1,3,0,2021-09-15,0.02,not_requested,0.0
3214,LostKingdom,0,1,0,0,0,0,0,0,0,79,35.0,0.01,256.0,76.0,False,08/19/2021,19,17,28,5,2021-11-01,0.01,not_requested,10.0
3215,LostSpirits,0,1,0,0,0,0,0,0,0,85,41.0,0.22,256.0,76.0,False,08/19/2021,19,17,28,5,2021-08-20,0.3075,not_requested,36.0
3216,Lostboy NFT,0,1,0,0,0,0,0,0,0,10000,3700.0,0.055,8709.0,212.0,False,07/28/2021,144,80,469,24,2021-08-25,78.20413856842647,verified,293.0
3217,Lostgirl NFT,1,0,0,0,0,0,0,0,0,1600,636.0,0.044,8709.0,212.0,False,07/28/2021,144,80,469,24,2021-11-07,3.2314000000000003,not_requested,264.0
3218,Love the weekday,1,0,0,0,0,0,0,0,0,6,4.0,0.02,3295.0,3009.0,False,04/26/2020,9,2,37,1,2021-11-15,0.02,not_requested,0.0
3219,Love ya!,0,1,0,0,0,0,0,0,0,21,12.0,0.05,751.0,770.0,False,10/10/2021,3,1,8,1,2021-11-18,0.087,not_requested,22.0
3220,Lovely Vino's,1,0,0,0,0,0,0,0,0,215,47.0,0.01,1243.0,1184.0,False,08/09/2021,20,12,40,2,2021-08-09,0.23,not_requested,0.0
3221,Low Effort Kongz,1,0,0,0,0,0,0,0,0,100,2.0,0.01,330.0,456.0,False,10/26/2021,3,3,13,1,2021-10-26,0.01,not_requested,0.0
3222,Low Effort Snails,0,1,0,0,0,0,0,0,0,31,6.0,0.01,602.0,895.0,False,09/12/2010,2,3,12,2,2021-12-09,0.04,not_requested,0.0
3223,Low Effort Toadz,1,0,0,0,0,0,0,0,0,86,33.0,0.01,398.0,1209.0,False,10/31/2021,6,4,13,2,2021-11-01,0.5100000000000002,not_requested,332.0
3224,Low Poly Car Lab,1,0,0,0,0,0,0,0,0,11,4.0,0.09,39.0,90.0,False,09/09/2021,7,3,12,2,2021-10-21,0.27,not_requested,21.0
3225,LucaTheAstronaut,1,0,0,0,0,0,0,0,0,71,182.0,0.175,5463.0,2240.0,False,04/04/2019,18,8,52,6,2021-08-06,2.6049999999999995,not_requested,0.0
3226,Lucha Libre Knockout,0,1,0,0,0,0,0,0,0,10000,3100.0,0.02,5405.0,723.0,False,07/07/2021,453,487,516,24,2021-08-10,5.642035584800542,verified,185.0
3227,Luchadores.io,0,1,0,0,0,0,0,0,0,10000,2000.0,0.089,6518.0,1348.0,False,03/29/2021,643,71,708,31,2021-05-17,82.30347800000004,approved,30.0
3228,Lucid Creationz Ltd - eGGz,0,1,0,0,0,0,0,0,0,1,10.0,0.02,1612.0,2905.0,False,05/01/2021,23,5,42,2,2021-11-25,0.04,not_requested,0.0
3229,Lucid Dreams NFT,1,0,0,0,0,0,0,0,0,39,338.0,0.003,9483.0,593.0,False,01/26/2011,77,40,299,8,2021-09-01,0.0086,not_requested,11.0
3230,Lucid Fractal Collection,1,0,0,0,0,0,0,0,0,16,8.0,0.5,254.0,420.0,False,09/04/2021,9,8,25,3,2021-10-13,0.005,not_requested,3.0
3231,Lucifer's Muse,1,0,0,0,0,0,0,0,0,2,2.0,0.03,314.0,397.0,False,05/14/2021,34,5,45,7,2021-10-23,0.03,not_requested,8.0
3232,Lucky Binary NFT Number,1,0,0,0,0,0,0,0,0,1.0M,7.0,0.01,1161.0,453.0,False,06/04/2021,1,1,6,0,2021-11-10,0.047,not_requested,0.0
3233,Lucky Black Cats,0,1,0,0,0,0,0,0,0,10,2.0,0.021,116.0,310.0,False,05/28/2011,2,2,9,2,2021-08-08,0.021,not_requested,13.0
3234,Lucky Buddha Lucky Club,0,1,0,0,0,0,0,0,0,6200,2900.0,0.003,37.0,0.0,False,09/30/2021,0,7,1,0,2021-09-05,0.29738,not_requested,233.0
3235,Lucky Buddys,1,1,0,0,0,0,0,0,0,8,7.0,3.99,48.0,52.0,False,03/22/2021,8,3,10,1,2021-03-31,0.75,not_requested,0.0
3236,Lucky Llamas NFT,0,1,0,0,0,0,0,0,0,577,217.0,0.019,2095.0,527.0,False,07/15/2021,150,361,51,6,2021-10-05,0.2339999999999999,not_requested,214.0
3237,Lucky Maneki,0,1,0,0,0,0,0,0,0,14200,3100.0,0.02,11744.0,1361.0,False,05/01/2021,393,357,346,13,2021-06-30,6.245609999999992,verified,550.0
3238,Lucky Phantom Bunch,1,0,0,0,0,0,0,0,0,174,90.0,0.25,1647.0,1365.0,False,03/13/2021,3,6,20,1,2021-05-12,0.64,approved,160.0
3239,Lucky Santa,0,1,0,0,0,0,0,0,0,2,3.0,3000.0,11.0,33.0,False,12/20/2021,0,1,5,0,2021-12-10,2.3317899999999683,not_requested,0.0
3240,Lucky Sloths NFT,0,1,0,0,0,0,0,0,0,2700,1300.0,0.015,4008.0,188.0,False,09/15/2021,67,57,85,3,2021-09-11,4.672209999999997,verified,122.0
3241,Lucky Spirit Cards,0,0,0,0,0,0,1,0,0,11,35.0,0.04,13222.0,500.0,False,06/12/2012,390,750,2311,92,2021-08-06,0.04,approved,6.0
3242,LuckyCryptoCats,1,1,0,0,0,0,0,0,0,149,77.0,0.15,1869.0,1007.0,False,03/22/2021,10,8,25,5,2021-03-26,0.99135284375,approved,443.0
3243,Ludo Labs Genesis Collection,0,0,0,0,0,1,0,0,0,939,271.0,0.09,3029.0,244.0,False,09/12/2021,179,161,692,7,2021-11-25,0.912,not_requested,168.0
3244,Luigi's Benedictions,0,1,0,0,0,0,0,0,0,14,34.0,0.007,1281.0,1696.0,False,07/22/2021,4,4,25,3,2021-07-25,0.13,not_requested,0.0
3245,Luis Dalvan - Ghost village,0,0,0,0,1,0,0,0,0,12,6.0,1.0,12721.0,467.0,False,04/30/2009,44,13,382,3,2021-08-11,0.14,not_requested,0.0
3246,Lulupunk,1,0,0,0,0,0,0,0,0,217,94.0,0.075,12842.0,1658.0,False,08/07/2021,331,137,474,6,2021-08-07,1.17,not_requested,422.0
3247,Luminuids,1,0,0,0,0,0,0,0,0,8,5.0,0.05,1396.0,932.0,False,12/17/2020,3,4,7,1,2021-10-13,0.11,not_requested,0.0
3248,Lumps Rapture,1,0,0,0,0,0,0,0,0,790,223.0,0.175,4451.0,1104.0,False,11/12/2016,46,41,373,12,2021-11-25,9.326999999999998,not_requested,219.0
3249,Lumps World,0,1,0,0,0,0,0,0,0,500,283.0,0.76,4451.0,1104.0,False,11/12/2016,46,41,373,12,2021-08-04,14.193,verified,66.0
3250,Lumpy Birds House,0,1,0,0,0,0,0,0,0,1100,12.0,0.003,452.0,1697.0,False,10/08/2020,1,2,6,2,2021-12-13,0.0194599999999999,not_requested,0.0
3251,Lunar Moon Plots,0,1,0,0,0,0,0,0,0,229,170.0,2.85,1281.0,13.0,False,10/11/2017,1049,1137,842,74,2021-08-07,45.99999999999999,verified,0.0
3252,LunarModule,1,0,0,0,0,0,0,0,0,9,2.0,0.09,102.0,284.0,False,09/07/2012,1,3,10,2,2021-09-06,0.09,not_requested,0.0
3253,Lunargistics Corp Space NFTs Mainnet,0,0,0,0,0,0,0,1,0,1,6.0,0.25,239.0,462.0,False,06/28/2019,15,20,135,4,2021-10-26,0.9,not_requested,0.0
3254,"Lundi, the Atlantic puffin",0,0,0,0,1,0,0,0,0,10,4.0,0.3,1580.0,1266.0,False,09/14/2021,4,64,101,3,2021-12-05,0.8999999999999999,not_requested,37.0
3255,Lusky Dollar Art,1,0,0,0,0,0,0,0,0,317,12.0,0.049,1876.0,4995.0,False,09/18/2020,1,2,4,1,2021-09-02,0.1,not_requested,0.0
3256,Lux Cards,0,0,0,0,0,0,1,0,0,55,403.0,0.04,8400.0,220.0,False,10/18/2018,140,122,155,14,2020-10-13,3.1100000000000003,verified,24.0
3257,Lux Portals - Polygon,0,0,0,0,0,0,1,0,0,5,59.0,0.185,8400.0,220.0,False,10/18/2018,140,122,155,14,2021-11-03,0.1369999999999999,not_requested,9.0
3258,"Lynx Art Collection - Artwork from Bitcoin, Ethereum, Crytpo, Space, and Science",1,0,0,0,0,0,0,0,0,83,8.0,0.12,5134.0,191.0,False,10/29/2012,14,19,90,4,2021-04-12,0.25,not_requested,3.0
3259,Lysergic Labs Acidheadz,1,0,0,0,0,0,0,0,0,2700,757.0,0.008,7231.0,114.0,False,08/12/2021,36,30,105,8,2021-11-06,1.5529900000000008,not_requested,115.0
3260,Lysergic Labs Shroomz,1,0,0,0,0,0,0,0,0,8600,3100.0,0.008,7231.0,114.0,False,08/12/2021,36,30,105,8,2021-09-03,3.0988278479450826,verified,155.0
3261,MAIKO bird,1,0,0,0,0,0,0,0,0,16,5.0,0.002,599.0,296.0,False,11/24/2021,15,9,78,5,2021-11-25,0.002,not_requested,0.0
3262,MAN NEEDS STAGE,0,1,0,0,0,0,0,0,0,95,352.0,0.001,737.0,929.0,False,12/10/2021,10,29,29,4,2021-12-06,0.143120506387,not_requested,0.0
3263,MANY FACE TA$H.,0,1,0,0,0,0,0,0,0,30,24.0,3.0,26541.0,908.0,True,10/19/2009,29,20,247,8,2021-12-16,4.2992,not_requested,0.0
3264,MARIO - SUPER MARIO,0,1,0,0,0,0,0,0,0,13,18.0,0.09,83.0,235.0,False,09/06/2021,1,1,4,0,2021-08-31,0.016,not_requested,0.0
3265,MASAI anxious girl,1,0,0,0,0,0,0,0,0,14,10.0,0.01,292.0,616.0,False,11/17/2021,3,2,23,1,2021-10-27,0.01,not_requested,0.0
3266,MAT Collection - Premium trading cards from Paul Mat,0,0,0,0,0,0,1,0,0,121,515.0,0.001,212.0,1364.0,False,10/15/2021,4,3,11,1,2021-09-21,0.00094,not_requested,0.0
3267,MAUER NFT,1,0,0,0,0,0,0,0,0,4100,659.0,0.154,861.0,32.0,False,08/06/2021,17,21,47,5,2021-11-09,42.29239999999999,not_requested,159.0
3268,MDV Official,0,0,0,0,0,0,0,1,0,892,464.0,0.1,1209.0,46.0,False,11/14/2021,525,66,145,8,2021-12-17,1.2678000000000005,not_requested,0.0
3269,MEKAPUNKS,1,0,0,0,0,0,0,0,0,75,31.0,0.02,1339.0,773.0,False,08/21/2011,7,10,27,3,2021-09-19,0.17,not_requested,20.0
3270,MEMORY EMOTION,0,0,0,0,1,0,0,0,0,25,15.0,0.45,8465.0,556.0,False,07/01/2021,22,9,135,3,2021-11-17,3.35,approved,0.0
3271,META by John Monkman,0,0,0,0,0,0,0,1,0,49,9.0,0.065,1213.0,502.0,False,10/05/2010,3,6,47,2,2021-11-18,0.6499999999999999,not_requested,0.0
3272,METABILLIONAIRE,0,1,0,0,0,0,0,0,0,7800,5200.0,0.3,21404.0,0.0,False,10/19/2021,3004,3433,3526,125,2021-11-23,395.1309767948,approved,206.0
3273,METAPUNKZ_,0,1,0,0,0,0,0,0,0,399,41.0,0.03,61.0,27.0,False,11/14/2021,0,2,4,0,2021-12-02,0.9440000000000004,not_requested,110.0
3274,METASENS - ANCIENT SPIRIT,0,1,0,0,0,0,0,0,0,3000,464.0,0.1,25665.0,5.0,False,10/14/2021,308,374,361,50,2021-12-17,6.604999999999998,not_requested,12.0
3275,METAVMASK,1,0,0,0,0,0,0,0,0,231,139.0,0.001,284.0,0.0,False,07/06/2020,30,29,37,4,2021-12-13,0.005,not_requested,0.0
3276,META_GOATS,0,0,0,0,0,1,0,0,0,357,213.0,0.092,100.0,1383.0,False,12/30/2021,2,0,2,0,2021-11-17,1.7650000000000003,not_requested,0.0
3277,METROPOLIS 2021,0,0,0,0,1,0,0,0,0,8,5.0,0.2,2373.0,1531.0,False,09/17/2021,11,13,55,1,2021-12-02,0.2,not_requested,0.0
3278,MILOVERSE,0,1,0,0,0,0,0,0,0,88,56.0,0.025,140.0,86.0,False,09/23/2021,6,4,13,3,2021-11-05,1.0870000000000004,not_requested,78.0
3279,MIMIMATES,1,0,0,0,0,0,0,0,0,90,164.0,0.007,2421.0,986.0,False,04/22/2021,5,19,82,0,2021-10-22,0.5360000000000001,not_requested,26.0
3280,MINDDS,1,0,0,0,0,0,0,0,0,305,345.0,0.19,6924.0,124.0,False,06/22/2021,42,266,259,76,2021-07-17,24.711844999999997,verified,18.0
3281,MINI DOODLES,1,0,0,0,0,0,0,0,0,7,15.0,0.002,17032.0,16217.0,False,06/24/2021,38,9,61,1,2021-10-12,0.009,not_requested,0.0
3282,MINIMAL MOMENTS,0,0,0,0,1,0,0,0,0,20,7.0,0.1,1656.0,1655.0,False,03/29/2016,9,24,112,2,2021-09-26,0.15,not_requested,0.0
3283,MINOR HEROES,1,0,0,0,0,0,0,0,0,38,194.0,0.029,4190.0,2280.0,False,04/10/2021,81,74,219,8,2021-04-13,0.217,not_requested,0.0
3284,MINT-Collection,1,0,0,0,0,0,0,0,0,119,916.0,0.001,4448.0,3713.0,False,02/13/2018,5,6,21,1,2021-10-05,0.0733015469999999,not_requested,0.0
3285,MIX TAPE BOY TRADING CARDS,0,0,0,0,0,0,1,0,0,11,8.0,0.01,2697.0,2352.0,False,06/08/2012,22,9,58,5,2021-07-22,0.01,not_requested,23.0
3286,MLB Champions,0,0,0,0,0,1,0,0,0,249100,2500.0,0.001,3905.0,198.0,False,06/06/2018,32,18,101,8,2019-04-26,2.496,verified,228.0
3287,MOE ANTHRO,1,0,0,0,0,0,0,0,0,33,18.0,0.008,5212.0,984.0,False,02/08/2021,17,2,60,2,2021-12-13,0.253,not_requested,0.0
3288,MONDRIAN GENERATOR,1,0,0,0,0,0,0,0,0,42,8.0,0.014,13.0,14.0,False,12/24/2021,1,1,2,1,2021-09-12,0.028,not_requested,12.0
3289,"MONKEYBALL, THE TREE SERIES",0,0,0,0,0,1,0,0,0,21,12.0,0.005,301.0,135.0,False,02/08/2017,22,28,35,3,2021-11-03,0.015,not_requested,22.0
3290,MONSTER MOB,0,0,0,0,0,0,0,1,0,7800,1700.0,0.001,2377.0,203.0,False,08/23/2021,48,42,49,2,2021-09-06,0.02380003,not_requested,152.0
3291,MONSTER STORE,1,0,0,0,0,0,0,0,0,102,24.0,0.005,3150.0,2237.0,False,07/22/2021,16,111,64,4,2021-07-29,0.1227,not_requested,69.0
3292,MONTREAL.AI,1,1,0,0,0,0,0,0,0,556,213.0,0.09,169725.0,0.0,False,11/01/2012,36,6,134,3,2021-02-26,1.0191,verified,9.0
3293,MOOGIE,1,0,0,0,0,0,0,0,0,100,69.0,0.025,1344.0,163.0,False,09/18/2021,46,25,307,7,2021-11-12,0.289,not_requested,0.0
3294,MOONFLARESERIES,0,1,0,0,0,0,0,0,0,75,32.0,0.03,382.0,612.0,False,08/25/2021,12,5,22,4,2021-09-09,0.11,not_requested,134.0
3295,MOTORBIKE RACER,0,0,0,0,0,1,0,0,0,26,1.0,0.015,41.0,83.0,False,01/20/2021,4,2,9,1,2021-09-23,0.015,not_requested,90.0
3296,MRAMMOU : Akan Gold Weights,0,1,0,0,0,0,0,0,0,67,37.0,0.75,7938.0,1438.0,False,01/25/2017,10,62,168,1,2021-07-08,11.0389525,approved,94.0
3297,MSTRS.,0,1,0,0,0,0,0,0,0,13,3.0,0.05,846.0,373.0,False,03/08/2021,7,3,21,1,2021-03-05,0.05,not_requested,23.0
3298,MUDMASKY NFT,1,0,0,0,0,0,0,0,0,101,3.0,0.015,1197.0,44.0,False,09/22/2015,9,1,8,1,2021-11-23,0.03,not_requested,46.0
3299,MUMBOT WORLD,1,0,0,0,0,0,0,0,0,15,97.0,0.9,11071.0,1060.0,False,11/17/2008,22,11,96,3,2021-08-05,9.23,verified,0.0
3300,MURK FLUID,1,0,0,0,0,0,0,0,0,41,5.0,0.01,58.0,123.0,False,08/26/2021,2,1,13,1,2021-09-06,0.02,not_requested,0.0
3301,MUSHROHMS,1,0,0,0,0,0,0,0,0,1500,1100.0,0.8,6983.0,211.0,False,03/04/2021,68,48,287,8,2021-10-18,241.3242998999999,approved,56.0
3302,MUSHROHMS: Descendants,1,0,0,0,0,0,0,0,0,3000,1900.0,0.11,6983.0,211.0,False,03/04/2021,68,48,287,8,2021-11-18,25.37749000000001,not_requested,27.0
3303,MUTAGANG,0,1,0,0,0,0,0,0,0,153,23.0,0.01,418.0,696.0,False,06/27/2021,45,9,43,3,2021-06-28,0.075,not_requested,295.0
3304,MUTED by Aaron Ferguson,0,0,0,0,1,0,0,0,0,16,11.0,0.99,2798.0,1793.0,False,03/10/2021,2,7,53,1,2021-03-07,2.54,requested,5.0
3305,MVP Cards,0,0,0,0,0,1,0,0,0,102,8.0,0.001,169.0,843.0,False,08/07/2021,3,3,7,1,2021-08-07,0.001,not_requested,5.0
3306,MVP Nikola Jokic,0,0,0,0,0,1,0,0,0,15,2.0,0.002,1.0,14.0,False,11/03/2021,0,0,2,1,2021-11-04,0.0005,not_requested,0.0
3307,MVP Punks,1,0,0,0,0,0,0,0,0,101,248.0,0.035,1350.0,441.0,False,03/16/2021,44,11,26,2,2021-05-03,1.1580000000000004,not_requested,149.0
3308,MVRiders,0,0,0,0,0,0,0,1,0,100,64.0,0.069,4008.0,530.0,False,08/22/2021,15,10,16,2,2021-11-06,0.002,not_requested,31.0
3309,MY ICON WORLD,1,0,0,0,0,0,0,0,0,94,80.0,0.005,1657.0,1910.0,False,08/16/2021,64,25,62,8,2021-09-04,0.005,not_requested,0.0
3310,MY MANIA,1,0,0,0,0,0,0,0,0,64,35.0,0.03,992.0,577.0,False,06/12/2012,88,8,285,6,2021-07-28,0.033,not_requested,84.0
3311,MYSTICAL EDITIONS,1,0,0,0,0,0,0,0,0,4,80.0,0.1,20635.0,1657.0,False,08/09/2009,7,3,55,3,2021-08-17,0.09,not_requested,0.0
3312,MaTIC PUNKS,0,1,0,0,0,0,0,0,0,10000,65.0,0.002,602.0,273.0,False,03/09/2021,1,2,5,2,2021-11-22,0.079256,not_requested,97.0
3313,Mac Miller,1,0,0,0,0,0,0,0,0,11,11.0,1.26,6646.0,2577.0,False,05/24/2012,360,28,3570,18,2021-02-16,0.2,approved,0.0
3314,Machinie to Migrate,0,1,0,0,0,0,0,0,0,891,124.0,0.218,3966.0,258.0,False,07/24/2021,162,173,191,8,2021-08-12,3.0529999999999995,approved,27.0
3315,Macho Apes,1,0,0,0,0,0,0,0,0,3,2.0,0.013,121.0,255.0,False,11/13/2008,9,3,15,4,2021-12-14,0.013,not_requested,0.0
3316,Macro Self-portraits,1,0,0,0,0,0,0,0,0,6,3.0,0.25,3157.0,966.0,False,06/29/2020,11,7,53,1,2021-12-13,0.5,not_requested,0.0
3317,Mad Banana Union,0,1,0,0,0,0,0,0,0,7000,2300.0,0.009,7061.0,536.0,False,07/16/2021,754,740,876,36,2021-08-15,0.8267612500000001,verified,104.0
3318,Mad Rabbits Riot Club,0,1,0,0,0,0,0,0,0,7500,2500.0,0.139,1006.0,304.0,False,06/04/2021,6,4,47,1,2021-10-11,152.89166311490789,verified,303.0
3319,Mad Space Squirrels. Classic collection,0,1,0,0,0,0,0,0,0,2300,179.0,0.009,1787.0,627.0,False,06/20/2021,13,11,36,1,2021-06-29,0.03,not_requested,198.0
3320,MadBabies,0,1,0,0,0,0,0,0,0,3000,76.0,0.008,776.0,441.0,False,09/23/2021,27,23,31,4,2021-09-27,0.4436000000000002,not_requested,52.0
3321,Maff as a Yeemaff,0,1,0,0,0,0,0,0,0,116,60.0,0.009,815.0,948.0,False,09/19/2018,2,2,6,0,2021-07-16,0.045,not_requested,95.0
3322,Mafia Gang Game Polygon,0,1,0,0,0,0,0,0,0,10000,1900.0,0.002,6359.0,463.0,False,02/25/2021,497,513,550,12,2021-11-29,4.671874174958943,approved,336.0
3323,MafiaReservoirDogs,0,1,0,0,0,0,0,0,0,9000,1900.0,0.001,6359.0,463.0,False,02/25/2021,497,513,550,12,2021-12-05,1.4691678891899846,not_requested,227.0
3324,Magic Effects,1,0,0,0,0,0,0,0,0,24,15.0,0.009,1015.0,844.0,False,07/20/2020,328,71,351,5,2021-11-13,0.109,not_requested,0.0
3325,Magic Mushroom Mafia,0,1,0,0,0,0,0,0,0,1100,466.0,0.009,3759.0,720.0,False,10/04/2021,515,588,611,96,2021-10-26,0.306,not_requested,124.0
3326,Magic Portals,1,0,0,0,0,0,0,0,0,31,16.0,0.1,1114.0,367.0,False,08/18/2021,10,9,81,5,2021-11-13,0.8,not_requested,0.0
3327,Magic Shroomies,0,1,0,0,0,0,0,0,0,317,118.0,0.015,1936.0,81.0,False,09/27/2021,125,44,321,4,2021-10-02,0.027,not_requested,176.0
3328,Magical Girl Club,1,0,0,0,0,0,0,0,0,71,31.0,0.027,6638.0,1066.0,False,04/13/2021,20,8,49,4,2021-10-04,0.199,not_requested,34.0
3329,Magical Girl Party,1,0,0,0,0,0,0,0,0,13,28.0,0.03,6638.0,1066.0,False,04/13/2021,20,8,49,4,2021-11-26,0.09,not_requested,14.0
3330,Magical Irish Sunrises,0,0,0,0,1,0,0,0,0,14,2.0,0.1,18772.0,15270.0,False,04/05/2010,3,13,54,2,2021-11-28,0.1,not_requested,0.0
3331,Magical Moments,0,0,0,0,0,1,1,0,0,7,29.0,0.15,30418.0,2371.0,False,01/25/2010,40,20,1446,3,2021-03-20,0.4549999999999999,not_requested,0.0
3332,Magical Strangers,1,0,0,0,0,0,0,0,0,15,7.0,0.035,243.0,371.0,False,10/12/2019,2,10,40,1,2021-09-11,0.0242,not_requested,0.0
3333,Magically,1,0,0,0,0,0,0,0,0,76,30.0,0.018,376.0,862.0,False,09/03/2021,2,2,15,1,2021-09-15,0.0098868365518563,not_requested,0.0
3334,Magnum by Thrush Holmes,1,0,0,0,0,0,0,0,0,999,358.0,0.042,1747.0,111.0,False,03/21/2010,261,90,198,13,2021-11-30,1.1276438350254545,not_requested,338.0
3335,Mai's Palette,1,0,0,0,0,0,0,0,0,11,9.0,1.0,4104.0,544.0,False,09/12/2021,10,31,170,1,2021-12-16,1.07,not_requested,0.0
3336,Maison Group,0,1,0,0,0,0,0,0,0,621,89.0,0.08,264.0,755.0,False,06/30/2021,1,2,15,1,2021-08-18,4.378000000000002,approved,169.0
3337,Major League Beastball,0,0,0,0,0,1,0,0,0,76,42.0,0.035,1389.0,971.0,False,06/18/2021,12,7,24,1,2021-06-18,0.115,not_requested,842.0
3338,Make Yourself at Home,0,0,0,0,1,0,0,0,0,50,29.0,0.5,11962.0,204.0,False,01/25/2010,280,30,1679,16,2021-09-27,4.805,approved,0.0
3339,Malachite,1,0,0,0,0,0,0,0,0,137,68.0,0.5,58.0,90.0,False,03/12/2021,1,1,7,1,2021-03-12,16.460606127862032,verified,0.0
3340,Mallorca Bloom,0,0,0,0,1,0,0,0,0,20,5.0,0.1,975.0,613.0,False,07/21/2019,2,9,41,1,2021-08-31,0.2,not_requested,0.0
3341,Man of the forest,0,0,0,0,1,0,0,0,0,20,6.0,0.15,2311.0,1422.0,False,06/26/2009,10,6,25,4,2021-11-15,0.4,not_requested,0.0
3342,ManManLaiZzz,1,0,0,0,0,0,0,0,0,158,101.0,0.15,13793.0,604.0,False,10/15/2020,11,43,106,1,2021-07-20,1.4449999999999998,not_requested,4.0
3343,Mandelbrot Set Collection,1,0,0,0,0,0,0,0,0,2000,960.0,0.035,3792.0,557.0,False,08/19/2021,37,39,50,23,2021-08-18,1.4182010000000005,verified,61.0
3344,Maneki Gang,0,1,0,0,0,0,0,0,0,11400,2200.0,0.015,11744.0,1361.0,False,05/01/2021,393,357,346,13,2021-08-23,3.6383709999999967,verified,178.0
3345,Manekirei,0,1,0,0,0,0,0,0,0,128,59.0,0.008,355.0,349.0,False,01/21/2011,21,13,30,2,2021-09-02,1.9071640778125003,not_requested,2.0
3346,Manga_Girls,0,1,0,0,0,0,0,0,0,101,2.0,0.1,42.0,143.0,False,11/19/2021,2,3,10,2,2021-12-12,0.1,not_requested,144.0
3347,MangoHawk,1,0,0,0,0,0,0,0,0,2,8.0,0.02,15894.0,5278.0,False,09/18/2017,15,21,203,2,2021-07-01,0.04,not_requested,12.0
3348,Mangolia,0,1,0,0,0,0,0,0,0,81,6.0,0.1,14730.0,6185.0,False,11/16/2020,5,8,37,2,2021-07-20,0.1,not_requested,57.0
3349,Manifest by Kyle Vollaers,0,0,0,0,1,0,0,0,0,50,37.0,0.3,4368.0,1046.0,False,01/20/2021,38,43,418,6,2021-08-31,0.75,not_requested,0.0
3350,Many eyes meow V.2,0,1,0,0,0,0,0,0,0,84,70.0,0.005,5286.0,2437.0,False,06/05/2021,8,4,18,5,2021-11-10,0.2586000000000001,not_requested,0.0
3351,Map Blocks,0,1,0,0,0,0,0,0,0,350,124.0,0.005,174.0,1.0,False,01/16/2021,3,8,13,1,2021-08-23,0.009,not_requested,2.0
3352,MarbleCards,0,0,0,0,0,0,1,0,0,236800,10000.0,0.001,18775.0,97.0,False,02/27/2018,130,34,105,19,2019-04-26,0.6309945850579666,approved,201.0
3353,Marbles Club,0,1,0,0,0,0,0,0,0,1000,9.0,0.001,6089.0,3812.0,False,07/13/2021,109,1789,1122,9,2021-11-23,0.01527,not_requested,2.0
3354,Marco Bottigelli | Blinded by the Light,1,0,0,0,0,0,0,0,0,15,5.0,0.3,1783.0,1235.0,False,06/14/2011,17,30,92,3,2021-08-16,0.3,not_requested,0.0
3355,Mark Ludy,1,0,0,0,0,0,0,0,0,8,2.0,0.57,340.0,34.0,False,08/26/2011,7,6,15,1,2021-10-13,0.36,not_requested,1.0
3356,MarlonStyle Products,1,0,0,0,0,0,0,0,0,88,2.0,0.004,819.0,1170.0,False,05/16/2007,3,3,13,2,2021-11-01,0.003,not_requested,0.0
3357,Mars Cats Specials,0,1,0,0,0,0,0,0,0,1,1500.0,0.009,19362.0,780.0,False,07/25/2021,64,64,185,12,2021-11-25,0.0589,not_requested,0.0
3358,Mars Cats Voyage,0,1,0,0,0,0,0,0,0,10000,3600.0,0.12,19362.0,780.0,False,07/25/2021,64,64,185,12,2021-09-11,87.06499125927343,verified,220.0
3359,Mars Cats in Spacesuits,0,1,0,0,0,0,0,0,0,1800,958.0,0.015,19362.0,780.0,False,07/25/2021,64,64,185,12,2021-10-01,4.90770885897757,not_requested,235.0
3360,Mars Dorian's Artworks,1,0,0,0,0,0,0,0,0,36,22.0,0.04,5409.0,991.0,False,09/10/2009,4,14,33,3,2021-06-16,0.11,not_requested,106.0
3361,Mars Genesis,0,0,0,0,0,0,1,0,0,2100,1000.0,0.039,16700.0,153.0,False,03/31/2021,43,28,216,9,2021-06-18,0.4688,not_requested,53.0
3362,Mars Goats' Gathering,1,1,0,0,0,0,0,0,0,3000,1700.0,0.02,3830.0,146.0,False,12/26/2019,66,55,86,2,2021-11-17,68.81141025196911,approved,22.0
3363,Mars Punks,0,1,0,0,0,0,0,0,0,1500,653.0,0.01,3834.0,884.0,False,10/19/2021,457,462,479,14,2021-12-14,14.78741299999998,not_requested,102.0
3364,MartiniPunks,0,1,0,0,0,0,0,0,0,26,18.0,0.003,412.0,1012.0,False,03/01/2021,6,2,10,2,2021-09-06,0.0113999999999999,not_requested,0.0
3365,Marvel NFTs,0,0,0,0,0,0,1,0,0,15,9.0,0.3,283.0,296.0,False,03/25/2021,21,240,210,3,2021-03-27,0.5,not_requested,80.0
3366,MaryCollection,0,1,0,0,0,0,0,0,0,35,3.0,0.01,292.0,1010.0,False,11/05/2018,2,8,14,5,2021-12-03,0.045,not_requested,0.0
3367,Mascot Club,0,1,0,0,0,0,0,0,0,71,56.0,0.05,1809.0,674.0,False,05/30/2011,7,4,11,2,2021-12-13,0.8458000000000003,not_requested,158.0
3368,Mashed,1,0,0,0,0,0,0,0,0,30,5.0,0.003,19348.0,15013.0,False,05/12/2021,48,28,103,3,2021-10-29,0.051,not_requested,0.0
3369,MaskedGirlNFT,1,0,0,0,0,0,0,0,0,29,12.0,0.037,591.0,707.0,False,06/13/2021,40,5,59,5,2021-06-13,0.02,not_requested,45.0
3370,Maskiss,1,0,0,0,0,0,0,0,0,77,35.0,0.008,700.0,303.0,False,10/05/2021,98,51,122,3,2021-11-12,0.25995435,not_requested,0.0
3371,Masks of the Metaverse,1,0,0,0,0,0,0,0,0,29,4.0,0.033,3838.0,3693.0,False,09/07/2021,3,13,39,1,2021-11-14,0.055,not_requested,0.0
3372,Masquerades,0,1,0,0,0,0,0,0,0,27,9.0,0.15,1335.0,3059.0,False,03/31/2021,5,13,11,1,2021-08-14,0.32,not_requested,7.0
3373,Master9Eyes,0,1,0,0,0,0,0,0,0,386,274.0,0.059,4350.0,507.0,False,10/15/2021,150,152,163,10,2021-12-09,5.472900000000001,not_requested,209.0
3374,Mathematics and Art by SURCHE,1,0,0,0,0,0,0,0,0,390,87.0,0.001,110.0,259.0,False,03/25/2014,20,41,20,3,2021-12-12,0.01053,not_requested,0.0
3375,Matic Mike,0,1,0,0,0,0,0,0,0,10000,213.0,0.015,2634.0,969.0,False,05/09/2014,98,99,121,7,2021-10-20,3.442549999999992,not_requested,72.0
3376,Matic Space Pals,1,0,0,0,0,0,0,0,0,79,90.0,0.004,403.0,396.0,False,11/08/2021,7,2,9,1,2021-11-10,0.025,not_requested,0.0
3377,MaticPunks,0,1,0,0,0,0,0,0,0,10000,3600.0,0.01,17696.0,2183.0,False,05/18/2021,5425,1264,2308,40,2021-08-11,2.478216999999999,not_requested,100.0
3378,MatrixWorld LandVoucher,0,1,0,0,0,0,0,0,0,1800,1100.0,1.83,35338.0,123.0,False,09/29/2021,1288,67,612,25,2021-10-22,674.7245159517199,verified,1692.0
3379,Matteo Mauro Collectors Awards,1,0,0,0,0,0,0,0,0,33,33.0,2.0,5706.0,243.0,False,04/12/2021,9,8,38,1,2021-05-10,0.15,not_requested,0.0
3380,MavirusVI's Collection,1,0,0,0,0,0,0,0,0,13,7.0,0.006,5068.0,4576.0,False,01/21/2019,115,6,1419,2,2021-10-04,0.05,not_requested,0.0
3381,Max Mix 4 Punks (DOS-Punks tribute),1,0,0,0,0,0,0,0,0,25,3.0,0.005,547.0,528.0,False,09/20/2021,1,3,5,0,2021-11-17,0.02,not_requested,0.0
3382,Max Verstappen World Champion,0,0,0,0,0,1,0,0,0,11,2.0,0.025,209.0,843.0,False,12/06/2021,2,2,7,2,2021-12-08,0.05,not_requested,0.0
3383,MaxiDOS,0,1,0,0,0,0,0,0,0,30,11.0,0.999,1909.0,3810.0,False,09/24/2021,4,4,20,1,2021-10-27,0.1275,not_requested,0.0
3384,Maximum Lurkage,1,0,0,0,0,0,0,0,0,8,92.0,0.067,2569.0,631.0,False,02/27/2021,40,12,170,8,2021-08-31,0.2532,not_requested,0.0
3385,Maxverse,0,1,0,0,0,0,0,0,0,373,101.0,0.005,433.0,11.0,False,11/30/2021,128,107,144,4,2021-12-08,0.11243554,not_requested,114.0
3386,Maxwells,0,1,0,0,0,0,0,0,0,512,243.0,0.09,5922.0,732.0,False,07/31/2009,12,4,39,3,2021-09-23,4.079000000000001,approved,68.0
3387,Maya.S,1,0,0,0,0,0,0,0,0,85,65.0,0.01,2877.0,2464.0,False,05/09/2021,32,122,642,5,2021-06-11,0.095,not_requested,69.0
3388,Mazing a Round,0,1,0,0,0,0,0,0,0,36,17.0,0.022,639.0,1149.0,False,04/18/2010,4,1,5,1,2021-08-30,0.033,not_requested,23.0
3389,Mbc Esports,1,0,0,0,0,0,0,0,0,1000,7.0,0.013,2529.0,2266.0,False,11/25/2021,283,15,768,3,2021-12-17,0.0785,not_requested,0.0
3390,Mcdonald's McRib Classic,0,1,0,0,0,0,0,0,0,4,24.0,0.008,4397590.0,13542.0,True,09/02/2009,1,2,2,1,2021-11-02,0.0878,not_requested,3.0
3391,Me And My Shadow,0,0,0,0,1,0,0,0,0,9,7.0,0.025,9624.0,2003.0,False,10/27/2009,7,11,59,2,2021-09-01,0.06,not_requested,0.0
3392,Meaningwave Video,1,1,0,0,0,0,0,0,0,103,42.0,0.2,27132.0,794.0,True,12/18/2008,44,24,280,8,2021-03-19,1.1,not_requested,0.0
3393,Meanstreak Collective,1,0,0,0,0,0,0,0,0,2,5.0,0.05,980.0,96.0,False,07/29/2021,6,9,45,3,2021-10-11,0.2,approved,0.0
3394,Measureless,0,0,0,0,1,0,0,0,0,22,7.0,0.025,590.0,685.0,False,05/09/2012,5,9,26,3,2021-08-12,0.125,not_requested,0.0
3395,Mebs NFT,1,0,0,0,0,0,0,0,0,110,71.0,0.03,91.0,4.0,False,11/17/2021,8,13,21,2,2021-11-15,0.17,not_requested,211.0
3396,Mech Identity Protocol Tickets,0,1,0,0,0,0,0,0,0,1,478.0,0.72,26335.0,1182.0,False,10/06/2021,2818,2630,2841,82,2021-11-26,98.86966799999998,not_requested,2.0
3397,Mech and stuff,1,0,0,0,0,0,0,0,0,8,5.0,0.07,715.0,665.0,False,10/06/2009,32,27,141,1,2021-06-09,0.07,not_requested,12.0
3398,Mecha NFT Collection,0,1,0,0,0,0,0,0,0,335,103.0,0.002,30.0,1.0,False,12/04/2021,2,3,11,6,2021-10-28,0.988099999999998,not_requested,871.0
3399,MechaDino,0,1,0,0,0,0,0,0,0,73,40.0,0.15,2155.0,284.0,False,12/28/2017,90,12,328,8,2021-08-22,0.365,not_requested,0.0
3400,Mechanized Abstractions,1,0,0,0,0,0,0,0,0,1200,629.0,0.06,1297.0,971.0,False,09/27/2021,37,33,67,4,2021-12-14,76.15979999998999,approved,46.0
3401,Meeler's Creations,1,0,0,0,0,0,0,0,0,117,238.0,0.07,4963.0,830.0,False,05/01/2021,13,30,79,3,2021-07-03,9.766599999999997,approved,4.0
3402,Meeple World,0,1,0,0,0,0,0,0,0,84,52.0,0.002,7673.0,6541.0,False,07/10/2020,69,8,105,3,2021-10-21,0.10329999,not_requested,21.0
3403,Meg Thorpe 1-200,1,0,0,0,0,0,0,0,0,137,79.0,0.27,5760.0,2246.0,False,04/27/2021,5,10,47,1,2021-06-21,1.98,verified,20.0
3404,Mega City Chain Motion,1,0,0,0,0,0,0,0,0,30,26.0,0.01,412.0,1269.0,False,11/27/2021,29,16,195,1,2021-12-01,0.06,not_requested,17.0
3405,Mega multiverse,0,0,0,0,0,0,1,0,0,18,209.0,0.001,75.0,19.0,False,10/10/2021,8,4,9,1,2021-10-10,0.0029365799999999,not_requested,13.0
3406,MegaCryptoPolis,0,0,0,0,0,0,0,0,1,89500,24000.0,0.001,7829.0,233.0,False,05/04/2018,77,32,244,19,2019-06-25,3.0589,verified,81.0
3407,MegaToads,0,1,0,0,0,0,0,0,0,653,407.0,2.15,56274.0,2241.0,False,06/24/2021,1302,1358,1613,41,2021-11-30,99.313399,approved,315.0
3408,Megavoxels,1,0,0,0,0,0,0,0,0,13,2.0,0.03,298.0,1290.0,False,12/31/2021,6,3,29,2,2021-12-12,0.05,not_requested,5.0
3409,MekaVerse,0,1,0,0,0,0,0,0,0,8900,5100.0,1.299,262759.0,277.0,True,08/27/2021,12212,13049,14585,883,2021-10-07,2131.494350091053,verified,242.0
3410,MekaVerse Factory,0,1,0,0,0,0,0,0,0,1,2500.0,0.094,262759.0,277.0,True,08/27/2021,12212,13049,14585,883,2021-12-15,39.67143389900004,approved,0.0
3411,Mekaformers,0,1,0,0,0,0,0,0,0,1500,667.0,0.14,10887.0,11.0,False,11/24/2021,1589,1827,1595,92,2021-12-17,137.89653611778772,approved,230.0
3412,Melania's Vision Official,0,1,0,0,0,0,0,0,0,27,10.0,0.05,1818586.0,48.0,True,01/26/2010,20940,6289,136539,3144,2021-12-17,0.7060000000000002,not_requested,0.0
3413,Melody of dreams,1,0,0,0,0,0,0,0,0,31,79.0,0.04,15636.0,3574.0,False,06/13/2021,22,23,105,1,2021-12-17,0.04,not_requested,0.0
3414,"Melrakki, the Arctic fox",0,0,0,0,1,0,0,0,0,15,6.0,0.3,1581.0,1266.0,False,09/14/2021,4,64,101,3,2021-11-17,1.5,approved,2.0
3415,Meltwater Champions Chess Tour 2021,0,0,0,0,0,1,0,0,0,30,32.0,0.025,578.0,263.0,False,08/24/2021,36,14,102,2,2021-09-25,0.275,not_requested,7.0
3416,Melvin's Snacks,0,1,0,0,0,0,0,0,0,4,173.0,0.404,56274.0,2241.0,False,06/24/2021,1302,1358,1613,41,2021-10-27,50.615348,approved,0.0
3417,Meme Ltd.,0,1,0,0,0,0,1,0,0,523,8100.0,0.003,22537.0,130.0,False,08/15/2020,32,38,173,7,2020-08-26,15.528745734729537,verified,372.0
3418,Meme Tiles,0,0,0,0,0,0,1,0,0,31,10.0,0.001,111.0,351.0,False,09/12/2021,16,14,16,1,2021-04-12,0.001,not_requested,15.0
3419,MemePunks,0,1,0,0,0,0,0,0,0,64,30.0,0.04,1498.0,570.0,False,03/04/2021,2,2,11,1,2021-03-04,0.04,approved,0.0
3420,Memento Mori xyz,1,0,0,0,0,0,0,0,0,501,6.0,0.1,18.0,38.0,False,11/04/2021,0,3,2,0,2021-11-04,0.1,not_requested,239.0
3421,Memes Doge Army,1,0,0,0,0,0,0,0,0,22,12.0,0.02,12.0,8.0,False,11/26/2021,2,1,6,2,2021-11-29,0.082,not_requested,71.0
3422,Memorial Block (Classic),0,1,0,0,0,0,0,0,0,1000,467.0,0.004,14266.0,62.0,False,06/09/2021,1459,215,1459,17,2021-06-30,0.024,not_requested,0.0
3423,Memories of Mexico,0,0,0,0,1,0,0,0,0,7,2.0,0.05,387.0,887.0,False,09/24/2009,4,5,13,2,2021-08-18,0.14,not_requested,0.0
3424,Menace World,0,1,0,0,0,0,0,0,0,472,250.0,0.03,2794.0,7.0,False,10/01/2021,320,361,353,5,2021-12-04,1.0478,not_requested,433.0
3425,Meow in the Box,0,1,0,0,0,0,0,0,0,68,28.0,0.006,328.0,587.0,False,08/01/2021,7,4,18,4,2021-08-02,0.007,not_requested,49.0
3426,MeowBits Collection,0,1,0,0,0,0,0,0,0,209,69.0,0.095,514.0,357.0,False,05/13/2021,11,5,27,8,2021-05-13,0.484999999999999,approved,74.0
3427,MeqhArt,1,0,0,0,0,0,0,0,0,21,21.0,0.015,5120.0,1046.0,False,01/26/2020,272,289,332,9,2021-11-17,0.03,not_requested,26.0
3428,MercedesBenzCAR,0,0,0,0,0,1,0,0,0,100,5.0,0.001,3793148.0,673.0,True,07/07/2009,238,36,1892,31,2021-11-01,0.0024,not_requested,0.0
3429,Mesmerizer,1,0,0,0,0,0,0,0,0,8000,624.0,0.07,717.0,1980.0,False,09/25/2021,14,9,44,3,2021-10-11,35.15669999999988,approved,0.0
3430,Message from Machinie,0,1,0,0,0,0,0,0,0,287,111.0,0.02,3966.0,258.0,False,07/24/2021,162,173,191,8,2021-09-07,0.02,not_requested,9.0
3431,Messi?,1,0,0,0,0,0,0,0,0,8,2.0,0.05,54.0,0.0,False,09/12/2021,3,3,11,3,2021-09-24,0.05,not_requested,0.0
3432,Met Gala Moments by HOF,0,0,0,0,0,0,0,1,0,48,11.0,0.012,6161.0,1207.0,False,03/13/2009,870,30,2539,166,2021-12-15,0.0345,not_requested,50.0
3433,Meta Ape Style,0,1,0,0,0,0,0,0,0,100,34.0,0.005,268.0,1010.0,False,12/14/2021,4,4,9,1,2021-12-13,0.2350000000000001,not_requested,105.0
3434,Meta Golden Nuggets,0,0,0,0,0,0,0,1,0,500,32.0,1.0,327.0,5.0,False,10/19/2021,3,2,10,1,2021-12-05,4.280000000000005,not_requested,0.0
3435,Meta Lisa by HALda Vinci,0,1,0,0,0,0,0,0,0,1100,178.0,0.002,760.0,1058.0,False,09/16/2021,20,6,36,5,2021-09-26,0.0825989999999999,not_requested,119.0
3436,Meta Luxury Property,0,1,0,0,0,0,0,0,0,342,151.0,0.688,1670.0,624.0,False,12/06/2021,13,9,26,7,2021-11-30,12.705000000000004,not_requested,78.0
3437,Meta Mint,0,0,0,0,0,0,0,1,0,1,234.0,0.42,401.0,3.0,False,10/18/2021,87,21,122,6,2021-10-18,14.769999899999998,not_requested,0.0
3438,Meta Toads,0,1,0,0,0,0,0,0,0,6100,315.0,0.001,183.0,160.0,False,11/03/2021,3,6,4,1,2021-11-15,0.04915,not_requested,89.0
3439,Meta Trends by Trends.vc,1,0,0,0,0,0,0,0,0,12,9.0,1.0,5705.0,109.0,False,04/04/2020,26,27,167,6,2021-09-18,0.5125,not_requested,2.0
3440,MetaApes Club,0,1,0,0,0,0,0,0,0,19500,8200.0,0.002,1654.0,130.0,False,08/17/2021,108,118,139,9,2021-11-17,0.3939490000000004,not_requested,75.0
3441,MetaBorgs playground,1,0,0,0,0,0,0,0,0,1,18.0,0.23,218.0,185.0,False,08/31/2021,48,43,54,6,2021-11-10,0.6,not_requested,0.0
3442,MetaBulldog,1,0,0,0,0,0,0,0,0,29,5.0,0.005,195.0,437.0,False,12/11/2021,16,17,31,2,2021-12-11,0.033,not_requested,2.0
3443,MetaChamps Genesis,0,0,0,0,0,1,0,0,0,300,233.0,0.1,4526.0,389.0,False,07/15/2021,76,72,98,14,2021-10-07,2.875600000000001,not_requested,103.0
3444,MetaCircle,0,1,0,0,0,0,0,0,0,40,2.0,0.08,2902.0,3508.0,False,08/06/2019,6,11,11,2,2021-10-09,0.02,not_requested,0.0
3445,MetaDinosaurs,0,1,0,0,0,0,0,0,0,211,2.0,0.032,605.0,3581.0,False,07/31/2018,5,5,26,2,2021-11-26,0.0321,not_requested,169.0
3446,MetaFans Genesis Collection,0,0,0,0,0,1,0,0,0,1900,624.0,0.059,7541.0,124.0,False,09/27/2021,89,89,102,15,2021-11-26,7.5629,approved,375.0
3447,MetaFighter,1,0,0,0,0,0,0,0,0,33,3.0,0.06,1560.0,610.0,False,01/11/2012,57,11,120,9,2021-03-28,0.12,not_requested,12.0
3448,MetaGeckos Genesis,0,0,0,0,0,0,0,1,0,2600,974.0,0.092,6050.0,216.0,False,07/25/2021,89,76,131,12,2021-10-31,14.6809,not_requested,286.0
3449,MetaGuardians: Villains,0,1,0,0,0,0,0,0,0,10000,3100.0,0.012,24247.0,213.0,False,07/22/2021,861,849,966,69,2021-10-26,5.513989999999991,not_requested,235.0
3450,MetaHuman - 2084,0,0,0,0,1,0,0,0,0,132,40.0,0.019,677.0,714.0,False,11/23/2021,12,6,41,4,2021-12-01,2.335500000000001,requested,2.0
3451,MetaHumanNFT,0,0,0,0,0,0,0,1,0,9,3.0,0.003,64.0,152.0,False,11/20/2021,1,1,2,0,2021-11-28,0.004405121,not_requested,0.0
3452,MetaJunkObject_Back,0,0,0,0,0,0,0,1,0,116,111.0,0.001,1285.0,1247.0,False,09/25/2021,3,3,17,1,2021-10-21,0.0144999999999999,not_requested,0.0
3453,MetaLoot,0,1,0,0,0,0,0,0,0,1,96.0,0.09,15781.0,461.0,False,10/20/2019,28,10,167,10,2021-10-06,0.205,not_requested,1.0
3454,MetaMarcus,0,1,0,0,0,0,0,0,0,200,71.0,0.02,84.0,2.0,False,12/07/2021,6,17,11,0,2021-12-06,4.248,not_requested,0.0
3455,MetaPets Orig,0,1,0,0,0,0,0,0,0,10000,44.0,0.01,21.0,54.0,False,12/26/2021,1,2,8,2,2021-12-02,0.2900000000000001,not_requested,39.0
3456,MetaPirates,0,1,0,0,0,0,0,0,0,1100,402.0,0.004,399.0,19.0,False,10/13/2021,211,26,240,9,2021-10-15,0.35694,not_requested,120.0
3457,MetaSapiens,1,0,0,0,0,0,0,0,0,952,151.0,0.05,1685.0,906.0,False,03/10/2021,8,30,134,1,2021-10-22,0.2349,not_requested,987.0
3458,MetaTaxidermy,0,1,0,0,0,0,0,0,0,9,5.0,0.054,527.0,1075.0,False,09/15/2017,1,5,16,2,2021-11-11,0.0849999999999999,not_requested,0.0
3459,MetaTokyo Pass Gen 1.0,0,0,0,0,0,0,0,1,0,101,93.0,0.19,541.0,6.0,False,06/11/2021,46,4,193,11,2021-11-17,2.365,not_requested,0.0
3460,MetaTravelers: Genesis Stone,0,0,0,0,0,0,0,1,0,1,321.0,0.255,13444.0,930.0,False,06/23/2021,518,517,590,23,2021-11-11,8.8393,approved,2.0
3461,MetaTravelers: Nibiru,0,1,0,0,0,0,0,0,0,7800,3100.0,0.025,13444.0,930.0,False,06/23/2021,518,517,590,23,2021-11-19,26.218397669990036,approved,158.0
3462,MetaVoicers,0,0,0,0,0,0,0,1,0,735,333.0,0.005,4008.0,530.0,False,08/22/2021,15,10,16,2,2021-09-16,0.1437,not_requested,150.0
3463,MetaWaifus NFT,0,0,0,0,0,0,0,1,0,15,2.0,0.05,7355.0,2276.0,False,09/04/2021,298,287,333,16,2021-11-18,0.02,not_requested,0.0
3464,MetaZoo Games Tokens,0,0,0,0,0,0,0,1,0,2300,1200.0,0.569,7610.0,1724.0,False,06/13/2020,378,368,486,36,2021-11-29,297.3752090237973,approved,21.0
3465,Metaani x KizunaAI,0,1,0,0,0,0,0,0,0,200,150.0,0.5,5528.0,1028.0,False,05/18/2021,84,81,279,238,2021-09-17,0.45,approved,9.0
3466,MetaaniGEN,0,1,0,0,0,0,0,0,0,1400,744.0,0.11,5528.0,1028.0,False,05/18/2021,84,81,279,238,2021-10-02,1.4228,not_requested,75.0
3467,Metadogepunks,0,1,0,0,0,0,0,0,0,249,45.0,0.005,966.0,202.0,False,03/15/2020,68,56,82,43,2021-07-13,0.04,not_requested,0.0
3468,Metagascar,0,0,0,0,0,0,0,1,0,381,61.0,0.05,3146.0,998.0,False,07/29/2021,21,13,32,3,2021-09-16,1.3929999999999998,not_requested,0.0
3469,Metakrew,0,1,0,0,0,0,0,0,0,7300,3300.0,0.08,36498.0,144.0,False,02/25/2021,79,96,305,21,2021-11-18,43.29093300000001,approved,200.0
3470,Metamorphosis,1,0,0,0,0,0,0,0,0,24,16.0,0.19,707.0,430.0,False,03/02/2007,3,3,15,4,2021-08-10,0.1,approved,0.0
3471,Metapins,0,0,0,0,0,0,0,1,0,100,3.0,0.06,164.0,84.0,False,11/26/2021,4,4,10,3,2021-11-29,0.12,not_requested,0.0
3472,Metapoochies,0,1,0,0,0,0,0,0,0,80,31.0,0.004,38.0,132.0,False,11/11/2021,2,20,15,1,2021-12-08,0.1460000000000001,not_requested,90.0
3473,Metasaurs Punks by Dr. DMT,0,1,0,0,0,0,0,0,0,11100,3100.0,0.03,39027.0,71.0,False,08/26/2021,1256,1206,1466,81,2021-12-16,117.74677220169087,approved,320.0
3474,Metavaders,1,0,0,0,0,0,0,0,0,1700,592.0,0.025,2965.0,453.0,False,08/03/2021,117,34,400,11,2021-10-02,6.196079999999996,not_requested,335.0
3475,Metaverse - Wearables,0,1,0,0,0,0,0,0,0,32,13.0,0.01,463.0,231.0,False,11/24/2011,21,10,66,3,2021-11-05,0.04,not_requested,22.0
3476,Metaverse Clouds 1.1,0,1,0,0,0,0,0,0,0,6,2.0,0.033,126.0,124.0,False,11/15/2021,6,5,32,3,2021-11-18,0.015,not_requested,3.0
3477,Metaverse Creatures,0,1,0,0,0,0,0,0,0,583,114.0,0.03,224.0,217.0,False,12/16/2021,16,10,140,3,2021-07-12,0.7200000000000001,approved,27.0
3478,Metaverse Guitar Collection,0,1,0,0,0,0,0,0,0,61,11.0,0.002,47.0,75.0,False,10/14/2021,2,5,11,4,2021-10-26,0.037,not_requested,50.0
3479,Metaverse HQ,0,0,0,0,0,0,0,1,0,1,1400.0,2.65,32990.0,305.0,False,01/30/2021,3373,635,3622,32,2021-07-12,364.6264000000001,verified,0.0
3480,Metaverse Marauders,1,0,0,0,0,0,0,0,0,1800,716.0,0.12,6219.0,256.0,False,08/03/2021,290,250,318,14,2021-10-04,10.8919,not_requested,123.0
3481,Metaverse Pets,0,1,0,0,0,0,0,0,0,89,507.0,0.002,385.0,74.0,False,09/18/2021,55,28,45,5,2021-09-05,0.7945480000000003,not_requested,29.0
3482,Metaverse Rooms,1,0,0,0,0,0,0,0,0,10,2.0,0.02,378.0,658.0,False,09/02/2019,9,6,40,5,2021-11-15,0.005,not_requested,49.0
3483,Metaverse Travel Agency (M.T.A.),0,1,0,0,0,0,0,0,0,5700,2700.0,0.02,6366.0,21.0,False,08/16/2021,115,89,215,20,2021-10-06,5.119500000019996,approved,179.0
3484,Metaverse avatars,0,1,0,0,0,0,0,0,0,61,27.0,0.06,463.0,231.0,False,11/24/2011,21,10,66,3,2021-08-16,0.49,not_requested,26.0
3485,Metaverse-Kimono,1,0,0,0,0,0,0,0,0,3,3.0,0.005,1899.0,1184.0,False,03/11/2020,3,11,52,1,2021-11-22,0.075,not_requested,0.0
3486,Metavpunk,0,1,0,0,0,0,0,0,0,249,71.0,0.006,426.0,1410.0,False,09/29/2021,1,2,3,2,2021-10-31,0.19922,not_requested,167.0
3487,Meteo Pebble,0,0,0,0,0,0,1,0,0,622,110.0,0.032,505.0,572.0,False,04/04/2021,70,70,81,2,2021-10-06,10.04879946,not_requested,79.0
3488,Meteoroid City,1,0,0,0,0,0,0,0,0,6,3.0,0.01,1031.0,513.0,False,04/18/2009,20,36,148,7,2021-10-25,0.02,not_requested,34.0
3489,Methodical Monkeys,0,1,0,0,0,0,0,0,0,253,27.0,0.033,488.0,419.0,False,03/12/2021,6,3,13,1,2021-04-16,0.113,approved,260.0
3490,Metomica - Proto Series,1,0,0,0,0,0,0,0,0,37,15.0,0.005,55.0,99.0,False,10/02/2020,11,4,10,1,2020-10-02,0.005,approved,13.0
3491,Metroverse:,0,0,0,0,0,0,0,1,0,20,2.0,0.1,81748.0,0.0,False,11/18/2021,9865,9296,11372,468,2021-12-01,0.05,not_requested,0.0
3492,Metti Landscape,1,0,0,0,0,0,0,0,0,1900,650.0,0.02,14154.0,2392.0,False,09/23/2021,104,104,146,9,2021-10-22,0.7909000000000002,approved,183.0
3493,Mgok Design,1,0,0,0,0,0,0,0,0,70,16.0,0.001,56.0,119.0,False,11/16/2012,2,5,12,1,2021-10-20,0.0018,not_requested,0.0
3494,Micheal Jordan: NFT Squad,1,0,0,0,0,0,0,0,0,6,2.0,0.036,3123.0,3150.0,False,05/09/2012,7,2,12,1,2021-08-05,0.036,not_requested,6.0
3495,Michella To Tomodachi,0,1,0,0,0,0,0,0,0,30,21.0,0.01,4621.0,2138.0,False,09/15/2021,106,80,105,6,2021-12-03,0.132,not_requested,28.0
3496,Mickey Mouse Disney Collectibles,0,1,0,0,0,0,0,0,0,241,2.0,0.08,16.0,0.0,False,12/03/2021,1,2,6,1,2021-11-30,0.08,not_requested,49.0
3497,Micro Garage Collection,0,1,0,0,0,0,0,0,0,23,4.0,0.005,0.0,7.0,False,12/22/2021,0,1,2,1,2021-09-15,0.035,not_requested,77.0
3498,MicroBuddies,0,0,0,0,0,0,0,1,0,31500,1400.0,0.001,22891.0,15.0,False,04/12/2021,7084,170,9783,100,2021-12-17,8.111075041270954,not_requested,894.0
3499,Mictlanians,0,1,0,0,0,0,0,0,0,91,4.0,0.042,2557.0,2735.0,False,07/07/2021,18,5,37,1,2021-11-09,0.084,not_requested,0.0
3500,MidnightBreeze,1,0,0,0,0,0,0,0,0,7000,2900.0,0.035,11120.0,1360.0,False,01/10/2019,40,38,203,9,2021-12-10,128.453713895462,approved,141.0
3501,Midwest views,0,0,0,0,1,0,0,0,0,28,5.0,0.03,3798.0,2808.0,False,01/14/2020,10,22,66,3,2021-11-24,0.18,not_requested,0.0
3502,Mighty Baby Dragons,0,1,0,0,0,0,0,0,0,10000,2200.0,0.001,2635.0,697.0,False,09/20/2021,7,7,18,5,2021-10-04,0.8133310000000005,not_requested,121.0
3503,Mighty Girls,0,1,0,0,0,0,0,0,0,28,16.0,0.05,288.0,536.0,False,09/12/2021,7,9,28,2,2021-08-08,0.18,not_requested,120.0
3504,Mighty Manateez,0,1,0,0,0,0,0,0,0,10000,2500.0,0.007,3106.0,183.0,False,08/27/2021,47,51,57,5,2021-08-29,1.3520999999999994,verified,266.0
3505,Mighty Mutts,0,1,0,0,0,0,0,0,0,777,20.0,0.02,1269.0,579.0,False,11/05/2021,9,4,20,3,2021-11-09,0.379,not_requested,204.0
3506,MightyPunks,0,1,0,0,0,0,0,0,0,86,37.0,0.02,465.0,536.0,False,08/09/2021,12,11,18,5,2021-12-01,1.1769000000000007,not_requested,110.0
3507,Mignon Generator,0,1,0,0,0,0,0,0,0,1,117.0,0.1,4202.0,2503.0,False,03/14/2012,7,23,89,2,2021-10-08,0.2,not_requested,4.0
3508,Miku-Miku series,1,0,0,0,0,0,0,0,0,4,4.0,0.009,1599.0,136.0,False,09/27/2019,745,7,3418,7,2021-10-18,0.012,not_requested,0.0
3509,Miladkaramooz Single Shots,0,0,0,0,1,0,0,0,0,8,1.0,0.14,1170.0,1933.0,False,10/01/2015,4,11,18,0,2021-09-13,0.2,not_requested,3.0
3510,Milady Maker,0,1,0,0,0,0,0,0,0,3600,834.0,0.029,1440.0,162.0,False,05/25/2021,27,10,332,10,2021-08-24,3.754699999999997,not_requested,0.0
3511,Milan Streets,0,0,0,0,1,0,0,0,0,22,4.0,0.007,1659.0,500.0,False,09/30/2010,23,28,24,3,2021-10-07,0.0074,not_requested,26.0
3512,Milky Way Meditation,0,0,0,0,1,0,0,0,0,25,23.0,0.1,2948.0,1123.0,False,11/18/2010,63,55,490,9,2021-08-06,0.01,not_requested,0.0
3513,Millionaire Certificate By: (METAVERSE GROUP.),0,0,0,0,0,0,0,1,0,3600,203.0,0.007,46.0,83.0,False,11/13/2021,18,20,17,1,2021-12-10,0.1175,not_requested,0.0
3514,Millionaire Raccoons League,0,1,0,0,0,0,0,0,0,500,274.0,0.069,3433.0,454.0,False,12/26/2012,28,85,136,7,2021-07-25,1.6327,not_requested,1772.0
3515,Millionaires Mining Club,0,0,0,0,0,0,0,1,0,1100,129.0,0.075,4926.0,15.0,False,08/29/2021,1190,118,310,10,2021-10-26,10.462269,not_requested,39.0
3516,MinTick,0,0,0,0,0,0,0,1,0,1,1600.0,0.009,2953.0,1176.0,False,11/28/2021,55,72,85,8,2021-12-12,0.9005132000000023,not_requested,0.0
3517,Minanse Club,0,1,0,0,0,0,0,0,0,905,230.0,0.006,1215.0,332.0,False,08/15/2021,7,35,17,1,2021-09-20,0.7468000000000002,not_requested,0.0
3518,Mind Control Boutique,0,1,0,0,0,0,0,0,0,203,328.0,0.001,777.0,1035.0,False,03/25/2009,5,3,12,1,2021-05-12,0.0199999999999999,approved,105.0
3519,Mined JPEG,1,0,0,0,0,0,0,0,0,25,24.0,0.99,977.0,648.0,False,05/27/2017,1,2,5,1,2021-12-07,0.15,not_requested,4.0
3520,Mini Monkey Mafia,0,1,0,0,0,0,0,0,0,5000,1700.0,0.004,7389.0,96.0,False,06/14/2021,31,31,62,4,2021-09-14,0.3930000000000001,not_requested,119.0
3521,Mini Mori,0,1,0,0,0,0,0,0,0,51,34.0,0.009,669.0,823.0,False,07/11/2021,7,44,124,5,2021-07-11,0.01,not_requested,80.0
3522,MiniGoros,0,1,0,0,0,0,0,0,0,10000,1200.0,0.006,5722.0,4911.0,False,05/03/2021,20,18,109,8,2021-11-16,5.958426099999985,not_requested,170.0
3523,Minideath,0,1,0,0,0,0,0,0,0,24,15.0,0.035,192.0,2.0,False,11/15/2021,45,28,48,7,2021-11-17,0.4700000000000001,not_requested,2.0
3524,MinimalKitten,1,0,0,0,0,0,0,0,0,90,7.0,0.012,399.0,176.0,False,10/29/2021,57,60,90,5,2021-10-29,0.0615,not_requested,38.0
3525,Minimalism V1,0,0,0,0,1,0,0,0,0,3,2.0,0.1,1662.0,1642.0,False,06/15/2009,5,4,30,1,2021-10-19,0.6799999999999999,not_requested,0.0
3526,Minimumizm,1,0,0,0,0,0,0,0,0,250,47.0,0.001,4543.0,865.0,False,08/04/2021,8,2,27,5,2021-07-31,0.037,not_requested,5.0
3527,Minis Everywhere I Go,1,0,0,0,0,0,0,0,0,5,4.0,0.1,11473.0,5045.0,False,12/17/2020,6,2,23,1,2021-10-12,0.2,not_requested,0.0
3528,Mint Songs,0,0,0,1,0,0,0,0,0,23900,1200.0,0.001,7707.0,893.0,False,11/14/2018,37,32,186,11,2021-07-03,0.120488,not_requested,0.0
3529,Minted Thoughts,1,0,0,0,0,0,0,0,0,11,9.0,0.015,9684.0,998.0,False,03/31/2009,13,5,38,1,2021-09-03,0.03,not_requested,0.0
3530,Mintopoly!,0,0,0,0,0,0,1,0,0,63,142.0,0.02,1289.0,426.0,False,06/12/2021,127,45,146,6,2021-07-16,0.6430000000000001,not_requested,52.0
3531,Minty | ONE,1,0,0,0,0,0,0,0,0,10,10.0,0.69,653.0,232.0,False,02/15/2019,8,3,30,1,2021-12-01,0.27,not_requested,18.0
3532,Minty's World,1,0,0,0,0,0,0,0,0,9,7.0,0.075,1071.0,1250.0,False,07/03/2021,26,25,60,10,2021-10-31,0.15,not_requested,0.0
3533,Miracle Girl Collection,0,1,0,0,0,0,0,0,0,13,11.0,0.03,2808.0,882.0,False,01/20/2018,15,13,46,1,2021-11-05,0.085,not_requested,0.0
3534,Mirage Gallery Memberships,0,0,0,0,0,0,0,1,0,51,75.0,0.2,1113.0,10.0,False,05/12/2021,33,37,137,7,2021-11-21,2.95,not_requested,2.0
3535,Mirandus,0,1,0,0,0,0,0,0,0,182,14700.0,0.08,272513.0,135.0,False,07/29/2020,670,166,2407,145,2020-10-06,1995.0071925790896,verified,20.0
3536,MirrorWorld,1,0,0,0,0,0,0,0,0,6400,1400.0,0.03,6269.0,885.0,False,08/16/2021,80,97,110,38,2021-09-24,2.6459000000000006,approved,198.0
3537,Misfit University Official,0,1,0,0,0,0,0,0,0,10000,2400.0,0.001,18997.0,108.0,False,05/11/2021,466,467,518,17,2021-06-24,0.2403012,verified,205.0
3538,Miss Cats NFT,1,0,0,0,0,0,0,0,0,79,18.0,0.01,399.0,1343.0,False,09/25/2021,2,24,9,1,2021-09-25,0.151,not_requested,155.0
3539,MissCryptoClub,0,1,0,0,0,0,0,0,0,3100,1200.0,0.037,2966.0,571.0,False,07/09/2021,41,14,105,12,2021-08-06,24.00865899999998,approved,79.0
3540,MissPolly,1,0,0,0,0,0,0,0,0,6,3.0,0.091,4825.0,3435.0,False,06/21/2021,5,2,20,2,2021-10-25,0.07,not_requested,18.0
3541,MissUniverse,1,0,0,0,0,0,0,0,0,11,4.0,0.004,132.0,302.0,False,03/10/2021,7,3,13,2,2021-06-11,0.027,not_requested,21.0
3542,Missing Faces Detroit Collection,1,0,0,0,0,0,0,0,0,20,12.0,0.031,44.0,75.0,False,08/16/2021,7,7,12,6,2021-08-26,0.06773,not_requested,43.0
3543,Mitsu Art,1,0,0,0,0,0,0,0,0,5,4.0,0.008,291.0,338.0,False,12/08/2021,13,2,56,6,2021-12-13,0.029,not_requested,0.0
3544,Mitzsuki,1,0,0,0,0,0,0,0,0,42,479.0,0.028,9003.0,1679.0,False,03/15/2009,118,140,328,5,2021-05-20,0.8594999999999999,verified,3.0
3545,MobyPunks,0,1,0,0,0,0,0,0,0,37,30.0,0.05,1192.0,663.0,False,06/11/2009,40,89,106,7,2021-10-08,0.148,not_requested,0.0
3546,ModBuildGen (Modern Building Generator),1,1,0,0,0,0,0,0,0,99,41.0,0.19,3983.0,675.0,False,04/03/2008,7,7,93,2,2021-01-13,0.349,approved,0.0
3547,Modern Art Punks,0,1,0,0,0,0,0,0,0,123,60.0,0.09,56.0,13.0,False,04/02/2021,25,3,32,3,2021-04-03,0.292,not_requested,210.0
3548,Modern Spells as Acts of Resistance,0,0,0,0,1,0,0,0,0,10,6.0,0.05,2042.0,2164.0,False,02/09/2019,16,3,59,3,2021-12-06,0.25,not_requested,0.0
3549,Moebocop,1,0,0,1,0,0,0,0,0,14,14.0,0.85,581.0,798.0,False,01/15/2010,3,4,12,1,2021-01-22,0.05,approved,0.0
3550,Molly Space,1,0,0,0,0,0,0,0,1,24,8.0,0.002,666.0,715.0,False,03/31/2021,3,1,14,2,2021-04-05,0.004,not_requested,0.0
3551,MomentX Genesis Tablet,0,1,0,0,0,0,0,0,0,1000,432.0,0.027,758.0,16.0,False,03/15/2021,23,5,26,3,2021-10-15,2.0361,not_requested,48.0
3552,Moments by r4v3n,1,0,0,0,0,0,0,0,0,1000,571.0,0.03,3403.0,702.0,False,07/18/2021,5,28,46,2,2021-09-14,2.342699121820899,verified,57.0
3553,Moments in Tide,0,0,0,0,1,0,0,0,0,26,20.0,0.2,1667.0,618.0,False,03/19/2019,28,13,263,3,2021-09-29,0.4,not_requested,0.0
3554,Moments of anonymity,0,0,0,0,1,0,0,0,0,15,11.0,0.15,1499.0,334.0,False,01/25/2015,12,21,86,3,2021-11-22,1.9,not_requested,0.0
3555,Moments: Around The World,0,0,0,0,1,0,0,0,0,60,38.0,1.5,24431.0,1342.0,False,03/11/2021,230,70,1735,11,2021-08-04,2.47,not_requested,76.0
3556,Momo Trading Card,0,0,0,0,0,0,1,0,0,6,108.0,0.005,16.0,149.0,False,08/31/2021,0,0,2,1,2021-09-19,0.03,not_requested,2.0
3557,Mona Lisas Club Official NFT,1,0,0,0,0,0,0,0,0,384,210.0,0.07,1386.0,31.0,False,11/15/2021,41,9,54,2,2021-12-16,3.75,not_requested,67.0
3558,Mona Spaces,1,0,0,0,0,0,0,0,0,36,14.0,3.0,6044.0,772.0,False,06/17/2021,14,10,45,4,2021-11-03,1.0814,approved,38.0
3559,Mona Spaces (Polygon),1,0,0,0,0,0,0,0,0,38,21.0,0.25,6044.0,772.0,False,06/17/2021,14,10,45,4,2021-11-04,2.4800000000000004,not_requested,35.0
3560,Mona Stairism,1,0,0,0,0,0,0,0,0,10,9.0,3.0,2372.0,973.0,False,09/19/2021,72,94,630,7,2021-11-21,6.6000000000000005,not_requested,0.0
3561,Monaco Planet KOL 100,0,1,0,0,0,0,0,0,0,52,50.0,4.207,20270.0,47.0,False,10/21/2021,95,256,264,28,2021-11-12,5.1,not_requested,52.0
3562,Monaco Planet Yacht,0,1,0,0,0,0,0,0,0,10000,5200.0,0.078,20270.0,47.0,False,10/21/2021,95,256,264,28,2021-11-12,127.01692060098642,approved,251.0
3563,Monami Killer,1,0,0,0,0,0,0,0,0,9,20.0,0.05,225.0,208.0,False,08/27/2010,16,11,43,1,2021-12-10,0.1,not_requested,0.0
3564,Monas,1,0,0,0,0,0,0,0,0,5000,2000.0,0.02,8218.0,3913.0,False,05/09/2021,2181,347,1945,8,2021-05-09,2.277,verified,233.0
3565,Monas - Celebrating Reddit 2021 (GIVEN FOR FREE),1,0,0,0,0,0,0,0,0,3,659.0,0.005,8218.0,3913.0,False,05/09/2021,2181,347,1945,8,2021-05-25,0.0158,not_requested,0.0
3566,Monero Lisa Genesis Collection,0,1,0,0,0,0,0,0,0,3300,1800.0,0.001,3891.0,28.0,False,09/21/2021,149,154,169,8,2021-09-21,0.144476999999999,not_requested,14.0
3567,Monet Masks,1,0,0,0,0,0,0,0,0,64,37.0,0.047,204.0,9.0,False,04/02/2021,56,54,64,10,2021-04-02,0.06,approved,0.0
3568,Money Stack,0,1,0,0,0,0,0,0,0,150,95.0,0.145,2516.0,8.0,False,08/21/2021,89,81,108,10,2021-08-20,1.25,verified,25.0
3569,MoneyPunks,1,0,0,0,0,0,0,0,0,100,56.0,0.035,101.0,5.0,False,03/31/2021,3,1,16,1,2021-04-03,0.11,not_requested,0.0
3570,Monfters Club,0,1,0,0,0,0,0,0,0,1300,767.0,0.01,4243.0,29.0,False,12/19/2021,99,94,235,31,2021-12-16,2665.5373703652454,approved,224.0
3571,Mongz,1,0,0,0,0,0,0,0,0,4800,477.0,0.008,5955.0,70.0,False,10/13/2021,866,477,1273,1706,2021-11-01,3.859344084999998,approved,161.0
3572,Monk Meta Mafia (3M),1,0,0,0,0,0,0,0,0,333,21.0,0.033,3233.0,2456.0,False,09/02/2021,1,51,70,1,2021-11-07,0.7597,not_requested,0.0
3573,Monkey Bet DAO,0,0,0,0,0,0,0,1,0,10000,3800.0,0.034,10181.0,4.0,False,08/20/2021,160,97,653,45,2021-08-28,32.04224136986329,verified,178.0
3574,Monkey Glowing Neon,1,0,0,0,0,0,0,0,0,6,2.0,0.05,204.0,2397.0,False,06/28/2009,1,4,17,0,2021-11-19,0.005,not_requested,0.0
3575,Monkey Heist CIub,1,0,0,0,0,0,0,0,0,85,4.0,0.05,14069.0,2085.0,False,09/15/2021,707,493,782,20,2021-11-15,0.15,not_requested,0.0
3576,Monkey NFT Arts,1,0,0,0,0,0,0,0,0,544,681.0,0.001,22.0,66.0,False,01/06/2022,5,20,10,1,2021-09-07,0.13484099,not_requested,0.0
3577,Monkey Token,1,0,0,0,0,0,0,0,0,10000,8.0,0.001,39.0,36.0,False,03/26/2009,21,5,17,4,2021-11-24,0.00456,not_requested,0.0
3578,MonkeyKingClub,0,1,0,0,0,0,0,0,0,8,7.0,0.16,605.0,8.0,False,08/15/2021,268,435,355,14,2021-09-04,0.02045,not_requested,0.0
3579,MonkeyVerse Genesis,1,0,0,0,0,0,0,0,0,152,89.0,0.05,7746.0,2446.0,False,03/11/2021,42,50,86,8,2021-12-07,0.2,not_requested,93.0
3580,Monkeybrix,0,1,0,0,0,0,0,0,0,5000,525.0,0.008,2202.0,1305.0,False,06/27/2021,151,160,193,19,2021-07-08,0.1658,not_requested,200.0
3581,Monkeyking8bit,0,1,0,0,0,0,0,0,0,94,31.0,0.005,856.0,1484.0,False,09/04/2021,27,6,33,4,2021-09-26,0.195,not_requested,0.0
3582,Monks of Crypto,0,1,0,0,0,0,0,0,0,500,73.0,0.02,2473.0,1319.0,False,10/26/2021,9,6,22,2,2021-10-30,4.600299999999992,not_requested,786.0
3583,Mono-Chrome World,0,0,0,0,1,0,0,0,0,9,5.0,0.008,1037.0,1189.0,False,03/16/2014,8,4,62,2,2021-10-21,0.016,not_requested,0.0
3584,Monochrome Minimalism,0,0,0,0,1,0,0,0,0,20,19.0,0.2,5398.0,1068.0,False,02/27/2016,6,5,25,3,2021-10-22,7.281999999999999,approved,0.0
3585,Monster Blocks - Official,1,0,0,0,0,0,0,0,0,9000,2100.0,0.009,4614.0,178.0,False,06/03/2021,48,30,54,4,2021-08-12,2.1067000999999985,verified,424.0
3586,Monster Darts,1,0,0,0,0,0,0,0,0,27,14.0,0.01,493.0,838.0,False,07/17/2021,1,2,5,1,2021-08-15,0.085,not_requested,3.0
3587,Monster Machine,0,1,0,0,0,0,0,0,0,42,11.0,0.012,2307.0,2505.0,False,08/17/2021,69,39,70,6,2021-09-11,0.027,not_requested,0.0
3588,Monster Punks,1,1,0,0,0,0,0,0,0,91,17.0,0.05,3775.0,1902.0,False,03/12/2021,8,9,25,3,2021-03-12,0.1,approved,10.0
3589,Monster Rehab 1.0,0,1,0,0,0,0,0,0,0,5400,1600.0,0.01,17261.0,6322.0,False,06/08/2013,48,36,84,7,2021-07-02,1.0124000000000002,verified,623.0
3590,Monster Satoshibles,0,1,0,0,0,0,0,0,0,2000,446.0,0.03,9590.0,1805.0,False,03/14/2021,75,32,250,24,2021-10-27,5.625999999999999,approved,310.0
3591,Monster University,1,0,0,0,0,0,0,0,0,26,15.0,0.067,3032.0,1806.0,False,06/13/2018,23,6,38,5,2021-11-23,0.2269999999999999,not_requested,21.0
3592,MonsterBuds,0,1,0,0,0,0,0,0,0,12000,3400.0,0.075,9763.0,805.0,False,05/12/2021,168,148,278,35,2021-09-21,45.47243279675395,verified,460.0
3593,MonsterBuds Green Room,0,1,0,0,0,0,0,0,0,817,755.0,0.095,9763.0,805.0,False,05/12/2021,168,148,278,35,2021-10-21,1.8980000000000008,not_requested,5.0
3594,Monsters Clan.,0,0,0,0,0,1,0,0,0,28,4.0,0.04,80255.0,11.0,False,07/25/2021,141,73,424,133,2021-09-15,0.15,not_requested,20.0
3595,Monsters Dont Exist,0,1,0,0,0,0,0,0,0,111,3.0,0.15,659.0,48.0,False,11/05/2021,3,11,11,1,2021-10-26,0.13,not_requested,187.0
3596,Monsters Party,1,0,0,0,0,0,0,0,0,115,75.0,0.007,3032.0,1806.0,False,06/13/2018,23,6,38,5,2021-07-28,0.072,not_requested,69.0
3597,Monsters of Mind (M.O.M),0,1,0,0,0,0,0,0,0,271,121.0,0.05,4511.0,3875.0,False,05/06/2021,9,5,30,1,2021-07-21,2.053000000000001,not_requested,301.0
3598,Monsters on Wall Street,0,1,0,0,0,0,0,0,0,1100,467.0,0.01,2049.0,718.0,False,02/21/2021,67,71,87,9,2021-09-02,0.29506913578,not_requested,201.0
3599,Monstruos de las croquetas,0,0,0,0,1,0,0,0,0,2,2.0,0.1,3607.0,2607.0,False,10/01/2021,11,18,62,1,2021-10-19,0.1,not_requested,0.0
3600,Montana Lemonious-Craig x The Peak Edition,0,0,0,0,0,1,0,0,0,14,5.0,0.01,1436.0,413.0,False,11/16/2017,49,48,943,16,2021-07-28,0.025,not_requested,4.0
3601,Mood Swing,1,0,0,0,0,0,0,0,0,12,2.0,0.09,1157.0,613.0,False,11/18/2021,2,10,11,1,2021-10-06,0.12,not_requested,0.0
3602,Moody Mice Club,0,1,0,0,0,0,0,0,0,1400,266.0,0.001,319.0,170.0,False,11/18/2021,35,37,45,10,2021-11-17,0.1070519999999999,not_requested,152.0
3603,Moody Monochrome,0,0,0,0,1,0,0,0,0,22,2.0,0.15,111.0,361.0,False,09/05/2021,2,2,19,1,2021-10-03,0.14,approved,0.0
3604,Moody lady,1,0,0,0,0,0,0,0,0,10,5.0,0.04,2867.0,4659.0,False,07/10/2017,7,17,27,3,2021-11-20,0.3,not_requested,15.0
3605,Moon Covers for Social Media,1,0,0,0,0,0,0,0,0,12,24.0,0.001,333.0,877.0,False,11/03/2021,14,5,30,2,2021-11-24,0.0071099999999999,not_requested,0.0
3606,Moon Light Owls,1,0,0,0,0,0,0,0,0,44,28.0,0.06,2229.0,997.0,False,11/01/2021,157,56,237,13,2021-10-30,0.5900000000000001,not_requested,68.0
3607,Moon Mates NFT,0,1,0,0,0,0,0,0,0,6000,122.0,0.004,10798.0,75.0,False,02/23/2012,300,314,320,13,2021-09-02,0.009,not_requested,107.0
3608,Moon Protocol,1,0,0,0,0,0,0,0,0,16,130.0,0.18,14811.0,742.0,False,03/20/2018,61,34,311,12,2021-03-25,0.469,not_requested,0.0
3609,Moon Seeker team,1,0,0,0,0,0,0,0,0,53,33.0,0.015,4231.0,4982.0,False,10/20/2009,3,1,10,1,2021-08-22,0.016,not_requested,122.0
3610,MoonBoys Alpha Collection,1,1,0,0,0,0,0,0,0,848,185.0,0.049,1349.0,898.0,False,03/07/2021,27,9,34,3,2021-03-16,4.395,verified,440.0
3611,MoonCats,0,1,0,0,0,0,0,0,0,18600,5200.0,0.566,9757.0,70.0,False,03/12/2021,22,27,68,2,2021-04-22,1649.2699338280208,verified,0.0
3612,Moonbeam Collection,1,0,0,0,0,0,0,0,0,20,44.0,0.4,15030.0,3372.0,False,03/29/2021,8,4,43,3,2021-05-10,0.55,not_requested,0.0
3613,Moondogs Adoption,0,1,0,0,0,0,0,0,0,444,228.0,0.01,1500.0,1314.0,False,02/24/2018,329,351,366,6,2021-08-24,0.13950001,not_requested,16.0
3614,Moondusa,0,1,0,0,0,0,0,0,0,309,170.0,0.02,14496.0,1940.0,False,04/22/2010,43,24,153,10,2021-11-11,0.0598999999999999,not_requested,265.0
3615,Moonicorns,0,1,0,0,0,0,0,0,0,66,11.0,0.008,1654.0,1021.0,False,03/25/2021,5,8,17,2,2021-03-25,0.035,not_requested,203.0
3616,MoonieNFT OG Collection,0,1,0,0,0,0,0,0,0,6000,1200.0,0.028,86404.0,50.0,False,05/18/2021,41,60,135,4,2021-11-05,3.7729999999999984,not_requested,85.0
3617,Moonkeyz,1,0,0,0,0,0,0,0,0,41,25.0,0.05,1446.0,1409.0,False,03/09/2021,7,11,30,5,2021-09-21,0.509,not_requested,0.0
3618,Moonlight Window,1,0,0,0,0,0,0,0,0,41,7.0,0.131,1961.0,1845.0,False,08/29/2021,35,13,77,1,2021-11-16,1.5929181300000002,not_requested,45.0
3619,Moonray Presale Pass,0,0,0,0,0,0,0,1,0,1,871.0,0.25,33227.0,325.0,False,12/18/2019,105,60,225,5,2021-10-20,32.5373,approved,3.0
3620,Moqarmat,1,0,0,0,0,0,0,0,0,163,213.0,0.009,610.0,1472.0,False,09/19/2021,4,2,13,1,2021-08-06,0.025,not_requested,0.0
3621,More of Hiiro's collection,1,0,0,0,0,0,0,0,0,20,66.0,0.008,1579.0,592.0,False,10/09/2021,17,5,76,5,2021-10-27,0.0249999999999999,not_requested,4.0
3622,More than a Moment,0,0,0,0,1,0,0,0,0,50,16.0,0.1,10010.0,1387.0,False,08/14/2010,456,14,1662,14,2021-09-20,0.6,approved,0.0
3623,Morgan Smiles,1,0,0,0,0,0,0,0,0,29,5.0,0.05,68026.0,1634.0,False,04/01/2010,73,64,193,4,2021-09-13,0.109,not_requested,20.0
3624,Morningstar,0,0,0,0,1,0,0,0,0,39,7.0,0.6,565.0,1380.0,False,04/21/2009,4,2,14,1,2021-02-21,0.6,approved,0.0
3625,Morse Codes,0,1,0,0,0,0,0,0,0,2200,63.0,0.01,66.0,252.0,False,11/13/2021,11,3,15,3,2021-11-05,0.05,not_requested,8.0
3626,Mosques of Anatolia Turkey,0,0,0,0,1,0,0,0,0,10,3.0,0.15,7579.0,765.0,False,04/12/2009,3,24,34,1,2021-11-07,0.3,not_requested,11.0
3627,Motion Effects,1,0,0,0,0,0,0,0,0,42,8500.0,0.001,193.0,685.0,False,05/11/2017,1,5,20,2,2021-11-20,0.6356847030315257,not_requested,0.0
3628,Motion VqGan+Clip by 3Magnas,1,0,0,0,0,0,0,0,0,12,2.0,0.001,398.0,311.0,False,03/09/2021,8,2,13,4,2021-10-27,0.002,not_requested,0.0
3629,MotoGP Collectibles,0,1,0,0,0,0,0,0,0,13,2.0,0.008,3.0,38.0,False,05/28/2021,3,3,9,0,2021-05-27,0.008,not_requested,111.0
3630,Mount Rainier Collection,0,0,0,0,1,0,0,0,0,9,4.0,0.05,787.0,1341.0,False,12/09/2019,12,9,56,3,2021-09-27,0.05,not_requested,0.0
3631,Mountain Splendor,0,0,0,0,1,0,0,0,0,31,20.0,1.0,10843.0,1832.0,False,12/17/2020,7,38,125,1,2021-09-20,2.0,not_requested,0.0
3632,Moustache Human,0,1,0,0,0,0,0,0,0,147,19.0,0.003,146.0,479.0,False,12/25/2021,0,0,1,0,2021-12-13,0.1783000000000001,not_requested,0.0
3633,Movement - A Study of Duality,1,0,0,0,0,0,0,0,0,2,2.0,0.044,0.0,18.0,False,07/31/2011,0,0,0,0,2021-11-06,0.044,not_requested,0.0
3634,Movement by Lasse_Tur,0,0,0,0,1,0,0,0,0,113,5.0,0.025,3491.0,4214.0,False,01/04/2010,26,3,85,4,2021-11-18,0.025,not_requested,0.0
3635,Mozart Derivatives,1,0,0,0,0,0,0,0,0,13,51.0,0.039,11323.0,1018.0,False,03/28/2012,25,12,103,4,2021-08-07,0.5299999999999999,not_requested,0.0
3636,Mr. Coin Buddies,1,0,0,0,0,0,0,0,0,100,44.0,0.007,675.0,1353.0,False,09/25/2021,6,5,22,4,2021-10-25,0.5414,not_requested,244.0
3637,Mr. Hightopper,1,0,0,0,0,0,0,0,0,10,2.0,0.2,3016.0,1375.0,False,07/27/2009,74,5,1009,3,2021-11-19,0.2,not_requested,0.0
3638,Mr. INTROVERT,1,0,0,0,0,0,0,0,0,30,22.0,0.1,1252.0,386.0,False,10/03/2021,6,3,32,3,2021-10-02,0.37,not_requested,71.0
3639,Mr. Uncommon,0,1,0,0,0,0,0,0,0,926,558.0,0.01,24157.0,11.0,False,10/25/2021,3598,145,4121,9,2021-10-20,1.775,not_requested,269.0
3640,Mr.Happy,1,0,0,0,0,0,0,0,0,46,2.0,0.009,533.0,446.0,False,09/12/2021,72,50,65,5,2021-10-07,0.013,not_requested,26.0
3641,Mr.HouseBear NFT on polygon,1,0,0,0,0,0,0,0,0,15,18.0,0.008,1011.0,801.0,False,10/20/2021,5,12,56,2,2021-12-03,0.137,not_requested,0.0
3642,Mr_Fox,0,1,0,0,0,0,0,0,0,502,14.0,0.01,197.0,236.0,False,10/09/2021,6,3,17,1,2021-12-17,0.0330079,not_requested,0.0
3643,Mtendere Mandowa - Record Seed Collection,1,0,0,0,0,0,0,0,0,404,274.0,0.03,19896.0,444.0,True,04/05/2010,13,20,450,2,2021-09-03,1.2126400000000002,verified,19.0
3644,Mufasax21,1,0,0,0,0,0,0,0,0,13,9.0,0.04,1194.0,999.0,False,07/13/2019,24,8,44,5,2021-11-18,0.81,not_requested,23.0
3645,Muke: UFO,0,1,0,0,0,0,0,0,0,177,67.0,0.029,1724.0,958.0,False,03/20/2021,26,4,72,5,2021-07-17,0.27,not_requested,106.0
3646,MuleSquad,1,0,0,0,0,0,0,0,0,690,347.0,0.135,678.0,411.0,False,09/01/2021,17,8,49,1,2021-10-06,5.221899999999997,approved,106.0
3647,Mullet Babies,0,1,0,0,0,0,0,0,0,135,46.0,0.02,141.0,202.0,False,12/12/2021,21,25,26,4,2021-11-30,1.0160180000000003,not_requested,0.0
3648,MulletMaxi NFTsp,0,0,0,0,0,0,0,1,0,500,27.0,0.085,664.0,606.0,False,09/02/2021,9,5,26,4,2021-11-01,0.085,not_requested,267.0
3649,Multicolorism,1,0,0,0,0,0,0,0,0,7,7.0,0.04,5128.0,5441.0,False,09/05/2009,27,17,113,4,2021-11-20,0.12,not_requested,0.0
3650,Multimeta,0,1,0,0,0,0,0,0,0,41,927.0,0.001,3510.0,1154.0,False,05/18/2021,503,585,493,12,2021-11-26,0.0209573798872294,not_requested,0.0
3651,MultiverseVM,0,0,0,0,0,0,0,1,0,8000,2000.0,0.019,1214.0,6.0,False,09/14/2021,54,52,72,5,2021-09-21,27.87672119999996,verified,1786.0
3652,Murda Murf,0,1,0,0,0,0,0,0,0,140,9.0,0.02,9.0,5.0,False,01/26/2014,1,1,8,0,2021-10-26,0.02,not_requested,140.0
3653,Murder Academy!,0,1,0,0,0,0,0,0,0,249,115.0,0.005,2830.0,1616.0,False,03/23/2021,31,8,56,6,2021-03-23,0.09,not_requested,319.0
3654,Murder art,1,0,0,0,0,0,0,0,0,47,17.0,0.169,12272.0,3065.0,False,08/09/2021,20,30,107,2,2021-10-27,1.1845,not_requested,0.0
3655,Museum The White Room,1,0,0,0,0,0,0,0,0,4800,2400.0,0.01,6480.0,514.0,False,08/13/2021,77,63,164,21,2021-10-06,6.848599889999995,approved,92.0
3656,Mushroom Budzz,0,1,0,0,0,0,0,0,0,32,8.0,0.012,136.0,306.0,False,11/19/2021,28,29,31,3,2021-11-19,0.081,not_requested,219.0
3657,MushyBaras,0,1,0,0,0,0,0,0,0,833,172.0,0.035,11621.0,1691.0,False,09/29/2021,21,10,33,1,2021-12-05,1.1382,not_requested,82.0
3658,Music is Magic,0,0,0,0,1,0,0,0,0,4,2.0,0.035,2091.0,872.0,False,12/13/2019,13,14,34,3,2021-09-14,0.04,not_requested,16.0
3659,Musings from an analog mind,1,0,0,0,0,0,0,0,0,4,11.0,0.1,3501.0,2352.0,False,07/09/2014,35,7,69,5,2021-10-12,0.25,not_requested,0.0
3660,Musky Martian,1,0,0,0,0,0,0,0,0,12,4.0,0.63,2.0,13.0,False,11/22/2021,0,0,2,0,2021-08-15,0.1,not_requested,8.0
3661,Mutant Ape AI Art Collection,1,0,0,0,0,0,0,0,0,603,149.0,0.009,715.0,76.0,False,09/22/2021,73,35,62,4,2021-09-24,0.1079,not_requested,0.0
3662,Mutant Ape Pixel Club Official,0,1,0,0,0,0,0,0,0,105,65.0,0.11,5951.0,2189.0,False,06/17/2021,192,196,222,8,2021-09-19,2.16299,not_requested,56.0
3663,Mutant Ape Pixel Party,0,1,0,0,0,0,0,0,0,2000,367.0,0.006,476.0,232.0,False,11/13/2021,68,60,94,6,2021-11-19,1.4036899999999977,not_requested,104.0
3664,Mutant Apes Skull,1,0,0,0,0,0,0,0,0,51,39.0,0.067,105.0,40.0,False,12/05/2021,34,24,52,4,2021-12-04,2.310070000000001,not_requested,31.0
3665,Mutant Doodles,0,1,0,0,0,0,0,0,0,100,23.0,0.004,185.0,364.0,False,11/25/2021,9,15,17,2,2021-12-04,0.2212000000000001,not_requested,137.0
3666,Mutant Duck Pond,0,1,0,0,0,0,0,0,0,11,118.0,0.02,6326.0,384.0,False,06/18/2021,36,34,107,20,2021-09-04,0.079,not_requested,0.0
3667,Mutant Ether Babie,0,1,0,0,0,0,0,0,0,21,3.0,0.09,91.0,4.0,False,11/17/2021,8,13,21,2,2021-11-01,0.3,not_requested,0.0
3668,Mutant Girls,0,1,0,0,0,0,0,0,0,749,440.0,0.001,1357.0,4997.0,False,06/22/2019,6,4,11,2,2021-11-20,0.267259,not_requested,0.0
3669,Mutant Picasso Ape Yacht Club,0,1,0,0,0,0,0,0,0,1000,188.0,0.006,2166.0,182.0,False,09/28/2021,37,44,72,6,2021-08-30,0.0929,not_requested,3000.0
3670,Mutant Punks NFT,0,1,0,0,0,0,0,0,0,10000,4700.0,0.008,4659.0,38.0,False,04/24/2021,243,220,275,7,2021-10-14,11.06574180283656,approved,120.0
3671,Mutant Serum Ape Yacht Club,0,1,0,0,0,0,0,0,0,42,22.0,0.04,748.0,1297.0,False,09/02/2021,7,17,19,3,2021-09-11,0.066,not_requested,0.0
3672,Mutant Unicorn Society,0,1,0,0,0,0,0,0,0,190,88.0,0.02,40238.0,0.0,False,08/10/2020,68,104,898,1,2021-11-24,20.000240882707505,not_requested,286.0
3673,MutantKongz,0,1,0,0,0,0,0,0,0,500,187.0,0.45,11649.0,1295.0,False,04/22/2021,46,34,102,8,2021-04-22,6.415,approved,69.0
3674,Mutation of abandonce,1,0,0,0,0,0,0,0,0,12,2.0,0.12,1461.0,4283.0,False,06/13/2021,3,1,4,1,2021-10-25,0.2,not_requested,0.0
3675,Muzesido Trading Cards Clup,0,0,0,0,0,0,1,0,0,73,143.0,0.001,5407.0,43.0,False,09/30/2021,57,358,232,2,2021-09-15,0.0037,not_requested,14.0
3676,MuzesidoUtility Clup,0,0,0,0,0,0,0,1,0,72,597.0,0.001,5407.0,43.0,False,09/30/2021,57,358,232,2,2021-09-14,0.00637342962768,not_requested,3.0
3677,My Art WoOorld,1,0,0,0,0,0,0,0,0,8,2.0,0.1,1917.0,1291.0,False,05/16/2021,1,1,4,1,2021-12-15,0.1,not_requested,12.0
3678,My Brother Is A Jerk.....,0,0,0,0,0,0,1,0,0,14,7.0,0.043,3982.0,1923.0,False,06/13/2009,13,8,37,6,2021-05-31,0.0125,not_requested,0.0
3679,My Crypto Island,0,1,0,0,0,0,0,0,0,174,60.0,0.035,1071.0,2838.0,False,08/06/2021,2,3,11,0,2021-04-02,2.028632756635401,not_requested,107.0
3680,My Curio Cards,1,0,0,0,0,0,1,0,0,30,4800.0,0.59,13236.0,158.0,False,04/12/2017,168,32,437,33,2021-03-28,2068.408444488484,verified,74.0
3681,My Dream land,1,0,0,0,0,0,0,0,0,243,41.0,0.003,135.0,241.0,False,10/31/2021,7,8,19,2,2021-10-27,0.025,not_requested,0.0
3682,My Fat Babiz,0,1,0,0,0,0,0,0,0,654,216.0,0.126,2761.0,81.0,False,04/01/2015,510,489,540,83,2021-12-08,16.903516599999996,not_requested,497.0
3683,My Favorite Collections_,1,0,0,0,0,0,0,0,0,23,19.0,0.078,21439.0,134.0,False,04/27/2018,822,11,7916,16,2021-10-31,0.4049999999999999,not_requested,0.0
3684,My Favorite Film Moments,1,0,0,0,0,0,0,0,0,22,3.0,0.222,10103.0,998.0,False,07/24/2020,29,10,176,4,2021-10-28,0.444,not_requested,0.0
3685,My Fractal Dreams,1,0,0,0,0,0,0,0,0,48,9.0,0.01,4923.0,2613.0,False,09/19/2021,31,311,210,2,2021-10-04,0.01,not_requested,0.0
3686,My Fucking Pickle,0,1,0,0,0,0,0,0,0,10000,2800.0,0.015,6482.0,25.0,False,06/16/2021,71,238,407,28,2021-06-17,1.0324500000000003,verified,87.0
3687,My Lisbon view,0,0,0,0,1,0,0,0,0,20,2.0,0.09,590.0,457.0,False,06/15/2009,10,6,88,2,2021-12-09,0.09,not_requested,0.0
3688,My Little Miner Genesis Miner,0,0,0,0,0,0,0,1,0,76,82.0,0.015,531.0,228.0,False,11/09/2021,14,6,25,2,2021-12-12,12.4281,not_requested,0.0
3689,My Little Piggie Club,0,1,0,0,0,0,0,0,0,6200,48.0,0.038,244.0,586.0,False,12/05/2021,7,5,15,3,2021-11-29,1.4607,approved,154.0
3690,My Look,1,0,0,0,0,0,0,0,0,12,9.0,0.25,3460.0,1161.0,False,07/27/2017,32,36,62,5,2021-11-05,0.5985,not_requested,8.0
3691,My People,1,0,0,0,0,0,0,0,0,2,2.0,0.16,65.0,230.0,False,11/02/2021,9,5,89,2,2021-11-16,0.08,not_requested,0.0
3692,My Photography journey,0,0,0,0,1,0,0,0,0,18,14.0,0.05,5149.0,4527.0,False,06/07/2021,3,2,10,1,2021-06-16,0.25,not_requested,0.0
3693,My Pink & Purple World,1,0,0,0,0,0,0,0,0,130,8.0,0.05,8340.0,5533.0,False,11/24/2020,13,29,84,2,2021-09-30,0.05,not_requested,126.0
3694,My Princess Elfanya Arsyinta,1,0,0,0,0,0,0,0,0,68,26.0,0.001,86.0,70.0,False,12/26/2021,3,7,6,1,2021-11-11,0.0060499999999999,not_requested,64.0
3695,My Qatar,0,0,0,0,1,0,0,0,0,13,4.0,0.096,3868.0,2423.0,False,03/04/2021,21,33,128,3,2021-11-18,5.302,approved,0.0
3696,My Querencia,1,0,0,0,0,0,0,0,0,13,12.0,0.02,631.0,346.0,False,09/27/2021,68,17,97,2,2021-11-22,0.16,not_requested,0.0
3697,My Richie,1,0,0,0,0,0,0,0,0,146,173.0,0.001,9571.0,9201.0,False,05/14/2021,3,1,5,2,2021-07-29,0.005,not_requested,0.0
3698,My Tits Art,1,0,0,0,0,0,0,0,0,296,1700.0,0.002,7726.0,1091.0,False,10/06/2021,52,634,364,6,2021-09-14,1.7838920250919363,not_requested,0.0
3699,My Weird World,1,0,0,0,0,0,0,0,0,11,6.0,0.33,1868.0,2092.0,False,03/30/2021,2,5,12,4,2021-04-09,0.4,not_requested,0.0
3700,My black and white soul in the streets V2,0,0,0,0,1,0,0,0,0,21,5.0,0.08,1883.0,1930.0,False,07/30/2017,1,4,9,1,2021-11-13,0.32,not_requested,0.0
3701,My creations Collection || Art Bambina,1,0,0,0,0,0,0,0,0,14,2.0,0.011,187.0,511.0,False,09/19/2021,6,4,19,3,2021-11-10,0.088,not_requested,0.0
